[{"file": "Abdomen-Anatomy__Abdominal_Organs.json", "title": "Abdomen Anatomy  Abdominal Organs", "category": "Anatomy", "count": 12}, {"file": "Abdomen-Anatomy__Pancreas__Kidney__and_Ureter.json", "title": "Abdomen Anatomy  Pancreas  Kidney  And Ureter", "category": "Anatomy", "count": 10}, {"file": "Abdomen-Inguinal_and_Femoral_Anatomy_and_Hernia__Abdominal_Wall_Layers__Peritoneal_Cavity.json", "title": "Abdomen Inguinal And Femoral Anatomy And Hernia  Abdominal Wall Layers  Peritoneal Cavity", "category": "Anatomy", "count": 14}, {"file": "Anat_ENT_Psychi__Radio_Cumulative_Test_The_Champion_Batch-2_Hyderabad_-_03-04-2025_-_2025-04-03.json", "title": "Anat Ent Psychi  Radio Cumulative Test The Champion Batch 2 Hyderabad   03 04 2025   2025 04 03", "category": "Anatomy", "count": 199}, {"file": "Anatomy.json", "title": "Anatomy", "category": "Anatomy", "count": 20}, {"file": "Anatomy_-_INI_CET_2020.json", "title": "Anatomy   Ini Cet 2020", "category": "Anatomy", "count": 11}, {"file": "Anatomy_-_INI_CET_JULY_2021.json", "title": "Anatomy   Ini Cet July 2021", "category": "Anatomy", "count": 6}, {"file": "Anatomy_-_INI_CET_MAY_2022.json", "title": "Anatomy   Ini Cet May 2022", "category": "Anatomy", "count": 8}, {"file": "Anatomy_-_INI_CET_MAY_2023.json", "title": "Anatomy   Ini Cet May 2023", "category": "Anatomy", "count": 5}, {"file": "Anatomy_-_INI_CET_NOV_2021.json", "title": "Anatomy   Ini Cet Nov 2021", "category": "Anatomy", "count": 14}, {"file": "Anatomy_-_INI_CET_NOV_2023.json", "title": "Anatomy   Ini Cet Nov 2023", "category": "Anatomy", "count": 17}, {"file": "Anatomy_-_INI_CET_NOVEMBER_2022_PART_-_A.json", "title": "Anatomy   Ini Cet November 2022 Part   A", "category": "Anatomy", "count": 7}, {"file": "Anatomy_-_INI_CET_NOVEMBER_2022_PART_-_B.json", "title": "Anatomy   Ini Cet November 2022 Part   B", "category": "Anatomy", "count": 15}, {"file": "Anatomy-_Class_Test_With_Video_Solution.json", "title": "Anatomy  Class Test With Video Solution", "category": "Anatomy", "count": 75}, {"file": "Anatomy__Physiology.json", "title": "Anatomy  Physiology", "category": "Anatomy", "count": 16}, {"file": "Anatomy__Physiology_Of_Bone.json", "title": "Anatomy  Physiology Of Bone", "category": "Anatomy", "count": 37}, {"file": "Anatomy__Physiology_of_Lymphatic_System.json", "title": "Anatomy  Physiology Of Lymphatic System", "category": "Anatomy", "count": 2}, {"file": "Anatomy_-Thorax__General_Histology-Special_First_Year_Class_Test.json", "title": "Anatomy  Thorax  General Histology Special First Year Class Test", "category": "Anatomy", "count": 40}, {"file": "Anatomy_1.json", "title": "Anatomy 1", "category": "Anatomy", "count": 20}, {"file": "Anatomy_and_Physiology_of_Larnyx.json", "title": "Anatomy And Physiology Of Larnyx", "category": "Anatomy", "count": 13}, {"file": "Anatomy_and_Physiology_of_Nose.json", "title": "Anatomy And Physiology Of Nose", "category": "Anatomy", "count": 18}, {"file": "Anatomy_Clinical_Vignettes.json", "title": "Anatomy Clinical Vignettes", "category": "Anatomy", "count": 129}, {"file": "Anatomy_Dissection_Based_Questions.json", "title": "Anatomy Dissection Based Questions", "category": "Anatomy", "count": 50}, {"file": "Anatomy_Dr_Sandeep.json", "title": "Anatomy Dr Sandeep", "category": "Anatomy", "count": 25}, {"file": "07_Anatomy_Dr_Sandeep.json", "title": "Anatomy Dr Sandeep", "category": "Anatomy", "count": 40}, {"file": "Anatomy_Dr_Sandeep-2026.json", "title": "Anatomy Dr Sandeep 2026", "category": "Anatomy", "count": 200}, {"file": "Anatomy_Dr_Sandeep-2026_1.json", "title": "Anatomy Dr Sandeep 2026 1", "category": "Anatomy", "count": 200}, {"file": "Anatomy_DVT_Revision_Test.json", "title": "Anatomy Dvt Revision Test", "category": "Anatomy", "count": 25}, {"file": "Anatomy_ED_-_Mission_10_-_02-01-2024_-_2024-01-02.json", "title": "Anatomy Ed   Mission 10   02 01 2024   2024 01 02", "category": "Anatomy", "count": 50}, {"file": "Anatomy_ED_-_Mission_10_Revision_-_27-10-2023_-_2023-10-27.json", "title": "Anatomy Ed   Mission 10 Revision   27 10 2023   2023 10 27", "category": "Anatomy", "count": 50}, {"file": "Anatomy_ED_-_Mission_15_-_23-03-2024_-_2024-03-23.json", "title": "Anatomy Ed   Mission 15   23 03 2024   2024 03 23", "category": "Anatomy", "count": 100}, {"file": "Anatomy_ED_-_Mission_15_Lap_2_-_09-06-2024_-_2024-06-09.json", "title": "Anatomy Ed   Mission 15 Lap 2   09 06 2024   2024 06 09", "category": "Anatomy", "count": 50}, {"file": "Anatomy_ED_-_Mission_20_-_22-06-2024_-_2024-06-22.json", "title": "Anatomy Ed   Mission 20   22 06 2024   2024 06 22", "category": "Anatomy", "count": 100}, {"file": "Anatomy_ED_-_Mission_20_Batch_2_-_13-10-2024_-_2024-10-13.json", "title": "Anatomy Ed   Mission 20 Batch 2   13 10 2024   2024 10 13", "category": "Anatomy", "count": 100}, {"file": "Anatomy_ED_-_Mission_20_Batch_3_-_11-01-2025_-_2025-01-11.json", "title": "Anatomy Ed   Mission 20 Batch 3   11 01 2025   2025 01 11", "category": "Anatomy", "count": 75}, {"file": "Anatomy_ED_-_Mission_20_Lap_2_-_19-04-2025_-_2025-04-19.json", "title": "Anatomy Ed   Mission 20 Lap 2   19 04 2025   2025 04 19", "category": "Anatomy", "count": 100}, {"file": "Anatomy_ED_Test-1_-_28-05-2023_-_2023-05-28.json", "title": "Anatomy Ed Test 1   28 05 2023   2023 05 28", "category": "Anatomy", "count": 50}, {"file": "Anatomy_ED_Test-2_-_03-06-2023_-_2023-06-03.json", "title": "Anatomy Ed Test 2   03 06 2023   2023 06 03", "category": "Anatomy", "count": 50}, {"file": "Anatomy_Image_Based_Question.json", "title": "Anatomy Image Based Question", "category": "Anatomy", "count": 80}, {"file": "Anatomy_Last_Month_ED_-_17-07-2024_-_2024-07-17.json", "title": "Anatomy Last Month Ed   17 07 2024   2024 07 17", "category": "Anatomy", "count": 25}, {"file": "Anatomy_Lower_Limb_Gen_EmbryoGeneral_Anatomy_Special_First_Year_Class_Test.json", "title": "Anatomy Lower Limb Gen Embryogeneral Anatomy Special First Year Class Test", "category": "Anatomy", "count": 40}, {"file": "Anatomy_MIQ_Series.json", "title": "Anatomy Miq Series", "category": "Anatomy", "count": 20}, {"file": "Anatomy_of_Ear.json", "title": "Anatomy Of Ear", "category": "Anatomy", "count": 6}, {"file": "Anatomy_Of_External_Ear__Tympanic_Membrane.json", "title": "Anatomy Of External Ear  Tympanic Membrane", "category": "Anatomy", "count": 22}, {"file": "Anatomy_Of_External_Genitalia.json", "title": "Anatomy Of External Genitalia", "category": "Anatomy", "count": 9}, {"file": "Anatomy_of_Larynx.json", "title": "Anatomy Of Larynx", "category": "Anatomy", "count": 4}, {"file": "Anatomy_Of_Larynx_Part_1.json", "title": "Anatomy Of Larynx Part 1", "category": "Anatomy", "count": 10}, {"file": "Anatomy_Of_Larynx_Part_2.json", "title": "Anatomy Of Larynx Part 2", "category": "Anatomy", "count": 12}, {"file": "Anatomy_of_Middle_Ear_-_Medial__Posterior_Walls.json", "title": "Anatomy Of Middle Ear   Medial  Posterior Walls", "category": "Anatomy", "count": 13}, {"file": "Anatomy_of_Middle_Ear_Anterior_Wall.json", "title": "Anatomy Of Middle Ear Anterior Wall", "category": "Anatomy", "count": 10}, {"file": "Anatomy_of_Nose_and_Paranasal_Sinuses.json", "title": "Anatomy Of Nose And Paranasal Sinuses", "category": "Anatomy", "count": 5}, {"file": "Anatomy_of_Pharnyx.json", "title": "Anatomy Of Pharnyx", "category": "Anatomy", "count": 10}, {"file": "Anatomy_of_Sinunes.json", "title": "Anatomy Of Sinunes", "category": "Anatomy", "count": 16}, {"file": "Anatomy_of_Throat__Neck_Spaces.json", "title": "Anatomy Of Throat  Neck Spaces", "category": "Anatomy", "count": 7}, {"file": "Anatomy_of_Throat__Tonsils.json", "title": "Anatomy Of Throat  Tonsils", "category": "Anatomy", "count": 5}, {"file": "Anatomy-Special_First_Year_Class_Test.json", "title": "Anatomy Special First Year Class Test", "category": "Anatomy", "count": 30}, {"file": "Anatomy_Test_The_Champion_Batch_Hyderabad_-_11-11-2024_-_2024-11-11.json", "title": "Anatomy Test The Champion Batch Hyderabad   11 11 2024   2024 11 11", "category": "Anatomy", "count": 100}, {"file": "Anatomy_Test_The_Champion_Batch_Hyderabad_-_20-05-2024_-_2024-05-20.json", "title": "Anatomy Test The Champion Batch Hyderabad   20 05 2024   2024 05 20", "category": "Anatomy", "count": 100}, {"file": "Anatomy_Test_The_Champion_Batch_Hyderabad_-_22-03-2025_-_2025-03-22.json", "title": "Anatomy Test The Champion Batch Hyderabad   22 03 2025   2025 03 22", "category": "Anatomy", "count": 100}, {"file": "Anatomy_Upper_Limb-Special_First_Year_Class_Test.json", "title": "Anatomy Upper Limb Special First Year Class Test", "category": "Anatomy", "count": 30}, {"file": "Applied_anatomy_and_heading.json", "title": "Applied Anatomy And Heading", "category": "Anatomy", "count": 56}, {"file": "Basic_Concept_Tricks_and_Magic_of_Anatomy.json", "title": "Basic Concept Tricks And Magic Of Anatomy", "category": "Anatomy", "count": 2}, {"file": "Ear-Anatomy_of_External__Middle__and_Internal_Ear.json", "title": "Ear Anatomy Of External  Middle  And Internal Ear", "category": "Anatomy", "count": 23}, {"file": "Esophagus_Surgical_Anatomy__Investigation.json", "title": "Esophagus Surgical Anatomy  Investigation", "category": "Anatomy", "count": 35}, {"file": "Extra-edge_BTR_test__Micro-Anat_-_2025-06-07.json", "title": "Extra Edge Btr Test  Micro Anat   2025 06 07", "category": "Anatomy", "count": 50}, {"file": "Facial_Nerve__Vestibulocochlear_Nerve_Anatomy.json", "title": "Facial Nerve  Vestibulocochlear Nerve Anatomy", "category": "Anatomy", "count": 12}, {"file": "Forensic_Thanatology-Previous_Year_Questions.json", "title": "Forensic Thanatology Previous Year Questions", "category": "Anatomy", "count": 39}, {"file": "Forensic_Thanatology-Thanatology.json", "title": "Forensic Thanatology Thanatology", "category": "Anatomy", "count": 25}, {"file": "Gall_Bladder_Surgical_Anatomy__Investigations.json", "title": "Gall Bladder Surgical Anatomy  Investigations", "category": "Anatomy", "count": 12}, {"file": "General_Anatomy.json", "title": "General Anatomy", "category": "Anatomy", "count": 26}, {"file": "General_Anatomy__Embryology.json", "title": "General Anatomy  Embryology", "category": "Anatomy", "count": 62}, {"file": "General_Anatomy_Special_First_Year_Class_Test.json", "title": "General Anatomy Special First Year Class Test", "category": "Anatomy", "count": 30}, {"file": "General_Anatomy-Special_First_Year_Class_Test.json", "title": "General Anatomy Special First Year Class Test", "category": "Anatomy", "count": 30}, {"file": "General_Microbiology-Bacterial_Anatomy.json", "title": "General Microbiology Bacterial Anatomy", "category": "Anatomy", "count": 18}, {"file": "General_Neuroanatomy.json", "title": "General Neuroanatomy", "category": "Anatomy", "count": 17}, {"file": "Gynecology-Clinical_Anatomy_of_Female.json", "title": "Gynecology Clinical Anatomy Of Female", "category": "Anatomy", "count": 20}, {"file": "Head_and_Neck-Anatomy_of_Ear__Nose__and_Eyeball.json", "title": "Head And Neck Anatomy Of Ear  Nose  And Eyeball", "category": "Anatomy", "count": 11}, {"file": "Larynx-Larynx__Anatomy_and_Pathology.json", "title": "Larynx Larynx  Anatomy And Pathology", "category": "Anatomy", "count": 19}, {"file": "Lens_-_Anatomy__Physiology.json", "title": "Lens   Anatomy  Physiology", "category": "Anatomy", "count": 8}, {"file": "Lower_Limb-Lower_Limb_Anatomy__Knee_and_Leg.json", "title": "Lower Limb Lower Limb Anatomy  Knee And Leg", "category": "Anatomy", "count": 20}, {"file": "Mastoid_Anatomy.json", "title": "Mastoid Anatomy", "category": "Anatomy", "count": 5}, {"file": "Micro-Anatomy_BTR_50_test_-_2025-01-11.json", "title": "Micro Anatomy Btr 50 Test   2025 01 11", "category": "Anatomy", "count": 175}, {"file": "Micro-Anatomy_BTR_test_30_-_2024-03-29.json", "title": "Micro Anatomy Btr Test 30   2024 03 29", "category": "Anatomy", "count": 100}, {"file": "Microbiology__Anatomy_10_BTR_Test_-_2023-08-22.json", "title": "Microbiology  Anatomy 10 Btr Test   2023 08 22", "category": "Anatomy", "count": 100}, {"file": "Microbiology-Anatomy_20_BTR_Test_-_2024-01-03.json", "title": "Microbiology Anatomy 20 Btr Test   2024 01 03", "category": "Anatomy", "count": 100}, {"file": "Microbiology-Anatomy_BTR_60_Test_-_2025-04-18.json", "title": "Microbiology Anatomy Btr 60 Test   2025 04 18", "category": "Anatomy", "count": 100}, {"file": "Microbiology_Anatomy_BTR_Test_40_-_2024-10-01.json", "title": "Microbiology Anatomy Btr Test 40   2024 10 01", "category": "Anatomy", "count": 100}, {"file": "Mid_Day_Module_Anatomy-1_-_2025-01-03.json", "title": "Mid Day Module Anatomy 1   2025 01 03", "category": "Anatomy", "count": 50}, {"file": "Mid_Day_Module_Anatomy-2_-_2025-01-04.json", "title": "Mid Day Module Anatomy 2   2025 01 04", "category": "Anatomy", "count": 50}, {"file": "Mid_Day_Module_Anatomy-3_-_2025-01-05.json", "title": "Mid Day Module Anatomy 3   2025 01 05", "category": "Anatomy", "count": 50}, {"file": "Mid_Day_Module_Anatomy-4_-_2025-01-06.json", "title": "Mid Day Module Anatomy 4   2025 01 06", "category": "Anatomy", "count": 50}, {"file": "Mid_Day_Module_Anatomy-5_-_2025-01-07.json", "title": "Mid Day Module Anatomy 5   2025 01 07", "category": "Anatomy", "count": 50}, {"file": "Mid_Day_Module_AnatomyMicrobiology-1_-_2025-01-13.json", "title": "Mid Day Module Anatomymicrobiology 1   2025 01 13", "category": "Anatomy", "count": 50}, {"file": "Mid_Day_Module_AnatomyMicrobiology-2_-_2025-01-14.json", "title": "Mid Day Module Anatomymicrobiology 2   2025 01 14", "category": "Anatomy", "count": 50}, {"file": "Nasopharynx__Anatomy__Diseases.json", "title": "Nasopharynx  Anatomy  Diseases", "category": "Anatomy", "count": 5}, {"file": "Nerve_Muscle_Physiology-Functional_Anatomy_of_Skeletal_Muscle.json", "title": "Nerve Muscle Physiology Functional Anatomy Of Skeletal Muscle", "category": "Anatomy", "count": 18}, {"file": "Neuro_Anatomy-Brainstem__Cranial_Nerves__and_Cerebellum.json", "title": "Neuro Anatomy Brainstem  Cranial Nerves  And Cerebellum", "category": "Anatomy", "count": 26}, {"file": "Neuro_Anatomy-Cerebrum_and_Associated_Structures.json", "title": "Neuro Anatomy Cerebrum And Associated Structures", "category": "Anatomy", "count": 17}, {"file": "Neuro_Anatomy-Nervous_System_Development.json", "title": "Neuro Anatomy Nervous System Development", "category": "Anatomy", "count": 12}, {"file": "Neuro_Anatomy-Neuroanatomy.json", "title": "Neuro Anatomy Neuroanatomy", "category": "Anatomy", "count": 25}, {"file": "Neuro_Anatomy-Previous_Year_Questions.json", "title": "Neuro Anatomy Previous Year Questions", "category": "Anatomy", "count": 62}, {"file": "Neuro_Anatomy-Ventricular_System__White_Matter__and_Neural_Columns.json", "title": "Neuro Anatomy Ventricular System  White Matter  And Neural Columns", "category": "Anatomy", "count": 16}, {"file": "Neuroanatomy.json", "title": "Neuroanatomy", "category": "Anatomy", "count": 28}, {"file": "Normal_Anatomy__Physiology.json", "title": "Normal Anatomy  Physiology", "category": "Anatomy", "count": 3}, {"file": "Nose_and_Paranasal_Sinuses-Anatomy_of_Nose_and_Paranasal_Sinuses.json", "title": "Nose And Paranasal Sinuses Anatomy Of Nose And Paranasal Sinuses", "category": "Anatomy", "count": 18}, {"file": "Orbit_-_Anatomy.json", "title": "Orbit   Anatomy", "category": "Anatomy", "count": 7}, {"file": "Pelvis_and_Perineum-Neurovascular_Anatomy_of_Pelvis__Perineum__Rectum__and_Anal_Canal.json", "title": "Pelvis And Perineum Neurovascular Anatomy Of Pelvis  Perineum  Rectum  And Anal Canal", "category": "Anatomy", "count": 14}, {"file": "Pharynx-Anatomy_of_Pharynx_and_Pharyngeal_Spaces.json", "title": "Pharynx Anatomy Of Pharynx And Pharyngeal Spaces", "category": "Anatomy", "count": 14}, {"file": "Radiological_Anatomy.json", "title": "Radiological Anatomy", "category": "Anatomy", "count": 7}, {"file": "Radiological_Anatomy_1.json", "title": "Radiological Anatomy 1", "category": "Anatomy", "count": 9}, {"file": "Relevant_Clinical_Anatomy.json", "title": "Relevant Clinical Anatomy", "category": "Anatomy", "count": 5}, {"file": "Relevant_Clinical_Anatomy-Previous_Year_Questions.json", "title": "Relevant Clinical Anatomy Previous Year Questions", "category": "Anatomy", "count": 11}, {"file": "Respiratory_System-Functional_Anatomy__Mechanics__Ventilation-Perfusion__Compliance_of_RS.json", "title": "Respiratory System Functional Anatomy  Mechanics  Ventilation Perfusion  Compliance Of Rs", "category": "Anatomy", "count": 25}, {"file": "Squint_-_Anatomy.json", "title": "Squint   Anatomy", "category": "Anatomy", "count": 11}, {"file": "Stomach_Surgical_Anatomy__Stomach_Surgeries.json", "title": "Stomach Surgical Anatomy  Stomach Surgeries", "category": "Anatomy", "count": 4}, {"file": "Surgical_Anatomy.json", "title": "Surgical Anatomy", "category": "Anatomy", "count": 13}, {"file": "Surgical_Anatomy__Cardiopulmonary_Bypass_Part_1.json", "title": "Surgical Anatomy  Cardiopulmonary Bypass Part 1", "category": "Anatomy", "count": 22}, {"file": "Surgical_Anatomy__Investigations_Part_1.json", "title": "Surgical Anatomy  Investigations Part 1", "category": "Anatomy", "count": 12}, {"file": "SWT-Anatomy_SET-A.json", "title": "Swt Anatomy Set A", "category": "Anatomy", "count": 200}, {"file": "SWT-Anatomy-SET-B.json", "title": "Swt Anatomy Set B", "category": "Anatomy", "count": 200}, {"file": "Thanatology.json", "title": "Thanatology", "category": "Anatomy", "count": 54}, {"file": "Thanatology_1.json", "title": "Thanatology 1", "category": "Anatomy", "count": 24}, {"file": "Thorax-Heart_and_Thorax_Anatomy.json", "title": "Thorax Heart And Thorax Anatomy", "category": "Anatomy", "count": 30}, {"file": "Thyroid_-_Surgical_Anatomy__Investigations_Part_1.json", "title": "Thyroid   Surgical Anatomy  Investigations Part 1", "category": "Anatomy", "count": 14}, {"file": "Uveal_Tract_-_Anatomy.json", "title": "Uveal Tract   Anatomy", "category": "Anatomy", "count": 5}, {"file": "Anesthesia.json", "title": "Anesthesia", "category": "Anesthesia", "count": 100}, {"file": "Anesthesia_-_INI_CET_JULY_2021.json", "title": "Anesthesia   Ini Cet July 2021", "category": "Anesthesia", "count": 8}, {"file": "Anesthesia_-_INI_CET_MAY_2022.json", "title": "Anesthesia   Ini Cet May 2022", "category": "Anesthesia", "count": 2}, {"file": "Anesthesia_-_INI_CET_MAY_2023.json", "title": "Anesthesia   Ini Cet May 2023", "category": "Anesthesia", "count": 3}, {"file": "Anesthesia_-_INI_CET_NOV_2020.json", "title": "Anesthesia   Ini Cet Nov 2020", "category": "Anesthesia", "count": 6}, {"file": "Anesthesia_-_INI_CET_NOV_2021.json", "title": "Anesthesia   Ini Cet Nov 2021", "category": "Anesthesia", "count": 4}, {"file": "Anesthesia_-_INI_CET_NOV_2022_PART_A.json", "title": "Anesthesia   Ini Cet Nov 2022 Part A", "category": "Anesthesia", "count": 2}, {"file": "Anesthesia_-_INI_CET_NOV_2022_PART_B.json", "title": "Anesthesia   Ini Cet Nov 2022 Part B", "category": "Anesthesia", "count": 3}, {"file": "Anesthesia_-_INI_CET_NOV_2023.json", "title": "Anesthesia   Ini Cet Nov 2023", "category": "Anesthesia", "count": 2}, {"file": "Anesthesia-_Class_Test_With_Video_Solution.json", "title": "Anesthesia  Class Test With Video Solution", "category": "Anesthesia", "count": 50}, {"file": "Anesthesia__Co-Existing_Diseases.json", "title": "Anesthesia  Co Existing Diseases", "category": "Anesthesia", "count": 60}, {"file": "Anesthesia_1.json", "title": "Anesthesia 1", "category": "Anesthesia", "count": 65}, {"file": "Anesthesia_Delivery_Systems.json", "title": "Anesthesia Delivery Systems", "category": "Anesthesia", "count": 39}, {"file": "Anesthesia_Dr_Anshul.json", "title": "Anesthesia Dr Anshul", "category": "Anesthesia", "count": 40}, {"file": "21_Anesthesia_Dr_Anshul.json", "title": "Anesthesia Dr Anshul", "category": "Anesthesia", "count": 40}, {"file": "Anesthesia_Dr_Anshul-2026.json", "title": "Anesthesia Dr Anshul 2026", "category": "Anesthesia", "count": 50}, {"file": "Anesthesia_DVT_Revision_Test.json", "title": "Anesthesia Dvt Revision Test", "category": "Anesthesia", "count": 25}, {"file": "Anesthesia_ED_-_Mission_15_-_16-03-2024_-_2024-03-16.json", "title": "Anesthesia Ed   Mission 15   16 03 2024   2024 03 16", "category": "Anesthesia", "count": 55}, {"file": "Anesthesia_ED_-_Mission_15_Lap_2_-_05-06-2024_-_2024-06-05.json", "title": "Anesthesia Ed   Mission 15 Lap 2   05 06 2024   2024 06 05", "category": "Anesthesia", "count": 50}, {"file": "Anesthesia_ED_-_Mission_20_Batch_2_-_25-10-2024_-_2024-10-25.json", "title": "Anesthesia Ed   Mission 20 Batch 2   25 10 2024   2024 10 25", "category": "Anesthesia", "count": 75}, {"file": "Anesthesia_ED_-_Mission_20_Batch_3_-_05-12-2024_-_2024-12-05.json", "title": "Anesthesia Ed   Mission 20 Batch 3   05 12 2024   2024 12 05", "category": "Anesthesia", "count": 50}, {"file": "Anesthesia_ED_-_Mission_20_Lap_2_-_24-03-2025_-_2025-03-24.json", "title": "Anesthesia Ed   Mission 20 Lap 2   24 03 2025   2025 03 24", "category": "Anesthesia", "count": 50}, {"file": "Anesthesia_IBQ.json", "title": "Anesthesia Ibq", "category": "Anesthesia", "count": 20}, {"file": "Anesthesia_Image_Based_Question.json", "title": "Anesthesia Image Based Question", "category": "Anesthesia", "count": 20}, {"file": "Anesthesia_Last_Month_ED_-_07-07-2024_-_2024-07-07.json", "title": "Anesthesia Last Month Ed   07 07 2024   2024 07 07", "category": "Anesthesia", "count": 25}, {"file": "Anesthesia_MIQ_Series.json", "title": "Anesthesia Miq Series", "category": "Anesthesia", "count": 15}, {"file": "Anesthesia_Test_The_Champion_Batch_Hyderabad_-_26-04-2024_-_2024-04-26.json", "title": "Anesthesia Test The Champion Batch Hyderabad   26 04 2024   2024 04 26", "category": "Anesthesia", "count": 75}, {"file": "Anesthesia_Test_The_Champion_Batch_Hyderabad_-_27-11-2024_-_2024-11-27.json", "title": "Anesthesia Test The Champion Batch Hyderabad   27 11 2024   2024 11 27", "category": "Anesthesia", "count": 50}, {"file": "Clinical_vignettes_Anesthesia.json", "title": "Clinical Vignettes Anesthesia", "category": "Anesthesia", "count": 99}, {"file": "Day_Care_Anesthesia.json", "title": "Day Care Anesthesia", "category": "Anesthesia", "count": 7}, {"file": "General_Anesthesia_-_Complications.json", "title": "General Anesthesia   Complications", "category": "Anesthesia", "count": 34}, {"file": "General_Anesthesia_-_Introduction.json", "title": "General Anesthesia   Introduction", "category": "Anesthesia", "count": 5}, {"file": "General_Anesthesia_-_IV_Anesthetics.json", "title": "General Anesthesia   Iv Anesthetics", "category": "Anesthesia", "count": 60}, {"file": "General_Anesthesia_-_Muscle_Relaxants.json", "title": "General Anesthesia   Muscle Relaxants", "category": "Anesthesia", "count": 35}, {"file": "History_of_Anesthesia.json", "title": "History Of Anesthesia", "category": "Anesthesia", "count": 5}, {"file": "Introduction_of_Anesthesia.json", "title": "Introduction Of Anesthesia", "category": "Anesthesia", "count": 12}, {"file": "Local_Anesthesia.json", "title": "Local Anesthesia", "category": "Anesthesia", "count": 11}, {"file": "Local_Anesthetics.json", "title": "Local Anesthetics", "category": "Anesthesia", "count": 30}, {"file": "Local_Anesthetics_1.json", "title": "Local Anesthetics 1", "category": "Anesthesia", "count": 40}, {"file": "Mid_Day_Module_Anesthesia-1_-_2024-12-05.json", "title": "Mid Day Module Anesthesia 1   2024 12 05", "category": "Anesthesia", "count": 49}, {"file": "Mid_Day_Module_Anesthesia-2_-_2024-12-06.json", "title": "Mid Day Module Anesthesia 2   2024 12 06", "category": "Anesthesia", "count": 50}, {"file": "Monitoring_in_Anesthesia.json", "title": "Monitoring In Anesthesia", "category": "Anesthesia", "count": 22}, {"file": "Monitoring_In_Anesthesia.json", "title": "Monitoring In Anesthesia", "category": "Anesthesia", "count": 51}, {"file": "Pre-Anesthesia_Evaluation.json", "title": "Pre Anesthesia Evaluation", "category": "Anesthesia", "count": 28}, {"file": "Regional_Anesthesia.json", "title": "Regional Anesthesia", "category": "Anesthesia", "count": 50}, {"file": "SWT-Anesthesia-SET-B.json", "title": "Swt Anesthesia Set B", "category": "Anesthesia", "count": 100}, {"file": "Biochem_FMT_10_BTR_Test_-_2023-10-07.json", "title": "Biochem Fmt 10 Btr Test   2023 10 07", "category": "Biochemistry", "count": 100}, {"file": "Biochem-FMT_50_BTR_Test_-_2024-12-30.json", "title": "Biochem Fmt 50 Btr Test   2024 12 30", "category": "Biochemistry", "count": 180}, {"file": "Biochem-FMT_BTR_Test_20_-_2024-01-12.json", "title": "Biochem Fmt Btr Test 20   2024 01 12", "category": "Biochemistry", "count": 100}, {"file": "Biochem-FMT_BTR_test_30_-_2024-04-06.json", "title": "Biochem Fmt Btr Test 30   2024 04 06", "category": "Biochemistry", "count": 100}, {"file": "Biochem_FMT_BTR_Test_40_-_2024-09-24.json", "title": "Biochem Fmt Btr Test 40   2024 09 24", "category": "Biochemistry", "count": 100}, {"file": "Biochem-FMT_BTR_Test_60_-_2025-04-05.json", "title": "Biochem Fmt Btr Test 60   2025 04 05", "category": "Biochemistry", "count": 100}, {"file": "Biochemistry.json", "title": "Biochemistry", "category": "Biochemistry", "count": 20}, {"file": "Biochemistry_-_INI_CET_2020.json", "title": "Biochemistry   Ini Cet 2020", "category": "Biochemistry", "count": 14}, {"file": "Biochemistry_-_INI_CET_JULY_2021.json", "title": "Biochemistry   Ini Cet July 2021", "category": "Biochemistry", "count": 16}, {"file": "Biochemistry_-_INI_CET_MAY_2022.json", "title": "Biochemistry   Ini Cet May 2022", "category": "Biochemistry", "count": 12}, {"file": "Biochemistry_-_INI_CET_MAY_2023.json", "title": "Biochemistry   Ini Cet May 2023", "category": "Biochemistry", "count": 10}, {"file": "Biochemistry_-_INI_CET_NOV_2021.json", "title": "Biochemistry   Ini Cet Nov 2021", "category": "Biochemistry", "count": 11}, {"file": "Biochemistry_-_INI_CET_NOV_2022.json", "title": "Biochemistry   Ini Cet Nov 2022", "category": "Biochemistry", "count": 20}, {"file": "Biochemistry-_Class_Test_With_Video_Solution.json", "title": "Biochemistry  Class Test With Video Solution", "category": "Biochemistry", "count": 75}, {"file": "Biochemistry-_INI_CET_NOV_2023.json", "title": "Biochemistry  Ini Cet Nov 2023", "category": "Biochemistry", "count": 8}, {"file": "Biochemistry_Clinical_Vignettes.json", "title": "Biochemistry Clinical Vignettes", "category": "Biochemistry", "count": 53}, {"file": "Biochemistry_Dr_Sonam.json", "title": "Biochemistry Dr Sonam", "category": "Biochemistry", "count": 40}, {"file": "32_Biochemistry_Dr_Sonam.json", "title": "Biochemistry Dr Sonam", "category": "Biochemistry", "count": 40}, {"file": "Biochemistry_Dr_Sonam-2026.json", "title": "Biochemistry Dr Sonam 2026", "category": "Biochemistry", "count": 100}, {"file": "Biochemistry_DVT_Revision_Test.json", "title": "Biochemistry Dvt Revision Test", "category": "Biochemistry", "count": 25}, {"file": "Biochemistry_ED_-_Mission_15_-_06-04-2024_-_2024-04-06.json", "title": "Biochemistry Ed   Mission 15   06 04 2024   2024 04 06", "category": "Biochemistry", "count": 100}, {"file": "Biochemistry_ED_-_Mission_15_Lap_2_-_30-05-2024_-_2024-05-30.json", "title": "Biochemistry Ed   Mission 15 Lap 2   30 05 2024   2024 05 30", "category": "Biochemistry", "count": 75}, {"file": "Biochemistry_ED_-_Mission_20_Batch_2_-_08-12-2024_-_2024-12-08.json", "title": "Biochemistry Ed   Mission 20 Batch 2   08 12 2024   2024 12 08", "category": "Biochemistry", "count": 100}, {"file": "Biochemistry_ED_-_Mission_20_Batch_3_-_29-12-2024_-_2024-12-29.json", "title": "Biochemistry Ed   Mission 20 Batch 3   29 12 2024   2024 12 29", "category": "Biochemistry", "count": 100}, {"file": "Biochemistry_ED_-_Mission_20_Lap_2_-_13-04-2025_-_2025-04-13.json", "title": "Biochemistry Ed   Mission 20 Lap 2   13 04 2025   2025 04 13", "category": "Biochemistry", "count": 75}, {"file": "Biochemistry_ED_Mission_30_Early_Intern_Batch_-_22-05-2025_-_2025-05-22.json", "title": "Biochemistry Ed Mission 30 Early Intern Batch   22 05 2025   2025 05 22", "category": "Biochemistry", "count": 100}, {"file": "Biochemistry_IBQ.json", "title": "Biochemistry Ibq", "category": "Biochemistry", "count": 20}, {"file": "Biochemistry_Image_Based_Question.json", "title": "Biochemistry Image Based Question", "category": "Biochemistry", "count": 20}, {"file": "Biochemistry_Last_Month_ED_-_03-08-2024_-_2024-08-03.json", "title": "Biochemistry Last Month Ed   03 08 2024   2024 08 03", "category": "Biochemistry", "count": 25}, {"file": "Biochemistry_MIQ_Series.json", "title": "Biochemistry Miq Series", "category": "Biochemistry", "count": 20}, {"file": "Biochemistry-Previous_Year_Questions.json", "title": "Biochemistry Previous Year Questions", "category": "Biochemistry", "count": 2}, {"file": "Biochemistry-Special_First_Year_Class_Test.json", "title": "Biochemistry Special First Year Class Test", "category": "Biochemistry", "count": 20}, {"file": "Biochemistry_Special_First_Year_Class_Test.json", "title": "Biochemistry Special First Year Class Test", "category": "Biochemistry", "count": 35}, {"file": "Biochemistry_Test_The_Champion_Batch_Hyderabad_-_16-08-2024_-_2024-08-16.json", "title": "Biochemistry Test The Champion Batch Hyderabad   16 08 2024   2024 08 16", "category": "Biochemistry", "count": 75}, {"file": "Biochemistry_Test_The_Champion_Batch_Hyderabad_-_25-12-2024_-_2024-12-25.json", "title": "Biochemistry Test The Champion Batch Hyderabad   25 12 2024   2024 12 25", "category": "Biochemistry", "count": 100}, {"file": "Clinical_Biochemistry-Previous_Year_Questions.json", "title": "Clinical Biochemistry Previous Year Questions", "category": "Biochemistry", "count": 21}, {"file": "Genetics-DNA_and_Chromosome_Biochemistry__Structure__Replication__and_Repair.json", "title": "Genetics Dna And Chromosome Biochemistry  Structure  Replication  And Repair", "category": "Biochemistry", "count": 27}, {"file": "Mid_Day_Module_Biochemistry-1_-_2024-12-23.json", "title": "Mid Day Module Biochemistry 1   2024 12 23", "category": "Biochemistry", "count": 50}, {"file": "Mid_Day_Module_Biochemistry-2_-_2024-12-24.json", "title": "Mid Day Module Biochemistry 2   2024 12 24", "category": "Biochemistry", "count": 50}, {"file": "Mid_Day_Module_Biochemistry-3_-_2024-12-25.json", "title": "Mid Day Module Biochemistry 3   2024 12 25", "category": "Biochemistry", "count": 50}, {"file": "Mid_Day_Module_Biochemistry-4_-_2024-12-26.json", "title": "Mid Day Module Biochemistry 4   2024 12 26", "category": "Biochemistry", "count": 50}, {"file": "Mid_Day_Module_FMT__Biochemistry-4_-_2024-12-30.json", "title": "Mid Day Module Fmt  Biochemistry 4   2024 12 30", "category": "Biochemistry", "count": 50}, {"file": "Mid_Day_Module_FMT__Biochemistry-5_-_2024-12-31.json", "title": "Mid Day Module Fmt  Biochemistry 5   2024 12 31", "category": "Biochemistry", "count": 50}, {"file": "SWT-Biochemistry-SET-A.json", "title": "Swt Biochemistry Set A", "category": "Biochemistry", "count": 200}, {"file": "SWT-Biochemistry-SET-B.json", "title": "Swt Biochemistry Set B", "category": "Biochemistry", "count": 200}, {"file": "Community_Ophthalmology.json", "title": "Community Ophthalmology", "category": "Community Medicine", "count": 12}, {"file": "Community_Ophthalmology__Miscellaneous.json", "title": "Community Ophthalmology  Miscellaneous", "category": "Community Medicine", "count": 29}, {"file": "Community_Ophthalmology-Previous_Year_Questions.json", "title": "Community Ophthalmology Previous Year Questions", "category": "Community Medicine", "count": 9}, {"file": "Extra-edge_BTR_test__PSM-Derma-Anes_-_2025-06-12.json", "title": "Extra Edge Btr Test  Psm Derma Anes   2025 06 12", "category": "Community Medicine", "count": 50}, {"file": "Health_Care_of_The_Community_in_India-Healthcare_of_Community_and_Health_Delivery_Systems.json", "title": "Health Care Of The Community In India Healthcare Of Community And Health Delivery Systems", "category": "Community Medicine", "count": 18}, {"file": "Health_Care_of_The_Community_in_India-Previous_Year_Questions.json", "title": "Health Care Of The Community In India Previous Year Questions", "category": "Community Medicine", "count": 25}, {"file": "Mid_Day_Module_PSM-1_-_2025-02-12.json", "title": "Mid Day Module Psm 1   2025 02 12", "category": "Community Medicine", "count": 50}, {"file": "Mid_Day_Module_PSM-2_-_2025-02-13.json", "title": "Mid Day Module Psm 2   2025 02 13", "category": "Community Medicine", "count": 50}, {"file": "Mid_Day_Module_PSM-3_-_2025-02-14.json", "title": "Mid Day Module Psm 3   2025 02 14", "category": "Community Medicine", "count": 50}, {"file": "Mid_Day_Module_PSM-4_-_2025-02-16.json", "title": "Mid Day Module Psm 4   2025 02 16", "category": "Community Medicine", "count": 50}, {"file": "Mid_Day_Module_PSM-5_-_2025-02-17.json", "title": "Mid Day Module Psm 5   2025 02 17", "category": "Community Medicine", "count": 50}, {"file": "Mid_Day_Module_PSM-6_-_2025-02-18.json", "title": "Mid Day Module Psm 6   2025 02 18", "category": "Community Medicine", "count": 49}, {"file": "Mid_Day_Module_PSM-7_-_2025-02-19.json", "title": "Mid Day Module Psm 7   2025 02 19", "category": "Community Medicine", "count": 50}, {"file": "Mid_Day_Module_PSMDermaAnes-1_-_2025-02-25.json", "title": "Mid Day Module Psmdermaanes 1   2025 02 25", "category": "Community Medicine", "count": 49}, {"file": "Mid_Day_Module_SurgeryPSM-1_-_2025-02-15.json", "title": "Mid Day Module Surgerypsm 1   2025 02 15", "category": "Community Medicine", "count": 50}, {"file": "PSM.json", "title": "Psm", "category": "Community Medicine", "count": 20}, {"file": "PSM_-_INI_CET_JULY_2021.json", "title": "Psm   Ini Cet July 2021", "category": "Community Medicine", "count": 11}, {"file": "PSM_-_INI_CET_MAY_2022.json", "title": "Psm   Ini Cet May 2022", "category": "Community Medicine", "count": 17}, {"file": "PSM_-_INI_CET_MAY_2023.json", "title": "Psm   Ini Cet May 2023", "category": "Community Medicine", "count": 8}, {"file": "PSM_-_INI_CET_NOV_2020.json", "title": "Psm   Ini Cet Nov 2020", "category": "Community Medicine", "count": 8}, {"file": "PSM_-_INI_CET_NOV_2021.json", "title": "Psm   Ini Cet Nov 2021", "category": "Community Medicine", "count": 12}, {"file": "PSM_-_INI_CET_NOV_2023.json", "title": "Psm   Ini Cet Nov 2023", "category": "Community Medicine", "count": 7}, {"file": "PSM_-_INI_CET_NOVEMBER_2022_PART_-_A.json", "title": "Psm   Ini Cet November 2022 Part   A", "category": "Community Medicine", "count": 8}, {"file": "PSM_-_INI_CET_NOVEMBER_2022_PART_-_B.json", "title": "Psm   Ini Cet November 2022 Part   B", "category": "Community Medicine", "count": 14}, {"file": "PSM_1.json", "title": "Psm 1", "category": "Community Medicine", "count": 20}, {"file": "PSM_Anaes_Derma_10_BTR_Test_-_2023-09-11.json", "title": "Psm Anaes Derma 10 Btr Test   2023 09 11", "category": "Community Medicine", "count": 100}, {"file": "PSM_Clinical_Vignettes.json", "title": "Psm Clinical Vignettes", "category": "Community Medicine", "count": 147}, {"file": "PSM_Derma_Anesthesia_30_BTR_Test_-_2024-03-18.json", "title": "Psm Derma Anesthesia 30 Btr Test   2024 03 18", "category": "Community Medicine", "count": 100}, {"file": "PSM-Derma-Anesthesia_BTR_test_60_-_2025-03-31.json", "title": "Psm Derma Anesthesia Btr Test 60   2025 03 31", "category": "Community Medicine", "count": 100}, {"file": "PSM_Derma_Anesthesia_Test_20_-_2023-12-26.json", "title": "Psm Derma Anesthesia Test 20   2023 12 26", "category": "Community Medicine", "count": 100}, {"file": "PSM_Dermatology_Anesthesia_40_BTR_test_-_2024-10-09.json", "title": "Psm Dermatology Anesthesia 40 Btr Test   2024 10 09", "category": "Community Medicine", "count": 100}, {"file": "PSM_Dermatology_Anesthesia_50_BTR_test_-_2025-02-22.json", "title": "Psm Dermatology Anesthesia 50 Btr Test   2025 02 22", "category": "Community Medicine", "count": 150}, {"file": "334_PSM_Dr_Kashish.json", "title": "Psm Dr Kashish", "category": "Community Medicine", "count": 40}, {"file": "336_PSM_Dr_Kashish.json", "title": "Psm Dr Kashish", "category": "Community Medicine", "count": 50}, {"file": "335_PSM_Dr_Kashish.json", "title": "Psm Dr Kashish", "category": "Community Medicine", "count": 40}, {"file": "PSM_Dr_Kashish.json", "title": "Psm Dr Kashish", "category": "Community Medicine", "count": 25}, {"file": "PSM_Dr_Kashish__BiostatsEpidemiologyScreening_NCDDemographyFamily_planning_MCHHealth_Progra.json", "title": "Psm Dr Kashish  Biostatsepidemiologyscreening Ncddemographyfamily Planning Mchhealth Progra", "category": "Community Medicine", "count": 20}, {"file": "PSM_Dr_Kashish-2026.json", "title": "Psm Dr Kashish 2026", "category": "Community Medicine", "count": 100}, {"file": "PSM_Dr_Sidharth.json", "title": "Psm Dr Sidharth", "category": "Community Medicine", "count": 100}, {"file": "PSM_Dr_Sidharth-2026.json", "title": "Psm Dr Sidharth 2026", "category": "Community Medicine", "count": 100}, {"file": "PSM_DVT_Revision_Test.json", "title": "Psm Dvt Revision Test", "category": "Community Medicine", "count": 50}, {"file": "PSM_ED_-_Mission_15_-_11-03-2024_-_2024-03-11.json", "title": "Psm Ed   Mission 15   11 03 2024   2024 03 11", "category": "Community Medicine", "count": 85}, {"file": "PSM_ED_-_Mission_15_Lap_2_-_28-05-2024_-_2024-05-28.json", "title": "Psm Ed   Mission 15 Lap 2   28 05 2024   2024 05 28", "category": "Community Medicine", "count": 75}, {"file": "PSM_ED_-_Mission_20_Batch_2_-_07-10-2024_-_2024-10-07.json", "title": "Psm Ed   Mission 20 Batch 2   07 10 2024   2024 10 07", "category": "Community Medicine", "count": 100}, {"file": "PSM_ED_-_Mission_20_Batch_3_-_18-02-2025_-_2025-02-18.json", "title": "Psm Ed   Mission 20 Batch 3   18 02 2025   2025 02 18", "category": "Community Medicine", "count": 75}, {"file": "PSM_ED_-_Mission_20_Lap_2_-_09-04-2025_-_2025-04-09.json", "title": "Psm Ed   Mission 20 Lap 2   09 04 2025   2025 04 09", "category": "Community Medicine", "count": 75}, {"file": "PSM_ED_Part-1_Mission_30_Early_Intern_Batch_-_04-05-2025_-_2025-05-04.json", "title": "Psm Ed Part 1 Mission 30 Early Intern Batch   04 05 2025   2025 05 04", "category": "Community Medicine", "count": 75}, {"file": "PSM_ED_Part-2_Mission_30_Early_Intern_Batch_-_08-05-2025_-_2025-05-08.json", "title": "Psm Ed Part 2 Mission 30 Early Intern Batch   08 05 2025   2025 05 08", "category": "Community Medicine", "count": 75}, {"file": "PSM_Epidemiology_History_of_Public_Health_Health__Disease_Screening_of_Disease__Infectious_Dis.json", "title": "Psm Epidemiology History Of Public Health Health  Disease Screening Of Disease  Infectious Dis", "category": "Community Medicine", "count": 50}, {"file": "PSM_Image_Based_Question.json", "title": "Psm Image Based Question", "category": "Community Medicine", "count": 20}, {"file": "PSM_Last_Month_ED_-_28-07-2024_-_2024-07-28.json", "title": "Psm Last Month Ed   28 07 2024   2024 07 28", "category": "Community Medicine", "count": 30}, {"file": "PSM_MIQ_Series.json", "title": "Psm Miq Series", "category": "Community Medicine", "count": 20}, {"file": "PSM_MIQ_Series_Dr_Sidharth.json", "title": "Psm Miq Series Dr Sidharth", "category": "Community Medicine", "count": 20}, {"file": "PSM_New_Season.json", "title": "Psm New Season", "category": "Community Medicine", "count": 25}, {"file": "PSM_Statistics_Demography_Obstetrics__Paediatrics_Nutrition_Environment_Management_Health_ca.json", "title": "Psm Statistics Demography Obstetrics  Paediatrics Nutrition Environment Management Health Ca", "category": "Community Medicine", "count": 50}, {"file": "PSM_Test_The_Champion_Batch_Hyderabad_-_11-07-2024_-_2024-07-11.json", "title": "Psm Test The Champion Batch Hyderabad   11 07 2024   2024 07 11", "category": "Community Medicine", "count": 75}, {"file": "PSM_Test_The_Champion_Batch_Hyderabad_-_18-12-2024_-_2024-12-18.json", "title": "Psm Test The Champion Batch Hyderabad   18 12 2024   2024 12 18", "category": "Community Medicine", "count": 75}, {"file": "PSM_Test_The_Champion_Batch_Hyderabad_-_25-04-2025_-_2025-04-25.json", "title": "Psm Test The Champion Batch Hyderabad   25 04 2025   2025 04 25", "category": "Community Medicine", "count": 75}, {"file": "Psychology_Psychotherapy_Community_Psychiatry.json", "title": "Psychology Psychotherapy Community Psychiatry", "category": "Community Medicine", "count": 39}, {"file": "SWT-PSM-SET-A.json", "title": "Swt Psm Set A", "category": "Community Medicine", "count": 200}, {"file": "SWT-PSM-SET-B.json", "title": "Swt Psm Set B", "category": "Community Medicine", "count": 200}, {"file": "Bacterial_Infections_of_Skin.json", "title": "Bacterial Infections Of Skin", "category": "Dermatology", "count": 4}, {"file": "Basics_of_Dermatology.json", "title": "Basics Of Dermatology", "category": "Dermatology", "count": 44}, {"file": "Breast_Bone_Skin_Soft_tissue.json", "title": "Breast Bone Skin Soft Tissue", "category": "Dermatology", "count": 15}, {"file": "Deep_Fungal_Skin_Infections.json", "title": "Deep Fungal Skin Infections", "category": "Dermatology", "count": 22}, {"file": "Dermatology.json", "title": "Dermatology", "category": "Dermatology", "count": 100}, {"file": "Dermatology_-_INI_CET_JULY_2021.json", "title": "Dermatology   Ini Cet July 2021", "category": "Dermatology", "count": 7}, {"file": "Dermatology_-_INI_CET_MAY_2022.json", "title": "Dermatology   Ini Cet May 2022", "category": "Dermatology", "count": 2}, {"file": "Dermatology_-_INI_CET_MAY_2023.json", "title": "Dermatology   Ini Cet May 2023", "category": "Dermatology", "count": 4}, {"file": "Dermatology_-_INI_CET_NOV_2020.json", "title": "Dermatology   Ini Cet Nov 2020", "category": "Dermatology", "count": 9}, {"file": "Dermatology_-_INI_CET_NOV_2021.json", "title": "Dermatology   Ini Cet Nov 2021", "category": "Dermatology", "count": 7}, {"file": "Dermatology_-_INI_CET_NOV_2022_PART_A.json", "title": "Dermatology   Ini Cet Nov 2022 Part A", "category": "Dermatology", "count": 2}, {"file": "Dermatology_-_INI_CET_NOV_2022_PART_B.json", "title": "Dermatology   Ini Cet Nov 2022 Part B", "category": "Dermatology", "count": 5}, {"file": "Dermatology_-_INI_CET_NOV_2023.json", "title": "Dermatology   Ini Cet Nov 2023", "category": "Dermatology", "count": 5}, {"file": "Dermatology-_Class_Test_With_Video_Solution.json", "title": "Dermatology  Class Test With Video Solution", "category": "Dermatology", "count": 50}, {"file": "Dermatology_Dr_Chesta.json", "title": "Dermatology Dr Chesta", "category": "Dermatology", "count": 50}, {"file": "45_Dermatology_Dr_Chesta.json", "title": "Dermatology Dr Chesta", "category": "Dermatology", "count": 40}, {"file": "Dermatology_Dr_Chesta_1.json", "title": "Dermatology Dr Chesta 1", "category": "Dermatology", "count": 50}, {"file": "Dermatology_Dr_Chesta-2026.json", "title": "Dermatology Dr Chesta 2026", "category": "Dermatology", "count": 50}, {"file": "Dermatology_DVT_Revision_Test.json", "title": "Dermatology Dvt Revision Test", "category": "Dermatology", "count": 25}, {"file": "Dermatology_ED_-_01-10-2023_-_2023-10-01.json", "title": "Dermatology Ed   01 10 2023   2023 10 01", "category": "Dermatology", "count": 50}, {"file": "Dermatology_ED_-_Mission_15_-_14-03-2024_-_2024-03-14.json", "title": "Dermatology Ed   Mission 15   14 03 2024   2024 03 14", "category": "Dermatology", "count": 75}, {"file": "Dermatology_ED_-_Mission_15_Lap_2_-_01-06-2024_-_2024-06-01.json", "title": "Dermatology Ed   Mission 15 Lap 2   01 06 2024   2024 06 01", "category": "Dermatology", "count": 50}, {"file": "Dermatology_ED_-_Mission_20_Batch_2_-_27-12-2024_-_2024-12-27.json", "title": "Dermatology Ed   Mission 20 Batch 2   27 12 2024   2024 12 27", "category": "Dermatology", "count": 75}, {"file": "Dermatology_ED_-_Mission_20_Batch_3_-_23-02-2025_-_2025-02-23.json", "title": "Dermatology Ed   Mission 20 Batch 3   23 02 2025   2025 02 23", "category": "Dermatology", "count": 75}, {"file": "Dermatology_ED_-_Mission_20_Lap_2_-_29-03-2025_-_2025-03-29.json", "title": "Dermatology Ed   Mission 20 Lap 2   29 03 2025   2025 03 29", "category": "Dermatology", "count": 50}, {"file": "Dermatology_IBQ.json", "title": "Dermatology Ibq", "category": "Dermatology", "count": 20}, {"file": "Dermatology_Image_Based_Qs.json", "title": "Dermatology Image Based Qs", "category": "Dermatology", "count": 52}, {"file": "Dermatology_Last_Month_ED_-_09-07-2024_-_2024-07-09.json", "title": "Dermatology Last Month Ed   09 07 2024   2024 07 09", "category": "Dermatology", "count": 25}, {"file": "Dermatology_MIQ_Series.json", "title": "Dermatology Miq Series", "category": "Dermatology", "count": 15}, {"file": "Dermatology_Test_The_Champion_Batch_Hyderabad_-_14-05-2024_-_2024-05-14.json", "title": "Dermatology Test The Champion Batch Hyderabad   14 05 2024   2024 05 14", "category": "Dermatology", "count": 75}, {"file": "Dermatology_Test_The_Champion_Batch_Hyderabad_-_15-04-2025_-_2025-04-15.json", "title": "Dermatology Test The Champion Batch Hyderabad   15 04 2025   2025 04 15", "category": "Dermatology", "count": 50}, {"file": "Dermatology_Test_The_Champion_Batch_Hyderabad_-_29-10-2024_-_2024-10-29.json", "title": "Dermatology Test The Champion Batch Hyderabad   29 10 2024   2024 10 29", "category": "Dermatology", "count": 75}, {"file": "Dermoepidermal_Junction_DIF__Nail_Diseases.json", "title": "Dermoepidermal Junction Dif  Nail Diseases", "category": "Dermatology", "count": 11}, {"file": "DNA_Viruses_Skin_Infections.json", "title": "Dna Viruses Skin Infections", "category": "Dermatology", "count": 22}, {"file": "Fungal_Infections_of_Skin.json", "title": "Fungal Infections Of Skin", "category": "Dermatology", "count": 4}, {"file": "General_Dermatology.json", "title": "General Dermatology", "category": "Dermatology", "count": 23}, {"file": "General_Dermatology_1.json", "title": "General Dermatology 1", "category": "Dermatology", "count": 15}, {"file": "Genetics__Skin.json", "title": "Genetics  Skin", "category": "Dermatology", "count": 19}, {"file": "Genodermatoses.json", "title": "Genodermatoses", "category": "Dermatology", "count": 3}, {"file": "Important_Short_Topics_Shapes_Of_Skin_Lesions_Woods_Lamp_Disorders_Neutrophilic_Dermatosis__Reactive_Arthritis.json", "title": "Important Short Topics Shapes Of Skin Lesions Woods Lamp Disorders Neutrophilic Dermatosis  Reactive Arthritis", "category": "Dermatology", "count": 26}, {"file": "Introduction_to_Dermatology.json", "title": "Introduction To Dermatology", "category": "Dermatology", "count": 3}, {"file": "Introduction_to_Dermatology-Basics_of_Dermatology.json", "title": "Introduction To Dermatology Basics Of Dermatology", "category": "Dermatology", "count": 10}, {"file": "Introduction_to_Dermatology-Previous_Year_Questions.json", "title": "Introduction To Dermatology Previous Year Questions", "category": "Dermatology", "count": 4}, {"file": "Introduction_to_Dermatology-Skin_Lesions_in_Dermatology.json", "title": "Introduction To Dermatology Skin Lesions In Dermatology", "category": "Dermatology", "count": 7}, {"file": "Mid_Day_Module_Dermatology-1_-_2025-02-22.json", "title": "Mid Day Module Dermatology 1   2025 02 22", "category": "Dermatology", "count": 50}, {"file": "Mid_Day_Module_Dermatology-2_-_2025-02-23.json", "title": "Mid Day Module Dermatology 2   2025 02 23", "category": "Dermatology", "count": 50}, {"file": "Miscellaneous_Disorders-Genodermatoses__Vector-Borne_Diseases__Bedside_Tests_in_Dermatology.json", "title": "Miscellaneous Disorders Genodermatoses  Vector Borne Diseases  Bedside Tests In Dermatology", "category": "Dermatology", "count": 10}, {"file": "Parasitic_Infection-Parasitic_infestations_of_skin.json", "title": "Parasitic Infection Parasitic Infestations Of Skin", "category": "Dermatology", "count": 9}, {"file": "Parasitic_Skin_Infections.json", "title": "Parasitic Skin Infections", "category": "Dermatology", "count": 21}, {"file": "Rheumatology-Scleroderma_and_Sjogren_syndrome.json", "title": "Rheumatology Scleroderma And Sjogren Syndrome", "category": "Dermatology", "count": 12}, {"file": "RNA_Viruses_Skin_Infections.json", "title": "Rna Viruses Skin Infections", "category": "Dermatology", "count": 22}, {"file": "Short_Topics_in_Dermatology.json", "title": "Short Topics In Dermatology", "category": "Dermatology", "count": 14}, {"file": "Skin.json", "title": "Skin", "category": "Dermatology", "count": 17}, {"file": "Skin__Subcutaneous_Tissue_Skin_Tumors__Common_Skin_Conditions.json", "title": "Skin  Subcutaneous Tissue Skin Tumors  Common Skin Conditions", "category": "Dermatology", "count": 19}, {"file": "Skin_and_Musculoskeletal-Previous_Year_Questions.json", "title": "Skin And Musculoskeletal Previous Year Questions", "category": "Dermatology", "count": 8}, {"file": "Skin_Appendages_and_their_Disorders-Disorders_of_Glands.json", "title": "Skin Appendages And Their Disorders Disorders Of Glands", "category": "Dermatology", "count": 10}, {"file": "Skin_Appendages_and_their_Disorders-Hair_and_Nail_disorders.json", "title": "Skin Appendages And Their Disorders Hair And Nail Disorders", "category": "Dermatology", "count": 15}, {"file": "Skin_Appendages_and_their_Disorders-Previous_Year_Questions.json", "title": "Skin Appendages And Their Disorders Previous Year Questions", "category": "Dermatology", "count": 22}, {"file": "Skin_Bone_and_Miscellaneous.json", "title": "Skin Bone And Miscellaneous", "category": "Dermatology", "count": 18}, {"file": "Skin_Cancer.json", "title": "Skin Cancer", "category": "Dermatology", "count": 19}, {"file": "Skin_Tumors-Previous_Year_Questions.json", "title": "Skin Tumors Previous Year Questions", "category": "Dermatology", "count": 7}, {"file": "Skin_Tumours.json", "title": "Skin Tumours", "category": "Dermatology", "count": 4}, {"file": "Skin_Tumours_1.json", "title": "Skin Tumours 1", "category": "Dermatology", "count": 19}, {"file": "Skin_Tumours-Skin_Tumors.json", "title": "Skin Tumours Skin Tumors", "category": "Dermatology", "count": 15}, {"file": "SLE_Juvenile_Dermatomyositis__Scleroderma.json", "title": "Sle Juvenile Dermatomyositis  Scleroderma", "category": "Dermatology", "count": 15}, {"file": "Staphylococcal_Skin_Infections.json", "title": "Staphylococcal Skin Infections", "category": "Dermatology", "count": 22}, {"file": "Streptococcal_Skin_Infections.json", "title": "Streptococcal Skin Infections", "category": "Dermatology", "count": 23}, {"file": "Superficial_Fungal_Skin_Infections.json", "title": "Superficial Fungal Skin Infections", "category": "Dermatology", "count": 22}, {"file": "SWT-Dermatology__Psychitary-SET-A.json", "title": "Swt Dermatology  Psychitary Set A", "category": "Dermatology", "count": 200}, {"file": "SWT-Dermatology-SET-B.json", "title": "Swt Dermatology Set B", "category": "Dermatology", "count": 100}, {"file": "Systemic__Nutritional_Dermatology.json", "title": "Systemic  Nutritional Dermatology", "category": "Dermatology", "count": 18}, {"file": "Systemic_Diseases___Skin.json", "title": "Systemic Diseases   Skin", "category": "Dermatology", "count": 4}, {"file": "Systemic_Diseases_and_Skin-Previous_Year_Questions.json", "title": "Systemic Diseases And Skin Previous Year Questions", "category": "Dermatology", "count": 14}, {"file": "Systemic_Diseases_and_Skin-Systemic_diseases_and_skin.json", "title": "Systemic Diseases And Skin Systemic Diseases And Skin", "category": "Dermatology", "count": 15}, {"file": "Viral_Infections_of_Skin.json", "title": "Viral Infections Of Skin", "category": "Dermatology", "count": 4}, {"file": "Adnexal_Management.json", "title": "Adnexal Management", "category": "ENT", "count": 15}, {"file": "All_Recent_Updates_2021-Previous_Year_Questions.json", "title": "All Recent Updates 2021 Previous Year Questions", "category": "ENT", "count": 1}, {"file": "Allied_Health_Disciplines-ESI_Act__Factory_Act__NREGA_Act_and_Disaster_Management.json", "title": "Allied Health Disciplines Esi Act  Factory Act  Nrega Act And Disaster Management", "category": "ENT", "count": 13}, {"file": "Anaesthesia_for_Co-existing_Medical_Illness-Anaesthesia_for_Special_Conditions_and_Fluid_Management.json", "title": "Anaesthesia For Co Existing Medical Illness Anaesthesia For Special Conditions And Fluid Management", "category": "ENT", "count": 13}, {"file": "Anaesthetic_Equipments_and_Pre-operative_Assessment.json", "title": "Anaesthetic Equipments And Pre Operative Assessment", "category": "ENT", "count": 73}, {"file": "Anesthesia_Equipment.json", "title": "Anesthesia Equipment", "category": "ENT", "count": 50}, {"file": "Anesthetic_Implication_of_Concurrent_Diseases.json", "title": "Anesthetic Implication Of Concurrent Diseases", "category": "ENT", "count": 19}, {"file": "Anterior_Compartment_of_Thigh__Femoral_Nerve.json", "title": "Anterior Compartment Of Thigh  Femoral Nerve", "category": "ENT", "count": 14}, {"file": "Antigen_Presenting_Cells__MHC.json", "title": "Antigen Presenting Cells  Mhc", "category": "ENT", "count": 8}, {"file": "Basics_and_Fundamentals_of_CT.json", "title": "Basics And Fundamentals Of Ct", "category": "ENT", "count": 24}, {"file": "Basics_of_Radiology-Basics_of_MRI_and_Interventional_Radiology.json", "title": "Basics Of Radiology Basics Of Mri And Interventional Radiology", "category": "ENT", "count": 10}, {"file": "Biomedical_Waste_Management.json", "title": "Biomedical Waste Management", "category": "ENT", "count": 26}, {"file": "Biomedical_Waste_Management_1.json", "title": "Biomedical Waste Management 1", "category": "ENT", "count": 16}, {"file": "Biomedical_Waste_Management-Biomedical_waste_management_and_Genetics_and_Health.json", "title": "Biomedical Waste Management Biomedical Waste Management And Genetics And Health", "category": "ENT", "count": 15}, {"file": "Biomedical_Waste_Management-Previous_Year_Questions.json", "title": "Biomedical Waste Management Previous Year Questions", "category": "ENT", "count": 4}, {"file": "Biostatistics-Biostatistics_and_Measures_of_Central_Tendency.json", "title": "Biostatistics Biostatistics And Measures Of Central Tendency", "category": "ENT", "count": 10}, {"file": "Brainstem_Ventral__Dorsal_View__IV_Ventricles.json", "title": "Brainstem Ventral  Dorsal View  Iv Ventricles", "category": "ENT", "count": 17}, {"file": "Breech_Presentation.json", "title": "Breech Presentation", "category": "ENT", "count": 7}, {"file": "Cardinal_Movements_of_Labour.json", "title": "Cardinal Movements Of Labour", "category": "ENT", "count": 2}, {"file": "Cardiovascular_System-Cardiac_Conducting_System_and_Action_Potentials.json", "title": "Cardiovascular System Cardiac Conducting System And Action Potentials", "category": "ENT", "count": 18}, {"file": "Cellular_Events_of_Inflammation.json", "title": "Cellular Events Of Inflammation", "category": "ENT", "count": 1}, {"file": "Central_Nervous_System.json", "title": "Central Nervous System", "category": "ENT", "count": 183}, {"file": "Central_Nervous_System_1.json", "title": "Central Nervous System 1", "category": "ENT", "count": 183}, {"file": "Central_Nervous_System_2.json", "title": "Central Nervous System 2", "category": "ENT", "count": 183}, {"file": "Central_Nervous_System_3.json", "title": "Central Nervous System 3", "category": "ENT", "count": 84}, {"file": "Central_Nervous_System_4.json", "title": "Central Nervous System 4", "category": "ENT", "count": 24}, {"file": "Central_Nervous_System-Previous_Year_Questions.json", "title": "Central Nervous System Previous Year Questions", "category": "ENT", "count": 17}, {"file": "Central_Neuraxial_Block.json", "title": "Central Neuraxial Block", "category": "ENT", "count": 49}, {"file": "Central_Neuraxial_Blockade-Previous_Year_Questions.json", "title": "Central Neuraxial Blockade Previous Year Questions", "category": "ENT", "count": 1}, {"file": "Clinical_Essentials-Previous_Year_Questions.json", "title": "Clinical Essentials Previous Year Questions", "category": "ENT", "count": 3}, {"file": "Clinical_Essentials-Previous_Year_Questions_1.json", "title": "Clinical Essentials Previous Year Questions 1", "category": "ENT", "count": 3}, {"file": "Clinical_Essentials-Previous_Year_Questions_2.json", "title": "Clinical Essentials Previous Year Questions 2", "category": "ENT", "count": 3}, {"file": "CNS-Dementia.json", "title": "Cns Dementia", "category": "ENT", "count": 7}, {"file": "Consent__Euthanasia.json", "title": "Consent  Euthanasia", "category": "ENT", "count": 6}, {"file": "Contrast_Agents_in_Radiology.json", "title": "Contrast Agents In Radiology", "category": "ENT", "count": 11}, {"file": "Culture__Identification.json", "title": "Culture  Identification", "category": "ENT", "count": 23}, {"file": "CVS_Development_-_Arterial_System.json", "title": "Cvs Development   Arterial System", "category": "ENT", "count": 6}, {"file": "CVS_Development_-_Heart_Tube__Derivates.json", "title": "Cvs Development   Heart Tube  Derivates", "category": "ENT", "count": 12}, {"file": "CVS_Development_-_Interatrial__Interventricular_Septum.json", "title": "Cvs Development   Interatrial  Interventricular Septum", "category": "ENT", "count": 10}, {"file": "CVS_Development_-_Venous_System.json", "title": "Cvs Development   Venous System", "category": "ENT", "count": 16}, {"file": "Dementia_-_Alzheimers_Disease_Part_1.json", "title": "Dementia   Alzheimers Disease Part 1", "category": "ENT", "count": 27}, {"file": "Dementia_-_Lewy_Body_Dementia__Vascular_Dementia_Part_2.json", "title": "Dementia   Lewy Body Dementia  Vascular Dementia Part 2", "category": "ENT", "count": 7}, {"file": "Demo_Test_for_First_Prof_Students_-_2024-12-20.json", "title": "Demo Test For First Prof Students   2024 12 20", "category": "ENT", "count": 30}, {"file": "Development_of_Eye.json", "title": "Development Of Eye", "category": "ENT", "count": 3}, {"file": "Developmental_and_Behavioral_Disorders-Previous_Year_Questions.json", "title": "Developmental And Behavioral Disorders Previous Year Questions", "category": "ENT", "count": 6}, {"file": "Developmental_and_Behavioural_Disorders-Normal_Development__Developmental___Behavioral_Disorders.json", "title": "Developmental And Behavioural Disorders Normal Development  Developmental   Behavioral Disorders", "category": "ENT", "count": 20}, {"file": "Difficult_airway_management___Ventilators.json", "title": "Difficult Airway Management   Ventilators", "category": "ENT", "count": 4}, {"file": "Disaster_Management.json", "title": "Disaster Management", "category": "ENT", "count": 12}, {"file": "Disaster_Management_1.json", "title": "Disaster Management 1", "category": "ENT", "count": 17}, {"file": "Disaster_Management_2.json", "title": "Disaster Management 2", "category": "ENT", "count": 10}, {"file": "Drugs_Affecting_Blood_and_Blood_formation-Oral_and_Parenteral_Anticoagulants.json", "title": "Drugs Affecting Blood And Blood Formation Oral And Parenteral Anticoagulants", "category": "ENT", "count": 15}, {"file": "ECG_-_Basics__Lead_Placement_Part_1.json", "title": "Ecg   Basics  Lead Placement Part 1", "category": "ENT", "count": 18}, {"file": "ECG_-_Ventricular_Hypertrophies__Axis_Part_4.json", "title": "Ecg   Ventricular Hypertrophies  Axis Part 4", "category": "ENT", "count": 2}, {"file": "Ectropion__Entropion.json", "title": "Ectropion  Entropion", "category": "ENT", "count": 16}, {"file": "Emergency_Medicine-Emergency_Cardiovascular_Care_Protocols__BCLS__ACLS__Mechanical_ventilation__and_Causes_of_Pulseless_Electrical_Activity.json", "title": "Emergency Medicine Emergency Cardiovascular Care Protocols  Bcls  Acls  Mechanical Ventilation  And Causes Of Pulseless Electrical Activity", "category": "ENT", "count": 13}, {"file": "ENT.json", "title": "Ent", "category": "ENT", "count": 20}, {"file": "ENT_-_INI_CET_JULY_2021.json", "title": "Ent   Ini Cet July 2021", "category": "ENT", "count": 3}, {"file": "ENT_-_INI_CET_MAY_2022.json", "title": "Ent   Ini Cet May 2022", "category": "ENT", "count": 4}, {"file": "ENT_-_INI_CET_NOV_2020.json", "title": "Ent   Ini Cet Nov 2020", "category": "ENT", "count": 7}, {"file": "ENT_-_INI_CET_NOV_2021.json", "title": "Ent   Ini Cet Nov 2021", "category": "ENT", "count": 5}, {"file": "ENT_-_INI_CET_NOV_2023.json", "title": "Ent   Ini Cet Nov 2023", "category": "ENT", "count": 7}, {"file": "ENT_-_INI_CET_NOVEMBER_2022_PART_A.json", "title": "Ent   Ini Cet November 2022 Part A", "category": "ENT", "count": 11}, {"file": "ENT_-_INI_CET_NOVEMBER_2022_PART_B.json", "title": "Ent   Ini Cet November 2022 Part B", "category": "ENT", "count": 3}, {"file": "ENT-_Class_Test_With_Video_Solution.json", "title": "Ent  Class Test With Video Solution", "category": "ENT", "count": 75}, {"file": "ENT-_INI_CET_MAY_2023.json", "title": "Ent  Ini Cet May 2023", "category": "ENT", "count": 5}, {"file": "ENT_Dr_Deepak.json", "title": "Ent Dr Deepak", "category": "ENT", "count": 75}, {"file": "55_ENT_Dr_Deepak.json", "title": "Ent Dr Deepak", "category": "ENT", "count": 40}, {"file": "56_ENT_Dr_Deepak.json", "title": "Ent Dr Deepak", "category": "ENT", "count": 40}, {"file": "59_ENT_Dr_Deepak.json", "title": "Ent Dr Deepak", "category": "ENT", "count": 40}, {"file": "ENT_Dr_Deepak_1.json", "title": "Ent Dr Deepak 1", "category": "ENT", "count": 75}, {"file": "ENT_Dr_Deepak-2026.json", "title": "Ent Dr Deepak 2026", "category": "ENT", "count": 75}, {"file": "ENT_DVT_Revision_Test.json", "title": "Ent Dvt Revision Test", "category": "ENT", "count": 25}, {"file": "ENT_ED_-_28-09-2023_-_2023-09-28.json", "title": "Ent Ed   28 09 2023   2023 09 28", "category": "ENT", "count": 75}, {"file": "ENT_ED_-_Mission_15_-_30-04-2024_-_2024-04-30.json", "title": "Ent Ed   Mission 15   30 04 2024   2024 04 30", "category": "ENT", "count": 60}, {"file": "ENT_ED_-_Mission_15_Lap_2_-_09-06-2024_-_2024-06-09.json", "title": "Ent Ed   Mission 15 Lap 2   09 06 2024   2024 06 09", "category": "ENT", "count": 75}, {"file": "ENT_ED_-_Mission_20_Batch_2_-_17-09-2024_-_2024-09-17.json", "title": "Ent Ed   Mission 20 Batch 2   17 09 2024   2024 09 17", "category": "ENT", "count": 50}, {"file": "ENT_ED_-_Mission_20_Batch_3_-_25-01-2025_-_2025-01-25.json", "title": "Ent Ed   Mission 20 Batch 3   25 01 2025   2025 01 25", "category": "ENT", "count": 99}, {"file": "ENT_ED_-_Mission_20_Lap_2_-_23-04-2025_-_2025-04-23.json", "title": "Ent Ed   Mission 20 Lap 2   23 04 2025   2025 04 23", "category": "ENT", "count": 50}, {"file": "ENT_Last_Month_ED_-_19-07-2024_-_2024-07-18.json", "title": "Ent Last Month Ed   19 07 2024   2024 07 18", "category": "ENT", "count": 50}, {"file": "ENT_MIQ_Series.json", "title": "Ent Miq Series", "category": "ENT", "count": 20}, {"file": "ENT_Ophthal_Psychiatry_30_-_2024-05-02.json", "title": "Ent Ophthal Psychiatry 30   2024 05 02", "category": "ENT", "count": 100}, {"file": "ENT_Ophthalmology__Psychiatry_BTR_50_Test_-_2025-01-25.json", "title": "Ent Ophthalmology  Psychiatry Btr 50 Test   2025 01 25", "category": "ENT", "count": 175}, {"file": "ENT_Surgeries-Previous_Year_Questions.json", "title": "Ent Surgeries Previous Year Questions", "category": "ENT", "count": 5}, {"file": "ENT_Test_The_Champion_Batch_Hyderabad_-_05-01-2025_-_2025-01-05.json", "title": "Ent Test The Champion Batch Hyderabad   05 01 2025   2025 01 05", "category": "ENT", "count": 50}, {"file": "ENT_Test_The_Champion_Batch_Hyderabad_-_29-03-2025_-_2025-03-29.json", "title": "Ent Test The Champion Batch Hyderabad   29 03 2025   2025 03 29", "category": "ENT", "count": 75}, {"file": "ENT_Test_The_Champion_Batch_Hyderabad_-_31-05-2024_-_2024-05-31.json", "title": "Ent Test The Champion Batch Hyderabad   31 05 2024   2024 05 31", "category": "ENT", "count": 75}, {"file": "ENT_Test_The_Champion_Batch_Hyderabad_11-10-2024_-_2024-10-11.json", "title": "Ent Test The Champion Batch Hyderabad 11 10 2024   2024 10 11", "category": "ENT", "count": 75}, {"file": "Entomology.json", "title": "Entomology", "category": "ENT", "count": 26}, {"file": "Entrapment_Neuropathies.json", "title": "Entrapment Neuropathies", "category": "ENT", "count": 11}, {"file": "Environment__Health.json", "title": "Environment  Health", "category": "ENT", "count": 30}, {"file": "Environment_and_Health.json", "title": "Environment And Health", "category": "ENT", "count": 109}, {"file": "Environment_and_Health-Air__Light__Sound__and_Radiation.json", "title": "Environment And Health Air  Light  Sound  And Radiation", "category": "ENT", "count": 16}, {"file": "Environment_and_Health-Entomology.json", "title": "Environment And Health Entomology", "category": "ENT", "count": 12}, {"file": "Environment_and_Health-Previous_Year_Questions.json", "title": "Environment And Health Previous Year Questions", "category": "ENT", "count": 34}, {"file": "Environment_and_Health-Water-_Introduction_and_Purification.json", "title": "Environment And Health Water  Introduction And Purification", "category": "ENT", "count": 15}, {"file": "Essential_Thromobocythemia.json", "title": "Essential Thromobocythemia", "category": "ENT", "count": 1}, {"file": "Exclusively_for_1st_Prof_Students_-_24-11-2024_-_2024-11-24.json", "title": "Exclusively For 1St Prof Students   24 11 2024   2024 11 24", "category": "ENT", "count": 30}, {"file": "Fetal_Assessment.json", "title": "Fetal Assessment", "category": "ENT", "count": 25}, {"file": "Fundamentals_of_Reproduction.json", "title": "Fundamentals Of Reproduction", "category": "ENT", "count": 18}, {"file": "Gastroenterology.json", "title": "Gastroenterology", "category": "ENT", "count": 140}, {"file": "General_Anesthesia_-_Inhalational_Agents.json", "title": "General Anesthesia   Inhalational Agents", "category": "ENT", "count": 50}, {"file": "General_Embryology-Development_Period.json", "title": "General Embryology Development Period", "category": "ENT", "count": 10}, {"file": "GIT_Development_-_Foregut.json", "title": "Git Development   Foregut", "category": "ENT", "count": 6}, {"file": "GIT_Development_-_Midgut.json", "title": "Git Development   Midgut", "category": "ENT", "count": 20}, {"file": "Glaucoma-Glaucoma-PACG__Treatment__Congenital_Glaucoma.json", "title": "Glaucoma Glaucoma Pacg  Treatment  Congenital Glaucoma", "category": "ENT", "count": 25}, {"file": "Growth__Development.json", "title": "Growth  Development", "category": "ENT", "count": 59}, {"file": "Growth_and_Development_Nutrition.json", "title": "Growth And Development Nutrition", "category": "ENT", "count": 50}, {"file": "Growth_Assessment.json", "title": "Growth Assessment", "category": "ENT", "count": 22}, {"file": "Growth_Development_Puberty.json", "title": "Growth Development Puberty", "category": "ENT", "count": 7}, {"file": "Hair__Other_Methods_of_Identification.json", "title": "Hair  Other Methods Of Identification", "category": "ENT", "count": 5}, {"file": "Hamstring_Compartment__Anastomosis.json", "title": "Hamstring Compartment  Anastomosis", "category": "ENT", "count": 8}, {"file": "Health_Management.json", "title": "Health Management", "category": "ENT", "count": 21}, {"file": "Health_Planning__Management.json", "title": "Health Planning  Management", "category": "ENT", "count": 14}, {"file": "Health_Planning_and_Management.json", "title": "Health Planning And Management", "category": "ENT", "count": 15}, {"file": "Health_Planning_and_Management-Health_Planning_and_Management.json", "title": "Health Planning And Management Health Planning And Management", "category": "ENT", "count": 8}, {"file": "Health_Planning_and_Management-Previous_Year_Questions.json", "title": "Health Planning And Management Previous Year Questions", "category": "ENT", "count": 15}, {"file": "Health_Planning_Planning_Committees_Health_Management_Techniques.json", "title": "Health Planning Planning Committees Health Management Techniques", "category": "ENT", "count": 4}, {"file": "Helminthic_Gastroenteritis.json", "title": "Helminthic Gastroenteritis", "category": "ENT", "count": 14}, {"file": "Hematology__White_Blood_Cells-WBC_Basics_and_Instruments.json", "title": "Hematology  White Blood Cells Wbc Basics And Instruments", "category": "ENT", "count": 9}, {"file": "Hematology-Blood_components_and_Complications_of_blood_transfusion.json", "title": "Hematology Blood Components And Complications Of Blood Transfusion", "category": "ENT", "count": 20}, {"file": "Higher_Mental_Functions.json", "title": "Higher Mental Functions", "category": "ENT", "count": 6}, {"file": "HIV_-_Treatment_Part_3.json", "title": "Hiv   Treatment Part 3", "category": "ENT", "count": 10}, {"file": "HNF_Development_-_Face__Palate.json", "title": "Hnf Development   Face  Palate", "category": "ENT", "count": 13}, {"file": "HNF_Development_-_Pharyngeal_Arches.json", "title": "Hnf Development   Pharyngeal Arches", "category": "ENT", "count": 19}, {"file": "HNF_Development_-_Tongue_Thyroid__Eyeball.json", "title": "Hnf Development   Tongue Thyroid  Eyeball", "category": "ENT", "count": 12}, {"file": "Hormonal_Agents__Tyrosine_Kinase_Inhibitors.json", "title": "Hormonal Agents  Tyrosine Kinase Inhibitors", "category": "ENT", "count": 14}, {"file": "IBD_Diarrhea__Dehydration_Management.json", "title": "Ibd Diarrhea  Dehydration Management", "category": "ENT", "count": 15}, {"file": "Identification.json", "title": "Identification", "category": "ENT", "count": 55}, {"file": "Identification_1.json", "title": "Identification 1", "category": "ENT", "count": 36}, {"file": "Image_Based_and_Recent_Updates.json", "title": "Image Based And Recent Updates", "category": "ENT", "count": 49}, {"file": "Images_and_Instruments-Orthopedic_Disorders_and_Instruments.json", "title": "Images And Instruments Orthopedic Disorders And Instruments", "category": "ENT", "count": 24}, {"file": "Images_and_Instruments-Previous_Year_Questions.json", "title": "Images And Instruments Previous Year Questions", "category": "ENT", "count": 1}, {"file": "Induction__Augmentation.json", "title": "Induction  Augmentation", "category": "ENT", "count": 12}, {"file": "Inhalational_Anaesthetic_Agents-Inhalational_Anaesthetics.json", "title": "Inhalational Anaesthetic Agents Inhalational Anaesthetics", "category": "ENT", "count": 16}, {"file": "Inhalational_Anaesthetic_Agents-Previous_Year_Questions.json", "title": "Inhalational Anaesthetic Agents Previous Year Questions", "category": "ENT", "count": 7}, {"file": "Inhalational_Anesthetic_Agents.json", "title": "Inhalational Anesthetic Agents", "category": "ENT", "count": 25}, {"file": "Instrument.json", "title": "Instrument", "category": "ENT", "count": 26}, {"file": "Instrument_1.json", "title": "Instrument 1", "category": "ENT", "count": 26}, {"file": "Instrument_2.json", "title": "Instrument 2", "category": "ENT", "count": 26}, {"file": "Instrumental_Delivery.json", "title": "Instrumental Delivery", "category": "ENT", "count": 6}, {"file": "Instrumental_Delivery_1.json", "title": "Instrumental Delivery 1", "category": "ENT", "count": 9}, {"file": "Instrumental_Vaginal_Delivery-Previous_Year_Questions.json", "title": "Instrumental Vaginal Delivery Previous Year Questions", "category": "ENT", "count": 3}, {"file": "Instruments.json", "title": "Instruments", "category": "ENT", "count": 40}, {"file": "Instruments__Implants_In_Ortho.json", "title": "Instruments  Implants In Ortho", "category": "ENT", "count": 14}, {"file": "Instruments_for_EAR.json", "title": "Instruments For Ear", "category": "ENT", "count": 12}, {"file": "Instruments_for_Nose__Throat.json", "title": "Instruments For Nose  Throat", "category": "ENT", "count": 3}, {"file": "Instruments_in_Anesthesia.json", "title": "Instruments In Anesthesia", "category": "ENT", "count": 56}, {"file": "Instruments_in_Gynae.json", "title": "Instruments In Gynae", "category": "ENT", "count": 21}, {"file": "Instruments_in_Obs.json", "title": "Instruments In Obs", "category": "ENT", "count": 11}, {"file": "Instruments-Previous_Year_Questions.json", "title": "Instruments Previous Year Questions", "category": "ENT", "count": 3}, {"file": "Instruments-Previous_Year_Questions_1.json", "title": "Instruments Previous Year Questions 1", "category": "ENT", "count": 3}, {"file": "Instruments-Previous_Year_Questions_2.json", "title": "Instruments Previous Year Questions 2", "category": "ENT", "count": 3}, {"file": "Instruments-Previous_Year_Questions_3.json", "title": "Instruments Previous Year Questions 3", "category": "ENT", "count": 3}, {"file": "Intensive_Care_Management.json", "title": "Intensive Care Management", "category": "ENT", "count": 11}, {"file": "Interferential_Statistics.json", "title": "Interferential Statistics", "category": "ENT", "count": 5}, {"file": "Interior_of_Right_Atrium__Right_Ventricle.json", "title": "Interior Of Right Atrium  Right Ventricle", "category": "ENT", "count": 7}, {"file": "Intravenous_Anaesthetic_Agents.json", "title": "Intravenous Anaesthetic Agents", "category": "ENT", "count": 13}, {"file": "Intravenous_Anaesthetic_Agents-Intravenous_Anaesthetic_Agents.json", "title": "Intravenous Anaesthetic Agents Intravenous Anaesthetic Agents", "category": "ENT", "count": 20}, {"file": "Intravenous_Anaesthetic_Agents-Previous_Year_Questions.json", "title": "Intravenous Anaesthetic Agents Previous Year Questions", "category": "ENT", "count": 7}, {"file": "Intravenous_and_Inhaled_Anaesthetic_Agents.json", "title": "Intravenous And Inhaled Anaesthetic Agents", "category": "ENT", "count": 104}, {"file": "Intravenous_Anesthetic_Agents.json", "title": "Intravenous Anesthetic Agents", "category": "ENT", "count": 51}, {"file": "Introduction__DNA_Alkylating_Agents.json", "title": "Introduction  Dna Alkylating Agents", "category": "ENT", "count": 20}, {"file": "Introduction__Examination_of_ENT.json", "title": "Introduction  Examination Of Ent", "category": "ENT", "count": 4}, {"file": "Investigation__Management.json", "title": "Investigation  Management", "category": "ENT", "count": 10}, {"file": "Laser_in_Ent__Photodynamic_Therapy.json", "title": "Laser In Ent  Photodynamic Therapy", "category": "ENT", "count": 4}, {"file": "Latent_Squint.json", "title": "Latent Squint", "category": "ENT", "count": 8}, {"file": "Lateral__Third_Ventricles.json", "title": "Lateral  Third Ventricles", "category": "ENT", "count": 10}, {"file": "Leg_Compartments.json", "title": "Leg Compartments", "category": "ENT", "count": 3}, {"file": "Levels_of_Prevention.json", "title": "Levels Of Prevention", "category": "ENT", "count": 8}, {"file": "Liver__Hepatic_Segments.json", "title": "Liver  Hepatic Segments", "category": "ENT", "count": 7}, {"file": "Lungs_-_Mediastinal_Surface__Bronchopulmonary_Segments.json", "title": "Lungs   Mediastinal Surface  Bronchopulmonary Segments", "category": "ENT", "count": 7}, {"file": "Lymphedema_Clinical_Presentation.json", "title": "Lymphedema Clinical Presentation", "category": "ENT", "count": 11}, {"file": "Malpresentation.json", "title": "Malpresentation", "category": "ENT", "count": 6}, {"file": "Management_of_Severe_Acute_Malnutrition.json", "title": "Management Of Severe Acute Malnutrition", "category": "ENT", "count": 21}, {"file": "Management_Part_1.json", "title": "Management Part 1", "category": "ENT", "count": 5}, {"file": "Management_Part_2.json", "title": "Management Part 2", "category": "ENT", "count": 14}, {"file": "Management_Part_3.json", "title": "Management Part 3", "category": "ENT", "count": 10}, {"file": "Management_Part_4.json", "title": "Management Part 4", "category": "ENT", "count": 25}, {"file": "Mechanical_Ventilation_and_Modes_of_Ventilation-Difficult_airway_management_and_Ventilators.json", "title": "Mechanical Ventilation And Modes Of Ventilation Difficult Airway Management And Ventilators", "category": "ENT", "count": 13}, {"file": "Mechanical_Ventilation_and_Modes_of_Ventilation-Previous_Year_Questions.json", "title": "Mechanical Ventilation And Modes Of Ventilation Previous Year Questions", "category": "ENT", "count": 5}, {"file": "Medial_Compartment_of_Thigh__Obturator_Nerve.json", "title": "Medial Compartment Of Thigh  Obturator Nerve", "category": "ENT", "count": 8}, {"file": "Membrane_Potentials.json", "title": "Membrane Potentials", "category": "ENT", "count": 15}, {"file": "Mental_Health.json", "title": "Mental Health", "category": "ENT", "count": 14}, {"file": "Mid_Day_Module_ENT-1_-_2025-01-22.json", "title": "Mid Day Module Ent 1   2025 01 22", "category": "ENT", "count": 49}, {"file": "Mid_Day_Module_ENT-2_-_2025-01-23.json", "title": "Mid Day Module Ent 2   2025 01 23", "category": "ENT", "count": 50}, {"file": "Mid_Day_Module_ENT-3_-_2025-01-24.json", "title": "Mid Day Module Ent 3   2025 01 24", "category": "ENT", "count": 50}, {"file": "Mid_Day_Module_ENT-4_-_2025-01-25.json", "title": "Mid Day Module Ent 4   2025 01 25", "category": "ENT", "count": 50}, {"file": "Mid_Day_Module_ENTOphthalmology-5_-_2025-01-26.json", "title": "Mid Day Module Entophthalmology 5   2025 01 26", "category": "ENT", "count": 50}, {"file": "Mid_Day_Module_ENTOphthalmologyPsychiatry-1_-_2025-01-27.json", "title": "Mid Day Module Entophthalmologypsychiatry 1   2025 01 27", "category": "ENT", "count": 50}, {"file": "Miscellaneous_History_of_Public_Health_Entomology.json", "title": "Miscellaneous History Of Public Health Entomology", "category": "ENT", "count": 3}, {"file": "Miscellaneous-Instruments.json", "title": "Miscellaneous Instruments", "category": "ENT", "count": 14}, {"file": "Missed_pill_management.json", "title": "Missed Pill Management", "category": "ENT", "count": 9}, {"file": "Movement_Disorders_Part_1.json", "title": "Movement Disorders Part 1", "category": "ENT", "count": 10}, {"file": "National_Health_Programs-National_health_mission_RMNCH_-_A___maternal_initiatives__Child_and_adolescents_health_initiatives.json", "title": "National Health Programs National Health Mission Rmnch   A   Maternal Initiatives  Child And Adolescents Health Initiatives", "category": "ENT", "count": 14}, {"file": "Neoplasia-Fundamentals_of_Neoplasia.json", "title": "Neoplasia Fundamentals Of Neoplasia", "category": "ENT", "count": 10}, {"file": "Normal_Development-Previous_Year_Questions.json", "title": "Normal Development Previous Year Questions", "category": "ENT", "count": 17}, {"file": "Nutrition_and_Health-Macronutrients.json", "title": "Nutrition And Health Macronutrients", "category": "ENT", "count": 14}, {"file": "O2_Independent_Killing.json", "title": "O2 Independent Killing", "category": "ENT", "count": 1}, {"file": "Obstetrics-Abnormalities_of_Placenta_and_Umbilical_Cord.json", "title": "Obstetrics Abnormalities Of Placenta And Umbilical Cord", "category": "ENT", "count": 19}, {"file": "Obstetrics-Instrumental_delivery_and_induction_of_labor.json", "title": "Obstetrics Instrumental Delivery And Induction Of Labor", "category": "ENT", "count": 14}, {"file": "Organic_Mental_Disorders.json", "title": "Organic Mental Disorders", "category": "ENT", "count": 31}, {"file": "Organic_Mental_Disorders_1.json", "title": "Organic Mental Disorders 1", "category": "ENT", "count": 26}, {"file": "Orientation_of_Extra_Ocular_Muscles.json", "title": "Orientation Of Extra Ocular Muscles", "category": "ENT", "count": 8}, {"file": "Oxygen_Therapy__Mechanical_Ventilation_and_Airway-Previous_Year_Questions.json", "title": "Oxygen Therapy  Mechanical Ventilation And Airway Previous Year Questions", "category": "ENT", "count": 25}, {"file": "Paediatric_Gastroentrology.json", "title": "Paediatric Gastroentrology", "category": "ENT", "count": 13}, {"file": "Pain_Management-Pain_management.json", "title": "Pain Management Pain Management", "category": "ENT", "count": 8}, {"file": "Pancreas_Management_of_Acute__Chronic_Pancreatitis.json", "title": "Pancreas Management Of Acute  Chronic Pancreatitis", "category": "ENT", "count": 53}, {"file": "Pediatric_Gastroenterology-GIT_Disorders_in_Children.json", "title": "Pediatric Gastroenterology Git Disorders In Children", "category": "ENT", "count": 20}, {"file": "Pediatric_Gastroenterology-Liver_Disorders_in_Children.json", "title": "Pediatric Gastroenterology Liver Disorders In Children", "category": "ENT", "count": 13}, {"file": "Pediatric_Gastroenterology-Previous_Year_Questions.json", "title": "Pediatric Gastroenterology Previous Year Questions", "category": "ENT", "count": 22}, {"file": "Pediatric_Nephrology-Renal_Development_and_Congenital_Disorders.json", "title": "Pediatric Nephrology Renal Development And Congenital Disorders", "category": "ENT", "count": 19}, {"file": "Pelvis_and_Perineum-Development_of_GUT__Pelvis___Perineum.json", "title": "Pelvis And Perineum Development Of Gut  Pelvis   Perineum", "category": "ENT", "count": 10}, {"file": "Permanent_Methods_of_Contraception.json", "title": "Permanent Methods Of Contraception", "category": "ENT", "count": 14}, {"file": "Permanent_Sterilisation.json", "title": "Permanent Sterilisation", "category": "ENT", "count": 7}, {"file": "Pigmentary_Disorder.json", "title": "Pigmentary Disorder", "category": "ENT", "count": 3}, {"file": "Pigmentary_Disorders.json", "title": "Pigmentary Disorders", "category": "ENT", "count": 21}, {"file": "Pigmentary_Disorders-Pigmentary_disorders.json", "title": "Pigmentary Disorders Pigmentary Disorders", "category": "ENT", "count": 20}, {"file": "Pigmentary_Disorders-Previous_Year_Questions.json", "title": "Pigmentary Disorders Previous Year Questions", "category": "ENT", "count": 14}, {"file": "Pigmentation_Diseases.json", "title": "Pigmentation Diseases", "category": "ENT", "count": 15}, {"file": "Placenta__Fetus.json", "title": "Placenta  Fetus", "category": "ENT", "count": 24}, {"file": "Placenta_Previa.json", "title": "Placenta Previa", "category": "ENT", "count": 7}, {"file": "Preoperative_Assessment.json", "title": "Preoperative Assessment", "category": "ENT", "count": 30}, {"file": "Prevention_of_Non_communicable_disease.json", "title": "Prevention Of Non Communicable Disease", "category": "ENT", "count": 25}, {"file": "Preventive_and_Social_Obstetrics.json", "title": "Preventive And Social Obstetrics", "category": "ENT", "count": 8}, {"file": "Preventive_Aspects_of_Communicable_Diseases.json", "title": "Preventive Aspects Of Communicable Diseases", "category": "ENT", "count": 139}, {"file": "Preventive_Medicine_in__Obstetrics__Pediatrics_and_Geriatrics-Preventive_Medicine_in_Obstetrics__Pediatrics_and_Geriatrics.json", "title": "Preventive Medicine In  Obstetrics  Pediatrics And Geriatrics Preventive Medicine In Obstetrics  Pediatrics And Geriatrics", "category": "ENT", "count": 25}, {"file": "Preventive_Medicine_in__Obstetrics__Pediatrics_and_Geriatrics-Previous_Year_Questions.json", "title": "Preventive Medicine In  Obstetrics  Pediatrics And Geriatrics Previous Year Questions", "category": "ENT", "count": 28}, {"file": "Preventive_Obstetrics_and_Gynecology__Pediatrics__Growth__Development__School_Health.json", "title": "Preventive Obstetrics And Gynecology  Pediatrics  Growth  Development  School Health", "category": "ENT", "count": 6}, {"file": "Preventive_Obstetrics_Paediatrics__Geriatrics.json", "title": "Preventive Obstetrics Paediatrics  Geriatrics", "category": "ENT", "count": 58}, {"file": "Protozoal_Gastroenteritis.json", "title": "Protozoal Gastroenteritis", "category": "ENT", "count": 31}, {"file": "Psychi_Optha_ENT_BTR_Test_20_-_2024-01-31.json", "title": "Psychi Optha Ent Btr Test 20   2024 01 31", "category": "ENT", "count": 100}, {"file": "Psychi_Opthal_ENT_10_BTR_Test_-_2023-10-13.json", "title": "Psychi Opthal Ent 10 Btr Test   2023 10 13", "category": "ENT", "count": 100}, {"file": "Psychiatry_ENT__Ophtha_40_BTR_test_-_2024-10-18.json", "title": "Psychiatry Ent  Ophtha 40 Btr Test   2024 10 18", "category": "ENT", "count": 100}, {"file": "Psychiatry_ENT__Ophthalmology_BTR_60_test_-_2025-04-25.json", "title": "Psychiatry Ent  Ophthalmology Btr 60 Test   2025 04 25", "category": "ENT", "count": 100}, {"file": "Pulmonary_Ventilation_-_Compliance__Surface_Tension.json", "title": "Pulmonary Ventilation   Compliance  Surface Tension", "category": "ENT", "count": 8}, {"file": "Pulmonary_Ventilation_-_Lung_Volume__Capacities.json", "title": "Pulmonary Ventilation   Lung Volume  Capacities", "category": "ENT", "count": 10}, {"file": "Pulmonary_Ventilation_-_Minute_Ventilation__Dead_Spaces.json", "title": "Pulmonary Ventilation   Minute Ventilation  Dead Spaces", "category": "ENT", "count": 3}, {"file": "Pulmonary_Ventilation_-_Obstructive_Vs_Restrictive_Lung_Disease.json", "title": "Pulmonary Ventilation   Obstructive Vs Restrictive Lung Disease", "category": "ENT", "count": 4}, {"file": "Pulmonary_Ventilation_-_Respiratory_Muscles_Pressures.json", "title": "Pulmonary Ventilation   Respiratory Muscles Pressures", "category": "ENT", "count": 5}, {"file": "Rational_PrescribingEssential_Medicine__Ebm.json", "title": "Rational Prescribingessential Medicine  Ebm", "category": "ENT", "count": 4}, {"file": "3rd_Stage_of_Labour__Its_Management.json", "title": "Rd Stage Of Labour  Its Management", "category": "ENT", "count": 6}, {"file": "Recent_Advances_in_Ent_Surgeries__Therapies.json", "title": "Recent Advances In Ent Surgeries  Therapies", "category": "ENT", "count": 3}, {"file": "Recent_MTP_ACT.json", "title": "Recent Mtp Act", "category": "ENT", "count": 3}, {"file": "Retina-Macular_and_Fundus_Disorders__Retinal_Detachment_and_Retinoblastoma.json", "title": "Retina Macular And Fundus Disorders  Retinal Detachment And Retinoblastoma", "category": "ENT", "count": 20}, {"file": "Retinal_Detachment.json", "title": "Retinal Detachment", "category": "ENT", "count": 5}, {"file": "Scientists.json", "title": "Scientists", "category": "ENT", "count": 8}, {"file": "Secondary_Developmental_Glaucoma.json", "title": "Secondary Developmental Glaucoma", "category": "ENT", "count": 7}, {"file": "Sociology__Biomedical_Waste_Management.json", "title": "Sociology  Biomedical Waste Management", "category": "ENT", "count": 24}, {"file": "Sociology__Enviroment_and_Health.json", "title": "Sociology  Enviroment And Health", "category": "ENT", "count": 76}, {"file": "Specialty_Management.json", "title": "Specialty Management", "category": "ENT", "count": 60}, {"file": "SWT-ENT-SET-A.json", "title": "Swt Ent Set A", "category": "ENT", "count": 200}, {"file": "SWT-ENT-SET-B.json", "title": "Swt Ent Set B", "category": "ENT", "count": 100}, {"file": "Systemic_Bacteriology-Corynebacterium___Filamentous_bacterium.json", "title": "Systemic Bacteriology Corynebacterium   Filamentous Bacterium", "category": "ENT", "count": 14}, {"file": "Systemic_Bacteriology-Vibrio_and_non-fermenters.json", "title": "Systemic Bacteriology Vibrio And Non Fermenters", "category": "ENT", "count": 7}, {"file": "The_Placenta__Fetal_Membranes.json", "title": "The Placenta  Fetal Membranes", "category": "ENT", "count": 14}, {"file": "Thorax-Development_of_the_Cardiovascular_System_and_Fetal_Circulation.json", "title": "Thorax Development Of The Cardiovascular System And Fetal Circulation", "category": "ENT", "count": 12}, {"file": "Thorax-Thorax__Lungs__Joints__Respiratory_Movements.json", "title": "Thorax Thorax  Lungs  Joints  Respiratory Movements", "category": "ENT", "count": 19}, {"file": "Trace_Elements_Nutrition_Health_Programs_Food_Adulteration_Food_Logos.json", "title": "Trace Elements Nutrition Health Programs Food Adulteration Food Logos", "category": "ENT", "count": 4}, {"file": "Traffic_Accident_Injuries.json", "title": "Traffic Accident Injuries", "category": "ENT", "count": 3}, {"file": "Transient_Myeloproliferative_Disorder__Lymphoma_Hl_NHL.json", "title": "Transient Myeloproliferative Disorder  Lymphoma Hl Nhl", "category": "ENT", "count": 7}, {"file": "Treatment.json", "title": "Treatment", "category": "ENT", "count": 9}, {"file": "Treatment_of_Bipolar_Affective_Disorder.json", "title": "Treatment Of Bipolar Affective Disorder", "category": "ENT", "count": 2}, {"file": "Treatment_of_Depression.json", "title": "Treatment Of Depression", "category": "ENT", "count": 16}, {"file": "Treatment_Of_Leprosy_And_Mac.json", "title": "Treatment Of Leprosy And Mac", "category": "ENT", "count": 2}, {"file": "Treatment_of_Otosclerosis__Stapedectomy.json", "title": "Treatment Of Otosclerosis  Stapedectomy", "category": "ENT", "count": 5}, {"file": "Treatment_of_POAG.json", "title": "Treatment Of Poag", "category": "ENT", "count": 8}, {"file": "Treatment_Of_Schizophrenia.json", "title": "Treatment Of Schizophrenia", "category": "ENT", "count": 18}, {"file": "Tubes_and_Catheters_Instruments.json", "title": "Tubes And Catheters Instruments", "category": "ENT", "count": 8}, {"file": "Urinary_Bladder_-_Urinary_Diversion_Retention_of_Urine__Incontinence_Part_1.json", "title": "Urinary Bladder   Urinary Diversion Retention Of Urine  Incontinence Part 1", "category": "ENT", "count": 9}, {"file": "Variables_Central_Tendency_Dispersion_Distribution.json", "title": "Variables Central Tendency Dispersion Distribution", "category": "ENT", "count": 5}, {"file": "Vascular_Events_of_Inflammation.json", "title": "Vascular Events Of Inflammation", "category": "ENT", "count": 1}, {"file": "Ventral__Other_Types_of_Hernias.json", "title": "Ventral  Other Types Of Hernias", "category": "ENT", "count": 11}, {"file": "Violent_Asphyxia_Deaths-Previous_Year_Questions.json", "title": "Violent Asphyxia Deaths Previous Year Questions", "category": "ENT", "count": 1}, {"file": "Viral_Gastro_Enteritis.json", "title": "Viral Gastro Enteritis", "category": "ENT", "count": 8}, {"file": "Ballistics-Forensic_Ballistics.json", "title": "Ballistics Forensic Ballistics", "category": "Forensic Medicine", "count": 25}, {"file": "FMT.json", "title": "Fmt", "category": "Forensic Medicine", "count": 100}, {"file": "FMT-_Class_Test_With_Video_Solution.json", "title": "Fmt  Class Test With Video Solution", "category": "Forensic Medicine", "count": 50}, {"file": "FMT-Clinical_Vignettes.json", "title": "Fmt Clinical Vignettes", "category": "Forensic Medicine", "count": 53}, {"file": "FMT_Dr_Mohit.json", "title": "Fmt Dr Mohit", "category": "Forensic Medicine", "count": 40}, {"file": "97_FMT_Dr_Mohit.json", "title": "Fmt Dr Mohit", "category": "Forensic Medicine", "count": 40}, {"file": "FMT_Dr_Mohit-2026.json", "title": "Fmt Dr Mohit 2026", "category": "Forensic Medicine", "count": 100}, {"file": "FMT_Dr_Mohit-2026_1.json", "title": "Fmt Dr Mohit 2026 1", "category": "Forensic Medicine", "count": 100}, {"file": "FMT_Dr_Mohit_Gupta.json", "title": "Fmt Dr Mohit Gupta", "category": "Forensic Medicine", "count": 50}, {"file": "FMT_DVT_Revision_Test.json", "title": "Fmt Dvt Revision Test", "category": "Forensic Medicine", "count": 25}, {"file": "FMT_IBQ.json", "title": "Fmt Ibq", "category": "Forensic Medicine", "count": 20}, {"file": "FMT_Image_Based_Question.json", "title": "Fmt Image Based Question", "category": "Forensic Medicine", "count": 20}, {"file": "Forensic_Identification-Forensic_Identification.json", "title": "Forensic Identification Forensic Identification", "category": "Forensic Medicine", "count": 25}, {"file": "Forensic_Identification-Previous_Year_Questions.json", "title": "Forensic Identification Previous Year Questions", "category": "Forensic Medicine", "count": 25}, {"file": "Forensic_Medicine_-_INI_CET_MAY_2023.json", "title": "Forensic Medicine   Ini Cet May 2023", "category": "Forensic Medicine", "count": 9}, {"file": "Forensic_Medicine_-_INI_CET_NOV_2023.json", "title": "Forensic Medicine   Ini Cet Nov 2023", "category": "Forensic Medicine", "count": 10}, {"file": "Forensic_Medicine_-_INI_CET_NOVEMBER_2022_PART_-_A.json", "title": "Forensic Medicine   Ini Cet November 2022 Part   A", "category": "Forensic Medicine", "count": 8}, {"file": "Forensic_Medicine_-_INI_CET_NOVEMBER_2022_PART_-_B.json", "title": "Forensic Medicine   Ini Cet November 2022 Part   B", "category": "Forensic Medicine", "count": 13}, {"file": "Forensic_Medicine_Last_Month_ED_-_21-07-2024_-_2024-07-21.json", "title": "Forensic Medicine Last Month Ed   21 07 2024   2024 07 21", "category": "Forensic Medicine", "count": 25}, {"file": "Forensic_Medicine_Test_The_Champion_Batch_Hyderabad_-_03-05-2024_-_2024-05-03.json", "title": "Forensic Medicine Test The Champion Batch Hyderabad   03 05 2024   2024 05 03", "category": "Forensic Medicine", "count": 75}, {"file": "Forensic_Medicine_Test_The_Champion_Batch_Hyderabad_-_04-06-2025_-_2025-06-04.json", "title": "Forensic Medicine Test The Champion Batch Hyderabad   04 06 2025   2025 06 04", "category": "Forensic Medicine", "count": 50}, {"file": "Forensic_Medicine_Test_The_Champion_Batch_Hyderabad_-_25-10-2024_-_2024-10-25.json", "title": "Forensic Medicine Test The Champion Batch Hyderabad   25 10 2024   2024 10 25", "category": "Forensic Medicine", "count": 75}, {"file": "Forensic_Psychiatry.json", "title": "Forensic Psychiatry", "category": "Forensic Medicine", "count": 14}, {"file": "Forensic_Psychiatry_1.json", "title": "Forensic Psychiatry 1", "category": "Forensic Medicine", "count": 15}, {"file": "Forensic_Psychiatry-Forensic_Psychiatry.json", "title": "Forensic Psychiatry Forensic Psychiatry", "category": "Forensic Medicine", "count": 11}, {"file": "Forensic_Psychiatry-Forensic_Psychiatry__Electroconvulsive_Therapy__Ect__And_Bereavement.json", "title": "Forensic Psychiatry Forensic Psychiatry  Electroconvulsive Therapy  Ect  And Bereavement", "category": "Forensic Medicine", "count": 9}, {"file": "Forensic_Psychiatry-Previous_Year_Questions.json", "title": "Forensic Psychiatry Previous Year Questions", "category": "Forensic Medicine", "count": 7}, {"file": "Forensic_Psychiatry-Previous_Year_Questions_1.json", "title": "Forensic Psychiatry Previous Year Questions 1", "category": "Forensic Medicine", "count": 7}, {"file": "Forensic_Toxicology-Forensic_Toxicology_1.json", "title": "Forensic Toxicology Forensic Toxicology 1", "category": "Forensic Medicine", "count": 20}, {"file": "Forensic_Toxicology-Forensic_Toxicology_2.json", "title": "Forensic Toxicology Forensic Toxicology 2", "category": "Forensic Medicine", "count": 25}, {"file": "Forensic_Toxicology-Previous_Year_Questions.json", "title": "Forensic Toxicology Previous Year Questions", "category": "Forensic Medicine", "count": 80}, {"file": "Forensic_Traumatology-Mechanical_injuries.json", "title": "Forensic Traumatology Mechanical Injuries", "category": "Forensic Medicine", "count": 24}, {"file": "Forensic_Traumatology-Previous_Year_Questions.json", "title": "Forensic Traumatology Previous Year Questions", "category": "Forensic Medicine", "count": 37}, {"file": "Forensic_Traumatology-Regional_injuries.json", "title": "Forensic Traumatology Regional Injuries", "category": "Forensic Medicine", "count": 13}, {"file": "Forensic_Traumatology-Thermal_injuries_and_RTA.json", "title": "Forensic Traumatology Thermal Injuries And Rta", "category": "Forensic Medicine", "count": 21}, {"file": "Introduction_Legal_Procedure_Law_Forensic_psychiatry.json", "title": "Introduction Legal Procedure Law Forensic Psychiatry", "category": "Forensic Medicine", "count": 40}, {"file": "Mid_Day_Module_FMT-1_-_2024-12-27.json", "title": "Mid Day Module Fmt 1   2024 12 27", "category": "Forensic Medicine", "count": 50}, {"file": "Mid_Day_Module_FMT-2_-_2024-12-28.json", "title": "Mid Day Module Fmt 2   2024 12 28", "category": "Forensic Medicine", "count": 50}, {"file": "Mid_Day_Module_FMT-3_-_2024-12-29.json", "title": "Mid Day Module Fmt 3   2024 12 29", "category": "Forensic Medicine", "count": 50}, {"file": "PSM_Ophthal_ENT__FMT_The_Champion_Batch_Hyderabad_-_17-03-2025_-_2025-03-17.json", "title": "Psm Ophthal Ent  Fmt The Champion Batch Hyderabad   17 03 2025   2025 03 17", "category": "Forensic Medicine", "count": 200}, {"file": "SARPO__FMT.json", "title": "Sarpo  Fmt", "category": "Forensic Medicine", "count": 30}, {"file": "SWT-FMT__Anesthesia-SET-A.json", "title": "Swt Fmt  Anesthesia Set A", "category": "Forensic Medicine", "count": 200}, {"file": "SWT-FMT-SET-B.json", "title": "Swt Fmt Set B", "category": "Forensic Medicine", "count": 100}, {"file": "All_India_INI_CET_Grand_Test_01__11th_Oct_2023__OCTOBER_2023____1__.json", "title": "All India Ini Cet Grand Test 01  11Th Oct 2023  October 2023    1  ", "category": "Grand Tests", "count": 200}, {"file": "All_India_INI_CET_Grand_Test_01__12th_Apr_2023__APRIL_2023____1__.json", "title": "All India Ini Cet Grand Test 01  12Th Apr 2023  April 2023    1  ", "category": "Grand Tests", "count": 200}, {"file": "All_India_INI_CET_Grand_Test_02__25th_Oct_2023__OCTOBER_2023____1__.json", "title": "All India Ini Cet Grand Test 02  25Th Oct 2023  October 2023    1  ", "category": "Grand Tests", "count": 200}, {"file": "All_India_INI_CET_Grand_Test_02__26th_Apr_2023__APRIL_2023____1__.json", "title": "All India Ini Cet Grand Test 02  26Th Apr 2023  April 2023    1  ", "category": "Grand Tests", "count": 200}, {"file": "BTR_GT-1_-_11-03-2025_-_2025-03-11.json", "title": "Btr Gt 1   11 03 2025   2025 03 11", "category": "Grand Tests", "count": 200}, {"file": "BTR_GT-2_-_14-03-2025_-_2025-03-14.json", "title": "Btr Gt 2   14 03 2025   2025 03 14", "category": "Grand Tests", "count": 200}, {"file": "BTR_GT-3_-_16-03-2025_-_2025-03-16.json", "title": "Btr Gt 3   16 03 2025   2025 03 16", "category": "Grand Tests", "count": 200}, {"file": "BTR_Mega_GT_30_-_2024-05-03.json", "title": "Btr Mega Gt 30   2024 05 03", "category": "Grand Tests", "count": 200}, {"file": "BTR_Mega-GT_40_-_29-10-2024_-_2024-10-29.json", "title": "Btr Mega Gt 40   29 10 2024   2024 10 29", "category": "Grand Tests", "count": 200}, {"file": "BTR_ONLINE_MOCK_GT-1_-_15-07-2025_-_2025-07-15.json", "title": "Btr Online Mock Gt 1   15 07 2025   2025 07 15", "category": "Grand Tests", "count": 200}, {"file": "Cerebel-HUM_Super-30_Grand_Test_-_2023-09-05.json", "title": "Cerebel Hum Super 30 Grand Test   2023 09 05", "category": "Grand Tests", "count": 100}, {"file": "Dementia_-_FTD_Huntington_CJD__NPH_Part_3.json", "title": "Dementia   Ftd Huntington Cjd  Nph Part 3", "category": "Grand Tests", "count": 31}, {"file": "FMG_Mega-BTR_GT_-_31-12-2024_-_2024-12-31.json", "title": "Fmg Mega Btr Gt   31 12 2024   2024 12 31", "category": "Grand Tests", "count": 150}, {"file": "Grand_Test_-_152.json", "title": "Grand Test   152", "category": "Grand Tests", "count": 300}, {"file": "Grand_Test_-_153.json", "title": "Grand Test   153", "category": "Grand Tests", "count": 300}, {"file": "Grand_Test_-_154.json", "title": "Grand Test   154", "category": "Grand Tests", "count": 300}, {"file": "Grand_Test_-_155.json", "title": "Grand Test   155", "category": "Grand Tests", "count": 300}, {"file": "Grand_Test_-_156.json", "title": "Grand Test   156", "category": "Grand Tests", "count": 299}, {"file": "Grand_Test_-_157.json", "title": "Grand Test   157", "category": "Grand Tests", "count": 300}, {"file": "Grand_Test_-_158.json", "title": "Grand Test   158", "category": "Grand Tests", "count": 300}, {"file": "Grand_Test_-_159.json", "title": "Grand Test   159", "category": "Grand Tests", "count": 300}, {"file": "Grand_Test_-_160.json", "title": "Grand Test   160", "category": "Grand Tests", "count": 300}, {"file": "Grand_Test_-_161.json", "title": "Grand Test   161", "category": "Grand Tests", "count": 300}, {"file": "Grand_Test_-_162.json", "title": "Grand Test   162", "category": "Grand Tests", "count": 300}, {"file": "Grand_Test_-_163.json", "title": "Grand Test   163", "category": "Grand Tests", "count": 300}, {"file": "Grand_Test_-_164.json", "title": "Grand Test   164", "category": "Grand Tests", "count": 300}, {"file": "Grand_Test_-_165.json", "title": "Grand Test   165", "category": "Grand Tests", "count": 300}, {"file": "Grand_Test_-_166.json", "title": "Grand Test   166", "category": "Grand Tests", "count": 300}, {"file": "Grand_Test_-_167.json", "title": "Grand Test   167", "category": "Grand Tests", "count": 300}, {"file": "Grand_Test_-_168.json", "title": "Grand Test   168", "category": "Grand Tests", "count": 300}, {"file": "Grand_Test_-_169.json", "title": "Grand Test   169", "category": "Grand Tests", "count": 300}, {"file": "Grand_Test_-_171.json", "title": "Grand Test   171", "category": "Grand Tests", "count": 300}, {"file": "Grand_Test_-_172.json", "title": "Grand Test   172", "category": "Grand Tests", "count": 299}, {"file": "Grand_Test_-_173.json", "title": "Grand Test   173", "category": "Grand Tests", "count": 300}, {"file": "Grand_Test_-_174.json", "title": "Grand Test   174", "category": "Grand Tests", "count": 300}, {"file": "Grand_Test_-_175.json", "title": "Grand Test   175", "category": "Grand Tests", "count": 300}, {"file": "Grand_Test_-_176.json", "title": "Grand Test   176", "category": "Grand Tests", "count": 300}, {"file": "Grand_Test_-_177.json", "title": "Grand Test   177", "category": "Grand Tests", "count": 300}, {"file": "Grand_Test_-_178.json", "title": "Grand Test   178", "category": "Grand Tests", "count": 300}, {"file": "Grand_Test-1_Clinical_New_Pattern.json", "title": "Grand Test 1 Clinical New Pattern", "category": "Grand Tests", "count": 200}, {"file": "Grand_Test-10_Clinical_New_Pattern.json", "title": "Grand Test 10 Clinical New Pattern", "category": "Grand Tests", "count": 200}, {"file": "Grand_Test-11_Clinical_New_Pattern.json", "title": "Grand Test 11 Clinical New Pattern", "category": "Grand Tests", "count": 200}, {"file": "Grand_Test-12_Clinical_New_Pattern.json", "title": "Grand Test 12 Clinical New Pattern", "category": "Grand Tests", "count": 200}, {"file": "Grand_Test-13_Clinical_New_Pattern.json", "title": "Grand Test 13 Clinical New Pattern", "category": "Grand Tests", "count": 200}, {"file": "Grand_Test-14_Clinical_New_Pattern.json", "title": "Grand Test 14 Clinical New Pattern", "category": "Grand Tests", "count": 200}, {"file": "Grand_Test-15_Clinical_New_Pattern.json", "title": "Grand Test 15 Clinical New Pattern", "category": "Grand Tests", "count": 200}, {"file": "Grand_Test_150.json", "title": "Grand Test 150", "category": "Grand Tests", "count": 300}, {"file": "Grand_Test_151.json", "title": "Grand Test 151", "category": "Grand Tests", "count": 300}, {"file": "Grand_Test-16_Clinical_New_Pattern.json", "title": "Grand Test 16 Clinical New Pattern", "category": "Grand Tests", "count": 200}, {"file": "Grand_Test-17_Clinical_New_Pattern.json", "title": "Grand Test 17 Clinical New Pattern", "category": "Grand Tests", "count": 200}, {"file": "GRAND_TEST-170.json", "title": "Grand Test 170", "category": "Grand Tests", "count": 300}, {"file": "Grand_Test-179.json", "title": "Grand Test 179", "category": "Grand Tests", "count": 300}, {"file": "Grand_Test-18_Clinical_New_Pattern.json", "title": "Grand Test 18 Clinical New Pattern", "category": "Grand Tests", "count": 200}, {"file": "Grand_Test-19_Clinical_New_Pattern.json", "title": "Grand Test 19 Clinical New Pattern", "category": "Grand Tests", "count": 200}, {"file": "Grand_Test-2_Clinical_New_Pattern.json", "title": "Grand Test 2 Clinical New Pattern", "category": "Grand Tests", "count": 200}, {"file": "Grand_Test-20_Clinical_New_Pattern.json", "title": "Grand Test 20 Clinical New Pattern", "category": "Grand Tests", "count": 200}, {"file": "Grand_Test-21_Clinical_New_Pattern.json", "title": "Grand Test 21 Clinical New Pattern", "category": "Grand Tests", "count": 200}, {"file": "Grand_Test-22_Clinical_New_Pattern.json", "title": "Grand Test 22 Clinical New Pattern", "category": "Grand Tests", "count": 200}, {"file": "Grand_Test-23_Clinical_New_Pattern.json", "title": "Grand Test 23 Clinical New Pattern", "category": "Grand Tests", "count": 200}, {"file": "Grand_Test-25_Clinical_New_Pattern.json", "title": "Grand Test 25 Clinical New Pattern", "category": "Grand Tests", "count": 200}, {"file": "Grand_Test-26.json", "title": "Grand Test 26", "category": "Grand Tests", "count": 200}, {"file": "Grand_Test-27.json", "title": "Grand Test 27", "category": "Grand Tests", "count": 200}, {"file": "Grand_Test-28.json", "title": "Grand Test 28", "category": "Grand Tests", "count": 200}, {"file": "Grand_Test-29.json", "title": "Grand Test 29", "category": "Grand Tests", "count": 200}, {"file": "Grand_Test-3_Clinical_New_Pattern.json", "title": "Grand Test 3 Clinical New Pattern", "category": "Grand Tests", "count": 200}, {"file": "Grand_Test-30.json", "title": "Grand Test 30", "category": "Grand Tests", "count": 200}, {"file": "Grand_Test-31.json", "title": "Grand Test 31", "category": "Grand Tests", "count": 200}, {"file": "Grand_Test-32.json", "title": "Grand Test 32", "category": "Grand Tests", "count": 200}, {"file": "Grand_Test-33.json", "title": "Grand Test 33", "category": "Grand Tests", "count": 200}, {"file": "Grand_Test-34.json", "title": "Grand Test 34", "category": "Grand Tests", "count": 200}, {"file": "Grand_Test-35.json", "title": "Grand Test 35", "category": "Grand Tests", "count": 200}, {"file": "Grand_Test-36.json", "title": "Grand Test 36", "category": "Grand Tests", "count": 200}, {"file": "Grand_Test-37.json", "title": "Grand Test 37", "category": "Grand Tests", "count": 200}, {"file": "Grand_Test-38.json", "title": "Grand Test 38", "category": "Grand Tests", "count": 200}, {"file": "Grand_Test-39_5_Sections.json", "title": "Grand Test 39 5 Sections", "category": "Grand Tests", "count": 200}, {"file": "Grand_Test-4_Clinical_New_Pattern.json", "title": "Grand Test 4 Clinical New Pattern", "category": "Grand Tests", "count": 200}, {"file": "Grand_Test-40_5_Sections.json", "title": "Grand Test 40 5 Sections", "category": "Grand Tests", "count": 200}, {"file": "Grand_Test-41_5_Sections.json", "title": "Grand Test 41 5 Sections", "category": "Grand Tests", "count": 200}, {"file": "Grand_Test-42_5_Sections.json", "title": "Grand Test 42 5 Sections", "category": "Grand Tests", "count": 200}, {"file": "Grand_Test-43_5_Sections.json", "title": "Grand Test 43 5 Sections", "category": "Grand Tests", "count": 200}, {"file": "Grand_Test-44_5_Sections.json", "title": "Grand Test 44 5 Sections", "category": "Grand Tests", "count": 200}, {"file": "Grand_Test-45_5_Sections.json", "title": "Grand Test 45 5 Sections", "category": "Grand Tests", "count": 200}, {"file": "Grand_Test-46_5_Sections.json", "title": "Grand Test 46 5 Sections", "category": "Grand Tests", "count": 200}, {"file": "Grand_Test-47_5_Sections.json", "title": "Grand Test 47 5 Sections", "category": "Grand Tests", "count": 200}, {"file": "Grand_Test-48_5_Sections.json", "title": "Grand Test 48 5 Sections", "category": "Grand Tests", "count": 200}, {"file": "Grand_Test-49_5_Sections.json", "title": "Grand Test 49 5 Sections", "category": "Grand Tests", "count": 200}, {"file": "Grand_Test-5_Clinical_New_Pattern.json", "title": "Grand Test 5 Clinical New Pattern", "category": "Grand Tests", "count": 200}, {"file": "Grand_Test-50_5_Sections.json", "title": "Grand Test 50 5 Sections", "category": "Grand Tests", "count": 200}, {"file": "Grand_Test-51_5_Sections.json", "title": "Grand Test 51 5 Sections", "category": "Grand Tests", "count": 200}, {"file": "Grand_Test-6_Clinical_New_Pattern.json", "title": "Grand Test 6 Clinical New Pattern", "category": "Grand Tests", "count": 200}, {"file": "Grand_Test-7_Clinical_New_Pattern.json", "title": "Grand Test 7 Clinical New Pattern", "category": "Grand Tests", "count": 200}, {"file": "Grand_Test-8_Clinical_New_Pattern.json", "title": "Grand Test 8 Clinical New Pattern", "category": "Grand Tests", "count": 200}, {"file": "Grand_Test-9_Clinical_New_Pattern.json", "title": "Grand Test 9 Clinical New Pattern", "category": "Grand Tests", "count": 200}, {"file": "INI_CET_Grand_Test_01__14th_Jun_2023__JUNE_2023____1__.json", "title": "Ini Cet Grand Test 01  14Th Jun 2023  June 2023    1  ", "category": "Grand Tests", "count": 200}, {"file": "INI_CET_Grand_Test_01__28th_Apr_2021__APRIL_2021____1__.json", "title": "Ini Cet Grand Test 01  28Th Apr 2021  April 2021    1  ", "category": "Grand Tests", "count": 200}, {"file": "INI_CET_Grand_Test_02__16th_Aug_2023__AUGUST_2023____1__.json", "title": "Ini Cet Grand Test 02  16Th Aug 2023  August 2023    1  ", "category": "Grand Tests", "count": 200}, {"file": "INI_CET_Grand_Test_02__26th_May_2021__MAY_2021____1__.json", "title": "Ini Cet Grand Test 02  26Th May 2021  May 2021    1  ", "category": "Grand Tests", "count": 200}, {"file": "INI_CET_Grand_Test_03__9th_Jun_2021__JUNE_2021____1__.json", "title": "Ini Cet Grand Test 03  9Th Jun 2021  June 2021    1  ", "category": "Grand Tests", "count": 200}, {"file": "INI_CET_Grand_Test_04__16th_Jul_2021__JULY_2021____1__.json", "title": "Ini Cet Grand Test 04  16Th Jul 2021  July 2021    1  ", "category": "Grand Tests", "count": 200}, {"file": "INI_CET_Grand_Test_05__18th_Aug_2021__AUGUST_2021____0__.json", "title": "Ini Cet Grand Test 05  18Th Aug 2021  August 2021    0  ", "category": "Grand Tests", "count": 200}, {"file": "INI_CET_Grand_Test_06__15th_Sep_2021__SEPTEMBER_2021____1__.json", "title": "Ini Cet Grand Test 06  15Th Sep 2021  September 2021    1  ", "category": "Grand Tests", "count": 200}, {"file": "INI_CET_Grand_Test_07__6th_Oct_2021__OCTOBER_2021____1__.json", "title": "Ini Cet Grand Test 07  6Th Oct 2021  October 2021    1  ", "category": "Grand Tests", "count": 200}, {"file": "INI_CET_Grand_Test_08__13th_Oct_2021__OCTOBER_2021____0__.json", "title": "Ini Cet Grand Test 08  13Th Oct 2021  October 2021    0  ", "category": "Grand Tests", "count": 200}, {"file": "INI_CET_Grand_Test_09__20th_Oct_2021__OCTOBER_2021____0__.json", "title": "Ini Cet Grand Test 09  20Th Oct 2021  October 2021    0  ", "category": "Grand Tests", "count": 200}, {"file": "INI_CET_Grand_Test_1__20th_Mar_2024__MARCH_2024____0__.json", "title": "Ini Cet Grand Test 1  20Th Mar 2024  March 2024    0  ", "category": "Grand Tests", "count": 200}, {"file": "INI_CET_Grand_Test_10__27th_Oct_2021__OCTOBER_2021____1__.json", "title": "Ini Cet Grand Test 10  27Th Oct 2021  October 2021    1  ", "category": "Grand Tests", "count": 200}, {"file": "INI_CET_Grand_Test_11__10th_Nov_2021__NOVEMBER_2021____0__.json", "title": "Ini Cet Grand Test 11  10Th Nov 2021  November 2021    0  ", "category": "Grand Tests", "count": 200}, {"file": "INI_CET_Grand_Test_12__22nd_Dec_2021__DECEMBER_2021____0__.json", "title": "Ini Cet Grand Test 12  22Nd Dec 2021  December 2021    0  ", "category": "Grand Tests", "count": 200}, {"file": "INI_CET_Grand_Test_13__5th_Jan_2022__JANUARY_2022____0__.json", "title": "Ini Cet Grand Test 13  5Th Jan 2022  January 2022    0  ", "category": "Grand Tests", "count": 200}, {"file": "INI_CET_Grand_Test_14__9th_Mar_2022__MARCH_2022____0__.json", "title": "Ini Cet Grand Test 14  9Th Mar 2022  March 2022    0  ", "category": "Grand Tests", "count": 200}, {"file": "INI_CET_Grand_Test_15__22nd_Jun_2022__JUNE_2022____1__.json", "title": "Ini Cet Grand Test 15  22Nd Jun 2022  June 2022    1  ", "category": "Grand Tests", "count": 200}, {"file": "INI_CET_Grand_Test_16__27th_Jul_2022__JULY_2022____1__.json", "title": "Ini Cet Grand Test 16  27Th Jul 2022  July 2022    1  ", "category": "Grand Tests", "count": 200}, {"file": "INI_CET_Grand_Test_17__24th_Aug_2022__AUGUST_2022____1__.json", "title": "Ini Cet Grand Test 17  24Th Aug 2022  August 2022    1  ", "category": "Grand Tests", "count": 200}, {"file": "INI_CET_Grand_Test_18__28th_Sep_2022__SEPTEMBER_2022____1__.json", "title": "Ini Cet Grand Test 18  28Th Sep 2022  September 2022    1  ", "category": "Grand Tests", "count": 200}, {"file": "INI_CET_Grand_Test_19__26th_Oct_2022__OCTOBER_2022____1__.json", "title": "Ini Cet Grand Test 19  26Th Oct 2022  October 2022    1  ", "category": "Grand Tests", "count": 200}, {"file": "INI_CET_Grand_Test_20__23rd_Nov_2022__NOVEMBER_2022____1__.json", "title": "Ini Cet Grand Test 20  23Rd Nov 2022  November 2022    1  ", "category": "Grand Tests", "count": 200}, {"file": "INI_CET_Grand_Test_21__25th_Jan_2023__JANUARY_2023____0__.json", "title": "Ini Cet Grand Test 21  25Th Jan 2023  January 2023    0  ", "category": "Grand Tests", "count": 200}, {"file": "INI_CET_Grand_Test_22__29th_Mar_2023__MARCH_2023____1__.json", "title": "Ini Cet Grand Test 22  29Th Mar 2023  March 2023    1  ", "category": "Grand Tests", "count": 200}, {"file": "Molar_Pregnancy___GTN-Previous_Year_Questions.json", "title": "Molar Pregnancy   Gtn Previous Year Questions", "category": "Grand Tests", "count": 9}, {"file": "ALL_INDIA_MEDICOS_TEST_-_2024_BATCH_-_2024-12-22.json", "title": "All India Medicos Test   2024 Batch   2024 12 22", "category": "Medicine", "count": 30}, {"file": "Anaesthesia_for_Co-existing_Medical_Illness-Previous_Year_Questions.json", "title": "Anaesthesia For Co Existing Medical Illness Previous Year Questions", "category": "Medicine", "count": 6}, {"file": "Basics_of_Radiology-Radiation_Exposure__Hazards__Protection_Guidelines__and_Contrast_Media.json", "title": "Basics Of Radiology Radiation Exposure  Hazards  Protection Guidelines  And Contrast Media", "category": "Medicine", "count": 12}, {"file": "Blood_Banking_and_Transfusion_Medicine-Previous_Year_Questions.json", "title": "Blood Banking And Transfusion Medicine Previous Year Questions", "category": "Medicine", "count": 6}, {"file": "Carcinoma_Lung__Mediastinal_Conditions_Part_3.json", "title": "Carcinoma Lung  Mediastinal Conditions Part 3", "category": "Medicine", "count": 14}, {"file": "Cardiac_Plexus_Thoracic_Duct_Esophagus__Posterior_Mediastinum.json", "title": "Cardiac Plexus Thoracic Duct Esophagus  Posterior Mediastinum", "category": "Medicine", "count": 15}, {"file": "Cardiothoracic_Vascular_Surgery-Thorax_and_Mediastinum.json", "title": "Cardiothoracic Vascular Surgery Thorax And Mediastinum", "category": "Medicine", "count": 35}, {"file": "Contrast_Media.json", "title": "Contrast Media", "category": "Medicine", "count": 13}, {"file": "Conus_Medullaris__Cauda_Equina_Syndrome.json", "title": "Conus Medullaris  Cauda Equina Syndrome", "category": "Medicine", "count": 9}, {"file": "Emergency_Medicine-Massive_Transfusion_Protocol__ARDS__Snakebite__AHA_updates__Altitude_Sickness.json", "title": "Emergency Medicine Massive Transfusion Protocol  Ards  Snakebite  Aha Updates  Altitude Sickness", "category": "Medicine", "count": 18}, {"file": "Emergency_Medicine-Previous_Year_Questions.json", "title": "Emergency Medicine Previous Year Questions", "category": "Medicine", "count": 17}, {"file": "Emergency_Medicine-Previous_Year_Questions_1.json", "title": "Emergency Medicine Previous Year Questions 1", "category": "Medicine", "count": 17}, {"file": "History_of_Medicine.json", "title": "History Of Medicine", "category": "Medicine", "count": 13}, {"file": "Important_Concepts_Related_to_Medical_Negligence.json", "title": "Important Concepts Related To Medical Negligence", "category": "Medicine", "count": 10}, {"file": "Indian_Legal_System___Medical_Jurisprudence-Previous_Year_Questions.json", "title": "Indian Legal System   Medical Jurisprudence Previous Year Questions", "category": "Medicine", "count": 22}, {"file": "Inflammation-Mediators_of_Inflammation.json", "title": "Inflammation Mediators Of Inflammation", "category": "Medicine", "count": 14}, {"file": "Median_Nerve.json", "title": "Median Nerve", "category": "Medicine", "count": 5}, {"file": "Mediastinum.json", "title": "Mediastinum", "category": "Medicine", "count": 48}, {"file": "Mediators_of_Inflammation.json", "title": "Mediators Of Inflammation", "category": "Medicine", "count": 33}, {"file": "Medical_and_Surgical_Complications.json", "title": "Medical And Surgical Complications", "category": "Medicine", "count": 166}, {"file": "Medical_Jurisprudence-Medical_Jurisprudence.json", "title": "Medical Jurisprudence Medical Jurisprudence", "category": "Medicine", "count": 16}, {"file": "Medical_Jurisprudence-Previous_Year_Questions.json", "title": "Medical Jurisprudence Previous Year Questions", "category": "Medicine", "count": 14}, {"file": "Medical_Law__Ethics.json", "title": "Medical Law  Ethics", "category": "Medicine", "count": 31}, {"file": "Medical_Law__Ethics_1.json", "title": "Medical Law  Ethics 1", "category": "Medicine", "count": 23}, {"file": "Medical_Oncology.json", "title": "Medical Oncology", "category": "Medicine", "count": 158}, {"file": "Medical_Termination_of_Pregnancy_MTP.json", "title": "Medical Termination Of Pregnancy Mtp", "category": "Medicine", "count": 2}, {"file": "Medicine_-_INI_CET_JULY_2021.json", "title": "Medicine   Ini Cet July 2021", "category": "Medicine", "count": 10}, {"file": "Medicine_-_INI_CET_MAY_2022.json", "title": "Medicine   Ini Cet May 2022", "category": "Medicine", "count": 11}, {"file": "Medicine_-_INI_CET_MAY_2023.json", "title": "Medicine   Ini Cet May 2023", "category": "Medicine", "count": 11}, {"file": "Medicine_-_INI_CET_NOV_2020.json", "title": "Medicine   Ini Cet Nov 2020", "category": "Medicine", "count": 36}, {"file": "Medicine_-_INI_CET_NOV_2021.json", "title": "Medicine   Ini Cet Nov 2021", "category": "Medicine", "count": 18}, {"file": "Medicine_-_INI_CET_NOV_2023.json", "title": "Medicine   Ini Cet Nov 2023", "category": "Medicine", "count": 20}, {"file": "Medicine_-_INI_CET_NOVEMBER_2022_PART_-_A.json", "title": "Medicine   Ini Cet November 2022 Part   A", "category": "Medicine", "count": 18}, {"file": "Medicine_-_INI_CET_NOVEMBER_2022_PART_-_B.json", "title": "Medicine   Ini Cet November 2022 Part   B", "category": "Medicine", "count": 19}, {"file": "Medicine-_1_DVT_Revision_Test.json", "title": "Medicine  1 Dvt Revision Test", "category": "Medicine", "count": 50}, {"file": "Medicine-_2__DVT_Revision_Test.json", "title": "Medicine  2  Dvt Revision Test", "category": "Medicine", "count": 50}, {"file": "Medicine_CNS-_Class_Test_With_Video_Solution.json", "title": "Medicine Cns  Class Test With Video Solution", "category": "Medicine", "count": 50}, {"file": "Medicine_CNS_Dr_Achin.json", "title": "Medicine Cns Dr Achin", "category": "Medicine", "count": 50}, {"file": "Medicine_CNS_Dr_Achin_1.json", "title": "Medicine Cns Dr Achin 1", "category": "Medicine", "count": 50}, {"file": "Medicine_CNS_Dr_Achin-2026.json", "title": "Medicine Cns Dr Achin 2026", "category": "Medicine", "count": 50}, {"file": "Medicine-CNSEndo.json", "title": "Medicine Cnsendo", "category": "Medicine", "count": 20}, {"file": "Medicine_CNSENDO_MIQ_Series.json", "title": "Medicine Cnsendo Miq Series", "category": "Medicine", "count": 20}, {"file": "Medicine_CVS-_Class_Test_With_Video_Solution.json", "title": "Medicine Cvs  Class Test With Video Solution", "category": "Medicine", "count": 50}, {"file": "Medicine_CVS_Dr_Arvind.json", "title": "Medicine Cvs Dr Arvind", "category": "Medicine", "count": 51}, {"file": "Medicine_CVS_Dr_Arvind_1.json", "title": "Medicine Cvs Dr Arvind 1", "category": "Medicine", "count": 51}, {"file": "Medicine_CVS_Dr_Arvind-2026.json", "title": "Medicine Cvs Dr Arvind 2026", "category": "Medicine", "count": 50}, {"file": "Medicine_CVSGIT_MIQ_Series.json", "title": "Medicine Cvsgit Miq Series", "category": "Medicine", "count": 20}, {"file": "Medicine_CVSGITCNSEndo_New_Season.json", "title": "Medicine Cvsgitcnsendo New Season", "category": "Medicine", "count": 25}, {"file": "Medicine-CVSGITGen.json", "title": "Medicine Cvsgitgen", "category": "Medicine", "count": 20}, {"file": "Medicine_ED_-_Mission_15_-_13-02-2024_-_2024-02-13.json", "title": "Medicine Ed   Mission 15   13 02 2024   2024 02 13", "category": "Medicine", "count": 150}, {"file": "Medicine_ED_-_Mission_15_Lap_2_-_04-06-2024_-_2024-06-04.json", "title": "Medicine Ed   Mission 15 Lap 2   04 06 2024   2024 06 04", "category": "Medicine", "count": 100}, {"file": "Medicine_ED_-_Mission_20_Batch_3_-_14-02-2025_-_2025-02-14.json", "title": "Medicine Ed   Mission 20 Batch 3   14 02 2025   2025 02 14", "category": "Medicine", "count": 100}, {"file": "Medicine_ED_-_Mission_20_Lap_2_-_19-03-2025_-_2025-03-19.json", "title": "Medicine Ed   Mission 20 Lap 2   19 03 2025   2025 03 19", "category": "Medicine", "count": 100}, {"file": "Medicine_ED_Part-1_Mission_30_Early_Intern_Batch_-_07-06-2025_-_2025-06-07.json", "title": "Medicine Ed Part 1 Mission 30 Early Intern Batch   07 06 2025   2025 06 07", "category": "Medicine", "count": 100}, {"file": "Medicine_ED_Part-2_Mission_30_Early_Intern_Batch_-_13-06-2025_-_2025-06-13.json", "title": "Medicine Ed Part 2 Mission 30 Early Intern Batch   13 06 2025   2025 06 13", "category": "Medicine", "count": 100}, {"file": "Medicine_ENDO-_Class_Test_With_Video_Solution.json", "title": "Medicine Endo  Class Test With Video Solution", "category": "Medicine", "count": 26}, {"file": "Medicine_Endo_Dr_Rahul.json", "title": "Medicine Endo Dr Rahul", "category": "Medicine", "count": 50}, {"file": "Medicine_Endo_Dr_Rahul-2026.json", "title": "Medicine Endo Dr Rahul 2026", "category": "Medicine", "count": 50}, {"file": "Medicine_EndoGastro_Dr_Rahul.json", "title": "Medicine Endogastro Dr Rahul", "category": "Medicine", "count": 50}, {"file": "Medicine_Except_CNS.json", "title": "Medicine Except Cns", "category": "Medicine", "count": 40}, {"file": "Medicine_GastroEndo_Dr_Rahul.json", "title": "Medicine Gastroendo Dr Rahul", "category": "Medicine", "count": 55}, {"file": "Medicine_GIT-_Class_Test_With_Video_Solution.json", "title": "Medicine Git  Class Test With Video Solution", "category": "Medicine", "count": 25}, {"file": "Medicine_GIT_Dr_Arvind.json", "title": "Medicine Git Dr Arvind", "category": "Medicine", "count": 25}, {"file": "Medicine_GIT_Dr_Arvind-2026.json", "title": "Medicine Git Dr Arvind 2026", "category": "Medicine", "count": 50}, {"file": "Medicine_IBQ_CNSRespAbbEndo.json", "title": "Medicine Ibq Cnsrespabbendo", "category": "Medicine", "count": 20}, {"file": "Medicine_IBQ_CVSGIT_Nephro_Rehumat.json", "title": "Medicine Ibq Cvsgit Nephro Rehumat", "category": "Medicine", "count": 20}, {"file": "Medicine_Image_Based_Question.json", "title": "Medicine Image Based Question", "category": "Medicine", "count": 40}, {"file": "Medicine_Nephrology-_Class_Test_With_Video_Solution.json", "title": "Medicine Nephrology  Class Test With Video Solution", "category": "Medicine", "count": 25}, {"file": "Medicine_Nephrology_Dr_Srinath.json", "title": "Medicine Nephrology Dr Srinath", "category": "Medicine", "count": 25}, {"file": "Medicine_Nephrology_Dr_Srinath-2026.json", "title": "Medicine Nephrology Dr Srinath 2026", "category": "Medicine", "count": 25}, {"file": "Medicine-NephroRheumat_MIQ_Series.json", "title": "Medicine Nephrorheumat Miq Series", "category": "Medicine", "count": 20}, {"file": "Medicine-NephroRheumatResp.json", "title": "Medicine Nephrorheumatresp", "category": "Medicine", "count": 20}, {"file": "Medicine_NephroRheumatRespABB_Dr_Srinath_Chandramani.json", "title": "Medicine Nephrorheumatrespabb Dr Srinath Chandramani", "category": "Medicine", "count": 50}, {"file": "Medicine_NephroRheumatRespABB_New_Season.json", "title": "Medicine Nephrorheumatrespabb New Season", "category": "Medicine", "count": 25}, {"file": "Medicine_NephroRhumatRespAbb_Dr_Srinath.json", "title": "Medicine Nephrorhumatrespabb Dr Srinath", "category": "Medicine", "count": 40}, {"file": "Medicine_ResABB_Dr_Bharath_Kathi-2026.json", "title": "Medicine Resabb Dr Bharath Kathi 2026", "category": "Medicine", "count": 50}, {"file": "Medicine_Resp_abb-_Class_Test_With_Video_Solution.json", "title": "Medicine Resp Abb  Class Test With Video Solution", "category": "Medicine", "count": 50}, {"file": "Medicine_RespAbb_MIQ_Series.json", "title": "Medicine Respabb Miq Series", "category": "Medicine", "count": 20}, {"file": "Medicine_Rheumatology-_Class_Test_With_Video_Solution.json", "title": "Medicine Rheumatology  Class Test With Video Solution", "category": "Medicine", "count": 25}, {"file": "Medicine_Rheumatology_Dr_Srinath.json", "title": "Medicine Rheumatology Dr Srinath", "category": "Medicine", "count": 25}, {"file": "Medicine_Rheumatology_Dr_Srinath-2026.json", "title": "Medicine Rheumatology Dr Srinath 2026", "category": "Medicine", "count": 25}, {"file": "Medicine_RSABBNephroRheumat_Dr_Srinath.json", "title": "Medicine Rsabbnephrorheumat Dr Srinath", "category": "Medicine", "count": 50}, {"file": "Medicine_Test_The_Champion_Batch_Hyderabad_-_15-01-2025_-_2025-01-15.json", "title": "Medicine Test The Champion Batch Hyderabad   15 01 2025   2025 01 15", "category": "Medicine", "count": 100}, {"file": "Medicine_Test_The_Champion_Batch_Hyderabad_-_15-12-2024_-_2024-12-15.json", "title": "Medicine Test The Champion Batch Hyderabad   15 12 2024   2024 12 15", "category": "Medicine", "count": 150}, {"file": "Medicine_Test_The_Champion_Batch_Hyderabad_-_25-09-2024_-_2024-09-25.json", "title": "Medicine Test The Champion Batch Hyderabad   25 09 2024   2024 09 25", "category": "Medicine", "count": 100}, {"file": "Medico_-_Legal_Autopsy.json", "title": "Medico   Legal Autopsy", "category": "Medicine", "count": 10}, {"file": "Medico-Legal_Aspects_of_Injuries.json", "title": "Medico Legal Aspects Of Injuries", "category": "Medicine", "count": 10}, {"file": "Medico-Legal_Importance_of_Age_Groups.json", "title": "Medico Legal Importance Of Age Groups", "category": "Medicine", "count": 5}, {"file": "Mid_Day_Module_Medicine-1_-_2024-12-07.json", "title": "Mid Day Module Medicine 1   2024 12 07", "category": "Medicine", "count": 50}, {"file": "Mid_Day_Module_Medicine-10_-_2024-12-22.json", "title": "Mid Day Module Medicine 10   2024 12 22", "category": "Medicine", "count": 50}, {"file": "Mid_Day_Module_Medicine-11_-_2025-02-06.json", "title": "Mid Day Module Medicine 11   2025 02 06", "category": "Medicine", "count": 50}, {"file": "Mid_Day_Module_Medicine-2_-_2024-12-08.json", "title": "Mid Day Module Medicine 2   2024 12 08", "category": "Medicine", "count": 50}, {"file": "Mid_Day_Module_Medicine-3_-_2024-12-09.json", "title": "Mid Day Module Medicine 3   2024 12 09", "category": "Medicine", "count": 50}, {"file": "Mid_Day_Module_Medicine-4_-_2024-12-10.json", "title": "Mid Day Module Medicine 4   2024 12 10", "category": "Medicine", "count": 50}, {"file": "Mid_Day_Module_Medicine-5_-_2024-12-11.json", "title": "Mid Day Module Medicine 5   2024 12 11", "category": "Medicine", "count": 50}, {"file": "Mid_Day_Module_Medicine-6_-_2024-12-18.json", "title": "Mid Day Module Medicine 6   2024 12 18", "category": "Medicine", "count": 50}, {"file": "Mid_Day_Module_Medicine-7_-_2024-12-19.json", "title": "Mid Day Module Medicine 7   2024 12 19", "category": "Medicine", "count": 50}, {"file": "Mid_Day_Module_Medicine-8_-_2024-12-20.json", "title": "Mid Day Module Medicine 8   2024 12 20", "category": "Medicine", "count": 50}, {"file": "Mid_Day_Module_Medicine-9_-_2024-12-21.json", "title": "Mid Day Module Medicine 9   2024 12 21", "category": "Medicine", "count": 50}, {"file": "Named_X-Ray_Views.json", "title": "Named X Ray Views", "category": "Medicine", "count": 5}, {"file": "Neurology-Syringomelia__conus_medullaris__channelopathies_and_SAH.json", "title": "Neurology Syringomelia  Conus Medullaris  Channelopathies And Sah", "category": "Medicine", "count": 21}, {"file": "Nuclear_Medicine.json", "title": "Nuclear Medicine", "category": "Medicine", "count": 24}, {"file": "Nuclear_Medicine_1.json", "title": "Nuclear Medicine 1", "category": "Medicine", "count": 16}, {"file": "Nuclear_Medicine_and_Radiotherapy.json", "title": "Nuclear Medicine And Radiotherapy", "category": "Medicine", "count": 5}, {"file": "Nuclear_Medicine-Nuclear_Medicine_and_Radiotherapy.json", "title": "Nuclear Medicine Nuclear Medicine And Radiotherapy", "category": "Medicine", "count": 22}, {"file": "Nuclear_Medicine-Previous_Year_Questions.json", "title": "Nuclear Medicine Previous Year Questions", "category": "Medicine", "count": 2}, {"file": "Pulmonary_Medicine__Critical_Care.json", "title": "Pulmonary Medicine  Critical Care", "category": "Medicine", "count": 184}, {"file": "Rheumatology-Autoimmune_and_Inflammatory_Diseases_in_Medicine.json", "title": "Rheumatology Autoimmune And Inflammatory Diseases In Medicine", "category": "Medicine", "count": 16}, {"file": "Serous_Otitis_Media_Som.json", "title": "Serous Otitis Media Som", "category": "Medicine", "count": 7}, {"file": "Surgeries_Of_Otitis_Media.json", "title": "Surgeries Of Otitis Media", "category": "Medicine", "count": 5}, {"file": "SWT-Medicine-1-SET-A_Disorders_of_the_Cardiovascular_System__Disorders_of_the_Respiratory_System.json", "title": "Swt Medicine 1 Set A Disorders Of The Cardiovascular System  Disorders Of The Respiratory System", "category": "Medicine", "count": 200}, {"file": "SWT-Medicine-2-SET-A_Disorders_of_the_kidney_and_urinary_tract__Disorders_of_the_gastrointestina.json", "title": "Swt Medicine 2 Set A Disorders Of The Kidney And Urinary Tract  Disorders Of The Gastrointestina", "category": "Medicine", "count": 195}, {"file": "SWT-Medicine-SET-B.json", "title": "Swt Medicine Set B", "category": "Medicine", "count": 200}, {"file": "Thorax_and_Mediastinum.json", "title": "Thorax And Mediastinum", "category": "Medicine", "count": 6}, {"file": "Transfusion_Medicine.json", "title": "Transfusion Medicine", "category": "Medicine", "count": 20}, {"file": "Anti_Microbials_Part-1.json", "title": "Anti Microbials Part 1", "category": "Microbiology", "count": 14}, {"file": "Anti_Microbials_Part-2.json", "title": "Anti Microbials Part 2", "category": "Microbiology", "count": 28}, {"file": "Antimicrobial_Agents.json", "title": "Antimicrobial Agents", "category": "Microbiology", "count": 116}, {"file": "Antimicrobial_Susceptibility_Testing__Genetics.json", "title": "Antimicrobial Susceptibility Testing  Genetics", "category": "Microbiology", "count": 22}, {"file": "Antimicrobial_System.json", "title": "Antimicrobial System", "category": "Microbiology", "count": 95}, {"file": "Antimicrobials-Anti-mycobacterial_drugs.json", "title": "Antimicrobials Anti Mycobacterial Drugs", "category": "Microbiology", "count": 25}, {"file": "Antimicrobials-Anti-Parasitic_and_Anti_Protozoal_Drugs.json", "title": "Antimicrobials Anti Parasitic And Anti Protozoal Drugs", "category": "Microbiology", "count": 20}, {"file": "Antimicrobials-Antifungal_Drugs.json", "title": "Antimicrobials Antifungal Drugs", "category": "Microbiology", "count": 12}, {"file": "Antimicrobials-Antimetabolites_and_Fluroquinolones.json", "title": "Antimicrobials Antimetabolites And Fluroquinolones", "category": "Microbiology", "count": 13}, {"file": "Antimicrobials-Antiviral_Drugs.json", "title": "Antimicrobials Antiviral Drugs", "category": "Microbiology", "count": 24}, {"file": "Antimicrobials-Cell_Wall_Synthesis_Inhibitors.json", "title": "Antimicrobials Cell Wall Synthesis Inhibitors", "category": "Microbiology", "count": 20}, {"file": "Antimicrobials-Previous_Year_Questions.json", "title": "Antimicrobials Previous Year Questions", "category": "Microbiology", "count": 93}, {"file": "Antimicrobials-Properties_of_Anti-microbial_Agents.json", "title": "Antimicrobials Properties Of Anti Microbial Agents", "category": "Microbiology", "count": 9}, {"file": "Antimicrobials-Protein_Synthesis_Inhibitors.json", "title": "Antimicrobials Protein Synthesis Inhibitors", "category": "Microbiology", "count": 15}, {"file": "Clinical_Microbiology.json", "title": "Clinical Microbiology", "category": "Microbiology", "count": 17}, {"file": "Clinical_Microbiology-Previous_Year_Questions.json", "title": "Clinical Microbiology Previous Year Questions", "category": "Microbiology", "count": 2}, {"file": "General_Microbiology.json", "title": "General Microbiology", "category": "Microbiology", "count": 16}, {"file": "General_Microbiology_1.json", "title": "General Microbiology 1", "category": "Microbiology", "count": 49}, {"file": "General_Microbiology_2.json", "title": "General Microbiology 2", "category": "Microbiology", "count": 96}, {"file": "General_Microbiology-Bacterial_genetics.json", "title": "General Microbiology Bacterial Genetics", "category": "Microbiology", "count": 7}, {"file": "General_Microbiology-Culture_Media.json", "title": "General Microbiology Culture Media", "category": "Microbiology", "count": 16}, {"file": "General_Microbiology-Previous_Year_Questions.json", "title": "General Microbiology Previous Year Questions", "category": "Microbiology", "count": 45}, {"file": "General_Microbiology-Scientists__Stains__and_Microscopes.json", "title": "General Microbiology Scientists  Stains  And Microscopes", "category": "Microbiology", "count": 17}, {"file": "General_Microbiology-Sterilization_and_Disinfection.json", "title": "General Microbiology Sterilization And Disinfection", "category": "Microbiology", "count": 14}, {"file": "Genetics-Advanced_Molecular_Techniques__Recombinant_DNA_technology__Microarray__CRISPR__Lac_operon.json", "title": "Genetics Advanced Molecular Techniques  Recombinant Dna Technology  Microarray  Crispr  Lac Operon", "category": "Microbiology", "count": 18}, {"file": "Hematology__Red_Blood_Cells-Microcytic_Hypochromic_Anemia_.json", "title": "Hematology  Red Blood Cells Microcytic Hypochromic Anemia ", "category": "Microbiology", "count": 22}, {"file": "215_Microbiology.json", "title": "Microbiology", "category": "Microbiology", "count": 40}, {"file": "Microbiology.json", "title": "Microbiology", "category": "Microbiology", "count": 20}, {"file": "Microbiology_-_INI_CET_JULY_2021.json", "title": "Microbiology   Ini Cet July 2021", "category": "Microbiology", "count": 14}, {"file": "Microbiology_-_INI_CET_MAY_2022.json", "title": "Microbiology   Ini Cet May 2022", "category": "Microbiology", "count": 9}, {"file": "Microbiology_-_INI_CET_MAY_2023.json", "title": "Microbiology   Ini Cet May 2023", "category": "Microbiology", "count": 8}, {"file": "Microbiology_-_INI_CET_NOV_2020.json", "title": "Microbiology   Ini Cet Nov 2020", "category": "Microbiology", "count": 12}, {"file": "Microbiology_-_INI_CET_NOV_2021.json", "title": "Microbiology   Ini Cet Nov 2021", "category": "Microbiology", "count": 11}, {"file": "Microbiology_-_INI_CET_NOV_2022_PART_A.json", "title": "Microbiology   Ini Cet Nov 2022 Part A", "category": "Microbiology", "count": 12}, {"file": "Microbiology_-_INI_CET_NOV_2022_PART_B.json", "title": "Microbiology   Ini Cet Nov 2022 Part B", "category": "Microbiology", "count": 11}, {"file": "Microbiology_-_INI_CET_NOV_2023.json", "title": "Microbiology   Ini Cet Nov 2023", "category": "Microbiology", "count": 18}, {"file": "Microbiology-_Class_Test_With_Video_Solution.json", "title": "Microbiology  Class Test With Video Solution", "category": "Microbiology", "count": 100}, {"file": "Microbiology_1.json", "title": "Microbiology 1", "category": "Microbiology", "count": 20}, {"file": "Microbiology_2.json", "title": "Microbiology 2", "category": "Microbiology", "count": 20}, {"file": "Microbiology_Clinical_Vignettes_-_1.json", "title": "Microbiology Clinical Vignettes   1", "category": "Microbiology", "count": 104}, {"file": "Microbiology_Clinical_Vignettes_-_2.json", "title": "Microbiology Clinical Vignettes   2", "category": "Microbiology", "count": 80}, {"file": "Microbiology_Dr_J_Suria.json", "title": "Microbiology Dr J Suria", "category": "Microbiology", "count": 40}, {"file": "Microbiology_Dr_J_Suria-2026.json", "title": "Microbiology Dr J Suria 2026", "category": "Microbiology", "count": 100}, {"file": "Microbiology_Dr_Jay_Suria-2026.json", "title": "Microbiology Dr Jay Suria 2026", "category": "Microbiology", "count": 200}, {"file": "Microbiology_DVT_Revision_Test.json", "title": "Microbiology Dvt Revision Test", "category": "Microbiology", "count": 25}, {"file": "Microbiology_ED_-_Mission_15_-_28-03-2024_-_2024-03-28.json", "title": "Microbiology Ed   Mission 15   28 03 2024   2024 03 28", "category": "Microbiology", "count": 100}, {"file": "Microbiology_ED_-_Mission_15_Lap_2_-_24-05-2024_-_2024-05-24.json", "title": "Microbiology Ed   Mission 15 Lap 2   24 05 2024   2024 05 24", "category": "Microbiology", "count": 75}, {"file": "Microbiology_ED_-_Mission_20_Batch_2_-_17-12-2024_-_2024-12-17.json", "title": "Microbiology Ed   Mission 20 Batch 2   17 12 2024   2024 12 17", "category": "Microbiology", "count": 70}, {"file": "Microbiology_ED_-_Mission_20_Batch_3_-_11-01-2025_-_2025-01-11.json", "title": "Microbiology Ed   Mission 20 Batch 3   11 01 2025   2025 01 11", "category": "Microbiology", "count": 75}, {"file": "Microbiology_ED_-_Mission_20_Lap_2_-_05-05-2025_-_2025-05-05.json", "title": "Microbiology Ed   Mission 20 Lap 2   05 05 2025   2025 05 05", "category": "Microbiology", "count": 75}, {"file": "Microbiology_ED_Test-1_-_08-05-2023_-_2023-05-08.json", "title": "Microbiology Ed Test 1   08 05 2023   2023 05 08", "category": "Microbiology", "count": 50}, {"file": "Microbiology_ED_Test-2_-_13-05-2023_-_2023-05-13.json", "title": "Microbiology Ed Test 2   13 05 2023   2023 05 13", "category": "Microbiology", "count": 50}, {"file": "Microbiology_Image_Based_Question.json", "title": "Microbiology Image Based Question", "category": "Microbiology", "count": 20}, {"file": "Microbiology_J_Surya.json", "title": "Microbiology J Surya", "category": "Microbiology", "count": 75}, {"file": "Microbiology_Last_Month_ED_-_30-07-2024_-_2024-07-30.json", "title": "Microbiology Last Month Ed   30 07 2024   2024 07 30", "category": "Microbiology", "count": 30}, {"file": "Microbiology_MIQ_Series.json", "title": "Microbiology Miq Series", "category": "Microbiology", "count": 20}, {"file": "Microbiology_New_Season.json", "title": "Microbiology New Season", "category": "Microbiology", "count": 25}, {"file": "Microbiology-Previous_Year_Questions.json", "title": "Microbiology Previous Year Questions", "category": "Microbiology", "count": 1}, {"file": "Microbiology_Test_The_Champion_Batch_Hyderabad_-_02-01-2025_-_2025-01-02.json", "title": "Microbiology Test The Champion Batch Hyderabad   02 01 2025   2025 01 02", "category": "Microbiology", "count": 75}, {"file": "Microbiology_Test_The_Champion_Batch_Hyderabad_-_12-06-2025_-_2025-06-12.json", "title": "Microbiology Test The Champion Batch Hyderabad   12 06 2025   2025 06 12", "category": "Microbiology", "count": 75}, {"file": "Microbiology_Test_The_Champion_Batch_Hyderabad_-_12-07-2024_-_2024-07-12.json", "title": "Microbiology Test The Champion Batch Hyderabad   12 07 2024   2024 07 12", "category": "Microbiology", "count": 75}, {"file": "Microcytic_Anemia_Part_1.json", "title": "Microcytic Anemia Part 1", "category": "Microbiology", "count": 13}, {"file": "Micronutrients.json", "title": "Micronutrients", "category": "Microbiology", "count": 20}, {"file": "Microscopy__Staining.json", "title": "Microscopy  Staining", "category": "Microbiology", "count": 23}, {"file": "Mid_Day_Module_Microbiology-1_-_2025-01-08.json", "title": "Mid Day Module Microbiology 1   2025 01 08", "category": "Microbiology", "count": 50}, {"file": "Mid_Day_Module_Microbiology-2_-_2025-01-09.json", "title": "Mid Day Module Microbiology 2   2025 01 09", "category": "Microbiology", "count": 50}, {"file": "Mid_Day_Module_Microbiology-3_-_2025-01-10.json", "title": "Mid Day Module Microbiology 3   2025 01 10", "category": "Microbiology", "count": 50}, {"file": "Mid_Day_Module_Microbiology-4_-_2025-01-11.json", "title": "Mid Day Module Microbiology 4   2025 01 11", "category": "Microbiology", "count": 50}, {"file": "Mid_Day_Module_Microbiology-5_-_2025-01-12.json", "title": "Mid Day Module Microbiology 5   2025 01 12", "category": "Microbiology", "count": 50}, {"file": "Nutrition_and_Health-Micronutrients.json", "title": "Nutrition And Health Micronutrients", "category": "Microbiology", "count": 15}, {"file": "Nutrition_and_Malnutrition-Breastmilk___Micronutrients.json", "title": "Nutrition And Malnutrition Breastmilk   Micronutrients", "category": "Microbiology", "count": 20}, {"file": "SWT-Microbiology-SET-A.json", "title": "Swt Microbiology Set A", "category": "Microbiology", "count": 200}, {"file": "SWT-Microbiology-SET-B.json", "title": "Swt Microbiology Set B", "category": "Microbiology", "count": 205}, {"file": "T-20_Microbiology_Test-1_-_25-05-2023_-_2023-05-25.json", "title": "T 20 Microbiology Test 1   25 05 2023   2023 05 25", "category": "Microbiology", "count": 20}, {"file": "T-20_Microbiology_Test-2_-_01-06-2023_-_2023-06-01.json", "title": "T 20 Microbiology Test 2   01 06 2023   2023 06 01", "category": "Microbiology", "count": 20}, {"file": "T-20_Microbiology_Test-3_-_21-06-2023_-_2023-06-21.json", "title": "T 20 Microbiology Test 3   21 06 2023   2023 06 21", "category": "Microbiology", "count": 20}, {"file": "T-20_Microbiology_Test-4_-_12-07-2023_-_2023-07-12.json", "title": "T 20 Microbiology Test 4   12 07 2023   2023 07 12", "category": "Microbiology", "count": 20}, {"file": "T-20_Microbiology_Test-5_-_26-07-2023_-_2023-07-26.json", "title": "T 20 Microbiology Test 5   26 07 2023   2023 07 26", "category": "Microbiology", "count": 20}, {"file": "T-20_Microbiology_Test-6_-_10-08-2023_-_2023-08-10.json", "title": "T 20 Microbiology Test 6   10 08 2023   2023 08 10", "category": "Microbiology", "count": 20}, {"file": "T-20_Microbiology_Test-7_-_18-08-2023_-_2023-08-18.json", "title": "T 20 Microbiology Test 7   18 08 2023   2023 08 18", "category": "Microbiology", "count": 20}, {"file": "T-20_Microbiology_Test-8_-_08-09-2023_-_2023-09-08.json", "title": "T 20 Microbiology Test 8   08 09 2023   2023 09 08", "category": "Microbiology", "count": 20}, {"file": "T-20_Microbiology_Test-9_-_29-09-2023_-_2023-09-29.json", "title": "T 20 Microbiology Test 9   29 09 2023   2023 09 29", "category": "Microbiology", "count": 20}, {"file": "Adnexal_Mass_and_Gyne_Cancers.json", "title": "Adnexal Mass And Gyne Cancers", "category": "Obstetrics", "count": 26}, {"file": "Basic_Obs_and_Gynae.json", "title": "Basic Obs And Gynae", "category": "Obstetrics", "count": 44}, {"file": "Benign_Gynae_Disorders.json", "title": "Benign Gynae Disorders", "category": "Obstetrics", "count": 49}, {"file": "Drugs_in_Gynae.json", "title": "Drugs In Gynae", "category": "Obstetrics", "count": 11}, {"file": "Drugs_used_in_Obstetrics_and_Gynaecology-Previous_Year_Questions.json", "title": "Drugs Used In Obstetrics And Gynaecology Previous Year Questions", "category": "Obstetrics", "count": 1}, {"file": "Gynae_Oncology.json", "title": "Gynae Oncology", "category": "Obstetrics", "count": 99}, {"file": "Gynaecology.json", "title": "Gynaecology", "category": "Obstetrics", "count": 15}, {"file": "Gynaecology_Dr_Deepti.json", "title": "Gynaecology Dr Deepti", "category": "Obstetrics", "count": 50}, {"file": "Gynaecology_Dr_Deepti-2026.json", "title": "Gynaecology Dr Deepti 2026", "category": "Obstetrics", "count": 75}, {"file": "Gynaecology_IBQ.json", "title": "Gynaecology Ibq", "category": "Obstetrics", "count": 20}, {"file": "Gynaecology_Image_based_questions.json", "title": "Gynaecology Image Based Questions", "category": "Obstetrics", "count": 70}, {"file": "Gyne_Oncology-Previous_Year_Questions.json", "title": "Gyne Oncology Previous Year Questions", "category": "Obstetrics", "count": 28}, {"file": "Gynecology-AUB__Hirsutism_and_Adnexal_Mass.json", "title": "Gynecology Aub  Hirsutism And Adnexal Mass", "category": "Obstetrics", "count": 20}, {"file": "Gynecology-Cervical_Carcinoma.json", "title": "Gynecology Cervical Carcinoma", "category": "Obstetrics", "count": 30}, {"file": "Gynecology-Disorders_of_Puberty__Amenorrhea__Menopause.json", "title": "Gynecology Disorders Of Puberty  Amenorrhea  Menopause", "category": "Obstetrics", "count": 16}, {"file": "Gynecology_Dr_Deepti.json", "title": "Gynecology Dr Deepti", "category": "Obstetrics", "count": 45}, {"file": "Gynecology-Embryology_and_Associated_Disorders.json", "title": "Gynecology Embryology And Associated Disorders", "category": "Obstetrics", "count": 12}, {"file": "Gynecology-Endometrial_Carcinoma.json", "title": "Gynecology Endometrial Carcinoma", "category": "Obstetrics", "count": 12}, {"file": "Gynecology-Endometriosis___Adenomyosis.json", "title": "Gynecology Endometriosis   Adenomyosis", "category": "Obstetrics", "count": 14}, {"file": "Gynecology-Fibroids_and_Polyps.json", "title": "Gynecology Fibroids And Polyps", "category": "Obstetrics", "count": 21}, {"file": "Gynecology-Infertility.json", "title": "Gynecology Infertility", "category": "Obstetrics", "count": 21}, {"file": "Gynecology-Ovarian_Tumors.json", "title": "Gynecology Ovarian Tumors", "category": "Obstetrics", "count": 20}, {"file": "Gynecology-Pelvic_Inflammatory_Disease.json", "title": "Gynecology Pelvic Inflammatory Disease", "category": "Obstetrics", "count": 20}, {"file": "Gynecology-Pelvic_Organ_Prolapse.json", "title": "Gynecology Pelvic Organ Prolapse", "category": "Obstetrics", "count": 20}, {"file": "Gynecology-Pelvis__Perineum_and_Pelvic_diaphragm.json", "title": "Gynecology Pelvis  Perineum And Pelvic Diaphragm", "category": "Obstetrics", "count": 15}, {"file": "Gynecology-Polycystic_Ovarian_Syndrome.json", "title": "Gynecology Polycystic Ovarian Syndrome", "category": "Obstetrics", "count": 8}, {"file": "Gynecology-Previous_Year_Questions.json", "title": "Gynecology Previous Year Questions", "category": "Obstetrics", "count": 181}, {"file": "Gynecology-Urinary_Incontinence_and_Fistulas.json", "title": "Gynecology Urinary Incontinence And Fistulas", "category": "Obstetrics", "count": 12}, {"file": "Gynecology-Vaginitis_and_Syndromic_approach_for_Vaginal_discharge.json", "title": "Gynecology Vaginitis And Syndromic Approach For Vaginal Discharge", "category": "Obstetrics", "count": 12}, {"file": "Gynecology-Vulval_and_Vaginal_Malignancy.json", "title": "Gynecology Vulval And Vaginal Malignancy", "category": "Obstetrics", "count": 16}, {"file": "Gynecology-Vulval_Infections_and_Genital_TB.json", "title": "Gynecology Vulval Infections And Genital Tb", "category": "Obstetrics", "count": 12}, {"file": "Imaging_in_Gynecology.json", "title": "Imaging In Gynecology", "category": "Obstetrics", "count": 14}, {"file": "Infections_in_Gynecology.json", "title": "Infections In Gynecology", "category": "Obstetrics", "count": 22}, {"file": "Mid_Day_Module_OBG-1_-_2025-03-02.json", "title": "Mid Day Module Obg 1   2025 03 02", "category": "Obstetrics", "count": 50}, {"file": "Mid_Day_Module_OBG-2_-_2025-03-03.json", "title": "Mid Day Module Obg 2   2025 03 03", "category": "Obstetrics", "count": 50}, {"file": "Mid_Day_Module_OBG-3_-_2025-03-04.json", "title": "Mid Day Module Obg 3   2025 03 04", "category": "Obstetrics", "count": 50}, {"file": "Mid_Day_Module_OBG-4_-_2025-03-05.json", "title": "Mid Day Module Obg 4   2025 03 05", "category": "Obstetrics", "count": 50}, {"file": "Mid_Day_Module_OBG-5_-_2025-03-07.json", "title": "Mid Day Module Obg 5   2025 03 07", "category": "Obstetrics", "count": 50}, {"file": "Mid_Day_Module_OBG-6_-_2025-03-08.json", "title": "Mid Day Module Obg 6   2025 03 08", "category": "Obstetrics", "count": 50}, {"file": "Mid_Day_Module_OBG-7_-_2025-03-09.json", "title": "Mid Day Module Obg 7   2025 03 09", "category": "Obstetrics", "count": 50}, {"file": "Mid_Day_Module_OBGPedia-1_-_2025-03-10.json", "title": "Mid Day Module Obgpedia 1   2025 03 10", "category": "Obstetrics", "count": 50}, {"file": "OBG_-_INI_CET_JULY_2021.json", "title": "Obg   Ini Cet July 2021", "category": "Obstetrics", "count": 21}, {"file": "OBG_-_INI_CET_MAY_2022.json", "title": "Obg   Ini Cet May 2022", "category": "Obstetrics", "count": 12}, {"file": "OBG_-_INI_CET_MAY_2023.json", "title": "Obg   Ini Cet May 2023", "category": "Obstetrics", "count": 8}, {"file": "OBG_-_INI_CET_NOV_2020.json", "title": "Obg   Ini Cet Nov 2020", "category": "Obstetrics", "count": 9}, {"file": "OBG_-_INI_CET_NOV_2021.json", "title": "Obg   Ini Cet Nov 2021", "category": "Obstetrics", "count": 12}, {"file": "OBG_-_INI_CET_NOV_2023.json", "title": "Obg   Ini Cet Nov 2023", "category": "Obstetrics", "count": 10}, {"file": "OBG_Basics.json", "title": "Obg Basics", "category": "Obstetrics", "count": 18}, {"file": "OBG_ED_-_Mission_15_-_01-03-2024_-_2024-03-01.json", "title": "Obg Ed   Mission 15   01 03 2024   2024 03 01", "category": "Obstetrics", "count": 150}, {"file": "OBG_ED_-_Mission_15_Lap_2_-_26-05-2024_-_2024-05-26.json", "title": "Obg Ed   Mission 15 Lap 2   26 05 2024   2024 05 26", "category": "Obstetrics", "count": 100}, {"file": "OBG_ED_-_Mission_20_Batch_2_-_05-11-2024_-_2024-11-05.json", "title": "Obg Ed   Mission 20 Batch 2   05 11 2024   2024 11 05", "category": "Obstetrics", "count": 100}, {"file": "OBG_ED_-_Mission_20_Batch_3_-_10-03-2025_-_2025-03-10.json", "title": "Obg Ed   Mission 20 Batch 3   10 03 2025   2025 03 10", "category": "Obstetrics", "count": 81}, {"file": "OBG_ED_-_Mission_20_Lap_2_-_01-05-2025_-_2025-05-01.json", "title": "Obg Ed   Mission 20 Lap 2   01 05 2025   2025 05 01", "category": "Obstetrics", "count": 100}, {"file": "OBG_Last_Month_ED_-_26-07-2024_-_2024-07-26.json", "title": "Obg Last Month Ed   26 07 2024   2024 07 26", "category": "Obstetrics", "count": 40}, {"file": "OBG-Pediatrics_10_BTR_Test_-_2023-09-19.json", "title": "Obg Pediatrics 10 Btr Test   2023 09 19", "category": "Obstetrics", "count": 100}, {"file": "OBG_Test_The_Champion_Batch_Hyderabad_-_28-09-2024_-_2024-09-28.json", "title": "Obg Test The Champion Batch Hyderabad   28 09 2024   2024 09 28", "category": "Obstetrics", "count": 75}, {"file": "OBGY_and_Breast_Imaging.json", "title": "Obgy And Breast Imaging", "category": "Obstetrics", "count": 4}, {"file": "OBGy_Imaging-Obstetrics__Gynaecology__and_Breast_Imaging.json", "title": "Obgy Imaging Obstetrics  Gynaecology  And Breast Imaging", "category": "Obstetrics", "count": 20}, {"file": "OBGy_Imaging-Previous_Year_Questions.json", "title": "Obgy Imaging Previous Year Questions", "category": "Obstetrics", "count": 6}, {"file": "Obs__Gynaecology-_Class_Test_With_Video_Solution.json", "title": "Obs  Gynaecology  Class Test With Video Solution", "category": "Obstetrics", "count": 100}, {"file": "Obstetrics__Gynaecology.json", "title": "Obstetrics  Gynaecology", "category": "Obstetrics", "count": 200}, {"file": "Obstetrics__Gynaecology_Dr_Deepti.json", "title": "Obstetrics  Gynaecology Dr Deepti", "category": "Obstetrics", "count": 50}, {"file": "Obstetrics__Gynaecology_DVT_Revision_Test.json", "title": "Obstetrics  Gynaecology Dvt Revision Test", "category": "Obstetrics", "count": 50}, {"file": "Obstetrics__Gynaecology_MIQ_Series.json", "title": "Obstetrics  Gynaecology Miq Series", "category": "Obstetrics", "count": 25}, {"file": "Obstetrics__Gynecology_Dr_Anil-2026.json", "title": "Obstetrics  Gynecology Dr Anil 2026", "category": "Obstetrics", "count": 200}, {"file": "Obstetrics__Gynecology_Dr_Anil-2026_1.json", "title": "Obstetrics  Gynecology Dr Anil 2026 1", "category": "Obstetrics", "count": 200}, {"file": "Operative_Gynecology.json", "title": "Operative Gynecology", "category": "Obstetrics", "count": 48}, {"file": "Pediatrics__OBG_BTR_60_test_-_2025-05-01.json", "title": "Pediatrics  Obg Btr 60 Test   2025 05 01", "category": "Obstetrics", "count": 100}, {"file": "Pediatrics-OBG_40_BTR_test_-_2024-10-25.json", "title": "Pediatrics Obg 40 Btr Test   2024 10 25", "category": "Obstetrics", "count": 100}, {"file": "Pediatrics_OBG_BTR_50_test_-_2025-03-08.json", "title": "Pediatrics Obg Btr 50 Test   2025 03 08", "category": "Obstetrics", "count": 150}, {"file": "Pediatrics-OBG_BTR_Test_20_-_2024-01-20.json", "title": "Pediatrics Obg Btr Test 20   2024 01 20", "category": "Obstetrics", "count": 100}, {"file": "Pediatrics-OBG_BTR_Test_30_-_2024-03-04.json", "title": "Pediatrics Obg Btr Test 30   2024 03 04", "category": "Obstetrics", "count": 100}, {"file": "Pelvic_Floor_Disorders_and_Urogynecology.json", "title": "Pelvic Floor Disorders And Urogynecology", "category": "Obstetrics", "count": 18}, {"file": "SWT-Obs__Gynaecology-SET-A.json", "title": "Swt Obs  Gynaecology Set A", "category": "Obstetrics", "count": 200}, {"file": "SWT-Obstetrics__Gynaecology-SET-B.json", "title": "Swt Obstetrics  Gynaecology Set B", "category": "Obstetrics", "count": 200}, {"file": "Urogynecology-Previous_Year_Questions.json", "title": "Urogynecology Previous Year Questions", "category": "Obstetrics", "count": 8}, {"file": "Eye_Changes_After_Death.json", "title": "Eye Changes After Death", "category": "Ophthalmology", "count": 10}, {"file": "Lasers_in_Eye-Previous_Year_Questions.json", "title": "Lasers In Eye Previous Year Questions", "category": "Ophthalmology", "count": 4}, {"file": "Primary_Meyelofibrosis.json", "title": "Primary Meyelofibrosis", "category": "Ophthalmology", "count": 3}, {"file": "Complication_In_Orthopaedics.json", "title": "Complication In Orthopaedics", "category": "Orthopedics", "count": 28}, {"file": "Complications_of_Fractures-Complications_in_Orthopedics.json", "title": "Complications Of Fractures Complications In Orthopedics", "category": "Orthopedics", "count": 14}, {"file": "Derma_Radio_Ortho_Anes__Psychi_Combo_The_Champion_Batch_Hyderabad_-_29-03-2025_-_2025-03-29.json", "title": "Derma Radio Ortho Anes  Psychi Combo The Champion Batch Hyderabad   29 03 2025   2025 03 29", "category": "Orthopedics", "count": 200}, {"file": "General-Miscellaneous_Topics_in_Orthopedics.json", "title": "General Miscellaneous Topics In Orthopedics", "category": "Orthopedics", "count": 21}, {"file": "General_Orthopedics.json", "title": "General Orthopedics", "category": "Orthopedics", "count": 20}, {"file": "Introduction_to_Orthopedics_Typical_and_Atypical_Fractures.json", "title": "Introduction To Orthopedics Typical And Atypical Fractures", "category": "Orthopedics", "count": 3}, {"file": "Metabolic_Bone_Diseases-Metabolic_Disorders_in_Orthopedics.json", "title": "Metabolic Bone Diseases Metabolic Disorders In Orthopedics", "category": "Orthopedics", "count": 32}, {"file": "Mid_Day_Module_Orthopedics-1_-_2025-01-28.json", "title": "Mid Day Module Orthopedics 1   2025 01 28", "category": "Orthopedics", "count": 50}, {"file": "Mid_Day_Module_Orthopedics-2_-_2025-01-29.json", "title": "Mid Day Module Orthopedics 2   2025 01 29", "category": "Orthopedics", "count": 50}, {"file": "Mid_Day_Module_RadiologyOrthopedics-1_-_2025-02-01.json", "title": "Mid Day Module Radiologyorthopedics 1   2025 02 01", "category": "Orthopedics", "count": 50}, {"file": "Orthopadic_DVT_Revision_Test.json", "title": "Orthopadic Dvt Revision Test", "category": "Orthopedics", "count": 25}, {"file": "Orthopaedic_Imaging.json", "title": "Orthopaedic Imaging", "category": "Orthopedics", "count": 57}, {"file": "Orthopaedics_-_INI_CET_JULY_2021.json", "title": "Orthopaedics   Ini Cet July 2021", "category": "Orthopedics", "count": 8}, {"file": "Orthopaedics_-_INI_CET_MAY_2022.json", "title": "Orthopaedics   Ini Cet May 2022", "category": "Orthopedics", "count": 2}, {"file": "Orthopaedics_-_INI_CET_MAY_2023.json", "title": "Orthopaedics   Ini Cet May 2023", "category": "Orthopedics", "count": 5}, {"file": "Orthopaedics_-_INI_CET_NOV_2020.json", "title": "Orthopaedics   Ini Cet Nov 2020", "category": "Orthopedics", "count": 5}, {"file": "Orthopaedics_-_INI_CET_NOV_2021.json", "title": "Orthopaedics   Ini Cet Nov 2021", "category": "Orthopedics", "count": 8}, {"file": "Orthopaedics_-_INI_CET_NOV_2022_PART_A.json", "title": "Orthopaedics   Ini Cet Nov 2022 Part A", "category": "Orthopedics", "count": 5}, {"file": "Orthopaedics_-_INI_CET_NOV_2022_PART_B.json", "title": "Orthopaedics   Ini Cet Nov 2022 Part B", "category": "Orthopedics", "count": 3}, {"file": "Orthopaedics_-_INI_CET_NOV_2023.json", "title": "Orthopaedics   Ini Cet Nov 2023", "category": "Orthopedics", "count": 7}, {"file": "Orthopaedics_IBQ.json", "title": "Orthopaedics Ibq", "category": "Orthopedics", "count": 20}, {"file": "Orthopaedics_Image_Based_Question.json", "title": "Orthopaedics Image Based Question", "category": "Orthopedics", "count": 20}, {"file": "Orthopaedics_MIQ_Series.json", "title": "Orthopaedics Miq Series", "category": "Orthopedics", "count": 15}, {"file": "Orthopaedics_New_Season.json", "title": "Orthopaedics New Season", "category": "Orthopedics", "count": 20}, {"file": "Orthopedic_Tests.json", "title": "Orthopedic Tests", "category": "Orthopedics", "count": 10}, {"file": "Orthopedics_Dr_Tushar.json", "title": "Orthopedics Dr Tushar", "category": "Orthopedics", "count": 40}, {"file": "Orthopedics_Dr_Tushar_1.json", "title": "Orthopedics Dr Tushar 1", "category": "Orthopedics", "count": 40}, {"file": "Orthopedics_Dr_Tushar_New.json", "title": "Orthopedics Dr Tushar New", "category": "Orthopedics", "count": 40}, {"file": "Orthopedics_ED_-_Mission_15_-_11-04-2024_-_2024-04-11.json", "title": "Orthopedics Ed   Mission 15   11 04 2024   2024 04 11", "category": "Orthopedics", "count": 50}, {"file": "Orthopedics_ED_-_Mission_15_Lap_2_-_22-05-2024_-_2024-05-22.json", "title": "Orthopedics Ed   Mission 15 Lap 2   22 05 2024   2024 05 22", "category": "Orthopedics", "count": 50}, {"file": "Orthopedics_ED_-_Mission_20_Batch_2_-_02-12-2024_-_2024-12-02.json", "title": "Orthopedics Ed   Mission 20 Batch 2   02 12 2024   2024 12 02", "category": "Orthopedics", "count": 75}, {"file": "Orthopedics_ED_-_Mission_20_Batch_3_-_31-01-2025_-_2025-01-31.json", "title": "Orthopedics Ed   Mission 20 Batch 3   31 01 2025   2025 01 31", "category": "Orthopedics", "count": 75}, {"file": "Orthopedics_ED_-_Mission_20_Lap_2_-_05-04-2025_-_2025-04-05.json", "title": "Orthopedics Ed   Mission 20 Lap 2   05 04 2025   2025 04 05", "category": "Orthopedics", "count": 50}, {"file": "Orthopedics_ED_Test-1_-_20-06-2023_-_2023-06-20.json", "title": "Orthopedics Ed Test 1   20 06 2023   2023 06 20", "category": "Orthopedics", "count": 50}, {"file": "Orthopedics_Last_Month_ED_-_04-07-2024_-_2024-07-04.json", "title": "Orthopedics Last Month Ed   04 07 2024   2024 07 04", "category": "Orthopedics", "count": 25}, {"file": "Orthopedics_Oncology.json", "title": "Orthopedics Oncology", "category": "Orthopedics", "count": 37}, {"file": "Orthopedics_Test_The_Champion_Batch_Hyderabad_-_25-01-2025_-_2025-01-25.json", "title": "Orthopedics Test The Champion Batch Hyderabad   25 01 2025   2025 01 25", "category": "Orthopedics", "count": 50}, {"file": "Orthopedics_Test_The_Champion_Batch_Hyderabad_-_25-07-2024_-_2024-07-25.json", "title": "Orthopedics Test The Champion Batch Hyderabad   25 07 2024   2024 07 25", "category": "Orthopedics", "count": 50}, {"file": "Orthopedics_Test_The_Champion_Batch_Hyderabad_-_30-04-2025_-_2025-04-30.json", "title": "Orthopedics Test The Champion Batch Hyderabad   30 04 2025   2025 04 30", "category": "Orthopedics", "count": 50}, {"file": "Special_X-Ray_views_in_Ortho.json", "title": "Special X Ray Views In Ortho", "category": "Orthopedics", "count": 5}, {"file": "Splints__Tractions_In_Ortho.json", "title": "Splints  Tractions In Ortho", "category": "Orthopedics", "count": 10}, {"file": "SWT-Orthopaedics-SET-A.json", "title": "Swt Orthopaedics Set A", "category": "Orthopedics", "count": 100}, {"file": "SWT-Orthopaedics-SET-B.json", "title": "Swt Orthopaedics Set B", "category": "Orthopedics", "count": 100}, {"file": "ANS_Pharmacology-Sympatholytics.json", "title": "Ans Pharmacology Sympatholytics", "category": "Pathology", "count": 13}, {"file": "ANS_Pharmacology-Sympathomimetics.json", "title": "Ans Pharmacology Sympathomimetics", "category": "Pathology", "count": 21}, {"file": "Blood_Banking_and_Transfusion_Medicine-Blood_Banking_and_Transfusion_Pathology.json", "title": "Blood Banking And Transfusion Medicine Blood Banking And Transfusion Pathology", "category": "Pathology", "count": 11}, {"file": "Bone_Disorders-Bone_and_soft_tissue_pathology.json", "title": "Bone Disorders Bone And Soft Tissue Pathology", "category": "Pathology", "count": 20}, {"file": "Breast_Pathology-Benign_Breast_Lesions.json", "title": "Breast Pathology Benign Breast Lesions", "category": "Pathology", "count": 14}, {"file": "Breast_Pathology-Malignant_Breast_Lesions.json", "title": "Breast Pathology Malignant Breast Lesions", "category": "Pathology", "count": 12}, {"file": "Breast_Pathology-Previous_Year_Questions.json", "title": "Breast Pathology Previous Year Questions", "category": "Pathology", "count": 6}, {"file": "Central_Nervous_System-CNS_Pathology.json", "title": "Central Nervous System Cns Pathology", "category": "Pathology", "count": 17}, {"file": "Central_Nervous_System_Pathology.json", "title": "Central Nervous System Pathology", "category": "Pathology", "count": 8}, {"file": "General_Pathology_Dr_Sanjeev.json", "title": "General Pathology Dr Sanjeev", "category": "Pathology", "count": 25}, {"file": "Genital_System-Pathology_of_Female_Genital_Tract-I.json", "title": "Genital System Pathology Of Female Genital Tract I", "category": "Pathology", "count": 11}, {"file": "Genital_System-Pathology_of_Female_Genital_Tract-II.json", "title": "Genital System Pathology Of Female Genital Tract Ii", "category": "Pathology", "count": 20}, {"file": "Genital_System-Pathology_of_Male_Genital_Tract.json", "title": "Genital System Pathology Of Male Genital Tract", "category": "Pathology", "count": 17}, {"file": "Histopathology.json", "title": "Histopathology", "category": "Pathology", "count": 5}, {"file": "Larynx-Voice_Pathologies_and_Congenital_Lesions_of_Larynx.json", "title": "Larynx Voice Pathologies And Congenital Lesions Of Larynx", "category": "Pathology", "count": 16}, {"file": "Liver__Biliary_System_and_Pancreas-Hepatobiliary_Pathology-I.json", "title": "Liver  Biliary System And Pancreas Hepatobiliary Pathology I", "category": "Pathology", "count": 18}, {"file": "Liver__Biliary_System_and_Pancreas-Hepatobiliary_Pathology-II.json", "title": "Liver  Biliary System And Pancreas Hepatobiliary Pathology Ii", "category": "Pathology", "count": 13}, {"file": "Macular_Pathologies.json", "title": "Macular Pathologies", "category": "Pathology", "count": 8}, {"file": "Mid_Day_Module_DermaPatho-1_-_2025-02-24.json", "title": "Mid Day Module Dermapatho 1   2025 02 24", "category": "Pathology", "count": 50}, {"file": "Mid_Day_Module_Pathology-1_-_2024-12-01.json", "title": "Mid Day Module Pathology 1   2024 12 01", "category": "Pathology", "count": 50}, {"file": "Mid_Day_Module_Pathology-2_-_2024-12-02.json", "title": "Mid Day Module Pathology 2   2024 12 02", "category": "Pathology", "count": 50}, {"file": "Mid_Day_Module_Pathology-3_-_2024-12-03.json", "title": "Mid Day Module Pathology 3   2024 12 03", "category": "Pathology", "count": 50}, {"file": "Mid_Day_Module_Pathology-4_-_2024-12-04.json", "title": "Mid Day Module Pathology 4   2024 12 04", "category": "Pathology", "count": 50}, {"file": "Mid_Day_Module_Pathology-5_-_2025-02-20.json", "title": "Mid Day Module Pathology 5   2025 02 20", "category": "Pathology", "count": 50}, {"file": "Mid_Day_Module_Pathology-6_-_2025-02-21.json", "title": "Mid Day Module Pathology 6   2025 02 21", "category": "Pathology", "count": 50}, {"file": "Mutation_Types__Pathogenesis.json", "title": "Mutation Types  Pathogenesis", "category": "Pathology", "count": 2}, {"file": "Neurology-Intracranial_Pathologies__ICP__Brain_Death__Tumors__and_Neurocysticercosis.json", "title": "Neurology Intracranial Pathologies  Icp  Brain Death  Tumors  And Neurocysticercosis", "category": "Pathology", "count": 23}, {"file": "Pathologies_of_Reproductive_Age_Group-Previous_Year_Questions.json", "title": "Pathologies Of Reproductive Age Group Previous Year Questions", "category": "Pathology", "count": 17}, {"file": "Pathology.json", "title": "Pathology", "category": "Pathology", "count": 20}, {"file": "Pathology_-_INI_CET_JUL_2021.json", "title": "Pathology   Ini Cet Jul 2021", "category": "Pathology", "count": 20}, {"file": "Pathology_-_INI_CET_MAY_2022.json", "title": "Pathology   Ini Cet May 2022", "category": "Pathology", "count": 19}, {"file": "Pathology_-_INI_CET_MAY_2023.json", "title": "Pathology   Ini Cet May 2023", "category": "Pathology", "count": 4}, {"file": "Pathology_-_INI_CET_NOV_2020.json", "title": "Pathology   Ini Cet Nov 2020", "category": "Pathology", "count": 17}, {"file": "Pathology_-_INI_CET_NOV_2021.json", "title": "Pathology   Ini Cet Nov 2021", "category": "Pathology", "count": 17}, {"file": "Pathology_-_INI_CET_NOV_2022_PART_A.json", "title": "Pathology   Ini Cet Nov 2022 Part A", "category": "Pathology", "count": 17}, {"file": "Pathology_-_INI_CET_NOV_2022_PART_B.json", "title": "Pathology   Ini Cet Nov 2022 Part B", "category": "Pathology", "count": 17}, {"file": "Pathology_-_INI_CET_NOV_2023.json", "title": "Pathology   Ini Cet Nov 2023", "category": "Pathology", "count": 24}, {"file": "Pathology_1.json", "title": "Pathology 1", "category": "Pathology", "count": 20}, {"file": "Pathology_Clinical_Vignettes.json", "title": "Pathology Clinical Vignettes", "category": "Pathology", "count": 138}, {"file": "272_Pathology_Dr_Shagun.json", "title": "Pathology Dr Shagun", "category": "Pathology", "count": 40}, {"file": "Pathology_Dr_Shagun.json", "title": "Pathology Dr Shagun", "category": "Pathology", "count": 40}, {"file": "Pathology_DVT_Revision_Test.json", "title": "Pathology Dvt Revision Test", "category": "Pathology", "count": 25}, {"file": "Pathology_ED_-_Mission_15_-_29-01-2024_-_2024-01-29.json", "title": "Pathology Ed   Mission 15   29 01 2024   2024 01 29", "category": "Pathology", "count": 100}, {"file": "Pathology_ED_-_Mission_15_Lap_2_-_11-06-2024_-_2024-06-11.json", "title": "Pathology Ed   Mission 15 Lap 2   11 06 2024   2024 06 11", "category": "Pathology", "count": 75}, {"file": "Pathology_ED_-_Mission_20_Batch_2_-_13-11-2024_-_2024-11-13.json", "title": "Pathology Ed   Mission 20 Batch 2   13 11 2024   2024 11 13", "category": "Pathology", "count": 70}, {"file": "Pathology_ED_-_Mission_20_Batch_3_-_23-02-2025_-_2025-02-23.json", "title": "Pathology Ed   Mission 20 Batch 3   23 02 2025   2025 02 23", "category": "Pathology", "count": 74}, {"file": "Pathology_ED_-_Mission_20_Lap_2_-_26-03-2025_-_2025-03-26.json", "title": "Pathology Ed   Mission 20 Lap 2   26 03 2025   2025 03 26", "category": "Pathology", "count": 70}, {"file": "Pathology_ED_Part-1_Mission_30_Early_Intern_Batch_-_25-04-2025_-_2025-04-25.json", "title": "Pathology Ed Part 1 Mission 30 Early Intern Batch   25 04 2025   2025 04 25", "category": "Pathology", "count": 50}, {"file": "Pathology_ED_Part-2_Mission_30_Early_Intern_Batch_-_29-04-2025_-_2025-04-29.json", "title": "Pathology Ed Part 2 Mission 30 Early Intern Batch   29 04 2025   2025 04 29", "category": "Pathology", "count": 50}, {"file": "Pathology_Gen-_Class_Test_With_Video_Solution.json", "title": "Pathology Gen  Class Test With Video Solution", "category": "Pathology", "count": 30}, {"file": "Pathology_General_Dr_Sanjeev-2026.json", "title": "Pathology General Dr Sanjeev 2026", "category": "Pathology", "count": 30}, {"file": "Pathology-General_Hemat_New_Season.json", "title": "Pathology General Hemat New Season", "category": "Pathology", "count": 25}, {"file": "Pathology_GENHemat_Dr_Shagun.json", "title": "Pathology Genhemat Dr Shagun", "category": "Pathology", "count": 42}, {"file": "Pathology_Hemat_Dr_Sanjeev-2026.json", "title": "Pathology Hemat Dr Sanjeev 2026", "category": "Pathology", "count": 30}, {"file": "Pathology_Hematology_Dr_Sanjeev.json", "title": "Pathology Hematology Dr Sanjeev", "category": "Pathology", "count": 30}, {"file": "275_Pathology_MIQ_Series.json", "title": "Pathology Miq Series", "category": "Pathology", "count": 20}, {"file": "Pathology_MIQ_Series.json", "title": "Pathology Miq Series", "category": "Pathology", "count": 20}, {"file": "Pathology_Systemic_Dr_Gaurav_Tehri.json", "title": "Pathology Systemic Dr Gaurav Tehri", "category": "Pathology", "count": 50}, {"file": "Pathology_Systemic_Dr_Sanjeev.json", "title": "Pathology Systemic Dr Sanjeev", "category": "Pathology", "count": 25}, {"file": "Pathology_Systemic_Dr_Sanjeev-2026.json", "title": "Pathology Systemic Dr Sanjeev 2026", "category": "Pathology", "count": 30}, {"file": "Pathology_Systemic_Gaurav_Tehri.json", "title": "Pathology Systemic Gaurav Tehri", "category": "Pathology", "count": 40}, {"file": "Pathology-Systemic_New_Season.json", "title": "Pathology Systemic New Season", "category": "Pathology", "count": 25}, {"file": "Pathology_Test_The_Champion_Batch_Hyderabad_-_10-08-2024_-_2024-08-10.json", "title": "Pathology Test The Champion Batch Hyderabad   10 08 2024   2024 08 10", "category": "Pathology", "count": 50}, {"file": "Pathology_Test_The_Champion_Batch_Hyderabad_-_12-12-2024_-_2024-12-12.json", "title": "Pathology Test The Champion Batch Hyderabad   12 12 2024   2024 12 12", "category": "Pathology", "count": 75}, {"file": "Renal_System-Basics_of_Renal_Pathology.json", "title": "Renal System Basics Of Renal Pathology", "category": "Pathology", "count": 9}, {"file": "Salivary_Glands-Salivary_Gland_Pathology.json", "title": "Salivary Glands Salivary Gland Pathology", "category": "Pathology", "count": 8}, {"file": "Skin_Pathology-Skin_pathology.json", "title": "Skin Pathology Skin Pathology", "category": "Pathology", "count": 14}, {"file": "SWT-Pathology-SET-A.json", "title": "Swt Pathology Set A", "category": "Pathology", "count": 200}, {"file": "SWT-Pathology-SET-B.json", "title": "Swt Pathology Set B", "category": "Pathology", "count": 200}, {"file": "Sympatholytic_Drugs.json", "title": "Sympatholytic Drugs", "category": "Pathology", "count": 24}, {"file": "Sympathomimetic_Drugs.json", "title": "Sympathomimetic Drugs", "category": "Pathology", "count": 10}, {"file": "T-20_Pathology_Test-1_-_16-05-2023_-_2023-05-16.json", "title": "T 20 Pathology Test 1   16 05 2023   2023 05 16", "category": "Pathology", "count": 20}, {"file": "T-20_Pathology_Test-2_-_28-06-2023_-_2023-06-28.json", "title": "T 20 Pathology Test 2   28 06 2023   2023 06 28", "category": "Pathology", "count": 20}, {"file": "T-20_Pathology_Test-3_-_18-07-2023_-_2023-07-18.json", "title": "T 20 Pathology Test 3   18 07 2023   2023 07 18", "category": "Pathology", "count": 20}, {"file": "T-20_Pathology_Test-4_-_30-07-2023_-_2023-07-30.json", "title": "T 20 Pathology Test 4   30 07 2023   2023 07 30", "category": "Pathology", "count": 20}, {"file": "T-20_Pathology_Test-5_-_06-08-2023_-_2023-08-06.json", "title": "T 20 Pathology Test 5   06 08 2023   2023 08 06", "category": "Pathology", "count": 20}, {"file": "T-20_Pathology_Test-6_-_13-08-2023_-_2023-08-13.json", "title": "T 20 Pathology Test 6   13 08 2023   2023 08 13", "category": "Pathology", "count": 20}, {"file": "T-20_Pathology_Test-7_-_03-09-2023_-_2023-09-03.json", "title": "T 20 Pathology Test 7   03 09 2023   2023 09 03", "category": "Pathology", "count": 20}, {"file": "T-20_Pathology_Test-8_-_10-09-2023_-_2023-09-10.json", "title": "T 20 Pathology Test 8   10 09 2023   2023 09 10", "category": "Pathology", "count": 20}, {"file": "T-20_Pathology_Test-9_-_17-09-2023_-_2023-09-17.json", "title": "T 20 Pathology Test 9   17 09 2023   2023 09 17", "category": "Pathology", "count": 20}, {"file": "Techniques_in_Pathology-Previous_Year_Questions.json", "title": "Techniques In Pathology Previous Year Questions", "category": "Pathology", "count": 11}, {"file": "Mid_Day_Module_Pediatrics-1_-_2025-02-26.json", "title": "Mid Day Module Pediatrics 1   2025 02 26", "category": "Pediatrics", "count": 50}, {"file": "Mid_Day_Module_Pediatrics-2_-_2025-02-27.json", "title": "Mid Day Module Pediatrics 2   2025 02 27", "category": "Pediatrics", "count": 50}, {"file": "Mid_Day_Module_Pediatrics-3_-_2025-02-28.json", "title": "Mid Day Module Pediatrics 3   2025 02 28", "category": "Pediatrics", "count": 50}, {"file": "Mid_Day_Module_Pediatrics-4_-_2025-03-01.json", "title": "Mid Day Module Pediatrics 4   2025 03 01", "category": "Pediatrics", "count": 50}, {"file": "Mid_Day_Module_Pediatrics-5_-_2025-03-06.json", "title": "Mid Day Module Pediatrics 5   2025 03 06", "category": "Pediatrics", "count": 50}, {"file": "Miscellaneous_Disorders-Adverse_Drug_Reactions__Pediatric_Dermatoses__Urticaria_and_Angioedema.json", "title": "Miscellaneous Disorders Adverse Drug Reactions  Pediatric Dermatoses  Urticaria And Angioedema", "category": "Pediatrics", "count": 10}, {"file": "Pediatric_and_Obstetric_Anesthesia.json", "title": "Pediatric And Obstetric Anesthesia", "category": "Pediatrics", "count": 19}, {"file": "Pediatric_Cardiology-Pediatric_Cardiology-I.json", "title": "Pediatric Cardiology Pediatric Cardiology I", "category": "Pediatrics", "count": 10}, {"file": "Pediatric_Cardiology-Pediatric_Cardiology-II.json", "title": "Pediatric Cardiology Pediatric Cardiology Ii", "category": "Pediatrics", "count": 11}, {"file": "Pediatric_Cardiology-Previous_Year_Questions.json", "title": "Pediatric Cardiology Previous Year Questions", "category": "Pediatrics", "count": 25}, {"file": "Pediatric_Endocrinology-Pediatric_Endocrinology_and_Metabolism.json", "title": "Pediatric Endocrinology Pediatric Endocrinology And Metabolism", "category": "Pediatrics", "count": 18}, {"file": "Pediatric_Endocrinology-Pituitary__Thyroid__and_Adrenal_Disorders.json", "title": "Pediatric Endocrinology Pituitary  Thyroid  And Adrenal Disorders", "category": "Pediatrics", "count": 17}, {"file": "Pediatric_Endocrinology-Previous_Year_Questions.json", "title": "Pediatric Endocrinology Previous Year Questions", "category": "Pediatrics", "count": 10}, {"file": "Pediatric_Hematology_and_Oncology-Pediatric_Hematology.json", "title": "Pediatric Hematology And Oncology Pediatric Hematology", "category": "Pediatrics", "count": 24}, {"file": "Pediatric_Hematology_and_Oncology-Previous_Year_Questions.json", "title": "Pediatric Hematology And Oncology Previous Year Questions", "category": "Pediatrics", "count": 12}, {"file": "Pediatric_Immunology.json", "title": "Pediatric Immunology", "category": "Pediatrics", "count": 20}, {"file": "Pediatric_Infectious_Diseases.json", "title": "Pediatric Infectious Diseases", "category": "Pediatrics", "count": 30}, {"file": "Pediatric_Nephrology-Previous_Year_Questions.json", "title": "Pediatric Nephrology Previous Year Questions", "category": "Pediatrics", "count": 13}, {"file": "Pediatric_Nephrology-Renal_Disorders.json", "title": "Pediatric Nephrology Renal Disorders", "category": "Pediatrics", "count": 19}, {"file": "Pediatric_Neurology.json", "title": "Pediatric Neurology", "category": "Pediatrics", "count": 47}, {"file": "Pediatric_Neurology-CNS_Disorders__Brain_Death__and_Images.json", "title": "Pediatric Neurology Cns Disorders  Brain Death  And Images", "category": "Pediatrics", "count": 14}, {"file": "Pediatric_Neurology-CNS_Malformations__Hydrocephalus__and_Seizures_in_Children.json", "title": "Pediatric Neurology Cns Malformations  Hydrocephalus  And Seizures In Children", "category": "Pediatrics", "count": 18}, {"file": "Pediatric_Neurology-Previous_Year_Questions.json", "title": "Pediatric Neurology Previous Year Questions", "category": "Pediatrics", "count": 26}, {"file": "Pediatric_Orthopedics.json", "title": "Pediatric Orthopedics", "category": "Pediatrics", "count": 69}, {"file": "Pediatric_Orthopedics-Pediatric_Orthopedics.json", "title": "Pediatric Orthopedics Pediatric Orthopedics", "category": "Pediatrics", "count": 16}, {"file": "Pediatric_Orthopedics-Previous_Year_Questions.json", "title": "Pediatric Orthopedics Previous Year Questions", "category": "Pediatrics", "count": 10}, {"file": "Pediatric_Respiratory_Disorders-Previous_Year_Questions.json", "title": "Pediatric Respiratory Disorders Previous Year Questions", "category": "Pediatrics", "count": 29}, {"file": "Pediatric_Respiratory_Disorders-Respiratory_Disorders_in_Children.json", "title": "Pediatric Respiratory Disorders Respiratory Disorders In Children", "category": "Pediatrics", "count": 26}, {"file": "Pediatric_tumours.json", "title": "Pediatric Tumours", "category": "Pediatrics", "count": 20}, {"file": "288_Pediatrics.json", "title": "Pediatrics", "category": "Pediatrics", "count": 100}, {"file": "Pediatrics.json", "title": "Pediatrics", "category": "Pediatrics", "count": 20}, {"file": "Pediatrics_-_INI_CET_JULY_2021.json", "title": "Pediatrics   Ini Cet July 2021", "category": "Pediatrics", "count": 9}, {"file": "Pediatrics_-_INI_CET_MAY_2022.json", "title": "Pediatrics   Ini Cet May 2022", "category": "Pediatrics", "count": 7}, {"file": "Pediatrics_-_INI_CET_MAY_2023.json", "title": "Pediatrics   Ini Cet May 2023", "category": "Pediatrics", "count": 8}, {"file": "Pediatrics_-_INI_CET_NOV_2020.json", "title": "Pediatrics   Ini Cet Nov 2020", "category": "Pediatrics", "count": 5}, {"file": "Pediatrics_-_INI_CET_NOV_2021.json", "title": "Pediatrics   Ini Cet Nov 2021", "category": "Pediatrics", "count": 7}, {"file": "Pediatrics_-_INI_CET_NOV_2023.json", "title": "Pediatrics   Ini Cet Nov 2023", "category": "Pediatrics", "count": 11}, {"file": "Pediatrics_-_INI_CET_NOVEMBER_2022_PART_-_A.json", "title": "Pediatrics   Ini Cet November 2022 Part   A", "category": "Pediatrics", "count": 9}, {"file": "Pediatrics_-_INI_CET_NOVEMBER_2022_PART_-_B.json", "title": "Pediatrics   Ini Cet November 2022 Part   B", "category": "Pediatrics", "count": 9}, {"file": "Pediatrics-_Class_Test_With_Video_Solution.json", "title": "Pediatrics  Class Test With Video Solution", "category": "Pediatrics", "count": 75}, {"file": "Pediatrics_1.json", "title": "Pediatrics 1", "category": "Pediatrics", "count": 20}, {"file": "292_Pediatrics_Dr_Ashutosh.json", "title": "Pediatrics Dr Ashutosh", "category": "Pediatrics", "count": 40}, {"file": "Pediatrics_Dr_Ashutosh.json", "title": "Pediatrics Dr Ashutosh", "category": "Pediatrics", "count": 40}, {"file": "Pediatrics_Dr_Ashutosh-2026.json", "title": "Pediatrics Dr Ashutosh 2026", "category": "Pediatrics", "count": 75}, {"file": "Pediatrics_Dr_Sidharth_Sethi-2026.json", "title": "Pediatrics Dr Sidharth Sethi 2026", "category": "Pediatrics", "count": 75}, {"file": "Pediatrics_DVT_Revision_Test.json", "title": "Pediatrics Dvt Revision Test", "category": "Pediatrics", "count": 50}, {"file": "Pediatrics_ED_-_Mission_15_-_23-02-2024_-_2024-02-23.json", "title": "Pediatrics Ed   Mission 15   23 02 2024   2024 02 23", "category": "Pediatrics", "count": 150}, {"file": "Pediatrics_ED_-_Mission_15_Lap_2_-_22-05-2024_-_2024-05-22.json", "title": "Pediatrics Ed   Mission 15 Lap 2   22 05 2024   2024 05 22", "category": "Pediatrics", "count": 75}, {"file": "Pediatrics_ED_-_Mission_20_Batch_2_-_13-09-2024_-_2024-09-12.json", "title": "Pediatrics Ed   Mission 20 Batch 2   13 09 2024   2024 09 12", "category": "Pediatrics", "count": 100}, {"file": "Pediatrics_ED_-_Mission_20_Batch_3_-_05-03-2025_-_2025-03-05.json", "title": "Pediatrics Ed   Mission 20 Batch 3   05 03 2025   2025 03 05", "category": "Pediatrics", "count": 75}, {"file": "Pediatrics_ED_-_Mission_20_Lap_2_-_16-04-2025_-_2025-04-16.json", "title": "Pediatrics Ed   Mission 20 Lap 2   16 04 2025   2025 04 16", "category": "Pediatrics", "count": 75}, {"file": "Pediatrics_Endocrinology.json", "title": "Pediatrics Endocrinology", "category": "Pediatrics", "count": 18}, {"file": "Pediatrics_IBQ.json", "title": "Pediatrics Ibq", "category": "Pediatrics", "count": 20}, {"file": "Pediatrics_Image_Based_Question.json", "title": "Pediatrics Image Based Question", "category": "Pediatrics", "count": 20}, {"file": "Pediatrics_Last_Month_ED_-_15-07-2024_-_2024-07-15.json", "title": "Pediatrics Last Month Ed   15 07 2024   2024 07 15", "category": "Pediatrics", "count": 25}, {"file": "297_Pediatrics_MIQ_Series.json", "title": "Pediatrics Miq Series", "category": "Pediatrics", "count": 20}, {"file": "Pediatrics_MIQ_Series.json", "title": "Pediatrics Miq Series", "category": "Pediatrics", "count": 20}, {"file": "Pediatrics_Nephrology.json", "title": "Pediatrics Nephrology", "category": "Pediatrics", "count": 28}, {"file": "Pediatrics_Test_The_Champion_Batch_Hyderabad_-_04-11-2024_-_2024-11-04.json", "title": "Pediatrics Test The Champion Batch Hyderabad   04 11 2024   2024 11 04", "category": "Pediatrics", "count": 75}, {"file": "Pediatrics_Test_The_Champion_Batch_Hyderabad_-_10-04-2025_-_2025-04-10.json", "title": "Pediatrics Test The Champion Batch Hyderabad   10 04 2025   2025 04 10", "category": "Pediatrics", "count": 75}, {"file": "Pediatrics_Test_The_Champion_Batch_Hyderabad_-_21-06-2024_-_2024-06-21.json", "title": "Pediatrics Test The Champion Batch Hyderabad   21 06 2024   2024 06 21", "category": "Pediatrics", "count": 75}, {"file": "Rheumatology_and_Pediatric_Vasculitis.json", "title": "Rheumatology And Pediatric Vasculitis", "category": "Pediatrics", "count": 19}, {"file": "Anaesthesia-Anaesthetic_Pharmacology.json", "title": "Anaesthesia Anaesthetic Pharmacology", "category": "Pharmacology", "count": 18}, {"file": "ANS_Pharmacology-ANS_Introduction_and_Cholinergic_Drugs.json", "title": "Ans Pharmacology Ans Introduction And Cholinergic Drugs", "category": "Pharmacology", "count": 23}, {"file": "ANS_Pharmacology-Anticholinergic_Drugs.json", "title": "Ans Pharmacology Anticholinergic Drugs", "category": "Pharmacology", "count": 12}, {"file": "ANS_Pharmacology-Previous_Year_Questions.json", "title": "Ans Pharmacology Previous Year Questions", "category": "Pharmacology", "count": 52}, {"file": "Clinical_Pharmacology.json", "title": "Clinical Pharmacology", "category": "Pharmacology", "count": 12}, {"file": "CNS_Pharmacology-Anti_Epileptic_Drugs.json", "title": "Cns Pharmacology Anti Epileptic Drugs", "category": "Pharmacology", "count": 15}, {"file": "CNS_Pharmacology-Antipsychotics_and_Antidepressants.json", "title": "Cns Pharmacology Antipsychotics And Antidepressants", "category": "Pharmacology", "count": 16}, {"file": "CNS_Pharmacology-Opioids.json", "title": "Cns Pharmacology Opioids", "category": "Pharmacology", "count": 12}, {"file": "CNS_Pharmacology-Parkinson_s_Disease_and_Other_Disorders.json", "title": "Cns Pharmacology Parkinson S Disease And Other Disorders", "category": "Pharmacology", "count": 10}, {"file": "CNS_Pharmacology-Previous_Year_Questions.json", "title": "Cns Pharmacology Previous Year Questions", "category": "Pharmacology", "count": 75}, {"file": "CNS_Pharmacology-Sedatives_Hypnotics__Drugs_for_Insomnia__and_Alcohol.json", "title": "Cns Pharmacology Sedatives Hypnotics  Drugs For Insomnia  And Alcohol", "category": "Pharmacology", "count": 15}, {"file": "CVS_Pharmacology-Anti_Anginal_drugs.json", "title": "Cvs Pharmacology Anti Anginal Drugs", "category": "Pharmacology", "count": 11}, {"file": "CVS_Pharmacology-Antihypertensives.json", "title": "Cvs Pharmacology Antihypertensives", "category": "Pharmacology", "count": 20}, {"file": "CVS_Pharmacology-Hypolipidemic_Drugs_and_Anti-Arrhythmic_Drugs.json", "title": "Cvs Pharmacology Hypolipidemic Drugs And Anti Arrhythmic Drugs", "category": "Pharmacology", "count": 16}, {"file": "CVS_Pharmacology-Myocardial_Infarction___Drugs_for_Heart_Failure.json", "title": "Cvs Pharmacology Myocardial Infarction   Drugs For Heart Failure", "category": "Pharmacology", "count": 18}, {"file": "CVS_Pharmacology-Previous_Year_Questions.json", "title": "Cvs Pharmacology Previous Year Questions", "category": "Pharmacology", "count": 63}, {"file": "Endocrine_Pharmacology-Antithyroid_Drugs.json", "title": "Endocrine Pharmacology Antithyroid Drugs", "category": "Pharmacology", "count": 7}, {"file": "Endocrine_Pharmacology-Corticosteroids_and_Sex_Hormones.json", "title": "Endocrine Pharmacology Corticosteroids And Sex Hormones", "category": "Pharmacology", "count": 15}, {"file": "Endocrine_Pharmacology-HPA_Axis_and_Drugs_acting_on_Bone_and_Osteoporosis.json", "title": "Endocrine Pharmacology Hpa Axis And Drugs Acting On Bone And Osteoporosis", "category": "Pharmacology", "count": 19}, {"file": "Endocrine_Pharmacology-Oral_Hypoglycemic_Drugs.json", "title": "Endocrine Pharmacology Oral Hypoglycemic Drugs", "category": "Pharmacology", "count": 17}, {"file": "Endocrine_Pharmacology-Parenteral_Hypoglycemic_Drugs.json", "title": "Endocrine Pharmacology Parenteral Hypoglycemic Drugs", "category": "Pharmacology", "count": 10}, {"file": "Endocrine_Pharmacology-Previous_Year_Questions.json", "title": "Endocrine Pharmacology Previous Year Questions", "category": "Pharmacology", "count": 55}, {"file": "Ethanol_Pharmacology.json", "title": "Ethanol Pharmacology", "category": "Pharmacology", "count": 7}, {"file": "General_Pharmacology.json", "title": "General Pharmacology", "category": "Pharmacology", "count": 100}, {"file": "General_Pharmacology_.json", "title": "General Pharmacology ", "category": "Pharmacology", "count": 23}, {"file": "General_Pharmacology_1.json", "title": "General Pharmacology 1", "category": "Pharmacology", "count": 88}, {"file": "General_Pharmacology-Clinical_Trials_and_Miscellaneous.json", "title": "General Pharmacology Clinical Trials And Miscellaneous", "category": "Pharmacology", "count": 13}, {"file": "General_Pharmacology-Pharmacodynamics.json", "title": "General Pharmacology Pharmacodynamics", "category": "Pharmacology", "count": 16}, {"file": "General_Pharmacology-Pharmacokinetics.json", "title": "General Pharmacology Pharmacokinetics", "category": "Pharmacology", "count": 20}, {"file": "General_Pharmacology-Previous_Year_Questions.json", "title": "General Pharmacology Previous Year Questions", "category": "Pharmacology", "count": 79}, {"file": "GIT_Pharmacology-Drugs_in_Acid_Peptic_Disease.json", "title": "Git Pharmacology Drugs In Acid Peptic Disease", "category": "Pharmacology", "count": 16}, {"file": "GIT_Pharmacology-GIT_Miscellaneous.json", "title": "Git Pharmacology Git Miscellaneous", "category": "Pharmacology", "count": 10}, {"file": "GIT_Pharmacology-Laxatives_and_Anti-Diarrheal_Drugs.json", "title": "Git Pharmacology Laxatives And Anti Diarrheal Drugs", "category": "Pharmacology", "count": 15}, {"file": "GIT_Pharmacology-Previous_Year_Questions.json", "title": "Git Pharmacology Previous Year Questions", "category": "Pharmacology", "count": 25}, {"file": "Hypothalamus_And_Pituitary_Hormones_Pharmacology.json", "title": "Hypothalamus And Pituitary Hormones Pharmacology", "category": "Pharmacology", "count": 14}, {"file": "Immuno_pharmacology.json", "title": "Immuno Pharmacology", "category": "Pharmacology", "count": 46}, {"file": "Introduction_to_Pharmacology-Previous_Year_Questions.json", "title": "Introduction To Pharmacology Previous Year Questions", "category": "Pharmacology", "count": 1}, {"file": "Mid_Day_Module_Pharma-1_-_2024-11-26.json", "title": "Mid Day Module Pharma 1   2024 11 26", "category": "Pharmacology", "count": 30}, {"file": "Mid_Day_Module_Pharma-2_-_2024-11-27.json", "title": "Mid Day Module Pharma 2   2024 11 27", "category": "Pharmacology", "count": 50}, {"file": "Mid_Day_Module_Pharma-3_-_2024-11-28.json", "title": "Mid Day Module Pharma 3   2024 11 28", "category": "Pharmacology", "count": 50}, {"file": "Mid_Day_Module_Pharma-4_-_2024-11-29.json", "title": "Mid Day Module Pharma 4   2024 11 29", "category": "Pharmacology", "count": 50}, {"file": "Mid_Day_Module_Pharma-5_-_2024-11-30.json", "title": "Mid Day Module Pharma 5   2024 11 30", "category": "Pharmacology", "count": 50}, {"file": "Pharmacodynamics.json", "title": "Pharmacodynamics", "category": "Pharmacology", "count": 11}, {"file": "Pharmacogenetics.json", "title": "Pharmacogenetics", "category": "Pharmacology", "count": 24}, {"file": "Pharmacology.json", "title": "Pharmacology", "category": "Pharmacology", "count": 20}, {"file": "Pharmacology_-_CNS__PNS.json", "title": "Pharmacology   Cns  Pns", "category": "Pharmacology", "count": 50}, {"file": "Pharmacology_-_INI_CET_JULY_2021.json", "title": "Pharmacology   Ini Cet July 2021", "category": "Pharmacology", "count": 22}, {"file": "Pharmacology_-_INI_CET_MAY_2022.json", "title": "Pharmacology   Ini Cet May 2022", "category": "Pharmacology", "count": 15}, {"file": "Pharmacology_-_INI_CET_MAY_2023.json", "title": "Pharmacology   Ini Cet May 2023", "category": "Pharmacology", "count": 13}, {"file": "Pharmacology_-_INI_CET_NOV_2020.json", "title": "Pharmacology   Ini Cet Nov 2020", "category": "Pharmacology", "count": 15}, {"file": "Pharmacology_-_INI_CET_NOV_2021.json", "title": "Pharmacology   Ini Cet Nov 2021", "category": "Pharmacology", "count": 22}, {"file": "Pharmacology_-_INI_CET_NOV_2023.json", "title": "Pharmacology   Ini Cet Nov 2023", "category": "Pharmacology", "count": 19}, {"file": "Pharmacology_-_INI_CET_NOVEMBER_2022_PART_-_A.json", "title": "Pharmacology   Ini Cet November 2022 Part   A", "category": "Pharmacology", "count": 15}, {"file": "Pharmacology_-_INI_CET_NOVEMBER_2022_PART_-_B.json", "title": "Pharmacology   Ini Cet November 2022 Part   B", "category": "Pharmacology", "count": 22}, {"file": "Pharmacology-_Class_Test_With_Video_Solution.json", "title": "Pharmacology  Class Test With Video Solution", "category": "Pharmacology", "count": 100}, {"file": "Pharmacology_1.json", "title": "Pharmacology 1", "category": "Pharmacology", "count": 20}, {"file": "Pharmacology_Clinical_Vignettes.json", "title": "Pharmacology Clinical Vignettes", "category": "Pharmacology", "count": 148}, {"file": "Pharmacology_Dr_Dinesh.json", "title": "Pharmacology Dr Dinesh", "category": "Pharmacology", "count": 40}, {"file": "303_Pharmacology_Dr_Dinesh.json", "title": "Pharmacology Dr Dinesh", "category": "Pharmacology", "count": 40}, {"file": "Pharmacology_Dr_Dinesh-2026.json", "title": "Pharmacology Dr Dinesh 2026", "category": "Pharmacology", "count": 100}, {"file": "Pharmacology_Dr_Thiru.json", "title": "Pharmacology Dr Thiru", "category": "Pharmacology", "count": 100}, {"file": "Pharmacology_Dr_Thiru-2026.json", "title": "Pharmacology Dr Thiru 2026", "category": "Pharmacology", "count": 200}, {"file": "Pharmacology_Dr_Thiru-2026_1.json", "title": "Pharmacology Dr Thiru 2026 1", "category": "Pharmacology", "count": 200}, {"file": "Pharmacology_DVT_Revision_Test.json", "title": "Pharmacology Dvt Revision Test", "category": "Pharmacology", "count": 25}, {"file": "Pharmacology_ED_-_Mission_15_-_03-02-2024_-_2024-02-03.json", "title": "Pharmacology Ed   Mission 15   03 02 2024   2024 02 03", "category": "Pharmacology", "count": 100}, {"file": "Pharmacology_ED_-_Mission_15_Lap_2_-_12-06-2024_-_2024-06-11.json", "title": "Pharmacology Ed   Mission 15 Lap 2   12 06 2024   2024 06 11", "category": "Pharmacology", "count": 75}, {"file": "Pharmacology_ED_-_Mission_20_Batch_2_-_27-09-2024_-_2024-09-27.json", "title": "Pharmacology Ed   Mission 20 Batch 2   27 09 2024   2024 09 27", "category": "Pharmacology", "count": 75}, {"file": "Pharmacology_ED_-_Mission_20_Batch_3_-_05-12-2024_-_2024-12-05.json", "title": "Pharmacology Ed   Mission 20 Batch 3   05 12 2024   2024 12 05", "category": "Pharmacology", "count": 75}, {"file": "Pharmacology_ED_-_Mission_20_Lap_2_-_13-03-2025_-_2025-03-13.json", "title": "Pharmacology Ed   Mission 20 Lap 2   13 03 2025   2025 03 13", "category": "Pharmacology", "count": 60}, {"file": "Pharmacology_ED_First_Test_-_17-05-2023_-_2023-05-17.json", "title": "Pharmacology Ed First Test   17 05 2023   2023 05 17", "category": "Pharmacology", "count": 50}, {"file": "Pharmacology_ED_Part-1_Mission_30_Early_Intern_Batch_-_12-05-2025_-_2025-05-12.json", "title": "Pharmacology Ed Part 1 Mission 30 Early Intern Batch   12 05 2025   2025 05 12", "category": "Pharmacology", "count": 50}, {"file": "Pharmacology_ED_Part-2_Mission_30_Early_Intern_Batch_-_17-05-2025_-_2025-05-17.json", "title": "Pharmacology Ed Part 2 Mission 30 Early Intern Batch   17 05 2025   2025 05 17", "category": "Pharmacology", "count": 50}, {"file": "Pharmacology_ED_Second_Test_-_23-05-2023_-_2023-05-23.json", "title": "Pharmacology Ed Second Test   23 05 2023   2023 05 23", "category": "Pharmacology", "count": 50}, {"file": "Pharmacology_Image_Based_Question.json", "title": "Pharmacology Image Based Question", "category": "Pharmacology", "count": 20}, {"file": "Pharmacology_MIQ_Series.json", "title": "Pharmacology Miq Series", "category": "Pharmacology", "count": 20}, {"file": "309_Pharmacology_MIQ_Series.json", "title": "Pharmacology Miq Series", "category": "Pharmacology", "count": 20}, {"file": "Pharmacology_New_Season.json", "title": "Pharmacology New Season", "category": "Pharmacology", "count": 20}, {"file": "Pharmacology_Test_The_Champion_Batch_Hyderabad_-_26-09-2024_-_2024-09-26.json", "title": "Pharmacology Test The Champion Batch Hyderabad   26 09 2024   2024 09 26", "category": "Pharmacology", "count": 75}, {"file": "Pharmacotherapy_of_BPH_ED__Androgen_Receptor_Antagonists.json", "title": "Pharmacotherapy Of Bph Ed  Androgen Receptor Antagonists", "category": "Pharmacology", "count": 5}, {"file": "Pharmacotherapy_of_Bronchial_Asthma.json", "title": "Pharmacotherapy Of Bronchial Asthma", "category": "Pharmacology", "count": 37}, {"file": "Pharmacotherapy_Of_CHF.json", "title": "Pharmacotherapy Of Chf", "category": "Pharmacology", "count": 16}, {"file": "Pharmacotherapy_Of_Glaucoma.json", "title": "Pharmacotherapy Of Glaucoma", "category": "Pharmacology", "count": 11}, {"file": "Pharmacotherapy_Of_Gout.json", "title": "Pharmacotherapy Of Gout", "category": "Pharmacology", "count": 9}, {"file": "Pharmacotherapy_Of_Hypertension.json", "title": "Pharmacotherapy Of Hypertension", "category": "Pharmacology", "count": 18}, {"file": "Pharmacotherapy_of_Mania__BPD.json", "title": "Pharmacotherapy Of Mania  Bpd", "category": "Pharmacology", "count": 6}, {"file": "Pharmacotherapy_Of_Osteoporosis.json", "title": "Pharmacotherapy Of Osteoporosis", "category": "Pharmacology", "count": 9}, {"file": "Pharmacotherapy_Of_Rheumatoid_Arthritis.json", "title": "Pharmacotherapy Of Rheumatoid Arthritis", "category": "Pharmacology", "count": 5}, {"file": "Psychopharmacology.json", "title": "Psychopharmacology", "category": "Pharmacology", "count": 88}, {"file": "Renal_Pharmacology-Diuretics_and_Antidiuretics.json", "title": "Renal Pharmacology Diuretics And Antidiuretics", "category": "Pharmacology", "count": 17}, {"file": "Renal_Pharmacology-Previous_Year_Questions.json", "title": "Renal Pharmacology Previous Year Questions", "category": "Pharmacology", "count": 25}, {"file": "Respiratory_Pharmacology-Previous_Year_Questions.json", "title": "Respiratory Pharmacology Previous Year Questions", "category": "Pharmacology", "count": 15}, {"file": "Respiratory_Pharmacology-Respiratory_Pharmacology.json", "title": "Respiratory Pharmacology Respiratory Pharmacology", "category": "Pharmacology", "count": 19}, {"file": "Serotonin_Pharmacology__Migraine.json", "title": "Serotonin Pharmacology  Migraine", "category": "Pharmacology", "count": 13}, {"file": "SWT-_Pharmacology_-SET-A.json", "title": "Swt  Pharmacology  Set A", "category": "Pharmacology", "count": 200}, {"file": "SWT-Pharmacology-SET-B.json", "title": "Swt Pharmacology Set B", "category": "Pharmacology", "count": 200}, {"file": "T-20_Pharmacology_Test-1_Pharmacokinetics_-_03-05-2023_-_2023-05-03.json", "title": "T 20 Pharmacology Test 1 Pharmacokinetics   03 05 2023   2023 05 03", "category": "Pharmacology", "count": 20}, {"file": "T-20_Pharmacology_Test-10_Kidney_Respiratory_System__Anaesthesia_-_18-09-2023_-_2023-09-18.json", "title": "T 20 Pharmacology Test 10 Kidney Respiratory System  Anaesthesia   18 09 2023   2023 09 18", "category": "Pharmacology", "count": 20}, {"file": "T-20_Pharmacology_Test-2_Pharmacodynamics_-_18-05-2023_-_2023-05-18.json", "title": "T 20 Pharmacology Test 2 Pharmacodynamics   18 05 2023   2023 05 18", "category": "Pharmacology", "count": 20}, {"file": "T-20_Pharmacology_Test-3_ANS_-_08-06-2023_-_2023-06-08.json", "title": "T 20 Pharmacology Test 3 Ans   08 06 2023   2023 06 08", "category": "Pharmacology", "count": 20}, {"file": "T-20_Pharmacology_Test-4_CVS_-_29-06-2023_-_2023-06-29.json", "title": "T 20 Pharmacology Test 4 Cvs   29 06 2023   2023 06 29", "category": "Pharmacology", "count": 20}, {"file": "T-20_Pharmacology_Test-5_CNS_-_10-07-2023_-_2023-07-10.json", "title": "T 20 Pharmacology Test 5 Cns   10 07 2023   2023 07 10", "category": "Pharmacology", "count": 20}, {"file": "T-20_Pharmacology_Test-6_Endocrine_-_24-07-2023_-_2023-07-24.json", "title": "T 20 Pharmacology Test 6 Endocrine   24 07 2023   2023 07 24", "category": "Pharmacology", "count": 20}, {"file": "T-20_Pharmacology_Test-7_Hematology__GIT_-_07-08-2023_-_2023-08-07.json", "title": "T 20 Pharmacology Test 7 Hematology  Git   07 08 2023   2023 08 07", "category": "Pharmacology", "count": 20}, {"file": "T-20_Pharmacology_Test-8_Antimicrobials-1_-_21-08-2023_-_2023-08-21.json", "title": "T 20 Pharmacology Test 8 Antimicrobials 1   21 08 2023   2023 08 21", "category": "Pharmacology", "count": 20}, {"file": "T-20_Pharmacology_Test-9_Antimicrobials-2_-_04-09-2023_-_2023-09-04.json", "title": "T 20 Pharmacology Test 9 Antimicrobials 2   04 09 2023   2023 09 04", "category": "Pharmacology", "count": 20}, {"file": "Testosterone_Pharmacology.json", "title": "Testosterone Pharmacology", "category": "Pharmacology", "count": 6}, {"file": "Basic_Pathophysiology_of_Trauma__Stress_Part_1.json", "title": "Basic Pathophysiology Of Trauma  Stress Part 1", "category": "Physiology", "count": 7}, {"file": "Blood_Physiology-Blood_Physiology.json", "title": "Blood Physiology Blood Physiology", "category": "Physiology", "count": 12}, {"file": "Blood_Physiology-Previous_Year_Questions.json", "title": "Blood Physiology Previous Year Questions", "category": "Physiology", "count": 9}, {"file": "Cardiovascular_Physiology-Previous_Year_Questions.json", "title": "Cardiovascular Physiology Previous Year Questions", "category": "Physiology", "count": 6}, {"file": "Cell__General_Physiology.json", "title": "Cell  General Physiology", "category": "Physiology", "count": 17}, {"file": "CNS_Physiology.json", "title": "Cns Physiology", "category": "Physiology", "count": 24}, {"file": "CNS_Physiology-Ascending_and_Descending_Tracts_of_Spinal_Cords.json", "title": "Cns Physiology Ascending And Descending Tracts Of Spinal Cords", "category": "Physiology", "count": 16}, {"file": "CNS_Physiology-Basal_Ganglia_and_Cerebellum.json", "title": "Cns Physiology Basal Ganglia And Cerebellum", "category": "Physiology", "count": 16}, {"file": "CNS_Physiology-EEG___Sleep__Learning_and_Memory.json", "title": "Cns Physiology Eeg   Sleep  Learning And Memory", "category": "Physiology", "count": 11}, {"file": "CNS_Physiology-Previous_Year_Questions.json", "title": "Cns Physiology Previous Year Questions", "category": "Physiology", "count": 6}, {"file": "CNS_Physiology-Somatosensory_Receptors__Nociceptors__Proprioceptors__and_Reflexes.json", "title": "Cns Physiology Somatosensory Receptors  Nociceptors  Proprioceptors  And Reflexes", "category": "Physiology", "count": 28}, {"file": "CNS_Physiology-Special_Senses.json", "title": "Cns Physiology Special Senses", "category": "Physiology", "count": 17}, {"file": "CNS_Physiology-Synapse_and_Synaptic_Inhibition.json", "title": "Cns Physiology Synapse And Synaptic Inhibition", "category": "Physiology", "count": 21}, {"file": "CVS_-_Physical_Examination__Cardiovascular_physiology.json", "title": "Cvs   Physical Examination  Cardiovascular Physiology", "category": "Physiology", "count": 32}, {"file": "Diabetes_Criteria_Classifications__Pathophysiology.json", "title": "Diabetes Criteria Classifications  Pathophysiology", "category": "Physiology", "count": 5}, {"file": "Ear-Physiology_and_Assessment_of_Hearing.json", "title": "Ear Physiology And Assessment Of Hearing", "category": "Physiology", "count": 23}, {"file": "Ear-Vestibular_System__Physiology__Assessment__and_Associated_Diseases.json", "title": "Ear Vestibular System  Physiology  Assessment  And Associated Diseases", "category": "Physiology", "count": 16}, {"file": "Endocrine_and_Reproductive_Physiology.json", "title": "Endocrine And Reproductive Physiology", "category": "Physiology", "count": 5}, {"file": "Endocrine_Physiology-Previous_Year_Questions.json", "title": "Endocrine Physiology Previous Year Questions", "category": "Physiology", "count": 4}, {"file": "Endocrine_System-Adrenal_Physiology_and_Calcium_Regulation.json", "title": "Endocrine System Adrenal Physiology And Calcium Regulation", "category": "Physiology", "count": 15}, {"file": "Excretory_Physiology-Previous_Year_Questions.json", "title": "Excretory Physiology Previous Year Questions", "category": "Physiology", "count": 9}, {"file": "General_Physiology.json", "title": "General Physiology", "category": "Physiology", "count": 123}, {"file": "General_Physiology_.json", "title": "General Physiology ", "category": "Physiology", "count": 10}, {"file": "General_Physiology_1.json", "title": "General Physiology 1", "category": "Physiology", "count": 43}, {"file": "General_Physiology-Previous_Year_Questions.json", "title": "General Physiology Previous Year Questions", "category": "Physiology", "count": 54}, {"file": "General_Physiology-Special_First_Year_Class_Test.json", "title": "General Physiology Special First Year Class Test", "category": "Physiology", "count": 30}, {"file": "GIT_Physiology.json", "title": "Git Physiology", "category": "Physiology", "count": 2}, {"file": "GIT_Physiology-Previous_Year_Questions.json", "title": "Git Physiology Previous Year Questions", "category": "Physiology", "count": 3}, {"file": "Gynecology-Menstrual_Physiology.json", "title": "Gynecology Menstrual Physiology", "category": "Physiology", "count": 21}, {"file": "Integrative_Neurophysiology_-_Cerebral_Cortex.json", "title": "Integrative Neurophysiology   Cerebral Cortex", "category": "Physiology", "count": 13}, {"file": "Integrative_Neurophysiology_-_Learning__Memory.json", "title": "Integrative Neurophysiology   Learning  Memory", "category": "Physiology", "count": 10}, {"file": "Integrative_Neurophysiology_-_Thalamus__Hypothalamus.json", "title": "Integrative Neurophysiology   Thalamus  Hypothalamus", "category": "Physiology", "count": 18}, {"file": "Integrative_Neurophysiology__Sleep__EEG.json", "title": "Integrative Neurophysiology  Sleep  Eeg", "category": "Physiology", "count": 12}, {"file": "Lung_Physiology_Part_1.json", "title": "Lung Physiology Part 1", "category": "Physiology", "count": 17}, {"file": "Lung_Physiology_Part_2.json", "title": "Lung Physiology Part 2", "category": "Physiology", "count": 17}, {"file": "Menstrual_cycle_physiology.json", "title": "Menstrual Cycle Physiology", "category": "Physiology", "count": 47}, {"file": "Mid_Day_Module_Physiology-1_-_2024-12-12.json", "title": "Mid Day Module Physiology 1   2024 12 12", "category": "Physiology", "count": 50}, {"file": "Mid_Day_Module_Physiology-2_-_2024-12-13.json", "title": "Mid Day Module Physiology 2   2024 12 13", "category": "Physiology", "count": 50}, {"file": "Mid_Day_Module_Physiology-3_-_2024-12-14.json", "title": "Mid Day Module Physiology 3   2024 12 14", "category": "Physiology", "count": 50}, {"file": "Mid_Day_Module_Physiology-4_-_2024-12-15.json", "title": "Mid Day Module Physiology 4   2024 12 15", "category": "Physiology", "count": 50}, {"file": "Mid_Day_Module_Physiology-5_-_2024-12-16.json", "title": "Mid Day Module Physiology 5   2024 12 16", "category": "Physiology", "count": 50}, {"file": "Mid_Day_Module_Physiology-6_-_2024-12-17.json", "title": "Mid Day Module Physiology 6   2024 12 17", "category": "Physiology", "count": 50}, {"file": "Nerve_Muscle_Physiology.json", "title": "Nerve Muscle Physiology", "category": "Physiology", "count": 63}, {"file": "Nerve_muscle_physiology_.json", "title": "Nerve Muscle Physiology ", "category": "Physiology", "count": 10}, {"file": "Nerve_Muscle_Physiology-Motor_unit___Smooth_muscle.json", "title": "Nerve Muscle Physiology Motor Unit   Smooth Muscle", "category": "Physiology", "count": 20}, {"file": "Nerve_Muscle_Physiology-Neuron_and_nerve__Action_Potential__RMP__Nerve_fibre_classification.json", "title": "Nerve Muscle Physiology Neuron And Nerve  Action Potential  Rmp  Nerve Fibre Classification", "category": "Physiology", "count": 26}, {"file": "Nerve_Muscle_Physiology-Previous_Year_Questions.json", "title": "Nerve Muscle Physiology Previous Year Questions", "category": "Physiology", "count": 33}, {"file": "Obstetrics-Physiological_changes_in_Pregnancy.json", "title": "Obstetrics Physiological Changes In Pregnancy", "category": "Physiology", "count": 18}, {"file": "Parathyroid_-_Basic_Physiology__Primary_Hyperparathyroidism_Part_1.json", "title": "Parathyroid   Basic Physiology  Primary Hyperparathyroidism Part 1", "category": "Physiology", "count": 17}, {"file": "Pathophysiology_of_Muscle_Contraction.json", "title": "Pathophysiology Of Muscle Contraction", "category": "Physiology", "count": 9}, {"file": "Pedia_Derma_PSM_Ortho__Physio_Cumulative_Test_The_Champion_Batch-2_Hyderabad_-_15-05-2025_-_2025-05-15.json", "title": "Pedia Derma Psm Ortho  Physio Cumulative Test The Champion Batch 2 Hyderabad   15 05 2025   2025 05 15", "category": "Physiology", "count": 200}, {"file": "Physiological_Changes_During_Pregnancy.json", "title": "Physiological Changes During Pregnancy", "category": "Physiology", "count": 35}, {"file": "Physiological_Changes_In_Pregnancy.json", "title": "Physiological Changes In Pregnancy", "category": "Physiology", "count": 28}, {"file": "Physiology.json", "title": "Physiology", "category": "Physiology", "count": 20}, {"file": "Physiology_-_INI_CET_2020.json", "title": "Physiology   Ini Cet 2020", "category": "Physiology", "count": 11}, {"file": "Physiology_-_INI_CET_JULY_2021.json", "title": "Physiology   Ini Cet July 2021", "category": "Physiology", "count": 13}, {"file": "Physiology_-_INI_CET_MAY_2022.json", "title": "Physiology   Ini Cet May 2022", "category": "Physiology", "count": 10}, {"file": "Physiology_-_INI_CET_NOV_2021.json", "title": "Physiology   Ini Cet Nov 2021", "category": "Physiology", "count": 11}, {"file": "Physiology_-_INI_CET_NOV_2023.json", "title": "Physiology   Ini Cet Nov 2023", "category": "Physiology", "count": 12}, {"file": "Physiology_-_INI_CET_NOVEMBER_2022_PART_-_A.json", "title": "Physiology   Ini Cet November 2022 Part   A", "category": "Physiology", "count": 14}, {"file": "Physiology_-_INI_CET_NOVEMBER_2022_PART_-_B.json", "title": "Physiology   Ini Cet November 2022 Part   B", "category": "Physiology", "count": 4}, {"file": "Physiology-_Class_Test_With_Video_Solution.json", "title": "Physiology  Class Test With Video Solution", "category": "Physiology", "count": 75}, {"file": "Physiology_1.json", "title": "Physiology 1", "category": "Physiology", "count": 20}, {"file": "Physiology_Assessment_of_Ear.json", "title": "Physiology Assessment Of Ear", "category": "Physiology", "count": 7}, {"file": "Physiology_Clinical_Vignettes.json", "title": "Physiology Clinical Vignettes", "category": "Physiology", "count": 68}, {"file": "Physiology_Dr_Kamal.json", "title": "Physiology Dr Kamal", "category": "Physiology", "count": 75}, {"file": "317_Physiology_Dr_Kamal.json", "title": "Physiology Dr Kamal", "category": "Physiology", "count": 40}, {"file": "Physiology_Dr_Kamal_1.json", "title": "Physiology Dr Kamal 1", "category": "Physiology", "count": 75}, {"file": "Physiology_Dr_Kamal-2026.json", "title": "Physiology Dr Kamal 2026", "category": "Physiology", "count": 75}, {"file": "Physiology_DVT_Revision_Test.json", "title": "Physiology Dvt Revision Test", "category": "Physiology", "count": 25}, {"file": "Physiology_ED_-_Mission_15_-_16-02-2024_-_2024-02-16.json", "title": "Physiology Ed   Mission 15   16 02 2024   2024 02 16", "category": "Physiology", "count": 100}, {"file": "Physiology_ED_-_Mission_15_Lap_2_-_30-05-2024_-_2024-05-30.json", "title": "Physiology Ed   Mission 15 Lap 2   30 05 2024   2024 05 30", "category": "Physiology", "count": 100}, {"file": "Physiology_ED_-_Mission_20_Batch_2_-_22-09-2024_-_2024-09-22.json", "title": "Physiology Ed   Mission 20 Batch 2   22 09 2024   2024 09 22", "category": "Physiology", "count": 80}, {"file": "Physiology_ED_-_Mission_20_Batch_3_-_15-12-2024_-_2024-12-15.json", "title": "Physiology Ed   Mission 20 Batch 3   15 12 2024   2024 12 15", "category": "Physiology", "count": 100}, {"file": "Physiology_ED_-_Mission_20_Lap_2_-_22-03-2025_-_2025-03-22.json", "title": "Physiology Ed   Mission 20 Lap 2   22 03 2025   2025 03 22", "category": "Physiology", "count": 75}, {"file": "Physiology_ED_Mission_30_Early_Intern_Batch_-_21-04-2025_-_2025-04-21.json", "title": "Physiology Ed Mission 30 Early Intern Batch   21 04 2025   2025 04 21", "category": "Physiology", "count": 100}, {"file": "Physiology_General_Physiology_Nerve_Physiology_-Special_First_Year_Class_Test.json", "title": "Physiology General Physiology Nerve Physiology  Special First Year Class Test", "category": "Physiology", "count": 50}, {"file": "Physiology_IBQ.json", "title": "Physiology Ibq", "category": "Physiology", "count": 20}, {"file": "Physiology_Image_Based_Question.json", "title": "Physiology Image Based Question", "category": "Physiology", "count": 20}, {"file": "Physiology_Last_Month_ED_-_16-07-2024_-_2024-07-16.json", "title": "Physiology Last Month Ed   16 07 2024   2024 07 16", "category": "Physiology", "count": 37}, {"file": "323_Physiology_MIQ_Series.json", "title": "Physiology Miq Series", "category": "Physiology", "count": 20}, {"file": "Physiology_MIQ_Series.json", "title": "Physiology Miq Series", "category": "Physiology", "count": 20}, {"file": "Physiology_Nerve__Muscle_Physiology_-Special_First_Year_Class_Test.json", "title": "Physiology Nerve  Muscle Physiology  Special First Year Class Test", "category": "Physiology", "count": 45}, {"file": "Physiology_New_Season.json", "title": "Physiology New Season", "category": "Physiology", "count": 20}, {"file": "Physiology_of_Audition.json", "title": "Physiology Of Audition", "category": "Physiology", "count": 5}, {"file": "Physiology_of_GIT.json", "title": "Physiology Of Git", "category": "Physiology", "count": 27}, {"file": "Physiology_of_Labour.json", "title": "Physiology Of Labour", "category": "Physiology", "count": 15}, {"file": "Physiology_of_Menstruation.json", "title": "Physiology Of Menstruation", "category": "Physiology", "count": 16}, {"file": "Physiology_of_Nose__Sinuses.json", "title": "Physiology Of Nose  Sinuses", "category": "Physiology", "count": 4}, {"file": "Physiology_of_Pregnancy.json", "title": "Physiology Of Pregnancy", "category": "Physiology", "count": 6}, {"file": "Physiology_of_Squints.json", "title": "Physiology Of Squints", "category": "Physiology", "count": 10}, {"file": "Physiology_Of_Vision.json", "title": "Physiology Of Vision", "category": "Physiology", "count": 5}, {"file": "Physiology-Renal_Physiology_Skeletal_muscle-Special_First_Year_Class_Test.json", "title": "Physiology Renal Physiology Skeletal Muscle Special First Year Class Test", "category": "Physiology", "count": 50}, {"file": "Physiology-Special_First_Year_Class_Test.json", "title": "Physiology Special First Year Class Test", "category": "Physiology", "count": 100}, {"file": "Physiology_Test_The_Champion_Batch_Hyderabad_-_09-06-2024_-_2024-06-09.json", "title": "Physiology Test The Champion Batch Hyderabad   09 06 2024   2024 06 09", "category": "Physiology", "count": 100}, {"file": "Physiology_Test_The_Champion_Batch_Hyderabad_-_09-10-2024_-_2024-10-09.json", "title": "Physiology Test The Champion Batch Hyderabad   09 10 2024   2024 10 09", "category": "Physiology", "count": 75}, {"file": "Physiology_Test_The_Champion_Batch_Hyderabad_-_11-01-2025_-_2025-01-11.json", "title": "Physiology Test The Champion Batch Hyderabad   11 01 2025   2025 01 11", "category": "Physiology", "count": 80}, {"file": "Physiology_Test_The_Champion_Batch_Hyderabad_-_14-05-2025_-_2025-05-14.json", "title": "Physiology Test The Champion Batch Hyderabad   14 05 2025   2025 05 14", "category": "Physiology", "count": 75}, {"file": "Physiology_Test_The_Champion_Batch_Hyderabad_-_20-12-2024_-_2024-12-20.json", "title": "Physiology Test The Champion Batch Hyderabad   20 12 2024   2024 12 20", "category": "Physiology", "count": 100}, {"file": "Pulmonology-Respiratory_Physiology_and_Failure.json", "title": "Pulmonology Respiratory Physiology And Failure", "category": "Physiology", "count": 8}, {"file": "Renal_Physiology.json", "title": "Renal Physiology", "category": "Physiology", "count": 24}, {"file": "Renal_Physiology-Acid_Secretion_and_Counter-Current_Mechanism_of_the_Kidney.json", "title": "Renal Physiology Acid Secretion And Counter Current Mechanism Of The Kidney", "category": "Physiology", "count": 12}, {"file": "Renal_Physiology-Previous_Year_Questions.json", "title": "Renal Physiology Previous Year Questions", "category": "Physiology", "count": 40}, {"file": "Renal_Physiology-Renal_Physiology.json", "title": "Renal Physiology Renal Physiology", "category": "Physiology", "count": 26}, {"file": "Renal_Physiology-Tubular_Transport.json", "title": "Renal Physiology Tubular Transport", "category": "Physiology", "count": 20}, {"file": "Reproductive_Physiology.json", "title": "Reproductive Physiology", "category": "Physiology", "count": 9}, {"file": "Reproductive_Physiology_and_Clinical_Conditions.json", "title": "Reproductive Physiology And Clinical Conditions", "category": "Physiology", "count": 10}, {"file": "Reproductive_Physiology-Previous_Year_Questions.json", "title": "Reproductive Physiology Previous Year Questions", "category": "Physiology", "count": 18}, {"file": "Reproductive_System-Reproductive_Physiology.json", "title": "Reproductive System Reproductive Physiology", "category": "Physiology", "count": 10}, {"file": "Respiratory_Physiology-Previous_Year_Questions.json", "title": "Respiratory Physiology Previous Year Questions", "category": "Physiology", "count": 15}, {"file": "SWT-Physiology-SET-A.json", "title": "Swt Physiology Set A", "category": "Physiology", "count": 200}, {"file": "SWT-Physiology-SET-B.json", "title": "Swt Physiology Set B", "category": "Physiology", "count": 200}, {"file": "_FMGE_CT_-_Pathology_Systemic.json", "title": " Fmge Ct   Pathology Systemic", "category": "Previous Year Papers", "count": 40}, {"file": "_Medicine_CVS__DR_Arvind_Class_Test_FMGE.json", "title": " Medicine Cvs  Dr Arvind Class Test Fmge", "category": "Previous Year Papers", "count": 40}, {"file": "AIIMS_May_2017_-_2017-05-07.json", "title": "Aiims May 2017   2017 05 07", "category": "Previous Year Papers", "count": 200}, {"file": "AIIMS_May_2018_-_2018-05-06.json", "title": "Aiims May 2018   2018 05 06", "category": "Previous Year Papers", "count": 200}, {"file": "AIIMS_May_2019_-_2019-05-05.json", "title": "Aiims May 2019   2019 05 05", "category": "Previous Year Papers", "count": 200}, {"file": "AIIMS_May_2020_-_2020-05-10.json", "title": "Aiims May 2020   2020 05 10", "category": "Previous Year Papers", "count": 200}, {"file": "AIIMS_MOCK_2020.json", "title": "Aiims Mock 2020", "category": "Previous Year Papers", "count": 208}, {"file": "AIIMS_Nov_2017_-_2017-11-12.json", "title": "Aiims Nov 2017   2017 11 12", "category": "Previous Year Papers", "count": 200}, {"file": "AIIMS_Nov_2018_-_2018-11-18.json", "title": "Aiims Nov 2018   2018 11 18", "category": "Previous Year Papers", "count": 200}, {"file": "AIIMS_Nov_2019_-_2019-11-17.json", "title": "Aiims Nov 2019   2019 11 17", "category": "Previous Year Papers", "count": 200}, {"file": "ALL_INDIA_DAMS_NEETPG_CBT-1_March_2025.json", "title": "All India Dams Neetpg Cbt 1 March 2025", "category": "Previous Year Papers", "count": 200}, {"file": "ALL_INDIA_DAMS_NEETPG_CBT-2_May_2025.json", "title": "All India Dams Neetpg Cbt 2 May 2025", "category": "Previous Year Papers", "count": 200}, {"file": "ALL_INDIA_DAMS_NEETPG_CBT-3_31st_May_2025.json", "title": "All India Dams Neetpg Cbt 3 31St May 2025", "category": "Previous Year Papers", "count": 200}, {"file": "ALL_INDIA_DAMS_NEETPG_CBT-4_12th_July_2025.json", "title": "All India Dams Neetpg Cbt 4 12Th July 2025", "category": "Previous Year Papers", "count": 200}, {"file": "ALL_INDIA_DAMS_NEETPG_MOCK_18_TO_21_2025.json", "title": "All India Dams Neetpg Mock 18 To 21 2025", "category": "Previous Year Papers", "count": 200}, {"file": "ALL_INDIA_DAMS_NEETPG_MOCK_18_TO_21_2025_1.json", "title": "All India Dams Neetpg Mock 18 To 21 2025 1", "category": "Previous Year Papers", "count": 200}, {"file": "All_India_NEET_PG_Grand_Test__4th_May_2022__MAY_2022____1__.json", "title": "All India Neet Pg Grand Test  4Th May 2022  May 2022    1  ", "category": "Previous Year Papers", "count": 200}, {"file": "All_India_NEET_PG_Grand_Test_1__8th_Feb_2023__FEBRUARY_2023____1__.json", "title": "All India Neet Pg Grand Test 1  8Th Feb 2023  February 2023    1  ", "category": "Previous Year Papers", "count": 200}, {"file": "All_India_NEET_PG_Grand_Test_2__22nd_Feb_2023__FEBRUARY_2023____1__.json", "title": "All India Neet Pg Grand Test 2  22Nd Feb 2023  February 2023    1  ", "category": "Previous Year Papers", "count": 200}, {"file": "ANAESTHESIA-INICET_NOV_2024.json", "title": "Anaesthesia Inicet Nov 2024", "category": "Previous Year Papers", "count": 6}, {"file": "Anatomy_-_AIIMS_JUNE_2020.json", "title": "Anatomy   Aiims June 2020", "category": "Previous Year Papers", "count": 15}, {"file": "Anatomy_-_AIIMS_MAY_2018.json", "title": "Anatomy   Aiims May 2018", "category": "Previous Year Papers", "count": 13}, {"file": "Anatomy_-_AIIMS_MAY_2019.json", "title": "Anatomy   Aiims May 2019", "category": "Previous Year Papers", "count": 11}, {"file": "Anatomy_-_AIIMS_NOV_2018.json", "title": "Anatomy   Aiims Nov 2018", "category": "Previous Year Papers", "count": 30}, {"file": "Anatomy_-_AIIMS_NOV_2019.json", "title": "Anatomy   Aiims Nov 2019", "category": "Previous Year Papers", "count": 13}, {"file": "Anatomy_-_INICET_MAY_2024.json", "title": "Anatomy   Inicet May 2024", "category": "Previous Year Papers", "count": 11}, {"file": "Anatomy_-_NEET_PG_2018.json", "title": "Anatomy   Neet Pg 2018", "category": "Previous Year Papers", "count": 12}, {"file": "Anatomy_-_NEET_PG_2019.json", "title": "Anatomy   Neet Pg 2019", "category": "Previous Year Papers", "count": 20}, {"file": "Anatomy_-_NEET_PG_2020.json", "title": "Anatomy   Neet Pg 2020", "category": "Previous Year Papers", "count": 17}, {"file": "Anatomy_-_NEET_PG_2021.json", "title": "Anatomy   Neet Pg 2021", "category": "Previous Year Papers", "count": 7}, {"file": "Anatomy_-_NEET_PG_2022.json", "title": "Anatomy   Neet Pg 2022", "category": "Previous Year Papers", "count": 3}, {"file": "Anatomy_-_NEET_PG_2023.json", "title": "Anatomy   Neet Pg 2023", "category": "Previous Year Papers", "count": 10}, {"file": "Anatomy_-_NEET_PG_2024.json", "title": "Anatomy   Neet Pg 2024", "category": "Previous Year Papers", "count": 10}, {"file": "Anatomy_AIIMS_2014-2018.json", "title": "Anatomy Aiims 2014 2018", "category": "Previous Year Papers", "count": 135}, {"file": "Anatomy_DR_Sandeep_Class_Test_FMGE.json", "title": "Anatomy Dr Sandeep Class Test Fmge", "category": "Previous Year Papers", "count": 40}, {"file": "Anatomy_ED_-_Mission_20_INICET_-_28-09-2024_-_2024-09-28.json", "title": "Anatomy Ed   Mission 20 Inicet   28 09 2024   2024 09 28", "category": "Previous Year Papers", "count": 100}, {"file": "Anatomy_ED_-_Mission_NEET_PG_20_-_Final_Batch_-_10-06-2025_-_2025-06-10.json", "title": "Anatomy Ed   Mission Neet Pg 20   Final Batch   10 06 2025   2025 06 10", "category": "Previous Year Papers", "count": 75}, {"file": "17_Anatomy_FMGE_Dr_Sandeep.json", "title": "Anatomy Fmge Dr Sandeep", "category": "Previous Year Papers", "count": 40}, {"file": "Anatomy_FMGE_Dr_Sandeep.json", "title": "Anatomy Fmge Dr Sandeep", "category": "Previous Year Papers", "count": 40}, {"file": "Anatomy_FMGE_PYQ.json", "title": "Anatomy Fmge Pyq", "category": "Previous Year Papers", "count": 115}, {"file": "ANATOMY-INICET_NOV_2024.json", "title": "Anatomy Inicet Nov 2024", "category": "Previous Year Papers", "count": 11}, {"file": "Anatomy_INICET_PYQ.json", "title": "Anatomy Inicet Pyq", "category": "Previous Year Papers", "count": 159}, {"file": "Anatomy_NEETPG_PYQ.json", "title": "Anatomy Neetpg Pyq", "category": "Previous Year Papers", "count": 95}, {"file": "Anesthesia_-_AIIMS_JUNE_2020.json", "title": "Anesthesia   Aiims June 2020", "category": "Previous Year Papers", "count": 1}, {"file": "Anesthesia_-_AIIMS_MAY_2018.json", "title": "Anesthesia   Aiims May 2018", "category": "Previous Year Papers", "count": 7}, {"file": "Anesthesia_-_AIIMS_MAY_2019.json", "title": "Anesthesia   Aiims May 2019", "category": "Previous Year Papers", "count": 2}, {"file": "Anesthesia_-_AIIMS_NOV_2018.json", "title": "Anesthesia   Aiims Nov 2018", "category": "Previous Year Papers", "count": 2}, {"file": "Anesthesia_-_AIIMS_NOV_2019.json", "title": "Anesthesia   Aiims Nov 2019", "category": "Previous Year Papers", "count": 12}, {"file": "Anesthesia_-_INICET_MAY_2024.json", "title": "Anesthesia   Inicet May 2024", "category": "Previous Year Papers", "count": 6}, {"file": "Anesthesia_-_NEET_PG_2018.json", "title": "Anesthesia   Neet Pg 2018", "category": "Previous Year Papers", "count": 8}, {"file": "Anesthesia_-_NEET_PG_2019.json", "title": "Anesthesia   Neet Pg 2019", "category": "Previous Year Papers", "count": 7}, {"file": "Anesthesia_-_NEET_PG_2020.json", "title": "Anesthesia   Neet Pg 2020", "category": "Previous Year Papers", "count": 5}, {"file": "Anesthesia_-_NEET_PG_2021.json", "title": "Anesthesia   Neet Pg 2021", "category": "Previous Year Papers", "count": 5}, {"file": "Anesthesia_-_NEET_PG_2022.json", "title": "Anesthesia   Neet Pg 2022", "category": "Previous Year Papers", "count": 3}, {"file": "Anesthesia_-_NEET_PG_2023.json", "title": "Anesthesia   Neet Pg 2023", "category": "Previous Year Papers", "count": 3}, {"file": "Anesthesia_-_NEET_PG_2024.json", "title": "Anesthesia   Neet Pg 2024", "category": "Previous Year Papers", "count": 14}, {"file": "Anesthesia_AIIMS_2014-2018.json", "title": "Anesthesia Aiims 2014 2018", "category": "Previous Year Papers", "count": 68}, {"file": "Anesthesia_Dr_Anshul_FMGE_CT.json", "title": "Anesthesia Dr Anshul Fmge Ct", "category": "Previous Year Papers", "count": 40}, {"file": "Anesthesia_ED_-_Mission_20_INICET_-_03-10-2024_-_2024-10-03.json", "title": "Anesthesia Ed   Mission 20 Inicet   03 10 2024   2024 10 03", "category": "Previous Year Papers", "count": 75}, {"file": "Anesthesia_ED_-_Mission_NEET_PG_20_-_Final_Batch_-_09-06-2025_-_2025-06-09.json", "title": "Anesthesia Ed   Mission Neet Pg 20   Final Batch   09 06 2025   2025 06 09", "category": "Previous Year Papers", "count": 50}, {"file": "Anesthesia_ED_Mission_NEET_PG_-_14-08-2023_-_2023-08-14.json", "title": "Anesthesia Ed Mission Neet Pg   14 08 2023   2023 08 14", "category": "Previous Year Papers", "count": 25}, {"file": "Anesthesia_ED_Mission_NEET_PG_INICET_20_-_26-04-2024_-_2024-04-26.json", "title": "Anesthesia Ed Mission Neet Pg Inicet 20   26 04 2024   2024 04 26", "category": "Previous Year Papers", "count": 75}, {"file": "Anesthesia_FMGE_PYQ.json", "title": "Anesthesia Fmge Pyq", "category": "Previous Year Papers", "count": 26}, {"file": "Anesthesia_INICET_PYQ.json", "title": "Anesthesia Inicet Pyq", "category": "Previous Year Papers", "count": 54}, {"file": "Anesthesia_NEET_PG_Revision_ED_-_24-12-2023_-_2023-12-24.json", "title": "Anesthesia Neet Pg Revision Ed   24 12 2023   2023 12 24", "category": "Previous Year Papers", "count": 50}, {"file": "Anesthesia_NEETPG_PYQ.json", "title": "Anesthesia Neetpg Pyq", "category": "Previous Year Papers", "count": 26}, {"file": "Biochemistry_-_AIIMS_JUNE_2O20.json", "title": "Biochemistry   Aiims June 2O20", "category": "Previous Year Papers", "count": 11}, {"file": "Biochemistry_-_AIIMS_MAY_2O19.json", "title": "Biochemistry   Aiims May 2O19", "category": "Previous Year Papers", "count": 14}, {"file": "Biochemistry_-_AIIMS_NOV_2018.json", "title": "Biochemistry   Aiims Nov 2018", "category": "Previous Year Papers", "count": 7}, {"file": "Biochemistry_-_AIIMS_NOV_2019.json", "title": "Biochemistry   Aiims Nov 2019", "category": "Previous Year Papers", "count": 11}, {"file": "Biochemistry_-_INICET_MAY_2024.json", "title": "Biochemistry   Inicet May 2024", "category": "Previous Year Papers", "count": 12}, {"file": "Biochemistry_-_NEET_PG_2018.json", "title": "Biochemistry   Neet Pg 2018", "category": "Previous Year Papers", "count": 12}, {"file": "Biochemistry_-_NEET_PG_2019.json", "title": "Biochemistry   Neet Pg 2019", "category": "Previous Year Papers", "count": 24}, {"file": "Biochemistry_-_NEET_PG_2020.json", "title": "Biochemistry   Neet Pg 2020", "category": "Previous Year Papers", "count": 17}, {"file": "Biochemistry_-_NEET_PG_2021.json", "title": "Biochemistry   Neet Pg 2021", "category": "Previous Year Papers", "count": 14}, {"file": "Biochemistry_-_NEET_PG_2022.json", "title": "Biochemistry   Neet Pg 2022", "category": "Previous Year Papers", "count": 19}, {"file": "Biochemistry_-_NEET_PG_2023.json", "title": "Biochemistry   Neet Pg 2023", "category": "Previous Year Papers", "count": 15}, {"file": "Biochemistry_-_NEET_PG_2024.json", "title": "Biochemistry   Neet Pg 2024", "category": "Previous Year Papers", "count": 20}, {"file": "Biochemistry_AIIMS_2014-2018.json", "title": "Biochemistry Aiims 2014 2018", "category": "Previous Year Papers", "count": 152}, {"file": "Biochemistry_Dr_Sonam_FMGE_CT.json", "title": "Biochemistry Dr Sonam Fmge Ct", "category": "Previous Year Papers", "count": 50}, {"file": "Biochemistry_ED_-_Mission_20_INICET_-_24-09-2024_-_2024-09-24.json", "title": "Biochemistry Ed   Mission 20 Inicet   24 09 2024   2024 09 24", "category": "Previous Year Papers", "count": 100}, {"file": "Biochemistry_ED_-_Mission_NEET_PG_20_-_Final_Batch_-_16-06-2025_-_2025-06-16.json", "title": "Biochemistry Ed   Mission Neet Pg 20   Final Batch   16 06 2025   2025 06 16", "category": "Previous Year Papers", "count": 75}, {"file": "Biochemistry_ED_Mission_NEET_PG_-_09-10-2023_-_2023-10-09.json", "title": "Biochemistry Ed Mission Neet Pg   09 10 2023   2023 10 09", "category": "Previous Year Papers", "count": 50}, {"file": "Biochemistry_ED_Mission_NEET_PG_INICET_20_-_12-06-2024_-_2024-06-12.json", "title": "Biochemistry Ed Mission Neet Pg Inicet 20   12 06 2024   2024 06 12", "category": "Previous Year Papers", "count": 100}, {"file": "Biochemistry_FMGE_PYQ.json", "title": "Biochemistry Fmge Pyq", "category": "Previous Year Papers", "count": 122}, {"file": "BIOCHEMISTRY-INICET_NOV_2024.json", "title": "Biochemistry Inicet Nov 2024", "category": "Previous Year Papers", "count": 6}, {"file": "Biochemistry_INICET_PYQ.json", "title": "Biochemistry Inicet Pyq", "category": "Previous Year Papers", "count": 156}, {"file": "Biochemistry_NEET_PG_Revision_ED_-_09-01-2024_-_2024-01-09.json", "title": "Biochemistry Neet Pg Revision Ed   09 01 2024   2024 01 09", "category": "Previous Year Papers", "count": 50}, {"file": "Biochemistry_NEETPG_PYQ.json", "title": "Biochemistry Neetpg Pyq", "category": "Previous Year Papers", "count": 89}, {"file": "BTR_INICET_MOCK_GT_-_2025-05-07.json", "title": "Btr Inicet Mock Gt   2025 05 07", "category": "Previous Year Papers", "count": 200}, {"file": "BTR_NEET_2024_GT-1_-_2024-08-02.json", "title": "Btr Neet 2024 Gt 1   2024 08 02", "category": "Previous Year Papers", "count": 200}, {"file": "BTR_NEET_2024_GT-2_-_2024-08-05.json", "title": "Btr Neet 2024 Gt 2   2024 08 05", "category": "Previous Year Papers", "count": 200}, {"file": "BTR_NEET_MOCK_GT-1_-_2025-06-02.json", "title": "Btr Neet Mock Gt 1   2025 06 02", "category": "Previous Year Papers", "count": 200}, {"file": "Champions_Exam_NEET_PG_-_2__15th_Jun_2024__JUNE_2024____1__.json", "title": "Champions Exam Neet Pg   2  15Th Jun 2024  June 2024    1  ", "category": "Previous Year Papers", "count": 200}, {"file": "Champions_Exam_NEET_PG__21st_May_2025__MAY_2025____1__.json", "title": "Champions Exam Neet Pg  21St May 2025  May 2025    1  ", "category": "Previous Year Papers", "count": 200}, {"file": "Champions_Exam_NEET_PG-_3__17th_Jul_2024__JULY_2024____1__.json", "title": "Champions Exam Neet Pg  3  17Th Jul 2024  July 2024    1  ", "category": "Previous Year Papers", "count": 200}, {"file": "Champions_Exam_NEET_PG__7th_May_2025__MAY_2025____1__.json", "title": "Champions Exam Neet Pg  7Th May 2025  May 2025    1  ", "category": "Previous Year Papers", "count": 200}, {"file": "CT_Medicine_CNS_FMGE_CT.json", "title": "Ct Medicine Cns Fmge Ct", "category": "Previous Year Papers", "count": 40}, {"file": "CT_Surgery__Gen__uro_FMGE_CT.json", "title": "Ct Surgery  Gen  Uro Fmge Ct", "category": "Previous Year Papers", "count": 50}, {"file": "Dermatology_-_AIIMS_JUNE_2020.json", "title": "Dermatology   Aiims June 2020", "category": "Previous Year Papers", "count": 4}, {"file": "Dermatology_-_AIIMS_MAY_2018.json", "title": "Dermatology   Aiims May 2018", "category": "Previous Year Papers", "count": 1}, {"file": "Dermatology_-_AIIMS_MAY_2019.json", "title": "Dermatology   Aiims May 2019", "category": "Previous Year Papers", "count": 9}, {"file": "Dermatology_-_AIIMS_NOV_2018.json", "title": "Dermatology   Aiims Nov 2018", "category": "Previous Year Papers", "count": 8}, {"file": "Dermatology_-_AIIMS_NOV_2019.json", "title": "Dermatology   Aiims Nov 2019", "category": "Previous Year Papers", "count": 5}, {"file": "Dermatology_-_INICET_MAY_2024.json", "title": "Dermatology   Inicet May 2024", "category": "Previous Year Papers", "count": 4}, {"file": "Dermatology_-_NEET_PG_2018.json", "title": "Dermatology   Neet Pg 2018", "category": "Previous Year Papers", "count": 11}, {"file": "Dermatology_-_NEET_PG_2019.json", "title": "Dermatology   Neet Pg 2019", "category": "Previous Year Papers", "count": 9}, {"file": "Dermatology_-_NEET_PG_2020.json", "title": "Dermatology   Neet Pg 2020", "category": "Previous Year Papers", "count": 6}, {"file": "Dermatology_-_NEET_PG_2021.json", "title": "Dermatology   Neet Pg 2021", "category": "Previous Year Papers", "count": 7}, {"file": "Dermatology_-_NEET_PG_2022.json", "title": "Dermatology   Neet Pg 2022", "category": "Previous Year Papers", "count": 4}, {"file": "Dermatology_-_NEET_PG_2023.json", "title": "Dermatology   Neet Pg 2023", "category": "Previous Year Papers", "count": 11}, {"file": "Dermatology_-_NEET_PG_2024.json", "title": "Dermatology   Neet Pg 2024", "category": "Previous Year Papers", "count": 12}, {"file": "Dermatology_AIIMS_2014-2018.json", "title": "Dermatology Aiims 2014 2018", "category": "Previous Year Papers", "count": 34}, {"file": "Dermatology_Dr_Chesta_FMGE_CT.json", "title": "Dermatology Dr Chesta Fmge Ct", "category": "Previous Year Papers", "count": 50}, {"file": "Dermatology_ED_-_Mission_20_INICET_-_07-10-2024_-_2024-10-07.json", "title": "Dermatology Ed   Mission 20 Inicet   07 10 2024   2024 10 07", "category": "Previous Year Papers", "count": 75}, {"file": "Dermatology_ED_-_Mission_NEET_PG_20_-_Final_Batch_-_11-06-2025_-_2025-06-11.json", "title": "Dermatology Ed   Mission Neet Pg 20   Final Batch   11 06 2025   2025 06 11", "category": "Previous Year Papers", "count": 50}, {"file": "Dermatology_ED_Mission_NEET_PG_-_25-07-2023_-_2023-07-25.json", "title": "Dermatology Ed Mission Neet Pg   25 07 2023   2023 07 25", "category": "Previous Year Papers", "count": 50}, {"file": "Dermatology_ED_Mission_NEET_PG_INICET_20_-_15-06-2024_-_2024-06-15.json", "title": "Dermatology Ed Mission Neet Pg Inicet 20   15 06 2024   2024 06 15", "category": "Previous Year Papers", "count": 75}, {"file": "Dermatology_FMGE_PYQ.json", "title": "Dermatology Fmge Pyq", "category": "Previous Year Papers", "count": 97}, {"file": "DERMATOLOGY-INICET_NOV_2024.json", "title": "Dermatology Inicet Nov 2024", "category": "Previous Year Papers", "count": 5}, {"file": "Dermatology_INICET_PYQ.json", "title": "Dermatology Inicet Pyq", "category": "Previous Year Papers", "count": 93}, {"file": "Dermatology_NEET_PG_Revision_ED_-_21-12-2023_-_2023-12-21.json", "title": "Dermatology Neet Pg Revision Ed   21 12 2023   2023 12 21", "category": "Previous Year Papers", "count": 50}, {"file": "Dermatology_NEETPG_PYQ.json", "title": "Dermatology Neetpg Pyq", "category": "Previous Year Papers", "count": 70}, {"file": "ENT_-_AIIMS_JUNE_2020.json", "title": "Ent   Aiims June 2020", "category": "Previous Year Papers", "count": 3}, {"file": "ENT_-_AIIMS_MAY_2018.json", "title": "Ent   Aiims May 2018", "category": "Previous Year Papers", "count": 5}, {"file": "ENT_-_AIIMS_MAY_2019.json", "title": "Ent   Aiims May 2019", "category": "Previous Year Papers", "count": 3}, {"file": "ENT_-_AIIMS_NOV_2018.json", "title": "Ent   Aiims Nov 2018", "category": "Previous Year Papers", "count": 2}, {"file": "ENT_-_AIIMS_NOV_2019.json", "title": "Ent   Aiims Nov 2019", "category": "Previous Year Papers", "count": 4}, {"file": "ENT_-_INICET_MAY_2024.json", "title": "Ent   Inicet May 2024", "category": "Previous Year Papers", "count": 6}, {"file": "ENT_-_NEET_PG_2018.json", "title": "Ent   Neet Pg 2018", "category": "Previous Year Papers", "count": 6}, {"file": "ENT_-_NEET_PG_2019.json", "title": "Ent   Neet Pg 2019", "category": "Previous Year Papers", "count": 7}, {"file": "ENT_-_NEET_PG_2020.json", "title": "Ent   Neet Pg 2020", "category": "Previous Year Papers", "count": 10}, {"file": "ENT_-_NEET_PG_2021.json", "title": "Ent   Neet Pg 2021", "category": "Previous Year Papers", "count": 6}, {"file": "ENT_-_NEET_PG_2022.json", "title": "Ent   Neet Pg 2022", "category": "Previous Year Papers", "count": 9}, {"file": "ENT_-_NEET_PG_2023.json", "title": "Ent   Neet Pg 2023", "category": "Previous Year Papers", "count": 9}, {"file": "ENT_-_NEET_PG_2024.json", "title": "Ent   Neet Pg 2024", "category": "Previous Year Papers", "count": 13}, {"file": "ENT_AIIMS_2014-2018.json", "title": "Ent Aiims 2014 2018", "category": "Previous Year Papers", "count": 70}, {"file": "ENT_ED_-_Mission_20_INICET_-_16-10-2024_-_2024-10-16.json", "title": "Ent Ed   Mission 20 Inicet   16 10 2024   2024 10 16", "category": "Previous Year Papers", "count": 75}, {"file": "ENT_ED_Mission_NEET_PG_-_10-07-2023_-_2023-07-10.json", "title": "Ent Ed Mission Neet Pg   10 07 2023   2023 07 10", "category": "Previous Year Papers", "count": 100}, {"file": "ENT_ED_Mission_NEET_PG_INICET_20_-_12-05-2024_-_2024-05-12.json", "title": "Ent Ed Mission Neet Pg Inicet 20   12 05 2024   2024 05 12", "category": "Previous Year Papers", "count": 100}, {"file": "ENT_FMGE_PYQ.json", "title": "Ent Fmge Pyq", "category": "Previous Year Papers", "count": 83}, {"file": "ENT-INICET_NOV_2024.json", "title": "Ent Inicet Nov 2024", "category": "Previous Year Papers", "count": 8}, {"file": "ENT_INICET_PYQ.json", "title": "Ent Inicet Pyq", "category": "Previous Year Papers", "count": 79}, {"file": "ENT_NEET_PG_Revision_ED_-_30-01-2024_-_2024-01-30.json", "title": "Ent Neet Pg Revision Ed   30 01 2024   2024 01 30", "category": "Previous Year Papers", "count": 50}, {"file": "ENT_NEETPG_PYQ.json", "title": "Ent Neetpg Pyq", "category": "Previous Year Papers", "count": 62}, {"file": "FM_-_AIIMS_JUNE_2020.json", "title": "Fm   Aiims June 2020", "category": "Previous Year Papers", "count": 9}, {"file": "FM_-_AIIMS_MAY_2018.json", "title": "Fm   Aiims May 2018", "category": "Previous Year Papers", "count": 9}, {"file": "FM_-_AIIMS_MAY_2019.json", "title": "Fm   Aiims May 2019", "category": "Previous Year Papers", "count": 7}, {"file": "FM_-_AIIMS_NOV_2018.json", "title": "Fm   Aiims Nov 2018", "category": "Previous Year Papers", "count": 10}, {"file": "FM_-_AIIMS_NOV_2019.json", "title": "Fm   Aiims Nov 2019", "category": "Previous Year Papers", "count": 6}, {"file": "FM_-_NEET_PG_2018.json", "title": "Fm   Neet Pg 2018", "category": "Previous Year Papers", "count": 9}, {"file": "FM_-_NEET_PG_2019.json", "title": "Fm   Neet Pg 2019", "category": "Previous Year Papers", "count": 9}, {"file": "FM_-_NEET_PG_2020.json", "title": "Fm   Neet Pg 2020", "category": "Previous Year Papers", "count": 11}, {"file": "FM_-_NEET_PG_2021.json", "title": "Fm   Neet Pg 2021", "category": "Previous Year Papers", "count": 8}, {"file": "FM_-_NEET_PG_2022.json", "title": "Fm   Neet Pg 2022", "category": "Previous Year Papers", "count": 5}, {"file": "FM_ED_-_Mission_20_INICET_-_21-09-2024_-_2024-09-21.json", "title": "Fm Ed   Mission 20 Inicet   21 09 2024   2024 09 21", "category": "Previous Year Papers", "count": 75}, {"file": "FMGE_2024_July_Paper_1.json", "title": "Fmge 2024 July Paper 1", "category": "Previous Year Papers", "count": 150}, {"file": "FMGE_2024_July_Paper_2.json", "title": "Fmge 2024 July Paper 2", "category": "Previous Year Papers", "count": 150}, {"file": "FMGE_2025_Jan_Paper_1.json", "title": "Fmge 2025 Jan Paper 1", "category": "Previous Year Papers", "count": 150}, {"file": "FMGE_2025_Jan_Paper_2.json", "title": "Fmge 2025 Jan Paper 2", "category": "Previous Year Papers", "count": 150}, {"file": "FMGE_Aug_2020.json", "title": "Fmge Aug 2020", "category": "Previous Year Papers", "count": 296}, {"file": "FMGE_Aug_2020_-_2020-08-31.json", "title": "Fmge Aug 2020   2020 08 31", "category": "Previous Year Papers", "count": 241}, {"file": "FMGE_CT_-__Surgery_HBP.json", "title": "Fmge Ct    Surgery Hbp", "category": "Previous Year Papers", "count": 40}, {"file": "FMGE_CT_-_Biochemistry.json", "title": "Fmge Ct   Biochemistry", "category": "Previous Year Papers", "count": 40}, {"file": "FMGE_CT_-_FMT.json", "title": "Fmge Ct   Fmt", "category": "Previous Year Papers", "count": 40}, {"file": "FMGE_CT_-_Medicine_CNS.json", "title": "Fmge Ct   Medicine Cns", "category": "Previous Year Papers", "count": 40}, {"file": "FMGE_CT_-_Medicine_Gastro__Endo.json", "title": "Fmge Ct   Medicine Gastro  Endo", "category": "Previous Year Papers", "count": 40}, {"file": "FMGE_CT_-_Paediatrics.json", "title": "Fmge Ct   Paediatrics", "category": "Previous Year Papers", "count": 43}, {"file": "FMGE_CT_-_Psychiatry.json", "title": "Fmge Ct   Psychiatry", "category": "Previous Year Papers", "count": 40}, {"file": "FMGE_CT_-_Surgery_General__Urology.json", "title": "Fmge Ct   Surgery General  Urology", "category": "Previous Year Papers", "count": 40}, {"file": "FMGE_CT-_Anesthesia_Dr_Anshul.json", "title": "Fmge Ct  Anesthesia Dr Anshul", "category": "Previous Year Papers", "count": 40}, {"file": "FMGE_CT-_Dermatology_Dr_Chesta.json", "title": "Fmge Ct  Dermatology Dr Chesta", "category": "Previous Year Papers", "count": 40}, {"file": "FMGE_Dec_2018.json", "title": "Fmge Dec 2018", "category": "Previous Year Papers", "count": 300}, {"file": "FMGE_Dec_2019.json", "title": "Fmge Dec 2019", "category": "Previous Year Papers", "count": 299}, {"file": "FMGE_Dec_2020.json", "title": "Fmge Dec 2020", "category": "Previous Year Papers", "count": 298}, {"file": "FMGE_Dec_2020_-_2020-12-04.json", "title": "Fmge Dec 2020   2020 12 04", "category": "Previous Year Papers", "count": 239}, {"file": "FMGE_Dec_2021.json", "title": "Fmge Dec 2021", "category": "Previous Year Papers", "count": 298}, {"file": "FMGE_Dec_2021_-_2021-12-12.json", "title": "Fmge Dec 2021   2021 12 12", "category": "Previous Year Papers", "count": 250}, {"file": "FMGE_Dec_CT_-_Pathology_Gen_Hema.json", "title": "Fmge Dec Ct   Pathology Gen Hema", "category": "Previous Year Papers", "count": 40}, {"file": "FMGE_Dec_CT_-_Pharmacology.json", "title": "Fmge Dec Ct   Pharmacology", "category": "Previous Year Papers", "count": 50}, {"file": "FMGE_EndoGITRhumat_Dr_Rahul.json", "title": "Fmge Endogitrhumat Dr Rahul", "category": "Previous Year Papers", "count": 45}, {"file": "FMGE_Jan_2023.json", "title": "Fmge Jan 2023", "category": "Previous Year Papers", "count": 299}, {"file": "FMGE_Jan_2023_-_2023-01-20.json", "title": "Fmge Jan 2023   2023 01 20", "category": "Previous Year Papers", "count": 255}, {"file": "FMGE_Jan_2024_-_2024-01-20.json", "title": "Fmge Jan 2024   2024 01 20", "category": "Previous Year Papers", "count": 397}, {"file": "FMGE_Jan_2024_Part_1.json", "title": "Fmge Jan 2024 Part 1", "category": "Previous Year Papers", "count": 150}, {"file": "FMGE_Jan_2024_Part_2.json", "title": "Fmge Jan 2024 Part 2", "category": "Previous Year Papers", "count": 150}, {"file": "FMGE_Jan_2025.json", "title": "Fmge Jan 2025", "category": "Previous Year Papers", "count": 300}, {"file": "FMGE_Jan_2025_-_2025-01-12.json", "title": "Fmge Jan 2025   2025 01 12", "category": "Previous Year Papers", "count": 313}, {"file": "FMGE_Jan_2025_Part_1.json", "title": "Fmge Jan 2025 Part 1", "category": "Previous Year Papers", "count": 150}, {"file": "FMGE_Jan_2025_Part_2.json", "title": "Fmge Jan 2025 Part 2", "category": "Previous Year Papers", "count": 150}, {"file": "FMGE_July_2023.json", "title": "Fmge July 2023", "category": "Previous Year Papers", "count": 282}, {"file": "FMGE_July_2023_-_2023-07-30.json", "title": "Fmge July 2023   2023 07 30", "category": "Previous Year Papers", "count": 300}, {"file": "FMGE_July_2024_-_2024-07-06.json", "title": "Fmge July 2024   2024 07 06", "category": "Previous Year Papers", "count": 300}, {"file": "FMGE_June_2019.json", "title": "Fmge June 2019", "category": "Previous Year Papers", "count": 63}, {"file": "FMGE_June_2021.json", "title": "Fmge June 2021", "category": "Previous Year Papers", "count": 300}, {"file": "FMGE_June_2021_-_2021-06-18.json", "title": "Fmge June 2021   2021 06 18", "category": "Previous Year Papers", "count": 273}, {"file": "FMGE_June_2022.json", "title": "Fmge June 2022", "category": "Previous Year Papers", "count": 254}, {"file": "FMGE_June_2022_-_2022-06-04.json", "title": "Fmge June 2022   2022 06 04", "category": "Previous Year Papers", "count": 243}, {"file": "FMGE_June_2024_Part_1.json", "title": "Fmge June 2024 Part 1", "category": "Previous Year Papers", "count": 150}, {"file": "FMGE_June_2024_Part_2.json", "title": "Fmge June 2024 Part 2", "category": "Previous Year Papers", "count": 150}, {"file": "FMGE_Mini_Mock_Test_OphtalmologyENTPathologyPediatrics.json", "title": "Fmge Mini Mock Test Ophtalmologyentpathologypediatrics", "category": "Previous Year Papers", "count": 80}, {"file": "FMGE_Mock_1_Paper_1.json", "title": "Fmge Mock 1 Paper 1", "category": "Previous Year Papers", "count": 150}, {"file": "FMGE_Mock_1_Paper_2.json", "title": "Fmge Mock 1 Paper 2", "category": "Previous Year Papers", "count": 150}, {"file": "FMGE_Mock_2_Paper_1.json", "title": "Fmge Mock 2 Paper 1", "category": "Previous Year Papers", "count": 150}, {"file": "FMGE_Mock_2_Paper_2.json", "title": "Fmge Mock 2 Paper 2", "category": "Previous Year Papers", "count": 150}, {"file": "FMGE_Mock_3_Paper_1.json", "title": "Fmge Mock 3 Paper 1", "category": "Previous Year Papers", "count": 150}, {"file": "FMGE_Mock_3_Paper_2.json", "title": "Fmge Mock 3 Paper 2", "category": "Previous Year Papers", "count": 150}, {"file": "FMGE_Mock_4_Paper_1.json", "title": "Fmge Mock 4 Paper 1", "category": "Previous Year Papers", "count": 150}, {"file": "FMGE_Mock_4_Paper_2.json", "title": "Fmge Mock 4 Paper 2", "category": "Previous Year Papers", "count": 150}, {"file": "FMGE_Mock_5_Paper_1.json", "title": "Fmge Mock 5 Paper 1", "category": "Previous Year Papers", "count": 150}, {"file": "FMGE_Mock_5_Paper_2.json", "title": "Fmge Mock 5 Paper 2", "category": "Previous Year Papers", "count": 150}, {"file": "FMGE_Mock_6_Paper_1.json", "title": "Fmge Mock 6 Paper 1", "category": "Previous Year Papers", "count": 150}, {"file": "FMGE_Mock_6_Paper_2.json", "title": "Fmge Mock 6 Paper 2", "category": "Previous Year Papers", "count": 150}, {"file": "FMGE_MOCK_PAPER_-1_JULY_2025.json", "title": "Fmge Mock Paper  1 July 2025", "category": "Previous Year Papers", "count": 150}, {"file": "FMGE_MOCK_PAPER_-2_JULY_2025.json", "title": "Fmge Mock Paper  2 July 2025", "category": "Previous Year Papers", "count": 150}, {"file": "FMT_AIIMS_2014-2018.json", "title": "Fmt Aiims 2014 2018", "category": "Previous Year Papers", "count": 127}, {"file": "FMT_Dr_Mohit_FMGE_CT.json", "title": "Fmt Dr Mohit Fmge Ct", "category": "Previous Year Papers", "count": 40}, {"file": "FMT_FMGE_PYQ.json", "title": "Fmt Fmge Pyq", "category": "Previous Year Papers", "count": 83}, {"file": "FMT_INICET_PYQ.json", "title": "Fmt Inicet Pyq", "category": "Previous Year Papers", "count": 139}, {"file": "FMT_NEETPG_PYQ.json", "title": "Fmt Neetpg Pyq", "category": "Previous Year Papers", "count": 80}, {"file": "Forensic_Medicine_-_INICET_MAY_2024.json", "title": "Forensic Medicine   Inicet May 2024", "category": "Previous Year Papers", "count": 6}, {"file": "Forensic_Medicine_-_NEET_PG_2023.json", "title": "Forensic Medicine   Neet Pg 2023", "category": "Previous Year Papers", "count": 4}, {"file": "Forensic_Medicine_-_NEET_PG_2024.json", "title": "Forensic Medicine   Neet Pg 2024", "category": "Previous Year Papers", "count": 17}, {"file": "Forensic_Medicine_ED_-_Mission_NEET_PG_20_-_Final_Batch_-_08-06-2025_-_2025-06-08.json", "title": "Forensic Medicine Ed   Mission Neet Pg 20   Final Batch   08 06 2025   2025 06 08", "category": "Previous Year Papers", "count": 50}, {"file": "Forensic_Medicine_ED_Mission_NEET_PG_-_13-09-2023_-_2023-09-13.json", "title": "Forensic Medicine Ed Mission Neet Pg   13 09 2023   2023 09 13", "category": "Previous Year Papers", "count": 50}, {"file": "Forensic_Medicine_ED_Mission_NEET_PG_INICET_20_-_07-07-2024_-_2024-07-07.json", "title": "Forensic Medicine Ed Mission Neet Pg Inicet 20   07 07 2024   2024 07 07", "category": "Previous Year Papers", "count": 75}, {"file": "FORENSIC_MEDICINE-INICET_NOV_2024.json", "title": "Forensic Medicine Inicet Nov 2024", "category": "Previous Year Papers", "count": 5}, {"file": "Forensic_Medicine_NEET_PG_Revision_ED_-_07-01-2024_-_2024-01-07.json", "title": "Forensic Medicine Neet Pg Revision Ed   07 01 2024   2024 01 07", "category": "Previous Year Papers", "count": 50}, {"file": "Free_Grand_Test_Pattern_of_NEETPG.json", "title": "Free Grand Test Pattern Of Neetpg", "category": "Previous Year Papers", "count": 200}, {"file": "Free_National_Mock_Test_Based_on_NEETPG_May.json", "title": "Free National Mock Test Based On Neetpg May", "category": "Previous Year Papers", "count": 200}, {"file": "Free_National_Mock_Test_INICET_November.json", "title": "Free National Mock Test Inicet November", "category": "Previous Year Papers", "count": 200}, {"file": "Gynaecology_AIIMS_2014-2018.json", "title": "Gynaecology Aiims 2014 2018", "category": "Previous Year Papers", "count": 75}, {"file": "Gynaecology_Dr_Deepti__FMGE_CT.json", "title": "Gynaecology Dr Deepti  Fmge Ct", "category": "Previous Year Papers", "count": 50}, {"file": "Gynaecology_FMGE_PYQ.json", "title": "Gynaecology Fmge Pyq", "category": "Previous Year Papers", "count": 82}, {"file": "Gynaecology_INICET_PYQ.json", "title": "Gynaecology Inicet Pyq", "category": "Previous Year Papers", "count": 133}, {"file": "Gynaecology_NEETPG_PYQ.json", "title": "Gynaecology Neetpg Pyq", "category": "Previous Year Papers", "count": 90}, {"file": "INICET_2024_NOV_Paper_4_Section.json", "title": "Inicet 2024 Nov Paper 4 Section", "category": "Previous Year Papers", "count": 200}, {"file": "INICET_Champions_Test__16th_Oct_2024__OCTOBER_2024____1__.json", "title": "Inicet Champions Test  16Th Oct 2024  October 2024    1  ", "category": "Previous Year Papers", "count": 200}, {"file": "INICET_Grand_Test_-_1_-_2023-04-16.json", "title": "Inicet Grand Test   1   2023 04 16", "category": "Previous Year Papers", "count": 200}, {"file": "INICET_Grand_Test_-_2_-_2023-04-30.json", "title": "Inicet Grand Test   2   2023 04 30", "category": "Previous Year Papers", "count": 200}, {"file": "INICET_Grand_Test_-_3_-_2023-10-26.json", "title": "Inicet Grand Test   3   2023 10 26", "category": "Previous Year Papers", "count": 200}, {"file": "INICET_Grand_Test_04__26th_Feb_2025__FEBRUARY_2025____0__.json", "title": "Inicet Grand Test 04  26Th Feb 2025  February 2025    0  ", "category": "Previous Year Papers", "count": 200}, {"file": "INICET_Grand_Test_2__16th_Aug_2024__AUGUST_2024____0__.json", "title": "Inicet Grand Test 2  16Th Aug 2024  August 2024    0  ", "category": "Previous Year Papers", "count": 200}, {"file": "INICET_Grand_Test_3__18th_Dec_2024__DECEMBER_2024____0__.json", "title": "Inicet Grand Test 3  18Th Dec 2024  December 2024    0  ", "category": "Previous Year Papers", "count": 200}, {"file": "INICET_May_2021_-_2021-05-09.json", "title": "Inicet May 2021   2021 05 09", "category": "Previous Year Papers", "count": 200}, {"file": "INICET_May_2022_-_2022-05-08.json", "title": "Inicet May 2022   2022 05 08", "category": "Previous Year Papers", "count": 200}, {"file": "INICET_May_2023_-_2023-05-07.json", "title": "Inicet May 2023   2023 05 07", "category": "Previous Year Papers", "count": 200}, {"file": "INICET_May_2024.json", "title": "Inicet May 2024", "category": "Previous Year Papers", "count": 200}, {"file": "INICET_May_2024_-_2024-05-19.json", "title": "Inicet May 2024   2024 05 19", "category": "Previous Year Papers", "count": 200}, {"file": "INICET_May_2024_Mock_Test-1_Part-1_-_19-04-2024_-_2024-04-19.json", "title": "Inicet May 2024 Mock Test 1 Part 1   19 04 2024   2024 04 19", "category": "Previous Year Papers", "count": 50}, {"file": "INICET_May_2024_Mock_Test-1_Part-2_-_19-04-2024_-_2024-04-19.json", "title": "Inicet May 2024 Mock Test 1 Part 2   19 04 2024   2024 04 19", "category": "Previous Year Papers", "count": 50}, {"file": "INICET_May_2024_Mock_Test-1_Part-3_-_19-04-2024_-_2024-04-19.json", "title": "Inicet May 2024 Mock Test 1 Part 3   19 04 2024   2024 04 19", "category": "Previous Year Papers", "count": 50}, {"file": "INICET_May_2024_Mock_Test-1_Part-4_-_19-04-2024_-_2024-04-19.json", "title": "Inicet May 2024 Mock Test 1 Part 4   19 04 2024   2024 04 19", "category": "Previous Year Papers", "count": 50}, {"file": "INICET_May_2024_Mock_Test-2_Part-1_-_28-04-2024_-_2024-04-28.json", "title": "Inicet May 2024 Mock Test 2 Part 1   28 04 2024   2024 04 28", "category": "Previous Year Papers", "count": 50}, {"file": "INICET_May_2024_Mock_Test-2_Part-2_-_28-04-2024_-_2024-04-28.json", "title": "Inicet May 2024 Mock Test 2 Part 2   28 04 2024   2024 04 28", "category": "Previous Year Papers", "count": 50}, {"file": "INICET_May_2024_Mock_Test-2_Part-3_-_28-04-2024_-_2024-04-28.json", "title": "Inicet May 2024 Mock Test 2 Part 3   28 04 2024   2024 04 28", "category": "Previous Year Papers", "count": 50}, {"file": "INICET_May_2024_Mock_Test-2_Part-4_-_28-04-2024_-_2024-04-28.json", "title": "Inicet May 2024 Mock Test 2 Part 4   28 04 2024   2024 04 28", "category": "Previous Year Papers", "count": 50}, {"file": "INICET_May_2024_Mock_Test-3_Part-1_-_12-05-2024_-_2024-05-12.json", "title": "Inicet May 2024 Mock Test 3 Part 1   12 05 2024   2024 05 12", "category": "Previous Year Papers", "count": 50}, {"file": "INICET_May_2024_Mock_Test-3_Part-2_-_12-05-2024_-_2024-05-12.json", "title": "Inicet May 2024 Mock Test 3 Part 2   12 05 2024   2024 05 12", "category": "Previous Year Papers", "count": 50}, {"file": "INICET_May_2024_Mock_Test-3_Part-3_-_12-05-2024_-_2024-05-12.json", "title": "Inicet May 2024 Mock Test 3 Part 3   12 05 2024   2024 05 12", "category": "Previous Year Papers", "count": 50}, {"file": "INICET_May_2024_Mock_Test-3_Part-4_-_12-05-2024_-_2024-05-12.json", "title": "Inicet May 2024 Mock Test 3 Part 4   12 05 2024   2024 05 12", "category": "Previous Year Papers", "count": 50}, {"file": "INICET_Mock_10_4_Sections.json", "title": "Inicet Mock 10 4 Sections", "category": "Previous Year Papers", "count": 200}, {"file": "INICET_Mock_11_4_Sections.json", "title": "Inicet Mock 11 4 Sections", "category": "Previous Year Papers", "count": 200}, {"file": "INICET_Mock_2.json", "title": "Inicet Mock 2", "category": "Previous Year Papers", "count": 209}, {"file": "INICET_Mock_3.json", "title": "Inicet Mock 3", "category": "Previous Year Papers", "count": 202}, {"file": "INICET_Mock_4.json", "title": "Inicet Mock 4", "category": "Previous Year Papers", "count": 200}, {"file": "INICET_MOCK_5_4_Sections.json", "title": "Inicet Mock 5 4 Sections", "category": "Previous Year Papers", "count": 200}, {"file": "INICET_MOCK_6_4_Sections.json", "title": "Inicet Mock 6 4 Sections", "category": "Previous Year Papers", "count": 200}, {"file": "INICET_Mock_7_4_Sections.json", "title": "Inicet Mock 7 4 Sections", "category": "Previous Year Papers", "count": 200}, {"file": "INICET_Mock_8_4_Sections.json", "title": "Inicet Mock 8 4 Sections", "category": "Previous Year Papers", "count": 200}, {"file": "INICET_Mock_9_4_Sections.json", "title": "Inicet Mock 9 4 Sections", "category": "Previous Year Papers", "count": 200}, {"file": "INICET_MOCK_Test-1_-_27-04-2025_-_2025-04-27.json", "title": "Inicet Mock Test 1   27 04 2025   2025 04 27", "category": "Previous Year Papers", "count": 200}, {"file": "INICET_MOCK_Test-2_-_03-05-2025_-_2025-05-03.json", "title": "Inicet Mock Test 2   03 05 2025   2025 05 03", "category": "Previous Year Papers", "count": 200}, {"file": "INICET_Nov_2020_-_2020-11-20.json", "title": "Inicet Nov 2020   2020 11 20", "category": "Previous Year Papers", "count": 200}, {"file": "INICET_Nov_2021_-_2021-11-14.json", "title": "Inicet Nov 2021   2021 11 14", "category": "Previous Year Papers", "count": 200}, {"file": "INICET_Nov_2022_-_Session_1_-_2022-11-13.json", "title": "Inicet Nov 2022   Session 1   2022 11 13", "category": "Previous Year Papers", "count": 200}, {"file": "INICET_Nov_2022_-_Session_2_-_2022-11-13.json", "title": "Inicet Nov 2022   Session 2   2022 11 13", "category": "Previous Year Papers", "count": 200}, {"file": "INICET_Nov_2023_-_2023-11-05.json", "title": "Inicet Nov 2023   2023 11 05", "category": "Previous Year Papers", "count": 200}, {"file": "INICET_Nov_2024.json", "title": "Inicet Nov 2024", "category": "Previous Year Papers", "count": 200}, {"file": "INICET_Nov_2024_-_2024-11-10.json", "title": "Inicet Nov 2024   2024 11 10", "category": "Previous Year Papers", "count": 228}, {"file": "INICET_Nov_2024_Mock_Test-1_-_19-10-2024_-_2024-10-19.json", "title": "Inicet Nov 2024 Mock Test 1   19 10 2024   2024 10 19", "category": "Previous Year Papers", "count": 200}, {"file": "INICET_Nov_2024_Mock_Test-2_-_27-10-2024_-_2024-10-27.json", "title": "Inicet Nov 2024 Mock Test 2   27 10 2024   2024 10 27", "category": "Previous Year Papers", "count": 200}, {"file": "Late_Night_PYQ_PYT_Marathon_-_1_-_2024-08-28.json", "title": "Late Night Pyq Pyt Marathon   1   2024 08 28", "category": "Previous Year Papers", "count": 60}, {"file": "Late_Night_PYQ_PYT_Marathon_-_10_-_2024-09-06.json", "title": "Late Night Pyq Pyt Marathon   10   2024 09 06", "category": "Previous Year Papers", "count": 60}, {"file": "Late_Night_PYQ_PYT_Marathon_-_11_-_2024-09-07.json", "title": "Late Night Pyq Pyt Marathon   11   2024 09 07", "category": "Previous Year Papers", "count": 60}, {"file": "Late_Night_PYQ_PYT_Marathon_-_12_-_2024-09-08.json", "title": "Late Night Pyq Pyt Marathon   12   2024 09 08", "category": "Previous Year Papers", "count": 60}, {"file": "Late_Night_PYQ_PYT_Marathon_-_13_-_2024-09-09.json", "title": "Late Night Pyq Pyt Marathon   13   2024 09 09", "category": "Previous Year Papers", "count": 60}, {"file": "Late_Night_PYQ_PYT_Marathon_-_14_-_2024-09-10.json", "title": "Late Night Pyq Pyt Marathon   14   2024 09 10", "category": "Previous Year Papers", "count": 60}, {"file": "Late_Night_PYQ_PYT_Marathon_-_15_-_2024-09-11.json", "title": "Late Night Pyq Pyt Marathon   15   2024 09 11", "category": "Previous Year Papers", "count": 60}, {"file": "Late_Night_PYQ_PYT_Marathon_-_16_-_2024-09-12.json", "title": "Late Night Pyq Pyt Marathon   16   2024 09 12", "category": "Previous Year Papers", "count": 60}, {"file": "Late_Night_PYQ_PYT_Marathon_-_17_-_2024-09-13.json", "title": "Late Night Pyq Pyt Marathon   17   2024 09 13", "category": "Previous Year Papers", "count": 60}, {"file": "Late_Night_PYQ_PYT_Marathon_-_18_-_2024-09-14.json", "title": "Late Night Pyq Pyt Marathon   18   2024 09 14", "category": "Previous Year Papers", "count": 60}, {"file": "Late_Night_PYQ_PYT_Marathon_-_19_-_2024-09-15.json", "title": "Late Night Pyq Pyt Marathon   19   2024 09 15", "category": "Previous Year Papers", "count": 60}, {"file": "Late_Night_PYQ_PYT_Marathon_-_2_-_2024-08-29.json", "title": "Late Night Pyq Pyt Marathon   2   2024 08 29", "category": "Previous Year Papers", "count": 60}, {"file": "Late_Night_PYQ_PYT_Marathon_-_20_-_2024-09-16.json", "title": "Late Night Pyq Pyt Marathon   20   2024 09 16", "category": "Previous Year Papers", "count": 60}, {"file": "Late_Night_PYQ_PYT_Marathon_-_21_-_2024-09-17.json", "title": "Late Night Pyq Pyt Marathon   21   2024 09 17", "category": "Previous Year Papers", "count": 60}, {"file": "Late_Night_PYQ_PYT_Marathon_-_22_-_2024-09-18.json", "title": "Late Night Pyq Pyt Marathon   22   2024 09 18", "category": "Previous Year Papers", "count": 60}, {"file": "Late_Night_PYQ_PYT_Marathon_-_23_-_2024-09-19.json", "title": "Late Night Pyq Pyt Marathon   23   2024 09 19", "category": "Previous Year Papers", "count": 60}, {"file": "Late_Night_PYQ_PYT_Marathon_-_24_-_2024-09-20.json", "title": "Late Night Pyq Pyt Marathon   24   2024 09 20", "category": "Previous Year Papers", "count": 60}, {"file": "Late_Night_PYQ_PYT_Marathon_-_25_-_2024-09-21.json", "title": "Late Night Pyq Pyt Marathon   25   2024 09 21", "category": "Previous Year Papers", "count": 60}, {"file": "Late_Night_PYQ_PYT_Marathon_-_26_-_2024-09-22.json", "title": "Late Night Pyq Pyt Marathon   26   2024 09 22", "category": "Previous Year Papers", "count": 60}, {"file": "Late_Night_PYQ_PYT_Marathon_-_27_-_2024-09-23.json", "title": "Late Night Pyq Pyt Marathon   27   2024 09 23", "category": "Previous Year Papers", "count": 60}, {"file": "Late_Night_PYQ_PYT_Marathon_-_28_-_2024-09-24.json", "title": "Late Night Pyq Pyt Marathon   28   2024 09 24", "category": "Previous Year Papers", "count": 60}, {"file": "Late_Night_PYQ_PYT_Marathon_-_29_-_2024-09-25.json", "title": "Late Night Pyq Pyt Marathon   29   2024 09 25", "category": "Previous Year Papers", "count": 60}, {"file": "Late_Night_PYQ_PYT_Marathon_-_3_-_2024-08-30.json", "title": "Late Night Pyq Pyt Marathon   3   2024 08 30", "category": "Previous Year Papers", "count": 60}, {"file": "Late_Night_PYQ_PYT_Marathon_-_30_-_2024-09-22.json", "title": "Late Night Pyq Pyt Marathon   30   2024 09 22", "category": "Previous Year Papers", "count": 60}, {"file": "Late_Night_PYQ_PYT_Marathon_-_31_-_2024-09-27.json", "title": "Late Night Pyq Pyt Marathon   31   2024 09 27", "category": "Previous Year Papers", "count": 60}, {"file": "Late_Night_PYQ_PYT_Marathon_-_32_-_2024-09-28.json", "title": "Late Night Pyq Pyt Marathon   32   2024 09 28", "category": "Previous Year Papers", "count": 60}, {"file": "Late_Night_PYQ_PYT_Marathon_-_33_-_2024-09-29.json", "title": "Late Night Pyq Pyt Marathon   33   2024 09 29", "category": "Previous Year Papers", "count": 60}, {"file": "Late_Night_PYQ_PYT_Marathon_-_34_-_2024-09-30.json", "title": "Late Night Pyq Pyt Marathon   34   2024 09 30", "category": "Previous Year Papers", "count": 60}, {"file": "Late_Night_PYQ_PYT_Marathon_-_35_-_2024-10-01.json", "title": "Late Night Pyq Pyt Marathon   35   2024 10 01", "category": "Previous Year Papers", "count": 60}, {"file": "Late_Night_PYQ_PYT_Marathon_-_36_-_2024-10-02.json", "title": "Late Night Pyq Pyt Marathon   36   2024 10 02", "category": "Previous Year Papers", "count": 60}, {"file": "Late_Night_PYQ_PYT_Marathon_-_37_-_2024-10-03.json", "title": "Late Night Pyq Pyt Marathon   37   2024 10 03", "category": "Previous Year Papers", "count": 60}, {"file": "Late_Night_PYQ_PYT_Marathon_-_38_-_2024-10-04.json", "title": "Late Night Pyq Pyt Marathon   38   2024 10 04", "category": "Previous Year Papers", "count": 60}, {"file": "Late_Night_PYQ_PYT_Marathon_-_39_-_2024-10-05.json", "title": "Late Night Pyq Pyt Marathon   39   2024 10 05", "category": "Previous Year Papers", "count": 60}, {"file": "Late_Night_PYQ_PYT_Marathon_-_4_-_2024-08-31.json", "title": "Late Night Pyq Pyt Marathon   4   2024 08 31", "category": "Previous Year Papers", "count": 60}, {"file": "Late_Night_PYQ_PYT_Marathon_-_40_-_2024-10-06.json", "title": "Late Night Pyq Pyt Marathon   40   2024 10 06", "category": "Previous Year Papers", "count": 60}, {"file": "Late_Night_PYQ_PYT_Marathon_-_41_-_2024-10-07.json", "title": "Late Night Pyq Pyt Marathon   41   2024 10 07", "category": "Previous Year Papers", "count": 60}, {"file": "Late_Night_PYQ_PYT_Marathon_-_42_-_2024-10-08.json", "title": "Late Night Pyq Pyt Marathon   42   2024 10 08", "category": "Previous Year Papers", "count": 60}, {"file": "Late_Night_PYQ_PYT_Marathon_-_43_-_2024-10-09.json", "title": "Late Night Pyq Pyt Marathon   43   2024 10 09", "category": "Previous Year Papers", "count": 60}, {"file": "Late_Night_PYQ_PYT_Marathon_-_44_-_2024-10-10.json", "title": "Late Night Pyq Pyt Marathon   44   2024 10 10", "category": "Previous Year Papers", "count": 60}, {"file": "Late_Night_PYQ_PYT_Marathon_-_45_-_2024-10-11.json", "title": "Late Night Pyq Pyt Marathon   45   2024 10 11", "category": "Previous Year Papers", "count": 60}, {"file": "Late_Night_PYQ_PYT_Marathon_-_46_-_2024-10-12.json", "title": "Late Night Pyq Pyt Marathon   46   2024 10 12", "category": "Previous Year Papers", "count": 60}, {"file": "Late_Night_PYQ_PYT_Marathon_-_47_-_2024-10-13.json", "title": "Late Night Pyq Pyt Marathon   47   2024 10 13", "category": "Previous Year Papers", "count": 60}, {"file": "Late_Night_PYQ_PYT_Marathon_-_48_-_2024-10-14.json", "title": "Late Night Pyq Pyt Marathon   48   2024 10 14", "category": "Previous Year Papers", "count": 60}, {"file": "Late_Night_PYQ_PYT_Marathon_-_49_-_2024-10-15.json", "title": "Late Night Pyq Pyt Marathon   49   2024 10 15", "category": "Previous Year Papers", "count": 60}, {"file": "Late_Night_PYQ_PYT_Marathon_-_5_-_2024-09-01.json", "title": "Late Night Pyq Pyt Marathon   5   2024 09 01", "category": "Previous Year Papers", "count": 60}, {"file": "Late_Night_PYQ_PYT_Marathon_-_50_-_2024-10-16.json", "title": "Late Night Pyq Pyt Marathon   50   2024 10 16", "category": "Previous Year Papers", "count": 60}, {"file": "Late_Night_PYQ_PYT_Marathon_-_51_-_2024-10-17.json", "title": "Late Night Pyq Pyt Marathon   51   2024 10 17", "category": "Previous Year Papers", "count": 60}, {"file": "Late_Night_PYQ_PYT_Marathon_-_52_-_2024-10-18.json", "title": "Late Night Pyq Pyt Marathon   52   2024 10 18", "category": "Previous Year Papers", "count": 60}, {"file": "Late_Night_PYQ_PYT_Marathon_-_53_-_2024-10-19.json", "title": "Late Night Pyq Pyt Marathon   53   2024 10 19", "category": "Previous Year Papers", "count": 60}, {"file": "Late_Night_PYQ_PYT_Marathon_-_54_-_2024-10-20.json", "title": "Late Night Pyq Pyt Marathon   54   2024 10 20", "category": "Previous Year Papers", "count": 60}, {"file": "Late_Night_PYQ_PYT_Marathon_-_55_-_2024-10-21.json", "title": "Late Night Pyq Pyt Marathon   55   2024 10 21", "category": "Previous Year Papers", "count": 60}, {"file": "Late_Night_PYQ_PYT_Marathon_-_56_-_2024-10-22.json", "title": "Late Night Pyq Pyt Marathon   56   2024 10 22", "category": "Previous Year Papers", "count": 60}, {"file": "Late_Night_PYQ_PYT_Marathon_-_57_-_2024-10-23.json", "title": "Late Night Pyq Pyt Marathon   57   2024 10 23", "category": "Previous Year Papers", "count": 60}, {"file": "Late_Night_PYQ_PYT_Marathon_-_58_-_2024-10-24.json", "title": "Late Night Pyq Pyt Marathon   58   2024 10 24", "category": "Previous Year Papers", "count": 60}, {"file": "Late_Night_PYQ_PYT_Marathon_-_59_-_2024-10-25.json", "title": "Late Night Pyq Pyt Marathon   59   2024 10 25", "category": "Previous Year Papers", "count": 60}, {"file": "Late_Night_PYQ_PYT_Marathon_-_6_-_2024-09-02.json", "title": "Late Night Pyq Pyt Marathon   6   2024 09 02", "category": "Previous Year Papers", "count": 60}, {"file": "Late_Night_PYQ_PYT_Marathon_-_60_-_2024-10-26.json", "title": "Late Night Pyq Pyt Marathon   60   2024 10 26", "category": "Previous Year Papers", "count": 60}, {"file": "Late_Night_PYQ_PYT_Marathon_-_61_-_2024-10-27.json", "title": "Late Night Pyq Pyt Marathon   61   2024 10 27", "category": "Previous Year Papers", "count": 60}, {"file": "Late_Night_PYQ_PYT_Marathon_-_62_-_2024-10-28.json", "title": "Late Night Pyq Pyt Marathon   62   2024 10 28", "category": "Previous Year Papers", "count": 60}, {"file": "Late_Night_PYQ_PYT_Marathon_-_63_-_2024-10-29.json", "title": "Late Night Pyq Pyt Marathon   63   2024 10 29", "category": "Previous Year Papers", "count": 60}, {"file": "Late_Night_PYQ_PYT_Marathon_-_64_-_2024-10-30.json", "title": "Late Night Pyq Pyt Marathon   64   2024 10 30", "category": "Previous Year Papers", "count": 60}, {"file": "Late_Night_PYQ_PYT_Marathon_-_65_-_2024-10-31.json", "title": "Late Night Pyq Pyt Marathon   65   2024 10 31", "category": "Previous Year Papers", "count": 60}, {"file": "Late_Night_PYQ_PYT_Marathon_-_66_-_2024-11-01.json", "title": "Late Night Pyq Pyt Marathon   66   2024 11 01", "category": "Previous Year Papers", "count": 60}, {"file": "Late_Night_PYQ_PYT_Marathon_-_67_-_2024-11-02.json", "title": "Late Night Pyq Pyt Marathon   67   2024 11 02", "category": "Previous Year Papers", "count": 60}, {"file": "Late_Night_PYQ_PYT_Marathon_-_68_-_2024-11-03.json", "title": "Late Night Pyq Pyt Marathon   68   2024 11 03", "category": "Previous Year Papers", "count": 60}, {"file": "Late_Night_PYQ_PYT_Marathon_-_69_-_2024-11-04.json", "title": "Late Night Pyq Pyt Marathon   69   2024 11 04", "category": "Previous Year Papers", "count": 60}, {"file": "Late_Night_PYQ_PYT_Marathon_-_7_-_2024-09-03.json", "title": "Late Night Pyq Pyt Marathon   7   2024 09 03", "category": "Previous Year Papers", "count": 60}, {"file": "Late_Night_PYQ_PYT_Marathon_-_70_-_2024-11-05.json", "title": "Late Night Pyq Pyt Marathon   70   2024 11 05", "category": "Previous Year Papers", "count": 60}, {"file": "Late_Night_PYQ_PYT_Marathon_-_71_-_2024-11-06.json", "title": "Late Night Pyq Pyt Marathon   71   2024 11 06", "category": "Previous Year Papers", "count": 60}, {"file": "Late_Night_PYQ_PYT_Marathon_-_72_-_2024-11-07.json", "title": "Late Night Pyq Pyt Marathon   72   2024 11 07", "category": "Previous Year Papers", "count": 60}, {"file": "Late_Night_PYQ_PYT_Marathon_-_73_-_2024-11-08.json", "title": "Late Night Pyq Pyt Marathon   73   2024 11 08", "category": "Previous Year Papers", "count": 60}, {"file": "Late_Night_PYQ_PYT_Marathon_-_8_-_2024-09-04.json", "title": "Late Night Pyq Pyt Marathon   8   2024 09 04", "category": "Previous Year Papers", "count": 60}, {"file": "Late_Night_PYQ_PYT_Marathon_-_9_-_2024-09-05.json", "title": "Late Night Pyq Pyt Marathon   9   2024 09 05", "category": "Previous Year Papers", "count": 60}, {"file": "Late_Night_PYQ_PYT_Marathon_Anatomy-1_-_2025-01-01.json", "title": "Late Night Pyq Pyt Marathon Anatomy 1   2025 01 01", "category": "Previous Year Papers", "count": 60}, {"file": "Late_Night_PYQ_PYT_Marathon_Anatomy-2_-_2025-01-02.json", "title": "Late Night Pyq Pyt Marathon Anatomy 2   2025 01 02", "category": "Previous Year Papers", "count": 60}, {"file": "Late_Night_PYQ_PYT_Marathon_Anatomy-3_-_2025-01-03.json", "title": "Late Night Pyq Pyt Marathon Anatomy 3   2025 01 03", "category": "Previous Year Papers", "count": 60}, {"file": "Late_Night_PYQ_PYT_Marathon_Anatomy-4_-_2025-01-04.json", "title": "Late Night Pyq Pyt Marathon Anatomy 4   2025 01 04", "category": "Previous Year Papers", "count": 60}, {"file": "Late_Night_PYQ_PYT_Marathon_Anatomy-5_-_2025-01-05.json", "title": "Late Night Pyq Pyt Marathon Anatomy 5   2025 01 05", "category": "Previous Year Papers", "count": 60}, {"file": "Late_Night_PYQ_PYT_Marathon_Anatomy-6_-_2025-01-06.json", "title": "Late Night Pyq Pyt Marathon Anatomy 6   2025 01 06", "category": "Previous Year Papers", "count": 60}, {"file": "Late_Night_PYQ_PYT_Marathon_AnatomyMicrobiology-1_-_2025-01-12.json", "title": "Late Night Pyq Pyt Marathon Anatomymicrobiology 1   2025 01 12", "category": "Previous Year Papers", "count": 60}, {"file": "Late_Night_PYQ_PYT_Marathon_AnatomyMicrobiology-2_-_2025-01-13.json", "title": "Late Night Pyq Pyt Marathon Anatomymicrobiology 2   2025 01 13", "category": "Previous Year Papers", "count": 60}, {"file": "Late_Night_PYQ_PYT_Marathon_Anesthesia-1_-_2024-12-04.json", "title": "Late Night Pyq Pyt Marathon Anesthesia 1   2024 12 04", "category": "Previous Year Papers", "count": 60}, {"file": "Late_Night_PYQ_PYT_Marathon_Biochemistry-1_-_2024-12-22.json", "title": "Late Night Pyq Pyt Marathon Biochemistry 1   2024 12 22", "category": "Previous Year Papers", "count": 60}, {"file": "Late_Night_PYQ_PYT_Marathon_Biochemistry-2_-_2024-12-23.json", "title": "Late Night Pyq Pyt Marathon Biochemistry 2   2024 12 23", "category": "Previous Year Papers", "count": 60}, {"file": "Late_Night_PYQ_PYT_Marathon_Biochemistry-3_-_2024-12-24.json", "title": "Late Night Pyq Pyt Marathon Biochemistry 3   2024 12 24", "category": "Previous Year Papers", "count": 60}, {"file": "Late_Night_PYQ_PYT_Marathon_Biochemistry-4_-_2024-12-25.json", "title": "Late Night Pyq Pyt Marathon Biochemistry 4   2024 12 25", "category": "Previous Year Papers", "count": 60}, {"file": "Late_Night_PYQ_PYT_Marathon_BiochemistryFMT-1_-_2024-12-29.json", "title": "Late Night Pyq Pyt Marathon Biochemistryfmt 1   2024 12 29", "category": "Previous Year Papers", "count": 60}, {"file": "Late_Night_PYQ_PYT_Marathon_BiochemistryFMT-2_-_2024-12-30.json", "title": "Late Night Pyq Pyt Marathon Biochemistryfmt 2   2024 12 30", "category": "Previous Year Papers", "count": 60}, {"file": "Late_Night_PYQ_PYT_Marathon_BiochemistryFMT-3_-_2024-12-31.json", "title": "Late Night Pyq Pyt Marathon Biochemistryfmt 3   2024 12 31", "category": "Previous Year Papers", "count": 60}, {"file": "Late_Night_PYQ_PYT_Marathon_Dermatology-1_-_2025-02-21.json", "title": "Late Night Pyq Pyt Marathon Dermatology 1   2025 02 21", "category": "Previous Year Papers", "count": 60}, {"file": "Late_Night_PYQ_PYT_Marathon_Dermatology-2_-_2025-02-22.json", "title": "Late Night Pyq Pyt Marathon Dermatology 2   2025 02 22", "category": "Previous Year Papers", "count": 60}, {"file": "Late_Night_PYQ_PYT_Marathon_ENT-1_-_2025-01-21.json", "title": "Late Night Pyq Pyt Marathon Ent 1   2025 01 21", "category": "Previous Year Papers", "count": 60}, {"file": "Late_Night_PYQ_PYT_Marathon_ENT-2_-_2025-01-22.json", "title": "Late Night Pyq Pyt Marathon Ent 2   2025 01 22", "category": "Previous Year Papers", "count": 60}, {"file": "Late_Night_PYQ_PYT_Marathon_ENT-3_-_2025-01-23.json", "title": "Late Night Pyq Pyt Marathon Ent 3   2025 01 23", "category": "Previous Year Papers", "count": 60}, {"file": "Late_Night_PYQ_PYT_Marathon_ENT-4_-_2025-01-24.json", "title": "Late Night Pyq Pyt Marathon Ent 4   2025 01 24", "category": "Previous Year Papers", "count": 60}, {"file": "Late_Night_PYQ_PYT_Marathon_FMT-1_-_2024-12-26.json", "title": "Late Night Pyq Pyt Marathon Fmt 1   2024 12 26", "category": "Previous Year Papers", "count": 60}, {"file": "Late_Night_PYQ_PYT_Marathon_FMT-2_-_2024-12-27.json", "title": "Late Night Pyq Pyt Marathon Fmt 2   2024 12 27", "category": "Previous Year Papers", "count": 60}, {"file": "Late_Night_PYQ_PYT_Marathon_FMT-3_-_2024-12-28.json", "title": "Late Night Pyq Pyt Marathon Fmt 3   2024 12 28", "category": "Previous Year Papers", "count": 60}, {"file": "Late_Night_PYQ_PYT_Marathon_Medicine-1_-_2024-12-06.json", "title": "Late Night Pyq Pyt Marathon Medicine 1   2024 12 06", "category": "Previous Year Papers", "count": 60}, {"file": "Late_Night_PYQ_PYT_Marathon_Medicine-10_-_2024-12-21.json", "title": "Late Night Pyq Pyt Marathon Medicine 10   2024 12 21", "category": "Previous Year Papers", "count": 60}, {"file": "Late_Night_PYQ_PYT_Marathon_Medicine-2_-_2024-12-07.json", "title": "Late Night Pyq Pyt Marathon Medicine 2   2024 12 07", "category": "Previous Year Papers", "count": 60}, {"file": "Late_Night_PYQ_PYT_Marathon_Medicine-3_-_2024-12-08.json", "title": "Late Night Pyq Pyt Marathon Medicine 3   2024 12 08", "category": "Previous Year Papers", "count": 60}, {"file": "Late_Night_PYQ_PYT_Marathon_Medicine-4_-_2024-12-09.json", "title": "Late Night Pyq Pyt Marathon Medicine 4   2024 12 09", "category": "Previous Year Papers", "count": 60}, {"file": "Late_Night_PYQ_PYT_Marathon_Medicine-5_-_2024-12-10.json", "title": "Late Night Pyq Pyt Marathon Medicine 5   2024 12 10", "category": "Previous Year Papers", "count": 60}, {"file": "Late_Night_PYQ_PYT_Marathon_Medicine-6_-_2024-12-17.json", "title": "Late Night Pyq Pyt Marathon Medicine 6   2024 12 17", "category": "Previous Year Papers", "count": 60}, {"file": "Late_Night_PYQ_PYT_Marathon_Medicine-7_-_2024-12-18.json", "title": "Late Night Pyq Pyt Marathon Medicine 7   2024 12 18", "category": "Previous Year Papers", "count": 60}, {"file": "Late_Night_PYQ_PYT_Marathon_Medicine-8_-_2024-12-19.json", "title": "Late Night Pyq Pyt Marathon Medicine 8   2024 12 19", "category": "Previous Year Papers", "count": 60}, {"file": "Late_Night_PYQ_PYT_Marathon_Medicine-9_-_2024-12-20.json", "title": "Late Night Pyq Pyt Marathon Medicine 9   2024 12 20", "category": "Previous Year Papers", "count": 60}, {"file": "Late_Night_PYQ_PYT_Marathon_Microbiology-1_-_2025-01-07.json", "title": "Late Night Pyq Pyt Marathon Microbiology 1   2025 01 07", "category": "Previous Year Papers", "count": 60}, {"file": "Late_Night_PYQ_PYT_Marathon_Microbiology-2_-_2025-01-08.json", "title": "Late Night Pyq Pyt Marathon Microbiology 2   2025 01 08", "category": "Previous Year Papers", "count": 60}, {"file": "Late_Night_PYQ_PYT_Marathon_Microbiology-3_-_2025-01-09.json", "title": "Late Night Pyq Pyt Marathon Microbiology 3   2025 01 09", "category": "Previous Year Papers", "count": 59}, {"file": "Late_Night_PYQ_PYT_Marathon_Microbiology-4_-_2025-01-10.json", "title": "Late Night Pyq Pyt Marathon Microbiology 4   2025 01 10", "category": "Previous Year Papers", "count": 60}, {"file": "Late_Night_PYQ_PYT_Marathon_Microbiology-5_-_2025-01-11.json", "title": "Late Night Pyq Pyt Marathon Microbiology 5   2025 01 11", "category": "Previous Year Papers", "count": 60}, {"file": "Late_Night_PYQ_PYT_Marathon_OBG-1_-_2025-03-01.json", "title": "Late Night Pyq Pyt Marathon Obg 1   2025 03 01", "category": "Previous Year Papers", "count": 60}, {"file": "Late_Night_PYQ_PYT_Marathon_OBG-2_-_2025-03-02.json", "title": "Late Night Pyq Pyt Marathon Obg 2   2025 03 02", "category": "Previous Year Papers", "count": 60}, {"file": "Late_Night_PYQ_PYT_Marathon_OBG-3_-_2025-03-03.json", "title": "Late Night Pyq Pyt Marathon Obg 3   2025 03 03", "category": "Previous Year Papers", "count": 60}, {"file": "Late_Night_PYQ_PYT_Marathon_OBG-4_-_2025-03-04.json", "title": "Late Night Pyq Pyt Marathon Obg 4   2025 03 04", "category": "Previous Year Papers", "count": 60}, {"file": "Late_Night_PYQ_PYT_Marathon_OBG-5_-_2025-03-06.json", "title": "Late Night Pyq Pyt Marathon Obg 5   2025 03 06", "category": "Previous Year Papers", "count": 60}, {"file": "Late_Night_PYQ_PYT_Marathon_OBG-6_-_2025-03-07.json", "title": "Late Night Pyq Pyt Marathon Obg 6   2025 03 07", "category": "Previous Year Papers", "count": 60}, {"file": "Late_Night_PYQ_PYT_Marathon_OBG-7_-_2025-03-08.json", "title": "Late Night Pyq Pyt Marathon Obg 7   2025 03 08", "category": "Previous Year Papers", "count": 60}, {"file": "Late_Night_PYQ_PYT_Marathon_OphthaENT-1_-_2025-01-25.json", "title": "Late Night Pyq Pyt Marathon Ophthaent 1   2025 01 25", "category": "Previous Year Papers", "count": 60}, {"file": "Late_Night_PYQ_PYT_Marathon_Ophthalmology-1_-_2025-01-17.json", "title": "Late Night Pyq Pyt Marathon Ophthalmology 1   2025 01 17", "category": "Previous Year Papers", "count": 60}, {"file": "Late_Night_PYQ_PYT_Marathon_Ophthalmology-2_-_2025-01-18.json", "title": "Late Night Pyq Pyt Marathon Ophthalmology 2   2025 01 18", "category": "Previous Year Papers", "count": 60}, {"file": "Late_Night_PYQ_PYT_Marathon_Ophthalmology-3_-_2025-01-19.json", "title": "Late Night Pyq Pyt Marathon Ophthalmology 3   2025 01 19", "category": "Previous Year Papers", "count": 60}, {"file": "Late_Night_PYQ_PYT_Marathon_Ophthalmology-4_-_2025-01-20.json", "title": "Late Night Pyq Pyt Marathon Ophthalmology 4   2025 01 20", "category": "Previous Year Papers", "count": 60}, {"file": "Late_Night_PYQ_PYT_Marathon_Orthopedics-1_-_2025-01-27.json", "title": "Late Night Pyq Pyt Marathon Orthopedics 1   2025 01 27", "category": "Previous Year Papers", "count": 60}, {"file": "Late_Night_PYQ_PYT_Marathon_Orthopedics-2_-_2025-01-28.json", "title": "Late Night Pyq Pyt Marathon Orthopedics 2   2025 01 28", "category": "Previous Year Papers", "count": 60}, {"file": "Late_Night_PYQ_PYT_Marathon_Pathology-1_-_2024-11-30.json", "title": "Late Night Pyq Pyt Marathon Pathology 1   2024 11 30", "category": "Previous Year Papers", "count": 60}, {"file": "Late_Night_PYQ_PYT_Marathon_Pathology-2_-_2024-12-01.json", "title": "Late Night Pyq Pyt Marathon Pathology 2   2024 12 01", "category": "Previous Year Papers", "count": 60}, {"file": "Late_Night_PYQ_PYT_Marathon_Pathology-3_-_2024-12-02.json", "title": "Late Night Pyq Pyt Marathon Pathology 3   2024 12 02", "category": "Previous Year Papers", "count": 60}, {"file": "Late_Night_PYQ_PYT_Marathon_Pathology-4_-_2024-12-03.json", "title": "Late Night Pyq Pyt Marathon Pathology 4   2024 12 03", "category": "Previous Year Papers", "count": 60}, {"file": "Late_Night_PYQ_PYT_Marathon_Pathology-5_-_2025-02-19.json", "title": "Late Night Pyq Pyt Marathon Pathology 5   2025 02 19", "category": "Previous Year Papers", "count": 60}, {"file": "Late_Night_PYQ_PYT_Marathon_Pathology-6_-_2025-02-20.json", "title": "Late Night Pyq Pyt Marathon Pathology 6   2025 02 20", "category": "Previous Year Papers", "count": 60}, {"file": "Late_Night_PYQ_PYT_Marathon_PathologyDermatology-1_-_2025-02-23.json", "title": "Late Night Pyq Pyt Marathon Pathologydermatology 1   2025 02 23", "category": "Previous Year Papers", "count": 60}, {"file": "Late_Night_PYQ_PYT_Marathon_Pedia-1_-_2025-02-25.json", "title": "Late Night Pyq Pyt Marathon Pedia 1   2025 02 25", "category": "Previous Year Papers", "count": 60}, {"file": "Late_Night_PYQ_PYT_Marathon_Pedia-2_-_2025-02-26.json", "title": "Late Night Pyq Pyt Marathon Pedia 2   2025 02 26", "category": "Previous Year Papers", "count": 60}, {"file": "Late_Night_PYQ_PYT_Marathon_Pedia-3_-_2025-02-27.json", "title": "Late Night Pyq Pyt Marathon Pedia 3   2025 02 27", "category": "Previous Year Papers", "count": 60}, {"file": "Late_Night_PYQ_PYT_Marathon_Pedia-4_-_2025-02-28.json", "title": "Late Night Pyq Pyt Marathon Pedia 4   2025 02 28", "category": "Previous Year Papers", "count": 60}, {"file": "Late_Night_PYQ_PYT_Marathon_Pedia-5_-_2025-03-05.json", "title": "Late Night Pyq Pyt Marathon Pedia 5   2025 03 05", "category": "Previous Year Papers", "count": 60}, {"file": "Late_Night_PYQ_PYT_Marathon_PediatricsOBG-1_-_2025-03-09.json", "title": "Late Night Pyq Pyt Marathon Pediatricsobg 1   2025 03 09", "category": "Previous Year Papers", "count": 60}, {"file": "Late_Night_PYQ_PYT_Marathon_PediatricsOBG-2_-_2025-03-10.json", "title": "Late Night Pyq Pyt Marathon Pediatricsobg 2   2025 03 10", "category": "Previous Year Papers", "count": 60}, {"file": "Late_Night_PYQ_PYT_Marathon_Pharma__Anesthesia_-_2024-12-05.json", "title": "Late Night Pyq Pyt Marathon Pharma  Anesthesia   2024 12 05", "category": "Previous Year Papers", "count": 60}, {"file": "Late_Night_PYQ_PYT_Marathon_Pharma-1_-_2024-11-25.json", "title": "Late Night Pyq Pyt Marathon Pharma 1   2024 11 25", "category": "Previous Year Papers", "count": 60}, {"file": "Late_Night_PYQ_PYT_Marathon_Pharma-2_-_2024-11-26.json", "title": "Late Night Pyq Pyt Marathon Pharma 2   2024 11 26", "category": "Previous Year Papers", "count": 60}, {"file": "Late_Night_PYQ_PYT_Marathon_Pharma-3_-_2024-11-27.json", "title": "Late Night Pyq Pyt Marathon Pharma 3   2024 11 27", "category": "Previous Year Papers", "count": 60}, {"file": "Late_Night_PYQ_PYT_Marathon_Pharma-4_-_2024-11-28.json", "title": "Late Night Pyq Pyt Marathon Pharma 4   2024 11 28", "category": "Previous Year Papers", "count": 60}, {"file": "Late_Night_PYQ_PYT_Marathon_Pharma-5_-_2024-11-29.json", "title": "Late Night Pyq Pyt Marathon Pharma 5   2024 11 29", "category": "Previous Year Papers", "count": 60}, {"file": "Late_Night_PYQ_PYT_Marathon_Physiology-1_-_2024-12-11.json", "title": "Late Night Pyq Pyt Marathon Physiology 1   2024 12 11", "category": "Previous Year Papers", "count": 60}, {"file": "Late_Night_PYQ_PYT_Marathon_Physiology-2_-_2024-12-12.json", "title": "Late Night Pyq Pyt Marathon Physiology 2   2024 12 12", "category": "Previous Year Papers", "count": 60}, {"file": "Late_Night_PYQ_PYT_Marathon_Physiology-3_-_2024-12-13.json", "title": "Late Night Pyq Pyt Marathon Physiology 3   2024 12 13", "category": "Previous Year Papers", "count": 60}, {"file": "Late_Night_PYQ_PYT_Marathon_Physiology-4_-_2024-12-14.json", "title": "Late Night Pyq Pyt Marathon Physiology 4   2024 12 14", "category": "Previous Year Papers", "count": 60}, {"file": "Late_Night_PYQ_PYT_Marathon_Physiology-5_-_2024-12-15.json", "title": "Late Night Pyq Pyt Marathon Physiology 5   2024 12 15", "category": "Previous Year Papers", "count": 60}, {"file": "Late_Night_PYQ_PYT_Marathon_Physiology-6_-_2024-12-16.json", "title": "Late Night Pyq Pyt Marathon Physiology 6   2024 12 16", "category": "Previous Year Papers", "count": 60}, {"file": "Late_Night_PYQ_PYT_Marathon_PSM-1_-_2025-02-11.json", "title": "Late Night Pyq Pyt Marathon Psm 1   2025 02 11", "category": "Previous Year Papers", "count": 60}, {"file": "Late_Night_PYQ_PYT_Marathon_PSM-2_-_2025-02-12.json", "title": "Late Night Pyq Pyt Marathon Psm 2   2025 02 12", "category": "Previous Year Papers", "count": 60}, {"file": "Late_Night_PYQ_PYT_Marathon_PSM-3_-_2025-02-13.json", "title": "Late Night Pyq Pyt Marathon Psm 3   2025 02 13", "category": "Previous Year Papers", "count": 60}, {"file": "Late_Night_PYQ_PYT_Marathon_PSM-4_-_2025-02-14.json", "title": "Late Night Pyq Pyt Marathon Psm 4   2025 02 14", "category": "Previous Year Papers", "count": 60}, {"file": "Late_Night_PYQ_PYT_Marathon_PSM-5_-_2025-02-15.json", "title": "Late Night Pyq Pyt Marathon Psm 5   2025 02 15", "category": "Previous Year Papers", "count": 60}, {"file": "Late_Night_PYQ_PYT_Marathon_PSM-6_-_2025-02-16.json", "title": "Late Night Pyq Pyt Marathon Psm 6   2025 02 16", "category": "Previous Year Papers", "count": 60}, {"file": "Late_Night_PYQ_PYT_Marathon_PSM-7_-_2025-02-17.json", "title": "Late Night Pyq Pyt Marathon Psm 7   2025 02 17", "category": "Previous Year Papers", "count": 60}, {"file": "Late_Night_PYQ_PYT_Marathon_PSM-8_-_2025-02-18.json", "title": "Late Night Pyq Pyt Marathon Psm 8   2025 02 18", "category": "Previous Year Papers", "count": 60}, {"file": "Late_Night_PYQ_PYT_Marathon_PSMAnesDerma_-_2025-02-24.json", "title": "Late Night Pyq Pyt Marathon Psmanesderma   2025 02 24", "category": "Previous Year Papers", "count": 60}, {"file": "Late_Night_PYQ_PYT_Marathon_Psychiatry-1_-_2025-01-14.json", "title": "Late Night Pyq Pyt Marathon Psychiatry 1   2025 01 14", "category": "Previous Year Papers", "count": 60}, {"file": "Late_Night_PYQ_PYT_Marathon_Psychiatry-2_-_2025-01-15.json", "title": "Late Night Pyq Pyt Marathon Psychiatry 2   2025 01 15", "category": "Previous Year Papers", "count": 60}, {"file": "Late_Night_PYQ_PYT_Marathon_Psychiatry-3_-_2025-01-16.json", "title": "Late Night Pyq Pyt Marathon Psychiatry 3   2025 01 16", "category": "Previous Year Papers", "count": 60}, {"file": "Late_Night_PYQ_PYT_Marathon_PsychiatryOphthaENT-1_-_2025-01-26.json", "title": "Late Night Pyq Pyt Marathon Psychiatryophthaent 1   2025 01 26", "category": "Previous Year Papers", "count": 60}, {"file": "Late_Night_PYQ_PYT_Marathon_Radiology-1_-_2025-01-29.json", "title": "Late Night Pyq Pyt Marathon Radiology 1   2025 01 29", "category": "Previous Year Papers", "count": 60}, {"file": "Late_Night_PYQ_PYT_Marathon_Radiology-2_-_2025-01-30.json", "title": "Late Night Pyq Pyt Marathon Radiology 2   2025 01 30", "category": "Previous Year Papers", "count": 60}, {"file": "Late_Night_PYQ_PYT_Marathon_RadiologyOrthopedics-1_-_2025-01-31.json", "title": "Late Night Pyq Pyt Marathon Radiologyorthopedics 1   2025 01 31", "category": "Previous Year Papers", "count": 60}, {"file": "Late_Night_PYQ_PYT_Marathon_Surgery-1_-_2025-02-01.json", "title": "Late Night Pyq Pyt Marathon Surgery 1   2025 02 01", "category": "Previous Year Papers", "count": 60}, {"file": "Late_Night_PYQ_PYT_Marathon_Surgery-2_-_2025-02-02.json", "title": "Late Night Pyq Pyt Marathon Surgery 2   2025 02 02", "category": "Previous Year Papers", "count": 60}, {"file": "Late_Night_PYQ_PYT_Marathon_Surgery-3_-_2025-02-03.json", "title": "Late Night Pyq Pyt Marathon Surgery 3   2025 02 03", "category": "Previous Year Papers", "count": 60}, {"file": "Late_Night_PYQ_PYT_Marathon_Surgery-4_-_2025-02-04.json", "title": "Late Night Pyq Pyt Marathon Surgery 4   2025 02 04", "category": "Previous Year Papers", "count": 60}, {"file": "Late_Night_PYQ_PYT_Marathon_Surgery-5_-_2025-02-05.json", "title": "Late Night Pyq Pyt Marathon Surgery 5   2025 02 05", "category": "Previous Year Papers", "count": 60}, {"file": "Late_Night_PYQ_PYT_Marathon_Surgery-6_-_2025-02-06.json", "title": "Late Night Pyq Pyt Marathon Surgery 6   2025 02 06", "category": "Previous Year Papers", "count": 60}, {"file": "Late_Night_PYQ_PYT_Marathon_Surgery-7_-_2025-02-07.json", "title": "Late Night Pyq Pyt Marathon Surgery 7   2025 02 07", "category": "Previous Year Papers", "count": 60}, {"file": "Late_Night_PYQ_PYT_Marathon_Surgery-8_-_2025-02-08.json", "title": "Late Night Pyq Pyt Marathon Surgery 8   2025 02 08", "category": "Previous Year Papers", "count": 60}, {"file": "Late_Night_PYQ_PYT_Marathon_Surgery-9_-_2025-02-09.json", "title": "Late Night Pyq Pyt Marathon Surgery 9   2025 02 09", "category": "Previous Year Papers", "count": 60}, {"file": "Late_Night_PYQ_PYT_Marathon_SurgeryOrthoRadio-1_-_2025-02-10.json", "title": "Late Night Pyq Pyt Marathon Surgeryorthoradio 1   2025 02 10", "category": "Previous Year Papers", "count": 60}, {"file": "Late_Night_PYQs_INICET_-_1_-_2025-05-06.json", "title": "Late Night Pyqs Inicet   1   2025 05 06", "category": "Previous Year Papers", "count": 50}, {"file": "Late_Night_PYQs_INICET_-_10_-_2025-05-15.json", "title": "Late Night Pyqs Inicet   10   2025 05 15", "category": "Previous Year Papers", "count": 50}, {"file": "Late_Night_PYQs_INICET_-_11_-_2025-05-16.json", "title": "Late Night Pyqs Inicet   11   2025 05 16", "category": "Previous Year Papers", "count": 50}, {"file": "Late_Night_PYQs_INICET_-_2_-_2025-05-07.json", "title": "Late Night Pyqs Inicet   2   2025 05 07", "category": "Previous Year Papers", "count": 50}, {"file": "Late_Night_PYQs_INICET_-_3_-_2025-05-08.json", "title": "Late Night Pyqs Inicet   3   2025 05 08", "category": "Previous Year Papers", "count": 50}, {"file": "Late_Night_PYQs_INICET_-_4_-_2025-05-09.json", "title": "Late Night Pyqs Inicet   4   2025 05 09", "category": "Previous Year Papers", "count": 50}, {"file": "Late_Night_PYQs_INICET_-_5_-_2025-05-10.json", "title": "Late Night Pyqs Inicet   5   2025 05 10", "category": "Previous Year Papers", "count": 50}, {"file": "Late_Night_PYQs_INICET_-_6_-_2025-05-11.json", "title": "Late Night Pyqs Inicet   6   2025 05 11", "category": "Previous Year Papers", "count": 50}, {"file": "Late_Night_PYQs_INICET_-_7_-_2025-05-12.json", "title": "Late Night Pyqs Inicet   7   2025 05 12", "category": "Previous Year Papers", "count": 50}, {"file": "Late_Night_PYQs_INICET_-_8_-_2025-05-13.json", "title": "Late Night Pyqs Inicet   8   2025 05 13", "category": "Previous Year Papers", "count": 50}, {"file": "Late_Night_PYQs_INICET_-_9_-_2025-05-14.json", "title": "Late Night Pyqs Inicet   9   2025 05 14", "category": "Previous Year Papers", "count": 50}, {"file": "Late_Night_PYQs_Mixed_Bag-1_-_2025-03-11.json", "title": "Late Night Pyqs Mixed Bag 1   2025 03 11", "category": "Previous Year Papers", "count": 40}, {"file": "Late_Night_PYQs_Mixed_Bag-10_-_2025-03-20.json", "title": "Late Night Pyqs Mixed Bag 10   2025 03 20", "category": "Previous Year Papers", "count": 40}, {"file": "Late_Night_PYQs_Mixed_Bag-11_-_2025-03-21.json", "title": "Late Night Pyqs Mixed Bag 11   2025 03 21", "category": "Previous Year Papers", "count": 40}, {"file": "Late_Night_PYQs_Mixed_Bag-12_-_2025-03-22.json", "title": "Late Night Pyqs Mixed Bag 12   2025 03 22", "category": "Previous Year Papers", "count": 40}, {"file": "Late_Night_PYQs_Mixed_Bag-13_-_2025-03-23.json", "title": "Late Night Pyqs Mixed Bag 13   2025 03 23", "category": "Previous Year Papers", "count": 40}, {"file": "Late_Night_PYQs_Mixed_Bag-14_-_2025-03-24.json", "title": "Late Night Pyqs Mixed Bag 14   2025 03 24", "category": "Previous Year Papers", "count": 40}, {"file": "Late_Night_PYQs_Mixed_Bag-15_-_2025-03-25.json", "title": "Late Night Pyqs Mixed Bag 15   2025 03 25", "category": "Previous Year Papers", "count": 40}, {"file": "Late_Night_PYQs_Mixed_Bag-16_-_2025-03-26.json", "title": "Late Night Pyqs Mixed Bag 16   2025 03 26", "category": "Previous Year Papers", "count": 40}, {"file": "Late_Night_PYQs_Mixed_Bag-17_-_2025-03-27.json", "title": "Late Night Pyqs Mixed Bag 17   2025 03 27", "category": "Previous Year Papers", "count": 40}, {"file": "Late_Night_PYQs_Mixed_Bag-18_-_2025-03-28.json", "title": "Late Night Pyqs Mixed Bag 18   2025 03 28", "category": "Previous Year Papers", "count": 40}, {"file": "Late_Night_PYQs_Mixed_Bag-19_-_2025-03-29.json", "title": "Late Night Pyqs Mixed Bag 19   2025 03 29", "category": "Previous Year Papers", "count": 40}, {"file": "Late_Night_PYQs_Mixed_Bag-2_-_2025-03-12.json", "title": "Late Night Pyqs Mixed Bag 2   2025 03 12", "category": "Previous Year Papers", "count": 40}, {"file": "Late_Night_PYQs_Mixed_Bag-20_-_2025-03-30.json", "title": "Late Night Pyqs Mixed Bag 20   2025 03 30", "category": "Previous Year Papers", "count": 40}, {"file": "Late_Night_PYQs_Mixed_Bag-21_-_2025-03-31.json", "title": "Late Night Pyqs Mixed Bag 21   2025 03 31", "category": "Previous Year Papers", "count": 40}, {"file": "Late_Night_PYQs_Mixed_Bag-22_-_2025-04-01.json", "title": "Late Night Pyqs Mixed Bag 22   2025 04 01", "category": "Previous Year Papers", "count": 40}, {"file": "Late_Night_PYQs_Mixed_Bag-23_-_2025-04-02.json", "title": "Late Night Pyqs Mixed Bag 23   2025 04 02", "category": "Previous Year Papers", "count": 40}, {"file": "Late_Night_PYQs_Mixed_Bag-24_-_2025-04-03.json", "title": "Late Night Pyqs Mixed Bag 24   2025 04 03", "category": "Previous Year Papers", "count": 40}, {"file": "Late_Night_PYQs_Mixed_Bag-25_-_2025-04-04.json", "title": "Late Night Pyqs Mixed Bag 25   2025 04 04", "category": "Previous Year Papers", "count": 40}, {"file": "Late_Night_PYQs_Mixed_Bag-26_-_2025-04-05.json", "title": "Late Night Pyqs Mixed Bag 26   2025 04 05", "category": "Previous Year Papers", "count": 40}, {"file": "Late_Night_PYQs_Mixed_Bag-27_-_2025-04-06.json", "title": "Late Night Pyqs Mixed Bag 27   2025 04 06", "category": "Previous Year Papers", "count": 40}, {"file": "Late_Night_PYQs_Mixed_Bag-28_-_2025-04-07.json", "title": "Late Night Pyqs Mixed Bag 28   2025 04 07", "category": "Previous Year Papers", "count": 40}, {"file": "Late_Night_PYQs_Mixed_Bag-29_-_2025-04-08.json", "title": "Late Night Pyqs Mixed Bag 29   2025 04 08", "category": "Previous Year Papers", "count": 40}, {"file": "Late_Night_PYQs_Mixed_Bag-3_-_2025-03-13.json", "title": "Late Night Pyqs Mixed Bag 3   2025 03 13", "category": "Previous Year Papers", "count": 40}, {"file": "Late_Night_PYQs_Mixed_Bag-30_-_2025-04-09.json", "title": "Late Night Pyqs Mixed Bag 30   2025 04 09", "category": "Previous Year Papers", "count": 40}, {"file": "Late_Night_PYQs_Mixed_Bag-31_-_2025-04-10.json", "title": "Late Night Pyqs Mixed Bag 31   2025 04 10", "category": "Previous Year Papers", "count": 40}, {"file": "Late_Night_PYQs_Mixed_Bag-32_-_2025-04-11.json", "title": "Late Night Pyqs Mixed Bag 32   2025 04 11", "category": "Previous Year Papers", "count": 40}, {"file": "Late_Night_PYQs_Mixed_Bag-33_-_2025-04-12.json", "title": "Late Night Pyqs Mixed Bag 33   2025 04 12", "category": "Previous Year Papers", "count": 40}, {"file": "Late_Night_PYQs_Mixed_Bag-34_-_2025-04-13.json", "title": "Late Night Pyqs Mixed Bag 34   2025 04 13", "category": "Previous Year Papers", "count": 40}, {"file": "Late_Night_PYQs_Mixed_Bag-35_-_2025-04-14.json", "title": "Late Night Pyqs Mixed Bag 35   2025 04 14", "category": "Previous Year Papers", "count": 40}, {"file": "Late_Night_PYQs_Mixed_Bag-36_-_2025-04-15.json", "title": "Late Night Pyqs Mixed Bag 36   2025 04 15", "category": "Previous Year Papers", "count": 40}, {"file": "Late_Night_PYQs_Mixed_Bag-37_-_2025-04-16.json", "title": "Late Night Pyqs Mixed Bag 37   2025 04 16", "category": "Previous Year Papers", "count": 40}, {"file": "Late_Night_PYQs_Mixed_Bag-38_-_2025-04-17.json", "title": "Late Night Pyqs Mixed Bag 38   2025 04 17", "category": "Previous Year Papers", "count": 40}, {"file": "Late_Night_PYQs_Mixed_Bag-39_-_2025-04-18.json", "title": "Late Night Pyqs Mixed Bag 39   2025 04 18", "category": "Previous Year Papers", "count": 40}, {"file": "Late_Night_PYQs_Mixed_Bag-4_-_2025-03-14.json", "title": "Late Night Pyqs Mixed Bag 4   2025 03 14", "category": "Previous Year Papers", "count": 40}, {"file": "Late_Night_PYQs_Mixed_Bag-40_-_2025-04-19.json", "title": "Late Night Pyqs Mixed Bag 40   2025 04 19", "category": "Previous Year Papers", "count": 40}, {"file": "Late_Night_PYQs_Mixed_Bag-41_-_2025-04-20.json", "title": "Late Night Pyqs Mixed Bag 41   2025 04 20", "category": "Previous Year Papers", "count": 40}, {"file": "Late_Night_PYQs_Mixed_Bag-42_-_2025-04-21.json", "title": "Late Night Pyqs Mixed Bag 42   2025 04 21", "category": "Previous Year Papers", "count": 40}, {"file": "Late_Night_PYQs_Mixed_Bag-43_-_2025-04-22.json", "title": "Late Night Pyqs Mixed Bag 43   2025 04 22", "category": "Previous Year Papers", "count": 40}, {"file": "Late_Night_PYQs_Mixed_Bag-44_-_2025-04-23.json", "title": "Late Night Pyqs Mixed Bag 44   2025 04 23", "category": "Previous Year Papers", "count": 40}, {"file": "Late_Night_PYQs_Mixed_Bag-45_-_2025-04-24.json", "title": "Late Night Pyqs Mixed Bag 45   2025 04 24", "category": "Previous Year Papers", "count": 40}, {"file": "Late_Night_PYQs_Mixed_Bag-46_-_2025-04-25.json", "title": "Late Night Pyqs Mixed Bag 46   2025 04 25", "category": "Previous Year Papers", "count": 40}, {"file": "Late_Night_PYQs_Mixed_Bag-47_-_2025-04-26.json", "title": "Late Night Pyqs Mixed Bag 47   2025 04 26", "category": "Previous Year Papers", "count": 40}, {"file": "Late_Night_PYQs_Mixed_Bag-48_-_2025-04-27.json", "title": "Late Night Pyqs Mixed Bag 48   2025 04 27", "category": "Previous Year Papers", "count": 40}, {"file": "Late_Night_PYQs_Mixed_Bag-49_-_2025-04-28.json", "title": "Late Night Pyqs Mixed Bag 49   2025 04 28", "category": "Previous Year Papers", "count": 40}, {"file": "Late_Night_PYQs_Mixed_Bag-5_-_2025-03-15.json", "title": "Late Night Pyqs Mixed Bag 5   2025 03 15", "category": "Previous Year Papers", "count": 40}, {"file": "Late_Night_PYQs_Mixed_Bag-50_-_2025-04-29.json", "title": "Late Night Pyqs Mixed Bag 50   2025 04 29", "category": "Previous Year Papers", "count": 40}, {"file": "Late_Night_PYQs_Mixed_Bag-51_-_2025-04-30.json", "title": "Late Night Pyqs Mixed Bag 51   2025 04 30", "category": "Previous Year Papers", "count": 40}, {"file": "Late_Night_PYQs_Mixed_Bag-52_-_2025-05-01.json", "title": "Late Night Pyqs Mixed Bag 52   2025 05 01", "category": "Previous Year Papers", "count": 40}, {"file": "Late_Night_PYQs_Mixed_Bag-53_-_2025-05-02.json", "title": "Late Night Pyqs Mixed Bag 53   2025 05 02", "category": "Previous Year Papers", "count": 40}, {"file": "Late_Night_PYQs_Mixed_Bag-54_-_2025-05-03.json", "title": "Late Night Pyqs Mixed Bag 54   2025 05 03", "category": "Previous Year Papers", "count": 40}, {"file": "Late_Night_PYQs_Mixed_Bag-55_-_2025-05-04.json", "title": "Late Night Pyqs Mixed Bag 55   2025 05 04", "category": "Previous Year Papers", "count": 40}, {"file": "Late_Night_PYQs_Mixed_Bag-56_-_2025-05-05.json", "title": "Late Night Pyqs Mixed Bag 56   2025 05 05", "category": "Previous Year Papers", "count": 40}, {"file": "Late_Night_PYQs_Mixed_Bag-6_-_2025-03-16.json", "title": "Late Night Pyqs Mixed Bag 6   2025 03 16", "category": "Previous Year Papers", "count": 40}, {"file": "Late_Night_PYQs_Mixed_Bag-7_-_2025-03-17.json", "title": "Late Night Pyqs Mixed Bag 7   2025 03 17", "category": "Previous Year Papers", "count": 40}, {"file": "Late_Night_PYQs_Mixed_Bag-8_-_2025-03-18.json", "title": "Late Night Pyqs Mixed Bag 8   2025 03 18", "category": "Previous Year Papers", "count": 40}, {"file": "Late_Night_PYQs_Mixed_Bag-9_-_2025-03-19.json", "title": "Late Night Pyqs Mixed Bag 9   2025 03 19", "category": "Previous Year Papers", "count": 40}, {"file": "Late_Night_PYQs_NEETPG_-_Final\u00a01_-_2025-06-10.json", "title": "Late Night Pyqs Neetpg   Final\u00a01   2025 06 10", "category": "Previous Year Papers", "count": 50}, {"file": "Late_Night_PYQs_NEETPG_-_Final\u00a02_-_2025-06-11.json", "title": "Late Night Pyqs Neetpg   Final\u00a02   2025 06 11", "category": "Previous Year Papers", "count": 50}, {"file": "Late_Night_PYQs_NEETPG_-_Final\u00a03_-_2025-06-12.json", "title": "Late Night Pyqs Neetpg   Final\u00a03   2025 06 12", "category": "Previous Year Papers", "count": 50}, {"file": "Late_Night_PYQs_NEETPG-1_-_2025-05-17.json", "title": "Late Night Pyqs Neetpg 1   2025 05 17", "category": "Previous Year Papers", "count": 50}, {"file": "Late_Night_PYQs_NEETPG-10_-_2025-05-26.json", "title": "Late Night Pyqs Neetpg 10   2025 05 26", "category": "Previous Year Papers", "count": 50}, {"file": "Late_Night_PYQs_NEETPG-11_-_2025-05-27.json", "title": "Late Night Pyqs Neetpg 11   2025 05 27", "category": "Previous Year Papers", "count": 50}, {"file": "Late_Night_PYQs_NEETPG-12_-_2025-05-28.json", "title": "Late Night Pyqs Neetpg 12   2025 05 28", "category": "Previous Year Papers", "count": 50}, {"file": "Late_Night_PYQs_NEETPG-13_-_2025-05-29.json", "title": "Late Night Pyqs Neetpg 13   2025 05 29", "category": "Previous Year Papers", "count": 50}, {"file": "Late_Night_PYQs_NEETPG-14_-_2025-05-30.json", "title": "Late Night Pyqs Neetpg 14   2025 05 30", "category": "Previous Year Papers", "count": 50}, {"file": "Late_Night_PYQs_NEETPG-15_-_2025-05-31.json", "title": "Late Night Pyqs Neetpg 15   2025 05 31", "category": "Previous Year Papers", "count": 50}, {"file": "Late_Night_PYQs_NEETPG-16_-_2025-06-01.json", "title": "Late Night Pyqs Neetpg 16   2025 06 01", "category": "Previous Year Papers", "count": 50}, {"file": "Late_Night_PYQs_NEETPG-17_-_2025-06-02.json", "title": "Late Night Pyqs Neetpg 17   2025 06 02", "category": "Previous Year Papers", "count": 50}, {"file": "Late_Night_PYQs_NEETPG-18_-_2025-06-03.json", "title": "Late Night Pyqs Neetpg 18   2025 06 03", "category": "Previous Year Papers", "count": 50}, {"file": "Late_Night_PYQs_NEETPG-19_-_2025-06-04.json", "title": "Late Night Pyqs Neetpg 19   2025 06 04", "category": "Previous Year Papers", "count": 50}, {"file": "Late_Night_PYQs_NEETPG-2_-_2025-05-18.json", "title": "Late Night Pyqs Neetpg 2   2025 05 18", "category": "Previous Year Papers", "count": 50}, {"file": "Late_Night_PYQs_NEETPG-20_-_2025-06-05.json", "title": "Late Night Pyqs Neetpg 20   2025 06 05", "category": "Previous Year Papers", "count": 50}, {"file": "Late_Night_PYQs_NEETPG-21_-_2025-06-06.json", "title": "Late Night Pyqs Neetpg 21   2025 06 06", "category": "Previous Year Papers", "count": 50}, {"file": "Late_Night_PYQs_NEETPG-22_-_2025-06-07.json", "title": "Late Night Pyqs Neetpg 22   2025 06 07", "category": "Previous Year Papers", "count": 50}, {"file": "Late_Night_PYQs_NEETPG-23_-_2025-06-08.json", "title": "Late Night Pyqs Neetpg 23   2025 06 08", "category": "Previous Year Papers", "count": 50}, {"file": "Late_Night_PYQs_NEETPG-24_-_2025-06-09.json", "title": "Late Night Pyqs Neetpg 24   2025 06 09", "category": "Previous Year Papers", "count": 50}, {"file": "Late_Night_PYQs_NEETPG-3_-_2025-05-19.json", "title": "Late Night Pyqs Neetpg 3   2025 05 19", "category": "Previous Year Papers", "count": 50}, {"file": "Late_Night_PYQs_NEETPG-4_-_2025-05-20.json", "title": "Late Night Pyqs Neetpg 4   2025 05 20", "category": "Previous Year Papers", "count": 50}, {"file": "Late_Night_PYQs_NEETPG-5_-_2025-05-21.json", "title": "Late Night Pyqs Neetpg 5   2025 05 21", "category": "Previous Year Papers", "count": 50}, {"file": "Late_Night_PYQs_NEETPG-6_-_2025-05-22.json", "title": "Late Night Pyqs Neetpg 6   2025 05 22", "category": "Previous Year Papers", "count": 50}, {"file": "Late_Night_PYQs_NEETPG-7_-_2025-05-23.json", "title": "Late Night Pyqs Neetpg 7   2025 05 23", "category": "Previous Year Papers", "count": 50}, {"file": "Late_Night_PYQs_NEETPG-8_-_2025-05-24.json", "title": "Late Night Pyqs Neetpg 8   2025 05 24", "category": "Previous Year Papers", "count": 50}, {"file": "Late_Night_PYQs_NEETPG-9_-_2025-05-25.json", "title": "Late Night Pyqs Neetpg 9   2025 05 25", "category": "Previous Year Papers", "count": 50}, {"file": "Medicine_-_AIIMS_JUNE_2020.json", "title": "Medicine   Aiims June 2020", "category": "Previous Year Papers", "count": 11}, {"file": "Medicine_-_AIIMS_MAY_2018.json", "title": "Medicine   Aiims May 2018", "category": "Previous Year Papers", "count": 23}, {"file": "Medicine_-_AIIMS_MAY_2019.json", "title": "Medicine   Aiims May 2019", "category": "Previous Year Papers", "count": 10}, {"file": "Medicine_-_AIIMS_NOV_2018.json", "title": "Medicine   Aiims Nov 2018", "category": "Previous Year Papers", "count": 17}, {"file": "Medicine_-_AIIMS_NOV_2019.json", "title": "Medicine   Aiims Nov 2019", "category": "Previous Year Papers", "count": 21}, {"file": "Medicine_-_INICET_MAY_2024.json", "title": "Medicine   Inicet May 2024", "category": "Previous Year Papers", "count": 24}, {"file": "Medicine_-_NEET_PG_2018.json", "title": "Medicine   Neet Pg 2018", "category": "Previous Year Papers", "count": 46}, {"file": "Medicine_-_NEET_PG_2019.json", "title": "Medicine   Neet Pg 2019", "category": "Previous Year Papers", "count": 17}, {"file": "Medicine_-_NEET_PG_2020.json", "title": "Medicine   Neet Pg 2020", "category": "Previous Year Papers", "count": 17}, {"file": "Medicine_-_NEET_PG_2021.json", "title": "Medicine   Neet Pg 2021", "category": "Previous Year Papers", "count": 22}, {"file": "Medicine_-_NEET_PG_2022.json", "title": "Medicine   Neet Pg 2022", "category": "Previous Year Papers", "count": 21}, {"file": "Medicine_-_NEET_PG_2023.json", "title": "Medicine   Neet Pg 2023", "category": "Previous Year Papers", "count": 21}, {"file": "Medicine_-_NEET_PG_2024.json", "title": "Medicine   Neet Pg 2024", "category": "Previous Year Papers", "count": 41}, {"file": "Medicine_AIIMS_2014-2018.json", "title": "Medicine Aiims 2014 2018", "category": "Previous Year Papers", "count": 205}, {"file": "Medicine_ED_Part_1_-_Mission_20_INICET_-_16-09-2024_-_2024-09-16.json", "title": "Medicine Ed Part 1   Mission 20 Inicet   16 09 2024   2024 09 16", "category": "Previous Year Papers", "count": 75}, {"file": "Medicine_ED_Part-1_Mission_NEET_PG_-_11-08-2023_-_2023-08-11.json", "title": "Medicine Ed Part 1 Mission Neet Pg   11 08 2023   2023 08 11", "category": "Previous Year Papers", "count": 74}, {"file": "Medicine_ED_Part_2_-_Mission_20_INICET_-_18-09-2024_-_2024-09-18.json", "title": "Medicine Ed Part 2   Mission 20 Inicet   18 09 2024   2024 09 18", "category": "Previous Year Papers", "count": 75}, {"file": "Medicine_ED_Part-2_Mission_NEET_PG_-_10-11-2023_-_2023-11-10.json", "title": "Medicine Ed Part 2 Mission Neet Pg   10 11 2023   2023 11 10", "category": "Previous Year Papers", "count": 75}, {"file": "Medicine_FMGE_PYQ.json", "title": "Medicine Fmge Pyq", "category": "Previous Year Papers", "count": 124}, {"file": "MEDICINE-INICET_NOV_2024.json", "title": "Medicine Inicet Nov 2024", "category": "Previous Year Papers", "count": 21}, {"file": "Medicine_INICET_PYQ.json", "title": "Medicine Inicet Pyq", "category": "Previous Year Papers", "count": 266}, {"file": "Medicine_NEET_PG_Revision_ED_-_30-11-2023_-_2023-11-30.json", "title": "Medicine Neet Pg Revision Ed   30 11 2023   2023 11 30", "category": "Previous Year Papers", "count": 100}, {"file": "Medicine_NEETPG_PYQ.json", "title": "Medicine Neetpg Pyq", "category": "Previous Year Papers", "count": 152}, {"file": "Mega_NEET_BTR-1_-_2024-05-27.json", "title": "Mega Neet Btr 1   2024 05 27", "category": "Previous Year Papers", "count": 40}, {"file": "Mega_NEET_BTR-2_-_2024-06-03.json", "title": "Mega Neet Btr 2   2024 06 03", "category": "Previous Year Papers", "count": 40}, {"file": "Mega_NEET_BTR-3_-_2024-06-08.json", "title": "Mega Neet Btr 3   2024 06 08", "category": "Previous Year Papers", "count": 40}, {"file": "Mega_NEET_BTR-4_-_2024-06-14.json", "title": "Mega Neet Btr 4   2024 06 14", "category": "Previous Year Papers", "count": 40}, {"file": "Mega_NEET_BTR-5_-_2024-06-19.json", "title": "Mega Neet Btr 5   2024 06 19", "category": "Previous Year Papers", "count": 40}, {"file": "Micriobiology_Dr_J_suriya_FMGE_CT.json", "title": "Micriobiology Dr J Suriya Fmge Ct", "category": "Previous Year Papers", "count": 40}, {"file": "Microbiology_-_AIIMS_JUNE_2020.json", "title": "Microbiology   Aiims June 2020", "category": "Previous Year Papers", "count": 21}, {"file": "Microbiology_-_AIIMS_MAY_2018.json", "title": "Microbiology   Aiims May 2018", "category": "Previous Year Papers", "count": 15}, {"file": "Microbiology_-_AIIMS_MAY_2019.json", "title": "Microbiology   Aiims May 2019", "category": "Previous Year Papers", "count": 14}, {"file": "Microbiology_-_AIIMS_NOV_2018.json", "title": "Microbiology   Aiims Nov 2018", "category": "Previous Year Papers", "count": 9}, {"file": "Microbiology_-_AIIMS_NOV_2019.json", "title": "Microbiology   Aiims Nov 2019", "category": "Previous Year Papers", "count": 12}, {"file": "Microbiology_-_INICET_MAY_2024.json", "title": "Microbiology   Inicet May 2024", "category": "Previous Year Papers", "count": 13}, {"file": "Microbiology_-_NEET_PG_2018.json", "title": "Microbiology   Neet Pg 2018", "category": "Previous Year Papers", "count": 11}, {"file": "Microbiology_-_NEET_PG_2019.json", "title": "Microbiology   Neet Pg 2019", "category": "Previous Year Papers", "count": 25}, {"file": "Microbiology_-_NEET_PG_2020.json", "title": "Microbiology   Neet Pg 2020", "category": "Previous Year Papers", "count": 19}, {"file": "Microbiology_-_NEET_PG_2021.json", "title": "Microbiology   Neet Pg 2021", "category": "Previous Year Papers", "count": 14}, {"file": "Microbiology_-_NEET_PG_2022.json", "title": "Microbiology   Neet Pg 2022", "category": "Previous Year Papers", "count": 17}, {"file": "Microbiology_-_NEET_PG_2023.json", "title": "Microbiology   Neet Pg 2023", "category": "Previous Year Papers", "count": 4}, {"file": "Microbiology_-_NEET_PG_2024.json", "title": "Microbiology   Neet Pg 2024", "category": "Previous Year Papers", "count": 25}, {"file": "Microbiology_AIIMS_2014-2018.json", "title": "Microbiology Aiims 2014 2018", "category": "Previous Year Papers", "count": 170}, {"file": "Microbiology_ED_-_Mission_20_INICET_-_30-09-2024_-_2024-09-30.json", "title": "Microbiology Ed   Mission 20 Inicet   30 09 2024   2024 09 30", "category": "Previous Year Papers", "count": 75}, {"file": "Microbiology_ED_-_Mission_NEET_PG_20_-_Final_Batch_-_15-06-2025_-_2025-06-15.json", "title": "Microbiology Ed   Mission Neet Pg 20   Final Batch   15 06 2025   2025 06 15", "category": "Previous Year Papers", "count": 75}, {"file": "Microbiology_ED_Mission_NEET_PG_-_20-10-2023_-_2023-10-20.json", "title": "Microbiology Ed Mission Neet Pg   20 10 2023   2023 10 20", "category": "Previous Year Papers", "count": 50}, {"file": "Microbiology_ED_Mission_NEET_PG_INICET_20_-_01-06-2024_-_2024-06-01.json", "title": "Microbiology Ed Mission Neet Pg Inicet 20   01 06 2024   2024 06 01", "category": "Previous Year Papers", "count": 100}, {"file": "Microbiology_FMGE_PYQ.json", "title": "Microbiology Fmge Pyq", "category": "Previous Year Papers", "count": 106}, {"file": "MICROBIOLOGY-INICET_NOV_2024.json", "title": "Microbiology Inicet Nov 2024", "category": "Previous Year Papers", "count": 15}, {"file": "Microbiology_INICET_PYQ.json", "title": "Microbiology Inicet Pyq", "category": "Previous Year Papers", "count": 148}, {"file": "Microbiology_NEET_PG_Revision_ED_-_30-12-2023_-_2023-12-30.json", "title": "Microbiology Neet Pg Revision Ed   30 12 2023   2023 12 30", "category": "Previous Year Papers", "count": 50}, {"file": "Microbiology_NEETPG_PYQ.json", "title": "Microbiology Neetpg Pyq", "category": "Previous Year Papers", "count": 111}, {"file": "Mid_Day_Module_PYQs_Mixed_Bag-10_-_2025-03-20.json", "title": "Mid Day Module Pyqs Mixed Bag 10   2025 03 20", "category": "Previous Year Papers", "count": 40}, {"file": "Mid_Day_Module_PYQs_Mixed_Bag-11_-_2025-03-21.json", "title": "Mid Day Module Pyqs Mixed Bag 11   2025 03 21", "category": "Previous Year Papers", "count": 40}, {"file": "Mid_Day_Module_PYQs_Mixed_Bag-12_-_2025-03-22.json", "title": "Mid Day Module Pyqs Mixed Bag 12   2025 03 22", "category": "Previous Year Papers", "count": 39}, {"file": "Mid_Day_Module_PYQs_Mixed_Bag-13_-_2025-03-23.json", "title": "Mid Day Module Pyqs Mixed Bag 13   2025 03 23", "category": "Previous Year Papers", "count": 40}, {"file": "Mid_Day_Module_PYQs_Mixed_Bag-14_-_2025-03-24.json", "title": "Mid Day Module Pyqs Mixed Bag 14   2025 03 24", "category": "Previous Year Papers", "count": 40}, {"file": "Mid_Day_Module_PYQs_Mixed_Bag-15_-_2025-03-25.json", "title": "Mid Day Module Pyqs Mixed Bag 15   2025 03 25", "category": "Previous Year Papers", "count": 40}, {"file": "Mid_Day_Module_PYQs_Mixed_Bag-16_-_2025-03-26.json", "title": "Mid Day Module Pyqs Mixed Bag 16   2025 03 26", "category": "Previous Year Papers", "count": 40}, {"file": "Mid_Day_Module_PYQs_Mixed_Bag-17_-_2025-03-27.json", "title": "Mid Day Module Pyqs Mixed Bag 17   2025 03 27", "category": "Previous Year Papers", "count": 40}, {"file": "Mid_Day_Module_PYQs_Mixed_Bag-18_-_2025-03-28.json", "title": "Mid Day Module Pyqs Mixed Bag 18   2025 03 28", "category": "Previous Year Papers", "count": 40}, {"file": "Mid_Day_Module_PYQs_Mixed_Bag-19_-_2025-03-29.json", "title": "Mid Day Module Pyqs Mixed Bag 19   2025 03 29", "category": "Previous Year Papers", "count": 40}, {"file": "Mid_Day_Module_PYQs_Mixed_Bag-20_-_2025-03-30.json", "title": "Mid Day Module Pyqs Mixed Bag 20   2025 03 30", "category": "Previous Year Papers", "count": 40}, {"file": "Mid_Day_Module_PYQs_Mixed_Bag-21_-_2025-03-31.json", "title": "Mid Day Module Pyqs Mixed Bag 21   2025 03 31", "category": "Previous Year Papers", "count": 40}, {"file": "Mid_Day_Module_PYQs_Mixed_Bag-22_-_2025-04-01.json", "title": "Mid Day Module Pyqs Mixed Bag 22   2025 04 01", "category": "Previous Year Papers", "count": 40}, {"file": "Mid_Day_Module_PYQs_Mixed_Bag-23_-_2025-04-02.json", "title": "Mid Day Module Pyqs Mixed Bag 23   2025 04 02", "category": "Previous Year Papers", "count": 40}, {"file": "Mid_Day_Module_PYQs_Mixed_Bag-24_-_2025-04-03.json", "title": "Mid Day Module Pyqs Mixed Bag 24   2025 04 03", "category": "Previous Year Papers", "count": 40}, {"file": "Mid_Day_Module_PYQs_Mixed_Bag-25_-_2025-04-04.json", "title": "Mid Day Module Pyqs Mixed Bag 25   2025 04 04", "category": "Previous Year Papers", "count": 40}, {"file": "Mid_Day_Module_PYQs_Mixed_Bag-26_-_2025-04-05.json", "title": "Mid Day Module Pyqs Mixed Bag 26   2025 04 05", "category": "Previous Year Papers", "count": 40}, {"file": "Mid_Day_Module_PYQs_Mixed_Bag-27_-_2025-04-06.json", "title": "Mid Day Module Pyqs Mixed Bag 27   2025 04 06", "category": "Previous Year Papers", "count": 40}, {"file": "Mid_Day_Module_PYQs_Mixed_Bag-28_-_2025-04-07.json", "title": "Mid Day Module Pyqs Mixed Bag 28   2025 04 07", "category": "Previous Year Papers", "count": 40}, {"file": "Mid_Day_Module_PYQs_Mixed_Bag-29_-_2025-04-08.json", "title": "Mid Day Module Pyqs Mixed Bag 29   2025 04 08", "category": "Previous Year Papers", "count": 40}, {"file": "Mid_Day_Module_PYQs_Mixed_Bag-30_-_2025-04-09.json", "title": "Mid Day Module Pyqs Mixed Bag 30   2025 04 09", "category": "Previous Year Papers", "count": 40}, {"file": "Mid_Day_Module_PYQs_Mixed_Bag-31_-_2025-04-10.json", "title": "Mid Day Module Pyqs Mixed Bag 31   2025 04 10", "category": "Previous Year Papers", "count": 40}, {"file": "Mid_Day_Module_PYQs_Mixed_Bag-32_-_2025-04-11.json", "title": "Mid Day Module Pyqs Mixed Bag 32   2025 04 11", "category": "Previous Year Papers", "count": 40}, {"file": "Mid_Day_Module_PYQs_Mixed_Bag-33_-_2025-04-12.json", "title": "Mid Day Module Pyqs Mixed Bag 33   2025 04 12", "category": "Previous Year Papers", "count": 40}, {"file": "Mid_Day_Module_PYQs_Mixed_Bag-34_-_2025-04-13.json", "title": "Mid Day Module Pyqs Mixed Bag 34   2025 04 13", "category": "Previous Year Papers", "count": 40}, {"file": "Mid_Day_Module_PYQs_Mixed_Bag-35_-_2025-04-14.json", "title": "Mid Day Module Pyqs Mixed Bag 35   2025 04 14", "category": "Previous Year Papers", "count": 40}, {"file": "Mid_Day_Module_PYQs_Mixed_Bag-36_-_2025-04-15.json", "title": "Mid Day Module Pyqs Mixed Bag 36   2025 04 15", "category": "Previous Year Papers", "count": 40}, {"file": "Mid_Day_Module_PYQs_Mixed_Bag-37_-_2025-04-16.json", "title": "Mid Day Module Pyqs Mixed Bag 37   2025 04 16", "category": "Previous Year Papers", "count": 40}, {"file": "Mid_Day_Module_PYQs_Mixed_Bag-38_-_2025-04-17.json", "title": "Mid Day Module Pyqs Mixed Bag 38   2025 04 17", "category": "Previous Year Papers", "count": 40}, {"file": "Mid_Day_Module_PYQs_Mixed_Bag-39_-_2025-04-18.json", "title": "Mid Day Module Pyqs Mixed Bag 39   2025 04 18", "category": "Previous Year Papers", "count": 40}, {"file": "Mid_Day_Module_PYQs_Mixed_Bag-40_-_2025-04-19.json", "title": "Mid Day Module Pyqs Mixed Bag 40   2025 04 19", "category": "Previous Year Papers", "count": 40}, {"file": "Mid_Day_Module_PYQs_Mixed_Bag-41_-_2025-04-20.json", "title": "Mid Day Module Pyqs Mixed Bag 41   2025 04 20", "category": "Previous Year Papers", "count": 40}, {"file": "Mid_Day_Module_PYQs_Mixed_Bag-42_-_2025-04-21.json", "title": "Mid Day Module Pyqs Mixed Bag 42   2025 04 21", "category": "Previous Year Papers", "count": 40}, {"file": "Mid_Day_Module_PYQs_Mixed_Bag-43_-_2025-04-22.json", "title": "Mid Day Module Pyqs Mixed Bag 43   2025 04 22", "category": "Previous Year Papers", "count": 40}, {"file": "Mid_Day_Module_PYQs_Mixed_Bag-44_-_2025-04-23.json", "title": "Mid Day Module Pyqs Mixed Bag 44   2025 04 23", "category": "Previous Year Papers", "count": 40}, {"file": "Mid_Day_Module_PYQs_Mixed_Bag-45_-_2025-04-24.json", "title": "Mid Day Module Pyqs Mixed Bag 45   2025 04 24", "category": "Previous Year Papers", "count": 40}, {"file": "Mid_Day_Module_PYQs_Mixed_Bag-46_-_2025-04-25.json", "title": "Mid Day Module Pyqs Mixed Bag 46   2025 04 25", "category": "Previous Year Papers", "count": 40}, {"file": "Mid_Day_Module_PYQs_Mixed_Bag-47_-_2025-04-26.json", "title": "Mid Day Module Pyqs Mixed Bag 47   2025 04 26", "category": "Previous Year Papers", "count": 40}, {"file": "Mid_Day_Module_PYQs_Mixed_Bag-48_-_2025-04-27.json", "title": "Mid Day Module Pyqs Mixed Bag 48   2025 04 27", "category": "Previous Year Papers", "count": 40}, {"file": "Mid_Day_Module_PYQs_Mixed_Bag-49_-_2025-04-28.json", "title": "Mid Day Module Pyqs Mixed Bag 49   2025 04 28", "category": "Previous Year Papers", "count": 40}, {"file": "Mid_Day_Module_PYQs_Mixed_Bag-50_-_2025-04-29.json", "title": "Mid Day Module Pyqs Mixed Bag 50   2025 04 29", "category": "Previous Year Papers", "count": 40}, {"file": "Mid_Day_Module_PYQs_Mixed_Bag-51_-_2025-04-30.json", "title": "Mid Day Module Pyqs Mixed Bag 51   2025 04 30", "category": "Previous Year Papers", "count": 40}, {"file": "Mid_Day_Module_PYQs_Mixed_Bag-52_-_2025-05-01.json", "title": "Mid Day Module Pyqs Mixed Bag 52   2025 05 01", "category": "Previous Year Papers", "count": 40}, {"file": "Mid_Day_Module_PYQs_Mixed_Bag-53_-_2025-05-02.json", "title": "Mid Day Module Pyqs Mixed Bag 53   2025 05 02", "category": "Previous Year Papers", "count": 40}, {"file": "Mid_Day_Module_PYQs_Mixed_Bag-54_-_2025-05-03.json", "title": "Mid Day Module Pyqs Mixed Bag 54   2025 05 03", "category": "Previous Year Papers", "count": 40}, {"file": "Mid_Day_Module_PYQs_Mixed_Bag-55_-_2025-05-04.json", "title": "Mid Day Module Pyqs Mixed Bag 55   2025 05 04", "category": "Previous Year Papers", "count": 40}, {"file": "Mid_Day_Module_PYQs_Mixed_Bag-56_-_2025-05-05.json", "title": "Mid Day Module Pyqs Mixed Bag 56   2025 05 05", "category": "Previous Year Papers", "count": 40}, {"file": "Mid_Day_PYQs_NEET_PG\u00a0-\u00a0Final\u00a01_-_2025-06-11.json", "title": "Mid Day Pyqs Neet Pg\u00a0 \u00a0Final\u00a01   2025 06 11", "category": "Previous Year Papers", "count": 25}, {"file": "Mid_Day_PYQs_NEET_PG\u00a0-\u00a0Final\u00a02_-_2025-06-12.json", "title": "Mid Day Pyqs Neet Pg\u00a0 \u00a0Final\u00a02   2025 06 12", "category": "Previous Year Papers", "count": 25}, {"file": "Mid_Day_PYQs_NEETPG-1_-_2025-05-17.json", "title": "Mid Day Pyqs Neetpg 1   2025 05 17", "category": "Previous Year Papers", "count": 25}, {"file": "Mid_Day_PYQs_NEETPG-10_-_2025-05-26.json", "title": "Mid Day Pyqs Neetpg 10   2025 05 26", "category": "Previous Year Papers", "count": 25}, {"file": "Mid_Day_PYQs_NEETPG-11_-_2025-05-27.json", "title": "Mid Day Pyqs Neetpg 11   2025 05 27", "category": "Previous Year Papers", "count": 25}, {"file": "Mid_Day_PYQs_NEETPG-12_-_2025-05-28.json", "title": "Mid Day Pyqs Neetpg 12   2025 05 28", "category": "Previous Year Papers", "count": 25}, {"file": "Mid_Day_PYQs_NEETPG-13_-_2025-05-29.json", "title": "Mid Day Pyqs Neetpg 13   2025 05 29", "category": "Previous Year Papers", "count": 25}, {"file": "Mid_Day_PYQs_NEETPG-14_-_2025-05-30.json", "title": "Mid Day Pyqs Neetpg 14   2025 05 30", "category": "Previous Year Papers", "count": 25}, {"file": "Mid_Day_PYQs_NEETPG-15_-_2025-05-31.json", "title": "Mid Day Pyqs Neetpg 15   2025 05 31", "category": "Previous Year Papers", "count": 25}, {"file": "Mid_Day_PYQs_NEETPG-16_-_2025-06-01.json", "title": "Mid Day Pyqs Neetpg 16   2025 06 01", "category": "Previous Year Papers", "count": 25}, {"file": "Mid_Day_PYQs_NEETPG-17_-_2025-06-02.json", "title": "Mid Day Pyqs Neetpg 17   2025 06 02", "category": "Previous Year Papers", "count": 25}, {"file": "Mid_Day_PYQs_NEETPG-18_-_2025-06-03.json", "title": "Mid Day Pyqs Neetpg 18   2025 06 03", "category": "Previous Year Papers", "count": 25}, {"file": "Mid_Day_PYQs_NEETPG-19_-_2025-06-04.json", "title": "Mid Day Pyqs Neetpg 19   2025 06 04", "category": "Previous Year Papers", "count": 25}, {"file": "Mid_Day_PYQs_NEETPG-2_-_2025-05-18.json", "title": "Mid Day Pyqs Neetpg 2   2025 05 18", "category": "Previous Year Papers", "count": 25}, {"file": "Mid_Day_PYQs_NEETPG-20_-_2025-06-05.json", "title": "Mid Day Pyqs Neetpg 20   2025 06 05", "category": "Previous Year Papers", "count": 25}, {"file": "Mid_Day_PYQs_NEETPG-21_-_2025-06-06.json", "title": "Mid Day Pyqs Neetpg 21   2025 06 06", "category": "Previous Year Papers", "count": 25}, {"file": "Mid_Day_PYQs_NEETPG-22_-_2025-06-07.json", "title": "Mid Day Pyqs Neetpg 22   2025 06 07", "category": "Previous Year Papers", "count": 25}, {"file": "Mid_Day_PYQs_NEETPG-23_-_2025-06-08.json", "title": "Mid Day Pyqs Neetpg 23   2025 06 08", "category": "Previous Year Papers", "count": 25}, {"file": "Mid_Day_PYQs_NEETPG-24_-_2025-06-09.json", "title": "Mid Day Pyqs Neetpg 24   2025 06 09", "category": "Previous Year Papers", "count": 25}, {"file": "Mid_Day_PYQs_NEETPG-25_-_2025-06-10.json", "title": "Mid Day Pyqs Neetpg 25   2025 06 10", "category": "Previous Year Papers", "count": 25}, {"file": "Mid_Day_PYQs_NEETPG-3_-_2025-05-19.json", "title": "Mid Day Pyqs Neetpg 3   2025 05 19", "category": "Previous Year Papers", "count": 25}, {"file": "Mid_Day_PYQs_NEETPG-4_-_2025-05-20.json", "title": "Mid Day Pyqs Neetpg 4   2025 05 20", "category": "Previous Year Papers", "count": 25}, {"file": "Mid_Day_PYQs_NEETPG-5_-_2025-05-21.json", "title": "Mid Day Pyqs Neetpg 5   2025 05 21", "category": "Previous Year Papers", "count": 25}, {"file": "Mid_Day_PYQs_NEETPG-6_-_2025-05-22.json", "title": "Mid Day Pyqs Neetpg 6   2025 05 22", "category": "Previous Year Papers", "count": 24}, {"file": "Mid_Day_PYQs_NEETPG-7_-_2025-05-23.json", "title": "Mid Day Pyqs Neetpg 7   2025 05 23", "category": "Previous Year Papers", "count": 25}, {"file": "Mid_Day_PYQs_NEETPG-8_-_2025-05-24.json", "title": "Mid Day Pyqs Neetpg 8   2025 05 24", "category": "Previous Year Papers", "count": 25}, {"file": "Mid_Day_PYQs_NEETPG-9_-_2025-05-25.json", "title": "Mid Day Pyqs Neetpg 9   2025 05 25", "category": "Previous Year Papers", "count": 25}, {"file": "Mission_NEET_PG-INICET_Grand_Test-15_-_16-06-2024_-_2024-06-16.json", "title": "Mission Neet Pg Inicet Grand Test 15   16 06 2024   2024 06 16", "category": "Previous Year Papers", "count": 200}, {"file": "Mission_NEET_PG-INICET_Grand_Test-16_-_03-07-2024_-_2024-07-03.json", "title": "Mission Neet Pg Inicet Grand Test 16   03 07 2024   2024 07 03", "category": "Previous Year Papers", "count": 200}, {"file": "Mission_NEET_PG-INICET_Grand_Test-17-_29-09-2024_-_2024-09-29.json", "title": "Mission Neet Pg Inicet Grand Test 17  29 09 2024   2024 09 29", "category": "Previous Year Papers", "count": 200}, {"file": "Mission_NEET_PG-INICET_Grand_Test-18_-_20-11-2024_-_2024-11-20.json", "title": "Mission Neet Pg Inicet Grand Test 18   20 11 2024   2024 11 20", "category": "Previous Year Papers", "count": 200}, {"file": "Mission_NEET_PG-INICET_Grand_Test-19_-_16-12-2024_-_2024-12-16.json", "title": "Mission Neet Pg Inicet Grand Test 19   16 12 2024   2024 12 16", "category": "Previous Year Papers", "count": 200}, {"file": "Mission_NEET_PG-INICET_Grand_Test-20_-_29-12-2024_-_2024-12-29.json", "title": "Mission Neet Pg Inicet Grand Test 20   29 12 2024   2024 12 29", "category": "Previous Year Papers", "count": 200}, {"file": "Mission_NEET_PG-INICET_Grand_Test-21_-_13-01-2025_-_2025-01-13.json", "title": "Mission Neet Pg Inicet Grand Test 21   13 01 2025   2025 01 13", "category": "Previous Year Papers", "count": 200}, {"file": "Mission_NEET_PG-INICET_Grand_Test-22_-_31-01-2025_-_2025-01-31.json", "title": "Mission Neet Pg Inicet Grand Test 22   31 01 2025   2025 01 31", "category": "Previous Year Papers", "count": 200}, {"file": "Mission_NEET_PG-INICET_Grand_Test-23_-_14-02-2025_-_2025-02-14.json", "title": "Mission Neet Pg Inicet Grand Test 23   14 02 2025   2025 02 14", "category": "Previous Year Papers", "count": 200}, {"file": "Mission_NEET_PG-INICET_Grand_Test-24_-_28-02-2025_-_2025-02-28.json", "title": "Mission Neet Pg Inicet Grand Test 24   28 02 2025   2025 02 28", "category": "Previous Year Papers", "count": 200}, {"file": "Mission_NEET_PG-INICET_Grand_Test-25_-_10-03-2025_-_2025-03-10.json", "title": "Mission Neet Pg Inicet Grand Test 25   10 03 2025   2025 03 10", "category": "Previous Year Papers", "count": 200}, {"file": "Mission_NEET_PG-INICET_Grand_Test-26_-_29-03-2025_-_2025-03-29.json", "title": "Mission Neet Pg Inicet Grand Test 26   29 03 2025   2025 03 29", "category": "Previous Year Papers", "count": 200}, {"file": "Mission_NEET_PG-INICET_Grand_Test-27_-_18-04-2025_-_2025-04-18.json", "title": "Mission Neet Pg Inicet Grand Test 27   18 04 2025   2025 04 18", "category": "Previous Year Papers", "count": 200}, {"file": "Mission_NEETPG_INICET_GT_-_1_-_2023-06-25.json", "title": "Mission Neetpg Inicet Gt   1   2023 06 25", "category": "Previous Year Papers", "count": 200}, {"file": "Mission_NEETPG_INICET_GT_-_10_-_2024-02-19.json", "title": "Mission Neetpg Inicet Gt   10   2024 02 19", "category": "Previous Year Papers", "count": 200}, {"file": "Mission_NEETPG_INICET_GT_-_11_-_2024-03-03.json", "title": "Mission Neetpg Inicet Gt   11   2024 03 03", "category": "Previous Year Papers", "count": 200}, {"file": "Mission_NEETPG_INICET_GT_-_12_-_2024-03-17.json", "title": "Mission Neetpg Inicet Gt   12   2024 03 17", "category": "Previous Year Papers", "count": 200}, {"file": "Mission_NEETPG_INICET_GT_-_13_-_2024-04-08.json", "title": "Mission Neetpg Inicet Gt   13   2024 04 08", "category": "Previous Year Papers", "count": 200}, {"file": "Mission_NEETPG_INICET_GT_-_14_-_2024-05-05.json", "title": "Mission Neetpg Inicet Gt   14   2024 05 05", "category": "Previous Year Papers", "count": 200}, {"file": "Mission_NEETPG_INICET_GT_-_15_-_2024-05-27.json", "title": "Mission Neetpg Inicet Gt   15   2024 05 27", "category": "Previous Year Papers", "count": 200}, {"file": "Mission_NEETPG_INICET_GT_-_2_-_2023-08-06.json", "title": "Mission Neetpg Inicet Gt   2   2023 08 06", "category": "Previous Year Papers", "count": 200}, {"file": "Mission_NEETPG_INICET_GT_-_3_-_2023-09-03.json", "title": "Mission Neetpg Inicet Gt   3   2023 09 03", "category": "Previous Year Papers", "count": 200}, {"file": "Mission_NEETPG_INICET_GT_-_4_-_2023-10-08.json", "title": "Mission Neetpg Inicet Gt   4   2023 10 08", "category": "Previous Year Papers", "count": 200}, {"file": "Mission_NEETPG_INICET_GT_-_5_-_2023-12-01.json", "title": "Mission Neetpg Inicet Gt   5   2023 12 01", "category": "Previous Year Papers", "count": 200}, {"file": "Mission_NEETPG_INICET_GT_-_6_-_2023-12-18.json", "title": "Mission Neetpg Inicet Gt   6   2023 12 18", "category": "Previous Year Papers", "count": 200}, {"file": "Mission_NEETPG_INICET_GT_-_7_-_2024-01-05.json", "title": "Mission Neetpg Inicet Gt   7   2024 01 05", "category": "Previous Year Papers", "count": 200}, {"file": "Mission_NEETPG_INICET_GT_-_8_-_2024-01-21.json", "title": "Mission Neetpg Inicet Gt   8   2024 01 21", "category": "Previous Year Papers", "count": 200}, {"file": "Mission_NEETPG_INICET_GT_-_9_-_2024-02-04.json", "title": "Mission Neetpg Inicet Gt   9   2024 02 04", "category": "Previous Year Papers", "count": 200}, {"file": "NEET_Mock_with_Video_Solutions_-_11-07-2024_-_2024-07-11.json", "title": "Neet Mock With Video Solutions   11 07 2024   2024 07 11", "category": "Previous Year Papers", "count": 200}, {"file": "NEET_PG_2018.json", "title": "Neet Pg 2018", "category": "Previous Year Papers", "count": 293}, {"file": "NEET_PG_2018_-_2018-01-07.json", "title": "Neet Pg 2018   2018 01 07", "category": "Previous Year Papers", "count": 300}, {"file": "NEET_PG_2019.json", "title": "Neet Pg 2019", "category": "Previous Year Papers", "count": 299}, {"file": "NEET_PG_2019_-_2019-01-06.json", "title": "Neet Pg 2019   2019 01 06", "category": "Previous Year Papers", "count": 300}, {"file": "NEET_PG_2020.json", "title": "Neet Pg 2020", "category": "Previous Year Papers", "count": 298}, {"file": "NEET_PG_2020_-_2020-01-05.json", "title": "Neet Pg 2020   2020 01 05", "category": "Previous Year Papers", "count": 300}, {"file": "NEET_PG_2021.json", "title": "Neet Pg 2021", "category": "Previous Year Papers", "count": 200}, {"file": "NEET_PG_2021_-_2021-09-11.json", "title": "Neet Pg 2021   2021 09 11", "category": "Previous Year Papers", "count": 200}, {"file": "NEET_PG_2022.json", "title": "Neet Pg 2022", "category": "Previous Year Papers", "count": 200}, {"file": "NEET_PG_2022_-_2022-05-21.json", "title": "Neet Pg 2022   2022 05 21", "category": "Previous Year Papers", "count": 200}, {"file": "NEET_PG_2023.json", "title": "Neet Pg 2023", "category": "Previous Year Papers", "count": 200}, {"file": "NEET_PG_2023_-_2023-03-05.json", "title": "Neet Pg 2023   2023 03 05", "category": "Previous Year Papers", "count": 200}, {"file": "NEET_PG_2023_5_Sections.json", "title": "Neet Pg 2023 5 Sections", "category": "Previous Year Papers", "count": 200}, {"file": "NEET_PG_2024_-_Session_1_-_2024-08-11.json", "title": "Neet Pg 2024   Session 1   2024 08 11", "category": "Previous Year Papers", "count": 200}, {"file": "NEET_PG_2024_-_Session_2_-_2024-08-11.json", "title": "Neet Pg 2024   Session 2   2024 08 11", "category": "Previous Year Papers", "count": 200}, {"file": "NEET_PG_2024_Paper_Part-A_5_Sections.json", "title": "Neet Pg 2024 Paper Part A 5 Sections", "category": "Previous Year Papers", "count": 200}, {"file": "NEET_PG_2024_Paper_Part-B_5_Sections.json", "title": "Neet Pg 2024 Paper Part B 5 Sections", "category": "Previous Year Papers", "count": 200}, {"file": "NEET_PG_August_2024_Evening_Batch.json", "title": "Neet Pg August 2024 Evening Batch", "category": "Previous Year Papers", "count": 200}, {"file": "NEET_PG_August_2024_Morning_Batch.json", "title": "Neet Pg August 2024 Morning Batch", "category": "Previous Year Papers", "count": 200}, {"file": "NEET_PG_Champions_Exam__22nd_May_2024__MAY_2024____1__.json", "title": "Neet Pg Champions Exam  22Nd May 2024  May 2024    1  ", "category": "Previous Year Papers", "count": 200}, {"file": "NEET_PG_Grand_Test_01__10th_May_2023__MAY_2023____1__.json", "title": "Neet Pg Grand Test 01  10Th May 2023  May 2023    1  ", "category": "Previous Year Papers", "count": 200}, {"file": "NEET_PG_Grand_Test_01__24th_Mar_2021__MARCH_2021____1__.json", "title": "Neet Pg Grand Test 01  24Th Mar 2021  March 2021    1  ", "category": "Previous Year Papers", "count": 200}, {"file": "NEET_PG_Grand_Test_01__8th_Jun_2022__JUNE_2022____0__.json", "title": "Neet Pg Grand Test 01  8Th Jun 2022  June 2022    0  ", "category": "Previous Year Papers", "count": 200}, {"file": "NEET_PG_Grand_Test_02__19th_Jul_2023__JULY_2023____1__.json", "title": "Neet Pg Grand Test 02  19Th Jul 2023  July 2023    1  ", "category": "Previous Year Papers", "count": 200}, {"file": "NEET_PG_Grand_Test_02__7th_Apr_2021__APRIL_2021____0__.json", "title": "Neet Pg Grand Test 02  7Th Apr 2021  April 2021    0  ", "category": "Previous Year Papers", "count": 200}, {"file": "NEET_PG_Grand_Test_03__10th_Aug_2022__AUGUST_2022____0__.json", "title": "Neet Pg Grand Test 03  10Th Aug 2022  August 2022    0  ", "category": "Previous Year Papers", "count": 200}, {"file": "NEET_PG_Grand_Test_03__20th_Sep_2023__SEPTEMBER_2023____1__.json", "title": "Neet Pg Grand Test 03  20Th Sep 2023  September 2023    1  ", "category": "Previous Year Papers", "count": 200}, {"file": "NEET_PG_Grand_Test_03__23rd_Apr_2021__APRIL_2021____1__.json", "title": "Neet Pg Grand Test 03  23Rd Apr 2021  April 2021    1  ", "category": "Previous Year Papers", "count": 200}, {"file": "NEET_PG_Grand_Test_04__14th_Sep_2022__SEPTEMBER_2022____0__.json", "title": "Neet Pg Grand Test 04  14Th Sep 2022  September 2022    0  ", "category": "Previous Year Papers", "count": 200}, {"file": "NEET_PG_Grand_Test_04__22nd_Nov_2023__NOVEMBER_2023____1__.json", "title": "Neet Pg Grand Test 04  22Nd Nov 2023  November 2023    1  ", "category": "Previous Year Papers", "count": 200}, {"file": "NEET_PG_Grand_Test_04__7th_May_2021__MAY_2021____1__.json", "title": "Neet Pg Grand Test 04  7Th May 2021  May 2021    1  ", "category": "Previous Year Papers", "count": 200}, {"file": "NEET_PG_Grand_Test_05__12th_May_2021__MAY_2021____1__.json", "title": "Neet Pg Grand Test 05  12Th May 2021  May 2021    1  ", "category": "Previous Year Papers", "count": 200}, {"file": "NEET_PG_Grand_Test_05__12th_Oct_2022__OCTOBER_2022____0__.json", "title": "Neet Pg Grand Test 05  12Th Oct 2022  October 2022    0  ", "category": "Previous Year Papers", "count": 200}, {"file": "NEET_PG_Grand_Test_05__15th_Jan_2025__JANUARY_2025____0__.json", "title": "Neet Pg Grand Test 05  15Th Jan 2025  January 2025    0  ", "category": "Previous Year Papers", "count": 200}, {"file": "NEET_PG_Grand_Test_05__20th_Dec_2023__DECEMBER_2023____1__.json", "title": "Neet Pg Grand Test 05  20Th Dec 2023  December 2023    1  ", "category": "Previous Year Papers", "count": 200}, {"file": "NEET_PG_Grand_Test_06__20th_Mar_2025__MARCH_2025____0__.json", "title": "Neet Pg Grand Test 06  20Th Mar 2025  March 2025    0  ", "category": "Previous Year Papers", "count": 200}, {"file": "NEET_PG_Grand_Test_06__21st_May_2021__MAY_2021____1__.json", "title": "Neet Pg Grand Test 06  21St May 2021  May 2021    1  ", "category": "Previous Year Papers", "count": 197}, {"file": "NEET_PG_Grand_Test_06__9th_Nov_2022__NOVEMBER_2022____0__.json", "title": "Neet Pg Grand Test 06  9Th Nov 2022  November 2022    0  ", "category": "Previous Year Papers", "count": 200}, {"file": "NEET_PG_Grand_Test_07__14th_Jul_2022__JULY_2022____0__.json", "title": "Neet Pg Grand Test 07  14Th Jul 2022  July 2022    0  ", "category": "Previous Year Papers", "count": 200}, {"file": "NEET_PG_Grand_Test_07__7th_Jul_2021__JULY_2021____0__.json", "title": "Neet Pg Grand Test 07  7Th Jul 2021  July 2021    0  ", "category": "Previous Year Papers", "count": 200}, {"file": "NEET_PG_Grand_Test_08__21st_Jul_2021__JULY_2021____0__.json", "title": "Neet Pg Grand Test 08  21St Jul 2021  July 2021    0  ", "category": "Previous Year Papers", "count": 200}, {"file": "NEET_PG_Grand_Test_08__28th_Dec_2022__DECEMBER_2022____0__.json", "title": "Neet Pg Grand Test 08  28Th Dec 2022  December 2022    0  ", "category": "Previous Year Papers", "count": 200}, {"file": "NEET_PG_Grand_Test_09__11th_Jan_2023__JANUARY_2023____0__.json", "title": "Neet Pg Grand Test 09  11Th Jan 2023  January 2023    0  ", "category": "Previous Year Papers", "count": 200}, {"file": "NEET_PG_Grand_Test_09__4th_Aug_2021__AUGUST_2021____0__.json", "title": "Neet Pg Grand Test 09  4Th Aug 2021  August 2021    0  ", "category": "Previous Year Papers", "count": 200}, {"file": "NEET_PG_Grand_Test_1__24th_Jan_2024__JANUARY_2024____0__.json", "title": "Neet Pg Grand Test 1  24Th Jan 2024  January 2024    0  ", "category": "Previous Year Papers", "count": 100}, {"file": "NEET_PG_Grand_Test_10__1st_Sep_2021__SEPTEMBER_2021____1__.json", "title": "Neet Pg Grand Test 10  1St Sep 2021  September 2021    1  ", "category": "Previous Year Papers", "count": 200}, {"file": "NEET_PG_Grand_Test_11__29th_Sep_2021__SEPTEMBER_2021____1__.json", "title": "Neet Pg Grand Test 11  29Th Sep 2021  September 2021    1  ", "category": "Previous Year Papers", "count": 200}, {"file": "NEET_PG_Grand_Test_12__24th_Nov_2021__NOVEMBER_2021____1__.json", "title": "Neet Pg Grand Test 12  24Th Nov 2021  November 2021    1  ", "category": "Previous Year Papers", "count": 200}, {"file": "NEET_PG_Grand_Test_13__8th_Dec_2021__DECEMBER_2021____0__.json", "title": "Neet Pg Grand Test 13  8Th Dec 2021  December 2021    0  ", "category": "Previous Year Papers", "count": 200}, {"file": "NEET_PG_Grand_Test_14__19th_Jan_2022__JANUARY_2022____0__.json", "title": "Neet Pg Grand Test 14  19Th Jan 2022  January 2022    0  ", "category": "Previous Year Papers", "count": 200}, {"file": "NEET_PG_Grand_Test_15__9th_Feb_2022__FEBRUARY_2022____0__.json", "title": "Neet Pg Grand Test 15  9Th Feb 2022  February 2022    0  ", "category": "Previous Year Papers", "count": 200}, {"file": "NEET_PG_Grand_Test_16__23rd_Feb_2022__FEBRUARY_2022____0__.json", "title": "Neet Pg Grand Test 16  23Rd Feb 2022  February 2022    0  ", "category": "Previous Year Papers", "count": 200}, {"file": "NEET_PG_Grand_Test_17__23rd_Mar_2022__MARCH_2022____0__.json", "title": "Neet Pg Grand Test 17  23Rd Mar 2022  March 2022    0  ", "category": "Previous Year Papers", "count": 200}, {"file": "NEET_PG_Grand_Test_18__13th_Apr_2022__APRIL_2022____0__.json", "title": "Neet Pg Grand Test 18  13Th Apr 2022  April 2022    0  ", "category": "Previous Year Papers", "count": 200}, {"file": "NEET_PG_Grand_Test_19__27th_Apr_2022__APRIL_2022____1__.json", "title": "Neet Pg Grand Test 19  27Th Apr 2022  April 2022    1  ", "category": "Previous Year Papers", "count": 200}, {"file": "NEET_PG_Grand_Test_2__13th_Jul_2022__JULY_2022____0__.json", "title": "Neet Pg Grand Test 2  13Th Jul 2022  July 2022    0  ", "category": "Previous Year Papers", "count": 200}, {"file": "NEET_PG_Grand_Test_2__14th_Feb_2024__FEBRUARY_2024____0__.json", "title": "Neet Pg Grand Test 2  14Th Feb 2024  February 2024    0  ", "category": "Previous Year Papers", "count": 200}, {"file": "NEET_PG_Grand_Test_4__13th_Nov_2024__NOVEMBER_2024____0__.json", "title": "Neet Pg Grand Test 4  13Th Nov 2024  November 2024    0  ", "category": "Previous Year Papers", "count": 200}, {"file": "NEET_PG_INI-CET_BASELINE_GRAND_TEST_-_31-08-2024_-_2024-08-31.json", "title": "Neet Pg Ini Cet Baseline Grand Test   31 08 2024   2024 08 31", "category": "Previous Year Papers", "count": 200}, {"file": "NEET_PG_Mock_1_5_Sections.json", "title": "Neet Pg Mock 1 5 Sections", "category": "Previous Year Papers", "count": 199}, {"file": "NEET_PG_Mock_1_5_Sections_1.json", "title": "Neet Pg Mock 1 5 Sections 1", "category": "Previous Year Papers", "count": 199}, {"file": "NEET_PG_Mock_1_Based_On_Clinical_Pattern.json", "title": "Neet Pg Mock 1 Based On Clinical Pattern", "category": "Previous Year Papers", "count": 200}, {"file": "NEET_PG_Mock_10_5_Section.json", "title": "Neet Pg Mock 10 5 Section", "category": "Previous Year Papers", "count": 200}, {"file": "NEET_PG_Mock_10_5_Section_1.json", "title": "Neet Pg Mock 10 5 Section 1", "category": "Previous Year Papers", "count": 200}, {"file": "NEET_PG_Mock_2_5_Sections.json", "title": "Neet Pg Mock 2 5 Sections", "category": "Previous Year Papers", "count": 200}, {"file": "NEET_PG_Mock_2_5_Sections_1.json", "title": "Neet Pg Mock 2 5 Sections 1", "category": "Previous Year Papers", "count": 200}, {"file": "NEET_PG_Mock_2_Based_On_Clinical_Pattern.json", "title": "Neet Pg Mock 2 Based On Clinical Pattern", "category": "Previous Year Papers", "count": 200}, {"file": "NEET_PG_Mock_3_5_Sections.json", "title": "Neet Pg Mock 3 5 Sections", "category": "Previous Year Papers", "count": 200}, {"file": "NEET_PG_Mock_3_5_Sections_1.json", "title": "Neet Pg Mock 3 5 Sections 1", "category": "Previous Year Papers", "count": 200}, {"file": "NEET_PG_Mock_4_5_Sections.json", "title": "Neet Pg Mock 4 5 Sections", "category": "Previous Year Papers", "count": 200}, {"file": "NEET_PG_Mock_4_5_Sections_1.json", "title": "Neet Pg Mock 4 5 Sections 1", "category": "Previous Year Papers", "count": 200}, {"file": "NEET_PG_Mock_5_5_Sections.json", "title": "Neet Pg Mock 5 5 Sections", "category": "Previous Year Papers", "count": 200}, {"file": "NEET_PG_Mock_5_5_Sections_1.json", "title": "Neet Pg Mock 5 5 Sections 1", "category": "Previous Year Papers", "count": 200}, {"file": "NEET_PG_Mock_6_5_Section.json", "title": "Neet Pg Mock 6 5 Section", "category": "Previous Year Papers", "count": 200}, {"file": "NEET_PG_Mock_6_5_Section_1.json", "title": "Neet Pg Mock 6 5 Section 1", "category": "Previous Year Papers", "count": 200}, {"file": "NEET_PG_Mock_7_5_Section.json", "title": "Neet Pg Mock 7 5 Section", "category": "Previous Year Papers", "count": 200}, {"file": "NEET_PG_Mock_7_5_Section_1.json", "title": "Neet Pg Mock 7 5 Section 1", "category": "Previous Year Papers", "count": 200}, {"file": "NEET_PG_Mock_8_5_Section.json", "title": "Neet Pg Mock 8 5 Section", "category": "Previous Year Papers", "count": 196}, {"file": "NEET_PG_Mock_8_5_Section_1.json", "title": "Neet Pg Mock 8 5 Section 1", "category": "Previous Year Papers", "count": 196}, {"file": "NEET_PG_Mock_9_5_Section.json", "title": "Neet Pg Mock 9 5 Section", "category": "Previous Year Papers", "count": 200}, {"file": "NEET_PG_Mock_9_5_Section_1.json", "title": "Neet Pg Mock 9 5 Section 1", "category": "Previous Year Papers", "count": 200}, {"file": "NEET_PG_PYQ_BASED_MOCK_TEST_-_30-07-2024_-_2024-07-30.json", "title": "Neet Pg Pyq Based Mock Test   30 07 2024   2024 07 30", "category": "Previous Year Papers", "count": 200}, {"file": "NEETPG_June_2024_Mock_Test-1_-_10-06-2024_-_2024-06-10.json", "title": "Neetpg June 2024 Mock Test 1   10 06 2024   2024 06 10", "category": "Previous Year Papers", "count": 200}, {"file": "NEETPG_Mock-1_Advanced_Difficulty_-_22-05-2025_-_2025-05-22.json", "title": "Neetpg Mock 1 Advanced Difficulty   22 05 2025   2025 05 22", "category": "Previous Year Papers", "count": 200}, {"file": "NEETPG_Mock-2_Standard_Difficulty_-_30-05-2025_-_2025-05-30.json", "title": "Neetpg Mock 2 Standard Difficulty   30 05 2025   2025 05 30", "category": "Previous Year Papers", "count": 200}, {"file": "NEETPG_Mock-3_Standard_Difficulty_-_15-06-2025_-_2025-06-15.json", "title": "Neetpg Mock 3 Standard Difficulty   15 06 2025   2025 06 15", "category": "Previous Year Papers", "count": 200}, {"file": "NEETPG_Mock-4_Standard_Difficulty_-_02-07-2025_-_2025-07-02.json", "title": "Neetpg Mock 4 Standard Difficulty   02 07 2025   2025 07 02", "category": "Previous Year Papers", "count": 200}, {"file": "NEETPG_Mock_Test_August.json", "title": "Neetpg Mock Test August", "category": "Previous Year Papers", "count": 200}, {"file": "OBG_-_AIIMS_JUNE_2020.json", "title": "Obg   Aiims June 2020", "category": "Previous Year Papers", "count": 15}, {"file": "OBG_-_AIIMS_MAY_2018.json", "title": "Obg   Aiims May 2018", "category": "Previous Year Papers", "count": 26}, {"file": "OBG_-_AIIMS_MAY_2019.json", "title": "Obg   Aiims May 2019", "category": "Previous Year Papers", "count": 15}, {"file": "OBG_-_AIIMS_NOV_2016.json", "title": "Obg   Aiims Nov 2016", "category": "Previous Year Papers", "count": 11}, {"file": "OBG_-_AIIMS_NOV_2018.json", "title": "Obg   Aiims Nov 2018", "category": "Previous Year Papers", "count": 11}, {"file": "OBG_-_AIIMS_NOV_2019.json", "title": "Obg   Aiims Nov 2019", "category": "Previous Year Papers", "count": 9}, {"file": "OBG_-_INICET_MAY_2024.json", "title": "Obg   Inicet May 2024", "category": "Previous Year Papers", "count": 14}, {"file": "OBG_-_NEET_PG_2018.json", "title": "Obg   Neet Pg 2018", "category": "Previous Year Papers", "count": 22}, {"file": "OBG_-_NEET_PG_2019.json", "title": "Obg   Neet Pg 2019", "category": "Previous Year Papers", "count": 25}, {"file": "OBG_-_NEET_PG_2020.json", "title": "Obg   Neet Pg 2020", "category": "Previous Year Papers", "count": 20}, {"file": "OBG_-_NEET_PG_2021.json", "title": "Obg   Neet Pg 2021", "category": "Previous Year Papers", "count": 17}, {"file": "OBG_-_NEET_PG_2022.json", "title": "Obg   Neet Pg 2022", "category": "Previous Year Papers", "count": 25}, {"file": "OBG_-_NEET_PG_2023.json", "title": "Obg   Neet Pg 2023", "category": "Previous Year Papers", "count": 17}, {"file": "OBG_-_NEET_PG_2024.json", "title": "Obg   Neet Pg 2024", "category": "Previous Year Papers", "count": 45}, {"file": "OBG_ED_-_Mission_20_INICET_-_19-10-2024_-_2024-10-19.json", "title": "Obg Ed   Mission 20 Inicet   19 10 2024   2024 10 19", "category": "Previous Year Papers", "count": 150}, {"file": "OBG_ED_Mission_NEET_PG_-_04-08-2023_-_2023-08-04.json", "title": "Obg Ed Mission Neet Pg   04 08 2023   2023 08 04", "category": "Previous Year Papers", "count": 75}, {"file": "OBG_ED_Mission_NEET_PG_INICET_20_-_16-07-2024_-_2024-07-16.json", "title": "Obg Ed Mission Neet Pg Inicet 20   16 07 2024   2024 07 16", "category": "Previous Year Papers", "count": 100}, {"file": "OBG-INICET_NOV_2024.json", "title": "Obg Inicet Nov 2024", "category": "Previous Year Papers", "count": 16}, {"file": "OBG_NEET_PG_Revision_ED_-_16-01-2024_-_2024-01-16.json", "title": "Obg Neet Pg Revision Ed   16 01 2024   2024 01 16", "category": "Previous Year Papers", "count": 50}, {"file": "Obstetrics_AIIMS_2014-2018.json", "title": "Obstetrics Aiims 2014 2018", "category": "Previous Year Papers", "count": 89}, {"file": "Obstetrics_DR_Deepti_Class_Test_FMGE.json", "title": "Obstetrics Dr Deepti Class Test Fmge", "category": "Previous Year Papers", "count": 50}, {"file": "Obstetrics_FMGE_PYQ.json", "title": "Obstetrics Fmge Pyq", "category": "Previous Year Papers", "count": 97}, {"file": "Obstetrics_INICET_PYQ.json", "title": "Obstetrics Inicet Pyq", "category": "Previous Year Papers", "count": 164}, {"file": "Obstetrics_NEETPG_PYQ.json", "title": "Obstetrics Neetpg Pyq", "category": "Previous Year Papers", "count": 106}, {"file": "Ophthalmology_-_AIIMS_JUNE_2020.json", "title": "Ophthalmology   Aiims June 2020", "category": "Previous Year Papers", "count": 6}, {"file": "Ophthalmology_-_AIIMS_MAY_2018.json", "title": "Ophthalmology   Aiims May 2018", "category": "Previous Year Papers", "count": 12}, {"file": "Ophthalmology_-_AIIMS_MAY_2019.json", "title": "Ophthalmology   Aiims May 2019", "category": "Previous Year Papers", "count": 7}, {"file": "Ophthalmology_-_AIIMS_NOV_2018.json", "title": "Ophthalmology   Aiims Nov 2018", "category": "Previous Year Papers", "count": 7}, {"file": "Ophthalmology_-_AIIMS_NOV_2019.json", "title": "Ophthalmology   Aiims Nov 2019", "category": "Previous Year Papers", "count": 8}, {"file": "Ophthalmology_-_INICET_MAY_2024.json", "title": "Ophthalmology   Inicet May 2024", "category": "Previous Year Papers", "count": 11}, {"file": "Ophthalmology_-_NEET_PG_2018.json", "title": "Ophthalmology   Neet Pg 2018", "category": "Previous Year Papers", "count": 12}, {"file": "Ophthalmology_-_NEET_PG_2019.json", "title": "Ophthalmology   Neet Pg 2019", "category": "Previous Year Papers", "count": 12}, {"file": "Ophthalmology_-_NEET_PG_2020.json", "title": "Ophthalmology   Neet Pg 2020", "category": "Previous Year Papers", "count": 13}, {"file": "Ophthalmology_-_NEET_PG_2021.json", "title": "Ophthalmology   Neet Pg 2021", "category": "Previous Year Papers", "count": 10}, {"file": "Ophthalmology_-_NEET_PG_2022.json", "title": "Ophthalmology   Neet Pg 2022", "category": "Previous Year Papers", "count": 5}, {"file": "Ophthalmology_-_NEET_PG_2023.json", "title": "Ophthalmology   Neet Pg 2023", "category": "Previous Year Papers", "count": 10}, {"file": "Ophthalmology_-_NEET_PG_2024.json", "title": "Ophthalmology   Neet Pg 2024", "category": "Previous Year Papers", "count": 14}, {"file": "Ophthalmology_AIIMS_2014-2018.json", "title": "Ophthalmology Aiims 2014 2018", "category": "Previous Year Papers", "count": 113}, {"file": "Ophthalmology_ED_-_Mission_20_INICET_-_14-10-2024_-_2024-10-14.json", "title": "Ophthalmology Ed   Mission 20 Inicet   14 10 2024   2024 10 14", "category": "Previous Year Papers", "count": 75}, {"file": "Ophthalmology_ED_Mission_NEET_PG_-_27-08-2023_-_2023-08-27.json", "title": "Ophthalmology Ed Mission Neet Pg   27 08 2023   2023 08 27", "category": "Previous Year Papers", "count": 50}, {"file": "Ophthalmology_ED_Mission_NEET_PG_INICET_20_-_12-07-2024_-_2024-07-12.json", "title": "Ophthalmology Ed Mission Neet Pg Inicet 20   12 07 2024   2024 07 12", "category": "Previous Year Papers", "count": 100}, {"file": "Ophthalmology_FMGE.json", "title": "Ophthalmology Fmge", "category": "Previous Year Papers", "count": 40}, {"file": "Ophthalmology-FMGE_PYQ.json", "title": "Ophthalmology Fmge Pyq", "category": "Previous Year Papers", "count": 137}, {"file": "OPHTHALMOLOGY-INICET_NOV_2024.json", "title": "Ophthalmology Inicet Nov 2024", "category": "Previous Year Papers", "count": 11}, {"file": "Ophthalmology_NEET_PG_Revision_ED_-_27-01-2024_-_2024-01-27.json", "title": "Ophthalmology Neet Pg Revision Ed   27 01 2024   2024 01 27", "category": "Previous Year Papers", "count": 50}, {"file": "Opthalmology_INICET_PYQ.json", "title": "Opthalmology Inicet Pyq", "category": "Previous Year Papers", "count": 141}, {"file": "Opthalmology_NEETPG_PYQ.json", "title": "Opthalmology Neetpg Pyq", "category": "Previous Year Papers", "count": 81}, {"file": "Orthopaedics_-_AIIMS_JUNE_2020.json", "title": "Orthopaedics   Aiims June 2020", "category": "Previous Year Papers", "count": 10}, {"file": "Orthopaedics_-_AIIMS_MAY_2018.json", "title": "Orthopaedics   Aiims May 2018", "category": "Previous Year Papers", "count": 8}, {"file": "Orthopaedics_-_AIIMS_MAY_2019.json", "title": "Orthopaedics   Aiims May 2019", "category": "Previous Year Papers", "count": 5}, {"file": "Orthopaedics_-_AIIMS_NOV_2018.json", "title": "Orthopaedics   Aiims Nov 2018", "category": "Previous Year Papers", "count": 8}, {"file": "Orthopaedics_-_AIIMS_NOV_2019.json", "title": "Orthopaedics   Aiims Nov 2019", "category": "Previous Year Papers", "count": 8}, {"file": "Orthopaedics_-_INICET_MAY_2024.json", "title": "Orthopaedics   Inicet May 2024", "category": "Previous Year Papers", "count": 6}, {"file": "Orthopaedics_-_NEET_PG_2018.json", "title": "Orthopaedics   Neet Pg 2018", "category": "Previous Year Papers", "count": 13}, {"file": "Orthopaedics_-_NEET_PG_2019.json", "title": "Orthopaedics   Neet Pg 2019", "category": "Previous Year Papers", "count": 12}, {"file": "Orthopaedics_-_NEET_PG_2020.json", "title": "Orthopaedics   Neet Pg 2020", "category": "Previous Year Papers", "count": 2}, {"file": "Orthopaedics_-_NEET_PG_2021.json", "title": "Orthopaedics   Neet Pg 2021", "category": "Previous Year Papers", "count": 4}, {"file": "Orthopaedics_-_NEET_PG_2022.json", "title": "Orthopaedics   Neet Pg 2022", "category": "Previous Year Papers", "count": 3}, {"file": "Orthopaedics_-_NEET_PG_2023.json", "title": "Orthopaedics   Neet Pg 2023", "category": "Previous Year Papers", "count": 5}, {"file": "Orthopaedics_-_NEET_PG_2024.json", "title": "Orthopaedics   Neet Pg 2024", "category": "Previous Year Papers", "count": 16}, {"file": "Orthopaedics_DR_Tushar_Class_Test_FMGE.json", "title": "Orthopaedics Dr Tushar Class Test Fmge", "category": "Previous Year Papers", "count": 40}, {"file": "Orthopaedics_INICET_PYQ.json", "title": "Orthopaedics Inicet Pyq", "category": "Previous Year Papers", "count": 86}, {"file": "Orthopedics_AIIMS_2014-2018.json", "title": "Orthopedics Aiims 2014 2018", "category": "Previous Year Papers", "count": 108}, {"file": "Orthopedics_ED_-_Mission_20_INICET_-_30-08-2024_-_2024-08-30.json", "title": "Orthopedics Ed   Mission 20 Inicet   30 08 2024   2024 08 30", "category": "Previous Year Papers", "count": 50}, {"file": "Orthopedics_ED_Mission_NEET_PG_-_14-07-2023_-_2023-07-14.json", "title": "Orthopedics Ed Mission Neet Pg   14 07 2023   2023 07 14", "category": "Previous Year Papers", "count": 50}, {"file": "Orthopedics_ED_Mission_NEET_PG_INICET_20_-_10-08-2024_-_2024-08-10.json", "title": "Orthopedics Ed Mission Neet Pg Inicet 20   10 08 2024   2024 08 10", "category": "Previous Year Papers", "count": 50}, {"file": "Orthopedics_FMGE_PYQ.json", "title": "Orthopedics Fmge Pyq", "category": "Previous Year Papers", "count": 41}, {"file": "ORTHOPEDICS-INICET_NOV_2024.json", "title": "Orthopedics Inicet Nov 2024", "category": "Previous Year Papers", "count": 5}, {"file": "Orthopedics_NEET_PG_Revision_ED_-_12-12-2023_-_2023-12-12.json", "title": "Orthopedics Neet Pg Revision Ed   12 12 2023   2023 12 12", "category": "Previous Year Papers", "count": 50}, {"file": "Orthopedics_NEETPG_PYQ.json", "title": "Orthopedics Neetpg Pyq", "category": "Previous Year Papers", "count": 41}, {"file": "Pathology_-_AIIMS_JUNE_2020.json", "title": "Pathology   Aiims June 2020", "category": "Previous Year Papers", "count": 12}, {"file": "Pathology_-_AIIMS_MAY_2018.json", "title": "Pathology   Aiims May 2018", "category": "Previous Year Papers", "count": 16}, {"file": "Pathology_-_AIIMS_MAY_2019.json", "title": "Pathology   Aiims May 2019", "category": "Previous Year Papers", "count": 14}, {"file": "Pathology_-_AIIMS_NOV_2018.json", "title": "Pathology   Aiims Nov 2018", "category": "Previous Year Papers", "count": 19}, {"file": "Pathology_-_AIIMS_NOV_2019.json", "title": "Pathology   Aiims Nov 2019", "category": "Previous Year Papers", "count": 19}, {"file": "Pathology_-_INICET_MAY_2024.json", "title": "Pathology   Inicet May 2024", "category": "Previous Year Papers", "count": 17}, {"file": "Pathology_-_NEET_PG_2018.json", "title": "Pathology   Neet Pg 2018", "category": "Previous Year Papers", "count": 24}, {"file": "Pathology_-_NEET_PG_2019.json", "title": "Pathology   Neet Pg 2019", "category": "Previous Year Papers", "count": 13}, {"file": "Pathology_-_NEET_PG_2020.json", "title": "Pathology   Neet Pg 2020", "category": "Previous Year Papers", "count": 26}, {"file": "Pathology_-_NEET_PG_2021.json", "title": "Pathology   Neet Pg 2021", "category": "Previous Year Papers", "count": 10}, {"file": "Pathology_-_NEET_PG_2022.json", "title": "Pathology   Neet Pg 2022", "category": "Previous Year Papers", "count": 9}, {"file": "Pathology_-_NEET_PG_2023.json", "title": "Pathology   Neet Pg 2023", "category": "Previous Year Papers", "count": 5}, {"file": "Pathology_-_NEET_PG_2024.json", "title": "Pathology   Neet Pg 2024", "category": "Previous Year Papers", "count": 33}, {"file": "Pathology_AIIMS_2014-2018.json", "title": "Pathology Aiims 2014 2018", "category": "Previous Year Papers", "count": 253}, {"file": "Pathology_ED_-_Mission_20_INICET_-_10-09-2024_-_2024-09-10.json", "title": "Pathology Ed   Mission 20 Inicet   10 09 2024   2024 09 10", "category": "Previous Year Papers", "count": 70}, {"file": "Pathology_ED_Mission_NEET_PG_-_14-10-2023_-_2023-10-14.json", "title": "Pathology Ed Mission Neet Pg   14 10 2023   2023 10 14", "category": "Previous Year Papers", "count": 50}, {"file": "Pathology_ED_Mission_NEET_PG_INICET_20_-_07-05-2024_-_2024-05-07.json", "title": "Pathology Ed Mission Neet Pg Inicet 20   07 05 2024   2024 05 07", "category": "Previous Year Papers", "count": 70}, {"file": "Pathology_FMGE_PYQ.json", "title": "Pathology Fmge Pyq", "category": "Previous Year Papers", "count": 113}, {"file": "Pathology_GenHemat_FMGE.json", "title": "Pathology Genhemat Fmge", "category": "Previous Year Papers", "count": 40}, {"file": "PATHOLOGY-INICET_NOV_2024.json", "title": "Pathology Inicet Nov 2024", "category": "Previous Year Papers", "count": 18}, {"file": "Pathology_INICET_PYQ.json", "title": "Pathology Inicet Pyq", "category": "Previous Year Papers", "count": 258}, {"file": "Pathology_NEET_PG_Revision_ED_-_24-11-2023_-_2023-11-24.json", "title": "Pathology Neet Pg Revision Ed   24 11 2023   2023 11 24", "category": "Previous Year Papers", "count": 50}, {"file": "Pathology_NEETPG_PYQ.json", "title": "Pathology Neetpg Pyq", "category": "Previous Year Papers", "count": 164}, {"file": "Pediatrics_-_AIIMS_JUNE_2020.json", "title": "Pediatrics   Aiims June 2020", "category": "Previous Year Papers", "count": 8}, {"file": "Pediatrics_-_AIIMS_MAY_2018.json", "title": "Pediatrics   Aiims May 2018", "category": "Previous Year Papers", "count": 15}, {"file": "Pediatrics_-_AIIMS_MAY_2019.json", "title": "Pediatrics   Aiims May 2019", "category": "Previous Year Papers", "count": 7}, {"file": "Pediatrics_-_AIIMS_NOV_2018.json", "title": "Pediatrics   Aiims Nov 2018", "category": "Previous Year Papers", "count": 7}, {"file": "Pediatrics_-_AIIMS_NOV_2019.json", "title": "Pediatrics   Aiims Nov 2019", "category": "Previous Year Papers", "count": 3}, {"file": "Pediatrics_-_INICET_MAY_2024.json", "title": "Pediatrics   Inicet May 2024", "category": "Previous Year Papers", "count": 10}, {"file": "Pediatrics_-_NEET_PG_2018.json", "title": "Pediatrics   Neet Pg 2018", "category": "Previous Year Papers", "count": 6}, {"file": "Pediatrics_-_NEET_PG_2019.json", "title": "Pediatrics   Neet Pg 2019", "category": "Previous Year Papers", "count": 8}, {"file": "Pediatrics_-_NEET_PG_2020.json", "title": "Pediatrics   Neet Pg 2020", "category": "Previous Year Papers", "count": 10}, {"file": "Pediatrics_-_NEET_PG_2021.json", "title": "Pediatrics   Neet Pg 2021", "category": "Previous Year Papers", "count": 7}, {"file": "Pediatrics_-_NEET_PG_2022.json", "title": "Pediatrics   Neet Pg 2022", "category": "Previous Year Papers", "count": 5}, {"file": "Pediatrics_-_NEET_PG_2023.json", "title": "Pediatrics   Neet Pg 2023", "category": "Previous Year Papers", "count": 14}, {"file": "Pediatrics_-_NEET_PG_2024.json", "title": "Pediatrics   Neet Pg 2024", "category": "Previous Year Papers", "count": 6}, {"file": "Pediatrics_AIIMS_2014-2018.json", "title": "Pediatrics Aiims 2014 2018", "category": "Previous Year Papers", "count": 110}, {"file": "Pediatrics_Dr_Ashutosh_Aggarwal__CT_FMGE.json", "title": "Pediatrics Dr Ashutosh Aggarwal  Ct Fmge", "category": "Previous Year Papers", "count": 40}, {"file": "Pediatrics_ED_-_Mission_20_INICET_-_22-10-2024_-_2024-10-22.json", "title": "Pediatrics Ed   Mission 20 Inicet   22 10 2024   2024 10 22", "category": "Previous Year Papers", "count": 75}, {"file": "Pediatrics_ED_Mission_NEET_PG_-_31-07-2023_-_2023-07-31.json", "title": "Pediatrics Ed Mission Neet Pg   31 07 2023   2023 07 31", "category": "Previous Year Papers", "count": 124}, {"file": "Pediatrics_ED_Mission_NEET_PG_INICET_20_-_06-06-2024_-_2024-06-06.json", "title": "Pediatrics Ed Mission Neet Pg Inicet 20   06 06 2024   2024 06 06", "category": "Previous Year Papers", "count": 100}, {"file": "Pediatrics_FMGE_PYQ.json", "title": "Pediatrics Fmge Pyq", "category": "Previous Year Papers", "count": 69}, {"file": "PEDIATRICS-INICET_NOV_2024.json", "title": "Pediatrics Inicet Nov 2024", "category": "Previous Year Papers", "count": 11}, {"file": "Pediatrics_INICET_PYQ.json", "title": "Pediatrics Inicet Pyq", "category": "Previous Year Papers", "count": 151}, {"file": "Pediatrics_NEET_PG_Revision_ED_-_19-01-2024_-_2024-01-19.json", "title": "Pediatrics Neet Pg Revision Ed   19 01 2024   2024 01 19", "category": "Previous Year Papers", "count": 100}, {"file": "Pediatrics_NEETPG_PYQ.json", "title": "Pediatrics Neetpg Pyq", "category": "Previous Year Papers", "count": 38}, {"file": "Pharmacology_-_AIIMS_JUNE_2020.json", "title": "Pharmacology   Aiims June 2020", "category": "Previous Year Papers", "count": 22}, {"file": "Pharmacology_-_AIIMS_MAY_2018.json", "title": "Pharmacology   Aiims May 2018", "category": "Previous Year Papers", "count": 27}, {"file": "Pharmacology_-_AIIMS_MAY_2019.json", "title": "Pharmacology   Aiims May 2019", "category": "Previous Year Papers", "count": 11}, {"file": "Pharmacology_-_AIIMS_NOV_2018.json", "title": "Pharmacology   Aiims Nov 2018", "category": "Previous Year Papers", "count": 24}, {"file": "Pharmacology_-_AIIMS_NOV_2019.json", "title": "Pharmacology   Aiims Nov 2019", "category": "Previous Year Papers", "count": 17}, {"file": "Pharmacology_-_INICET_MAY_2024.json", "title": "Pharmacology   Inicet May 2024", "category": "Previous Year Papers", "count": 13}, {"file": "Pharmacology_-_NEET_PG_2018.json", "title": "Pharmacology   Neet Pg 2018", "category": "Previous Year Papers", "count": 22}, {"file": "Pharmacology_-_NEET_PG_2019.json", "title": "Pharmacology   Neet Pg 2019", "category": "Previous Year Papers", "count": 29}, {"file": "Pharmacology_-_NEET_PG_2020.json", "title": "Pharmacology   Neet Pg 2020", "category": "Previous Year Papers", "count": 19}, {"file": "Pharmacology_-_NEET_PG_2021.json", "title": "Pharmacology   Neet Pg 2021", "category": "Previous Year Papers", "count": 21}, {"file": "Pharmacology_-_NEET_PG_2022.json", "title": "Pharmacology   Neet Pg 2022", "category": "Previous Year Papers", "count": 18}, {"file": "Pharmacology_-_NEET_PG_2023.json", "title": "Pharmacology   Neet Pg 2023", "category": "Previous Year Papers", "count": 6}, {"file": "Pharmacology_-_NEET_PG_2024.json", "title": "Pharmacology   Neet Pg 2024", "category": "Previous Year Papers", "count": 24}, {"file": "Pharmacology_AIIMS_2014-2018.json", "title": "Pharmacology Aiims 2014 2018", "category": "Previous Year Papers", "count": 207}, {"file": "Pharmacology_ED_-_Mission_20_INICET_-_08-09-2024_-_2024-09-07.json", "title": "Pharmacology Ed   Mission 20 Inicet   08 09 2024   2024 09 07", "category": "Previous Year Papers", "count": 75}, {"file": "Pharmacology_ED_1_Mission_NEET_PG_10_-_27-09-2023_-_2023-09-27.json", "title": "Pharmacology Ed 1 Mission Neet Pg 10   27 09 2023   2023 09 27", "category": "Previous Year Papers", "count": 50}, {"file": "Pharmacology_ED_Mission_NEET_PG_INICET_20_-_26-05-2024_-_2024-05-26.json", "title": "Pharmacology Ed Mission Neet Pg Inicet 20   26 05 2024   2024 05 26", "category": "Previous Year Papers", "count": 100}, {"file": "Pharmacology_FMGE.json", "title": "Pharmacology Fmge", "category": "Previous Year Papers", "count": 60}, {"file": "Pharmacology_FMGE_PYQ.json", "title": "Pharmacology Fmge Pyq", "category": "Previous Year Papers", "count": 152}, {"file": "PHARMACOLOGY-INICET_NOV_2024.json", "title": "Pharmacology Inicet Nov 2024", "category": "Previous Year Papers", "count": 10}, {"file": "Pharmacology_INICET_PYQ.json", "title": "Pharmacology Inicet Pyq", "category": "Previous Year Papers", "count": 272}, {"file": "Pharmacology_NEETPG_PYQ.json", "title": "Pharmacology Neetpg Pyq", "category": "Previous Year Papers", "count": 192}, {"file": "Pharmacology_Revision_ED_2_Mission_NEET_PG_10_-_17-11-2023_-_2023-11-17.json", "title": "Pharmacology Revision Ed 2 Mission Neet Pg 10   17 11 2023   2023 11 17", "category": "Previous Year Papers", "count": 50}, {"file": "Physiology_-_AIIMS_JUNE_2020.json", "title": "Physiology   Aiims June 2020", "category": "Previous Year Papers", "count": 11}, {"file": "Physiology_-_AIIMS_MAY_2018.json", "title": "Physiology   Aiims May 2018", "category": "Previous Year Papers", "count": 8}, {"file": "Physiology_-_AIIMS_MAY_2019.json", "title": "Physiology   Aiims May 2019", "category": "Previous Year Papers", "count": 14}, {"file": "Physiology_-_AIIMS_NOV_2018.json", "title": "Physiology   Aiims Nov 2018", "category": "Previous Year Papers", "count": 10}, {"file": "Physiology_-_AIIMS_NOV_2019.json", "title": "Physiology   Aiims Nov 2019", "category": "Previous Year Papers", "count": 5}, {"file": "Physiology_-_INICET_MAY_2024.json", "title": "Physiology   Inicet May 2024", "category": "Previous Year Papers", "count": 11}, {"file": "Physiology_-_NEET_PG_2018.json", "title": "Physiology   Neet Pg 2018", "category": "Previous Year Papers", "count": 16}, {"file": "Physiology_-_NEET_PG_2019.json", "title": "Physiology   Neet Pg 2019", "category": "Previous Year Papers", "count": 20}, {"file": "Physiology_-_NEET_PG_2020.json", "title": "Physiology   Neet Pg 2020", "category": "Previous Year Papers", "count": 25}, {"file": "Physiology_-_NEET_PG_2021.json", "title": "Physiology   Neet Pg 2021", "category": "Previous Year Papers", "count": 9}, {"file": "Physiology_-_NEET_PG_2022.json", "title": "Physiology   Neet Pg 2022", "category": "Previous Year Papers", "count": 10}, {"file": "Physiology_-_NEET_PG_2023.json", "title": "Physiology   Neet Pg 2023", "category": "Previous Year Papers", "count": 11}, {"file": "Physiology_-_NEET_PG_2024.json", "title": "Physiology   Neet Pg 2024", "category": "Previous Year Papers", "count": 16}, {"file": "Physiology_AIIMS_2014-2018.json", "title": "Physiology Aiims 2014 2018", "category": "Previous Year Papers", "count": 128}, {"file": "Physiology_Dr_Kamal_FMGE_CT.json", "title": "Physiology Dr Kamal Fmge Ct", "category": "Previous Year Papers", "count": 40}, {"file": "Physiology_ED_-_Mission_20_INICET_-_13-09-2024_-_2024-09-13.json", "title": "Physiology Ed   Mission 20 Inicet   13 09 2024   2024 09 13", "category": "Previous Year Papers", "count": 100}, {"file": "Physiology_ED_Mission_NEET_PG_-_04-10-2023_-_2023-10-04.json", "title": "Physiology Ed Mission Neet Pg   04 10 2023   2023 10 04", "category": "Previous Year Papers", "count": 100}, {"file": "Physiology_ED_Mission_NEET_PG_INICET_20_-_27-06-2024_-_2024-06-27.json", "title": "Physiology Ed Mission Neet Pg Inicet 20   27 06 2024   2024 06 27", "category": "Previous Year Papers", "count": 100}, {"file": "Physiology_FMGE_Dr_Prem.json", "title": "Physiology Fmge Dr Prem", "category": "Previous Year Papers", "count": 40}, {"file": "Physiology_FMGE_PYQ.json", "title": "Physiology Fmge Pyq", "category": "Previous Year Papers", "count": 73}, {"file": "PHYSIOLOGY-INICET_NOV_2024.json", "title": "Physiology Inicet Nov 2024", "category": "Previous Year Papers", "count": 10}, {"file": "Physiology_INICET_PYQ.json", "title": "Physiology Inicet Pyq", "category": "Previous Year Papers", "count": 154}, {"file": "Physiology_NEET_PG_Revision_ED_-_21-11-2023_-_2023-11-21.json", "title": "Physiology Neet Pg Revision Ed   21 11 2023   2023 11 21", "category": "Previous Year Papers", "count": 100}, {"file": "Physiology_NEET_PG_Revision_ED_-_26-11-2023_-_2023-11-26.json", "title": "Physiology Neet Pg Revision Ed   26 11 2023   2023 11 26", "category": "Previous Year Papers", "count": 50}, {"file": "Physiology_NEETPG_PYQ.json", "title": "Physiology Neetpg Pyq", "category": "Previous Year Papers", "count": 69}, {"file": "PSM_-_AIIMS_JUNE_2020.json", "title": "Psm   Aiims June 2020", "category": "Previous Year Papers", "count": 16}, {"file": "PSM_-_AIIMS_MAY_2018.json", "title": "Psm   Aiims May 2018", "category": "Previous Year Papers", "count": 9}, {"file": "PSM_-_AIIMS_MAY_2019.json", "title": "Psm   Aiims May 2019", "category": "Previous Year Papers", "count": 14}, {"file": "PSM_-_AIIMS_NOV_2018.json", "title": "Psm   Aiims Nov 2018", "category": "Previous Year Papers", "count": 16}, {"file": "PSM_-_AIIMS_NOV_2019.json", "title": "Psm   Aiims Nov 2019", "category": "Previous Year Papers", "count": 24}, {"file": "PSM_-_INICET_MAY_2024.json", "title": "Psm   Inicet May 2024", "category": "Previous Year Papers", "count": 7}, {"file": "PSM_-_NEET_PG_2018.json", "title": "Psm   Neet Pg 2018", "category": "Previous Year Papers", "count": 20}, {"file": "PSM_-_NEET_PG_2019.json", "title": "Psm   Neet Pg 2019", "category": "Previous Year Papers", "count": 25}, {"file": "PSM_-_NEET_PG_2020.json", "title": "Psm   Neet Pg 2020", "category": "Previous Year Papers", "count": 18}, {"file": "PSM_-_NEET_PG_2021.json", "title": "Psm   Neet Pg 2021", "category": "Previous Year Papers", "count": 15}, {"file": "PSM_-_NEET_PG_2022.json", "title": "Psm   Neet Pg 2022", "category": "Previous Year Papers", "count": 12}, {"file": "PSM_-_NEET_PG_2023.json", "title": "Psm   Neet Pg 2023", "category": "Previous Year Papers", "count": 8}, {"file": "PSM_-_NEET_PG_2024.json", "title": "Psm   Neet Pg 2024", "category": "Previous Year Papers", "count": 33}, {"file": "PSM_AIIMS_2014-2018.json", "title": "Psm Aiims 2014 2018", "category": "Previous Year Papers", "count": 167}, {"file": "PSM_ED_-_Mission_20_INICET_-_09-10-2024_-_2024-10-09.json", "title": "Psm Ed   Mission 20 Inicet   09 10 2024   2024 10 09", "category": "Previous Year Papers", "count": 100}, {"file": "PSM_ED_-_Mission_NEET_PG_20_-_Final_Batch_-_13-06-2025_-_2025-06-13.json", "title": "Psm Ed   Mission Neet Pg 20   Final Batch   13 06 2025   2025 06 13", "category": "Previous Year Papers", "count": 75}, {"file": "PSM_ED_Mission_NEET_PG_-_21-09-2023_-_2023-09-21.json", "title": "Psm Ed Mission Neet Pg   21 09 2023   2023 09 21", "category": "Previous Year Papers", "count": 50}, {"file": "PSM_ED_Mission_NEET_PG_INICET_20_-_07-08-2024_-_2024-08-07.json", "title": "Psm Ed Mission Neet Pg Inicet 20   07 08 2024   2024 08 07", "category": "Previous Year Papers", "count": 100}, {"file": "PSM_FMGE.json", "title": "Psm Fmge", "category": "Previous Year Papers", "count": 40}, {"file": "PSM_FMGE_PYQ.json", "title": "Psm Fmge Pyq", "category": "Previous Year Papers", "count": 167}, {"file": "PSM-INICET_NOV_2024.json", "title": "Psm Inicet Nov 2024", "category": "Previous Year Papers", "count": 17}, {"file": "PSM_INICET_PYQ.json", "title": "Psm Inicet Pyq", "category": "Previous Year Papers", "count": 194}, {"file": "PSM_NEET_PG_Revision_ED_-_17-12-2023_-_2023-12-17.json", "title": "Psm Neet Pg Revision Ed   17 12 2023   2023 12 17", "category": "Previous Year Papers", "count": 42}, {"file": "PSM_NEETPG_PYQ.json", "title": "Psm Neetpg Pyq", "category": "Previous Year Papers", "count": 133}, {"file": "Psychiatry_-_AIIMS_JUNE_2020.json", "title": "Psychiatry   Aiims June 2020", "category": "Previous Year Papers", "count": 2}, {"file": "Psychiatry_-_AIIMS_MAY_2018.json", "title": "Psychiatry   Aiims May 2018", "category": "Previous Year Papers", "count": 5}, {"file": "Psychiatry_-_AIIMS_MAY_2019.json", "title": "Psychiatry   Aiims May 2019", "category": "Previous Year Papers", "count": 6}, {"file": "Psychiatry_-_AIIMS_NOV_2018.json", "title": "Psychiatry   Aiims Nov 2018", "category": "Previous Year Papers", "count": 7}, {"file": "Psychiatry_-_AIIMS_NOV_2019.json", "title": "Psychiatry   Aiims Nov 2019", "category": "Previous Year Papers", "count": 4}, {"file": "Psychiatry_-_INICET_MAY_2024.json", "title": "Psychiatry   Inicet May 2024", "category": "Previous Year Papers", "count": 6}, {"file": "Psychiatry_-_NEET_PG_2018.json", "title": "Psychiatry   Neet Pg 2018", "category": "Previous Year Papers", "count": 12}, {"file": "Psychiatry_-_NEET_PG_2019.json", "title": "Psychiatry   Neet Pg 2019", "category": "Previous Year Papers", "count": 9}, {"file": "Psychiatry_-_NEET_PG_2020.json", "title": "Psychiatry   Neet Pg 2020", "category": "Previous Year Papers", "count": 4}, {"file": "Psychiatry_-_NEET_PG_2021.json", "title": "Psychiatry   Neet Pg 2021", "category": "Previous Year Papers", "count": 5}, {"file": "Psychiatry_-_NEET_PG_2022.json", "title": "Psychiatry   Neet Pg 2022", "category": "Previous Year Papers", "count": 2}, {"file": "Psychiatry_-_NEET_PG_2023.json", "title": "Psychiatry   Neet Pg 2023", "category": "Previous Year Papers", "count": 4}, {"file": "Psychiatry_-_NEET_PG_2024.json", "title": "Psychiatry   Neet Pg 2024", "category": "Previous Year Papers", "count": 10}, {"file": "Psychiatry_AIIMS_2014-2018.json", "title": "Psychiatry Aiims 2014 2018", "category": "Previous Year Papers", "count": 67}, {"file": "Psychiatry_Dr_Sachin_FMGE_CT.json", "title": "Psychiatry Dr Sachin Fmge Ct", "category": "Previous Year Papers", "count": 40}, {"file": "Psychiatry_ED_-_Mission_20_INICET_-_11-10-2024_-_2024-10-11.json", "title": "Psychiatry Ed   Mission 20 Inicet   11 10 2024   2024 10 11", "category": "Previous Year Papers", "count": 75}, {"file": "Psychiatry_ED_Mission_NEET_PG_-_05-07-2023_-_2023-07-05.json", "title": "Psychiatry Ed Mission Neet Pg   05 07 2023   2023 07 05", "category": "Previous Year Papers", "count": 50}, {"file": "Psychiatry_ED_Mission_NEET_PG_INICET_20_-_23-04-2024_-_2024-04-23.json", "title": "Psychiatry Ed Mission Neet Pg Inicet 20   23 04 2024   2024 04 23", "category": "Previous Year Papers", "count": 75}, {"file": "Psychiatry_FMGE_PYQ.json", "title": "Psychiatry Fmge Pyq", "category": "Previous Year Papers", "count": 65}, {"file": "PSYCHIATRY-INICET_NOV_2024.json", "title": "Psychiatry Inicet Nov 2024", "category": "Previous Year Papers", "count": 1}, {"file": "Psychiatry_INICET_PYQ.json", "title": "Psychiatry Inicet Pyq", "category": "Previous Year Papers", "count": 106}, {"file": "Psychiatry_NEETPG_PYQ.json", "title": "Psychiatry Neetpg Pyq", "category": "Previous Year Papers", "count": 51}, {"file": "Radiology_-_AIIMS_JUNE_2020.json", "title": "Radiology   Aiims June 2020", "category": "Previous Year Papers", "count": 4}, {"file": "Radiology_-_AIIMS_MAY_2018.json", "title": "Radiology   Aiims May 2018", "category": "Previous Year Papers", "count": 3}, {"file": "Radiology_-_AIIMS_MAY_2019.json", "title": "Radiology   Aiims May 2019", "category": "Previous Year Papers", "count": 5}, {"file": "Radiology_-_AIIMS_NOV_2018.json", "title": "Radiology   Aiims Nov 2018", "category": "Previous Year Papers", "count": 5}, {"file": "Radiology_-_AIIMS_NOV_2019.json", "title": "Radiology   Aiims Nov 2019", "category": "Previous Year Papers", "count": 3}, {"file": "Radiology_-_INICET_MAY_2024.json", "title": "Radiology   Inicet May 2024", "category": "Previous Year Papers", "count": 7}, {"file": "Radiology_-_NEET_PG_2018.json", "title": "Radiology   Neet Pg 2018", "category": "Previous Year Papers", "count": 10}, {"file": "Radiology_-_NEET_PG_2019.json", "title": "Radiology   Neet Pg 2019", "category": "Previous Year Papers", "count": 15}, {"file": "Radiology_-_NEET_PG_2020.json", "title": "Radiology   Neet Pg 2020", "category": "Previous Year Papers", "count": 14}, {"file": "Radiology_-_NEET_PG_2021.json", "title": "Radiology   Neet Pg 2021", "category": "Previous Year Papers", "count": 9}, {"file": "Radiology_-_NEET_PG_2022.json", "title": "Radiology   Neet Pg 2022", "category": "Previous Year Papers", "count": 4}, {"file": "Radiology_-_NEET_PG_2023.json", "title": "Radiology   Neet Pg 2023", "category": "Previous Year Papers", "count": 9}, {"file": "Radiology_-_NEET_PG_2024.json", "title": "Radiology   Neet Pg 2024", "category": "Previous Year Papers", "count": 15}, {"file": "Radiology_AIIMS_2014-2018.json", "title": "Radiology Aiims 2014 2018", "category": "Previous Year Papers", "count": 80}, {"file": "Radiology_Dr_Sumer_FMGE_CT.json", "title": "Radiology Dr Sumer Fmge Ct", "category": "Previous Year Papers", "count": 60}, {"file": "Radiology_ED_-_Mission_20_INICET_-_28-08-2024_-_2024-08-28.json", "title": "Radiology Ed   Mission 20 Inicet   28 08 2024   2024 08 28", "category": "Previous Year Papers", "count": 60}, {"file": "Radiology_ED_Mission_NEET_PG_-_17-07-2023_-_2023-07-17.json", "title": "Radiology Ed Mission Neet Pg   17 07 2023   2023 07 17", "category": "Previous Year Papers", "count": 50}, {"file": "Radiology_ED_Mission_NEET_PG_INICET_20_-_20-07-2024_-_2024-07-20.json", "title": "Radiology Ed Mission Neet Pg Inicet 20   20 07 2024   2024 07 20", "category": "Previous Year Papers", "count": 50}, {"file": "Radiology_FMGE_PYQ.json", "title": "Radiology Fmge Pyq", "category": "Previous Year Papers", "count": 84}, {"file": "RADIOLOGY-INICET_NOV_2024.json", "title": "Radiology Inicet Nov 2024", "category": "Previous Year Papers", "count": 3}, {"file": "Radiology_INICET_PYQ.json", "title": "Radiology Inicet Pyq", "category": "Previous Year Papers", "count": 117}, {"file": "Radiology_NEET_PG_PYQ.json", "title": "Radiology Neet Pg Pyq", "category": "Previous Year Papers", "count": 90}, {"file": "Radiology_NEET_PG_Revision_ED_-_10-12-2023_-_2023-12-10.json", "title": "Radiology Neet Pg Revision Ed   10 12 2023   2023 12 10", "category": "Previous Year Papers", "count": 50}, {"file": "Surgery_-_AIIMS_JUNE_2020.json", "title": "Surgery   Aiims June 2020", "category": "Previous Year Papers", "count": 14}, {"file": "Surgery_-_AIIMS_MAY_2018.json", "title": "Surgery   Aiims May 2018", "category": "Previous Year Papers", "count": 16}, {"file": "Surgery_-_AIIMS_MAY_2019.json", "title": "Surgery   Aiims May 2019", "category": "Previous Year Papers", "count": 20}, {"file": "Surgery_-_AIIMS_NOV_2018.json", "title": "Surgery   Aiims Nov 2018", "category": "Previous Year Papers", "count": 13}, {"file": "Surgery_-_AIIMS_NOV_2019.json", "title": "Surgery   Aiims Nov 2019", "category": "Previous Year Papers", "count": 11}, {"file": "Surgery_-_INICET_MAY_2024.json", "title": "Surgery   Inicet May 2024", "category": "Previous Year Papers", "count": 16}, {"file": "Surgery_-_NEET_PG_-2023.json", "title": "Surgery   Neet Pg  2023", "category": "Previous Year Papers", "count": 22}, {"file": "Surgery_-_NEET_PG_2018.json", "title": "Surgery   Neet Pg 2018", "category": "Previous Year Papers", "count": 17}, {"file": "Surgery_-_NEET_PG_2019.json", "title": "Surgery   Neet Pg 2019", "category": "Previous Year Papers", "count": 23}, {"file": "Surgery_-_NEET_PG_2020.json", "title": "Surgery   Neet Pg 2020", "category": "Previous Year Papers", "count": 26}, {"file": "Surgery_-_NEET_PG_2021.json", "title": "Surgery   Neet Pg 2021", "category": "Previous Year Papers", "count": 19}, {"file": "Surgery_-_NEET_PG_2022.json", "title": "Surgery   Neet Pg 2022", "category": "Previous Year Papers", "count": 24}, {"file": "Surgery_-_NEET_PG_2024.json", "title": "Surgery   Neet Pg 2024", "category": "Previous Year Papers", "count": 37}, {"file": "Surgery_ED_-_Mission_20_INICET_-_03-09-2024_-_2024-09-03.json", "title": "Surgery Ed   Mission 20 Inicet   03 09 2024   2024 09 03", "category": "Previous Year Papers", "count": 100}, {"file": "Surgery_ED_Mission_NEET_PG_INICET_20_-_29-07-2024_-_2024-07-29.json", "title": "Surgery Ed Mission Neet Pg Inicet 20   29 07 2024   2024 07 29", "category": "Previous Year Papers", "count": 100}, {"file": "Surgery_ED_Part-1_Mission_NEET_PG_-_01-09-2023_-_2023-09-01.json", "title": "Surgery Ed Part 1 Mission Neet Pg   01 09 2023   2023 09 01", "category": "Previous Year Papers", "count": 60}, {"file": "Surgery_ED_Part-2_Mission_NEET_PG_-_08-09-2023_-_2023-09-08.json", "title": "Surgery Ed Part 2 Mission Neet Pg   08 09 2023   2023 09 08", "category": "Previous Year Papers", "count": 60}, {"file": "Surgery_FMGE_PYQ.json", "title": "Surgery Fmge Pyq", "category": "Previous Year Papers", "count": 187}, {"file": "Surgery_GIT_HBP_Dr_RAJEEV__FMGE_CT.json", "title": "Surgery Git Hbp Dr Rajeev  Fmge Ct", "category": "Previous Year Papers", "count": 40}, {"file": "Surgery_GITUrology_FMGE.json", "title": "Surgery Giturology Fmge", "category": "Previous Year Papers", "count": 40}, {"file": "SURGERY-INICET_NOV_2024.json", "title": "Surgery Inicet Nov 2024", "category": "Previous Year Papers", "count": 21}, {"file": "Surgery_INICET_PYQ.json", "title": "Surgery Inicet Pyq", "category": "Previous Year Papers", "count": 238}, {"file": "Surgery_NEET_PG_Revision_ED_-_06-12-2023_-_2023-12-06.json", "title": "Surgery Neet Pg Revision Ed   06 12 2023   2023 12 06", "category": "Previous Year Papers", "count": 50}, {"file": "Surgery_NEETPG_PYQ.json", "title": "Surgery Neetpg Pyq", "category": "Previous Year Papers", "count": 212}, {"file": "SurgeryAIIMS_2014-2018.json", "title": "Surgeryaiims 2014 2018", "category": "Previous Year Papers", "count": 226}, {"file": "Antipsychotic_Drugs.json", "title": "Antipsychotic Drugs", "category": "Psychiatry", "count": 20}, {"file": "Basics_of_Psychiatry.json", "title": "Basics Of Psychiatry", "category": "Psychiatry", "count": 34}, {"file": "Basics_of_Psychiatry_.json", "title": "Basics Of Psychiatry ", "category": "Psychiatry", "count": 13}, {"file": "Basics_of_Psychiatry-Basics_of_Psychiatry_.json", "title": "Basics Of Psychiatry Basics Of Psychiatry ", "category": "Psychiatry", "count": 25}, {"file": "Basics_of_Psychiatry-Previous_Year_Questions.json", "title": "Basics Of Psychiatry Previous Year Questions", "category": "Psychiatry", "count": 7}, {"file": "Child_Psychiatry.json", "title": "Child Psychiatry", "category": "Psychiatry", "count": 22}, {"file": "Child_psychiatry_.json", "title": "Child Psychiatry ", "category": "Psychiatry", "count": 6}, {"file": "Child_Psychiatry_1.json", "title": "Child Psychiatry 1", "category": "Psychiatry", "count": 25}, {"file": "Child_Psychiatry-Child_Psychiatry.json", "title": "Child Psychiatry Child Psychiatry", "category": "Psychiatry", "count": 19}, {"file": "Child_Psychiatry-Previous_Year_Questions.json", "title": "Child Psychiatry Previous Year Questions", "category": "Psychiatry", "count": 13}, {"file": "Classification_In_Psychiatry.json", "title": "Classification In Psychiatry", "category": "Psychiatry", "count": 7}, {"file": "General_Psychiatry.json", "title": "General Psychiatry", "category": "Psychiatry", "count": 39}, {"file": "Mid_Day_Module_Psychiatry-1_-_2025-01-15.json", "title": "Mid Day Module Psychiatry 1   2025 01 15", "category": "Psychiatry", "count": 50}, {"file": "Mid_Day_Module_Psychiatry-2_-_2025-01-16.json", "title": "Mid Day Module Psychiatry 2   2025 01 16", "category": "Psychiatry", "count": 50}, {"file": "Mid_Day_Module_Psychiatry-3_-_2025-01-17.json", "title": "Mid Day Module Psychiatry 3   2025 01 17", "category": "Psychiatry", "count": 50}, {"file": "Neuropsychological_Tests.json", "title": "Neuropsychological Tests", "category": "Psychiatry", "count": 2}, {"file": "Other_Psychotic_Disorders.json", "title": "Other Psychotic Disorders", "category": "Psychiatry", "count": 13}, {"file": "Psychiatry.json", "title": "Psychiatry", "category": "Psychiatry", "count": 100}, {"file": "Psychiatry_-_INI_CET_2020.json", "title": "Psychiatry   Ini Cet 2020", "category": "Psychiatry", "count": 8}, {"file": "Psychiatry_-_INI_CET_JULY_2021.json", "title": "Psychiatry   Ini Cet July 2021", "category": "Psychiatry", "count": 4}, {"file": "Psychiatry_-_INI_CET_MAY_2022.json", "title": "Psychiatry   Ini Cet May 2022", "category": "Psychiatry", "count": 3}, {"file": "Psychiatry_-_INI_CET_MAY_2023.json", "title": "Psychiatry   Ini Cet May 2023", "category": "Psychiatry", "count": 3}, {"file": "Psychiatry_-_INI_CET_NOV_2021.json", "title": "Psychiatry   Ini Cet Nov 2021", "category": "Psychiatry", "count": 2}, {"file": "Psychiatry_-_INI_CET_NOV_2023.json", "title": "Psychiatry   Ini Cet Nov 2023", "category": "Psychiatry", "count": 3}, {"file": "Psychiatry_-_INI_CET_NOVEMBER_2022_PART_-_A.json", "title": "Psychiatry   Ini Cet November 2022 Part   A", "category": "Psychiatry", "count": 7}, {"file": "Psychiatry_-_INI_CET_NOVEMBER_2022_PART_-_B.json", "title": "Psychiatry   Ini Cet November 2022 Part   B", "category": "Psychiatry", "count": 3}, {"file": "Psychiatry-_Class_Test_With_Video_Solution.json", "title": "Psychiatry  Class Test With Video Solution", "category": "Psychiatry", "count": 50}, {"file": "Psychiatry_Clinical_Vignettes.json", "title": "Psychiatry Clinical Vignettes", "category": "Psychiatry", "count": 95}, {"file": "348_Psychiatry_Dr_Sachin.json", "title": "Psychiatry Dr Sachin", "category": "Psychiatry", "count": 40}, {"file": "Psychiatry_Dr_Sachin.json", "title": "Psychiatry Dr Sachin", "category": "Psychiatry", "count": 40}, {"file": "Psychiatry_Dr_Sachin-2026.json", "title": "Psychiatry Dr Sachin 2026", "category": "Psychiatry", "count": 49}, {"file": "350_Psychiatry_Dr_Sachin-2026.json", "title": "Psychiatry Dr Sachin 2026", "category": "Psychiatry", "count": 49}, {"file": "Psychiatry_DVT_Revision_Test.json", "title": "Psychiatry Dvt Revision Test", "category": "Psychiatry", "count": 25}, {"file": "Psychiatry_ED_-_Mission_15_-_23-01-2024_-_2024-01-23.json", "title": "Psychiatry Ed   Mission 15   23 01 2024   2024 01 23", "category": "Psychiatry", "count": 75}, {"file": "Psychiatry_ED_-_Mission_15_Lap_2_-_24-05-2024_-_2024-05-24.json", "title": "Psychiatry Ed   Mission 15 Lap 2   24 05 2024   2024 05 24", "category": "Psychiatry", "count": 50}, {"file": "Psychiatry_ED_-_Mission_20_Batch_2_-_08-09-2024_-_2024-09-08.json", "title": "Psychiatry Ed   Mission 20 Batch 2   08 09 2024   2024 09 08", "category": "Psychiatry", "count": 66}, {"file": "Psychiatry_ED_-_Mission_20_Batch_3_-_16-01-2025_-_2025-01-16.json", "title": "Psychiatry Ed   Mission 20 Batch 3   16 01 2025   2025 01 16", "category": "Psychiatry", "count": 75}, {"file": "Psychiatry_ED_-_Mission_20_Lap_2_-_23-04-2025_-_2025-04-23.json", "title": "Psychiatry Ed   Mission 20 Lap 2   23 04 2025   2025 04 23", "category": "Psychiatry", "count": 68}, {"file": "Psychiatry_ED_Mission_30_Early_Intern_Batch_-_15-04-2025_-_2025-04-15.json", "title": "Psychiatry Ed Mission 30 Early Intern Batch   15 04 2025   2025 04 15", "category": "Psychiatry", "count": 75}, {"file": "Psychiatry_ED_The_Champion_Batch_Hyderabad_-_20-04-2024_-_2024-04-20.json", "title": "Psychiatry Ed The Champion Batch Hyderabad   20 04 2024   2024 04 20", "category": "Psychiatry", "count": 75}, {"file": "Psychiatry_IBQ.json", "title": "Psychiatry Ibq", "category": "Psychiatry", "count": 20}, {"file": "Psychiatry_Image_Based_Question.json", "title": "Psychiatry Image Based Question", "category": "Psychiatry", "count": 20}, {"file": "Psychiatry_Last_Month_ED_-_04-07-2024_-_2024-07-04.json", "title": "Psychiatry Last Month Ed   04 07 2024   2024 07 04", "category": "Psychiatry", "count": 25}, {"file": "Psychiatry_MIQ_Series.json", "title": "Psychiatry Miq Series", "category": "Psychiatry", "count": 15}, {"file": "Psychiatry_New_Season.json", "title": "Psychiatry New Season", "category": "Psychiatry", "count": 20}, {"file": "Psychiatry_Test_The_Champion_Batch_Hyderabad_-_14-03-2025_-_2025-03-14.json", "title": "Psychiatry Test The Champion Batch Hyderabad   14 03 2025   2025 03 14", "category": "Psychiatry", "count": 50}, {"file": "Psychiatry_Test_The_Champion_Batch_Hyderabad_-_19-12-2024_-_2024-12-19.json", "title": "Psychiatry Test The Champion Batch Hyderabad   19 12 2024   2024 12 19", "category": "Psychiatry", "count": 50}, {"file": "Psychoanalysis.json", "title": "Psychoanalysis", "category": "Psychiatry", "count": 14}, {"file": "Psychoanalysis_1.json", "title": "Psychoanalysis 1", "category": "Psychiatry", "count": 9}, {"file": "Psychology-Previous_Year_Questions.json", "title": "Psychology Previous Year Questions", "category": "Psychiatry", "count": 5}, {"file": "Psychology-Psychology.json", "title": "Psychology Psychology", "category": "Psychiatry", "count": 13}, {"file": "Schizophrenia_and_Other_Primary_Psychotic_Disorders.json", "title": "Schizophrenia And Other Primary Psychotic Disorders", "category": "Psychiatry", "count": 63}, {"file": "Schizophrenia_and_other_Psychotic_Disorders.json", "title": "Schizophrenia And Other Psychotic Disorders", "category": "Psychiatry", "count": 6}, {"file": "Schizophrenia_and_Psychotic_Disorders.json", "title": "Schizophrenia And Psychotic Disorders", "category": "Psychiatry", "count": 63}, {"file": "Schizophrenia_Spectrum_and_Other_Psychotic_Disorders-Previous_Year_Questions.json", "title": "Schizophrenia Spectrum And Other Psychotic Disorders Previous Year Questions", "category": "Psychiatry", "count": 26}, {"file": "Schizophrenia_Spectrum_and_Other_Psychotic_Disorders-Schizophrenia_And_Other_Psychotic_Disorders.json", "title": "Schizophrenia Spectrum And Other Psychotic Disorders Schizophrenia And Other Psychotic Disorders", "category": "Psychiatry", "count": 22}, {"file": "SWT-Psychiatry-SET-B.json", "title": "Swt Psychiatry Set B", "category": "Psychiatry", "count": 100}, {"file": "Basics_of_Radiography.json", "title": "Basics Of Radiography", "category": "Radiology", "count": 22}, {"file": "Basics_of_Radiology_.json", "title": "Basics Of Radiology ", "category": "Radiology", "count": 12}, {"file": "Basics_of_Radiology-Basics_of_Radiology.json", "title": "Basics Of Radiology Basics Of Radiology", "category": "Radiology", "count": 25}, {"file": "Basics_of_Radiology-Previous_Year_Questions.json", "title": "Basics Of Radiology Previous Year Questions", "category": "Radiology", "count": 31}, {"file": "Cardiovascular_Radiology-CVS_Radiology.json", "title": "Cardiovascular Radiology Cvs Radiology", "category": "Radiology", "count": 16}, {"file": "Cardiovascular_Radiology-Previous_Year_Questions.json", "title": "Cardiovascular Radiology Previous Year Questions", "category": "Radiology", "count": 3}, {"file": "CVS_Radiology.json", "title": "Cvs Radiology", "category": "Radiology", "count": 19}, {"file": "Gastrointestinal_Radiology.json", "title": "Gastrointestinal Radiology", "category": "Radiology", "count": 31}, {"file": "Gastrointestinal_Radiology-GIT_Radiology.json", "title": "Gastrointestinal Radiology Git Radiology", "category": "Radiology", "count": 18}, {"file": "Gastrointestinal_Radiology-Previous_Year_Questions.json", "title": "Gastrointestinal Radiology Previous Year Questions", "category": "Radiology", "count": 34}, {"file": "Genito-Urinary_Radiology.json", "title": "Genito Urinary Radiology", "category": "Radiology", "count": 24}, {"file": "Genitourinary_Radiology-Genitourinary_Radiology.json", "title": "Genitourinary Radiology Genitourinary Radiology", "category": "Radiology", "count": 23}, {"file": "Genitourinary_Radiology-Previous_Year_Questions.json", "title": "Genitourinary Radiology Previous Year Questions", "category": "Radiology", "count": 8}, {"file": "GI_Radiology.json", "title": "Gi Radiology", "category": "Radiology", "count": 20}, {"file": "GU_Radiology.json", "title": "Gu Radiology", "category": "Radiology", "count": 26}, {"file": "Head___Neck_Imaging-Head_and_Neck_Radiology.json", "title": "Head   Neck Imaging Head And Neck Radiology", "category": "Radiology", "count": 15}, {"file": "Hepatobiliary-Pancreatic_Radiology.json", "title": "Hepatobiliary Pancreatic Radiology", "category": "Radiology", "count": 13}, {"file": "Hepatobiliary_Radiology-Hepatobiliary_and_Pancreatic_Radiology.json", "title": "Hepatobiliary Radiology Hepatobiliary And Pancreatic Radiology", "category": "Radiology", "count": 22}, {"file": "Hepatobiliary_Radiology-Previous_Year_Questions.json", "title": "Hepatobiliary Radiology Previous Year Questions", "category": "Radiology", "count": 6}, {"file": "Introduction_to_Radiology__Basics_of_Investigations.json", "title": "Introduction To Radiology  Basics Of Investigations", "category": "Radiology", "count": 19}, {"file": "Mid_Day_Module_Radiology-1_-_2025-01-30.json", "title": "Mid Day Module Radiology 1   2025 01 30", "category": "Radiology", "count": 50}, {"file": "Mid_Day_Module_Radiology-2_-_2025-01-31.json", "title": "Mid Day Module Radiology 2   2025 01 31", "category": "Radiology", "count": 50}, {"file": "Musculoskeletal_Radiology.json", "title": "Musculoskeletal Radiology", "category": "Radiology", "count": 9}, {"file": "Musculoskeletal_Radiology-Musculoskeletal_Radiology.json", "title": "Musculoskeletal Radiology Musculoskeletal Radiology", "category": "Radiology", "count": 25}, {"file": "Musculoskeletal_Radiology-Previous_Year_Questions.json", "title": "Musculoskeletal Radiology Previous Year Questions", "category": "Radiology", "count": 10}, {"file": "Neural_Radiology.json", "title": "Neural Radiology", "category": "Radiology", "count": 7}, {"file": "Neuro_Radiology-Neuroradiology-I.json", "title": "Neuro Radiology Neuroradiology I", "category": "Radiology", "count": 22}, {"file": "Neuro_Radiology-Neuroradiology-II.json", "title": "Neuro Radiology Neuroradiology Ii", "category": "Radiology", "count": 23}, {"file": "Neuro_Radiology-Previous_Year_Questions.json", "title": "Neuro Radiology Previous Year Questions", "category": "Radiology", "count": 4}, {"file": "Neuroradiology.json", "title": "Neuroradiology", "category": "Radiology", "count": 27}, {"file": "Neuroradiology_Part_1.json", "title": "Neuroradiology Part 1", "category": "Radiology", "count": 17}, {"file": "Neuroradiology_Part_2.json", "title": "Neuroradiology Part 2", "category": "Radiology", "count": 13}, {"file": "Radiology.json", "title": "Radiology", "category": "Radiology", "count": 10}, {"file": "Radiology_-_INI_CET_JULY_2021.json", "title": "Radiology   Ini Cet July 2021", "category": "Radiology", "count": 5}, {"file": "Radiology_-_INI_CET_MAY_2022.json", "title": "Radiology   Ini Cet May 2022", "category": "Radiology", "count": 1}, {"file": "Radiology_-_INI_CET_MAY_2023.json", "title": "Radiology   Ini Cet May 2023", "category": "Radiology", "count": 4}, {"file": "Radiology_-_INI_CET_NOV_2020.json", "title": "Radiology   Ini Cet Nov 2020", "category": "Radiology", "count": 14}, {"file": "Radiology_-_INI_CET_NOV_2021.json", "title": "Radiology   Ini Cet Nov 2021", "category": "Radiology", "count": 5}, {"file": "Radiology_-_INI_CET_NOV_2023.json", "title": "Radiology   Ini Cet Nov 2023", "category": "Radiology", "count": 3}, {"file": "Radiology_-_INI_CET_NOVEMBER_2022_PART_-_A.json", "title": "Radiology   Ini Cet November 2022 Part   A", "category": "Radiology", "count": 5}, {"file": "Radiology_-_INI_CET_NOVEMBER_2022_PART_-_B.json", "title": "Radiology   Ini Cet November 2022 Part   B", "category": "Radiology", "count": 3}, {"file": "Radiology-_Class_Test_With_Video_Solution.json", "title": "Radiology  Class Test With Video Solution", "category": "Radiology", "count": 50}, {"file": "Radiology_Clinical_Vignette.json", "title": "Radiology Clinical Vignette", "category": "Radiology", "count": 10}, {"file": "Radiology_Dr_Sumer.json", "title": "Radiology Dr Sumer", "category": "Radiology", "count": 49}, {"file": "Radiology_Dr_Sumer-2026.json", "title": "Radiology Dr Sumer 2026", "category": "Radiology", "count": 50}, {"file": "Radiology_DVT_Base_Test.json", "title": "Radiology Dvt Base Test", "category": "Radiology", "count": 25}, {"file": "Radiology_ED_-_Mission_15_-_17-04-2024_-_2024-04-17.json", "title": "Radiology Ed   Mission 15   17 04 2024   2024 04 17", "category": "Radiology", "count": 50}, {"file": "Radiology_ED_-_Mission_15_Lap_2_-_28-05-2024_-_2024-05-28.json", "title": "Radiology Ed   Mission 15 Lap 2   28 05 2024   2024 05 28", "category": "Radiology", "count": 50}, {"file": "Radiology_ED_-_Mission_20_Batch_2_-_28-11-2024_-_2024-11-28.json", "title": "Radiology Ed   Mission 20 Batch 2   28 11 2024   2024 11 28", "category": "Radiology", "count": 50}, {"file": "Radiology_ED_-_Mission_20_Batch_3_-_31-01-2025_-_2025-01-31.json", "title": "Radiology Ed   Mission 20 Batch 3   31 01 2025   2025 01 31", "category": "Radiology", "count": 50}, {"file": "Radiology_ED_-_Mission_20_Lap_2_-_04-04-2025_-_2025-04-04.json", "title": "Radiology Ed   Mission 20 Lap 2   04 04 2025   2025 04 04", "category": "Radiology", "count": 50}, {"file": "Radiology_IBQ.json", "title": "Radiology Ibq", "category": "Radiology", "count": 20}, {"file": "Radiology_Image-Based_Qs.json", "title": "Radiology Image Based Qs", "category": "Radiology", "count": 128}, {"file": "Radiology_MIQ_Series.json", "title": "Radiology Miq Series", "category": "Radiology", "count": 15}, {"file": "Radiology_Test_The_Champion_Batch_Hyderabad_-_02-04-2025_-_2025-04-02.json", "title": "Radiology Test The Champion Batch Hyderabad   02 04 2025   2025 04 02", "category": "Radiology", "count": 50}, {"file": "Radiology_Test_The_Champion_Batch_Hyderabad_-_18-01-2025_-_2025-01-18.json", "title": "Radiology Test The Champion Batch Hyderabad   18 01 2025   2025 01 18", "category": "Radiology", "count": 50}, {"file": "Radiology_Test_The_Champion_Batch_Hyderabad_-_19-08-2024_-_2024-08-19.json", "title": "Radiology Test The Champion Batch Hyderabad   19 08 2024   2024 08 19", "category": "Radiology", "count": 50}, {"file": "Radiotherapy.json", "title": "Radiotherapy", "category": "Radiology", "count": 25}, {"file": "Radiotherapy_1.json", "title": "Radiotherapy 1", "category": "Radiology", "count": 61}, {"file": "Radiotherapy_2.json", "title": "Radiotherapy 2", "category": "Radiology", "count": 8}, {"file": "Radiotherapy-Previous_Year_Questions.json", "title": "Radiotherapy Previous Year Questions", "category": "Radiology", "count": 9}, {"file": "Reproductive_Radiology-Previous_Year_Questions.json", "title": "Reproductive Radiology Previous Year Questions", "category": "Radiology", "count": 2}, {"file": "Respiratory_Radiology.json", "title": "Respiratory Radiology", "category": "Radiology", "count": 32}, {"file": "Respiratory_Radiology_1.json", "title": "Respiratory Radiology 1", "category": "Radiology", "count": 9}, {"file": "SWT-RADIOLOGY-SET-A.json", "title": "Swt Radiology Set A", "category": "Radiology", "count": 100}, {"file": "SWT-Radiology-SET-B.json", "title": "Swt Radiology Set B", "category": "Radiology", "count": 100}, {"file": "Thoracic_Radiology-Previous_Year_Questions.json", "title": "Thoracic Radiology Previous Year Questions", "category": "Radiology", "count": 53}, {"file": "Thoracic_Radiology-Respiratory_Radiology.json", "title": "Thoracic Radiology Respiratory Radiology", "category": "Radiology", "count": 28}, {"file": "Bariatric_Surgery.json", "title": "Bariatric Surgery", "category": "Surgery", "count": 7}, {"file": "Burns_and_Plastic_Surgery.json", "title": "Burns And Plastic Surgery", "category": "Surgery", "count": 9}, {"file": "Cardiothoracic_Vascular_Surgery-Arterial_Disorders.json", "title": "Cardiothoracic Vascular Surgery Arterial Disorders", "category": "Surgery", "count": 25}, {"file": "Cardiothoracic_Vascular_Surgery-Lymphatic_System.json", "title": "Cardiothoracic Vascular Surgery Lymphatic System", "category": "Surgery", "count": 10}, {"file": "Cardiothoracic_Vascular_Surgery-Previous_Year_Questions.json", "title": "Cardiothoracic Vascular Surgery Previous Year Questions", "category": "Surgery", "count": 65}, {"file": "Cardiothoracic_Vascular_Surgery-Venous_Disorders.json", "title": "Cardiothoracic Vascular Surgery Venous Disorders", "category": "Surgery", "count": 26}, {"file": "Damage_Control_Surgery.json", "title": "Damage Control Surgery", "category": "Surgery", "count": 12}, {"file": "Endocrine_Surgery-Breast-I.json", "title": "Endocrine Surgery Breast I", "category": "Surgery", "count": 21}, {"file": "Endocrine_Surgery-Breast-II.json", "title": "Endocrine Surgery Breast Ii", "category": "Surgery", "count": 20}, {"file": "Endocrine_Surgery-Parathyroid_and_Adrenal_Glands.json", "title": "Endocrine Surgery Parathyroid And Adrenal Glands", "category": "Surgery", "count": 21}, {"file": "Endocrine_Surgery-Previous_Year_Questions.json", "title": "Endocrine Surgery Previous Year Questions", "category": "Surgery", "count": 86}, {"file": "Endocrine_Surgery-Thyroid-I.json", "title": "Endocrine Surgery Thyroid I", "category": "Surgery", "count": 21}, {"file": "Endocrine_Surgery-Thyroid-II.json", "title": "Endocrine Surgery Thyroid Ii", "category": "Surgery", "count": 20}, {"file": "Gastrointestinal_Surgery-Appendix.json", "title": "Gastrointestinal Surgery Appendix", "category": "Surgery", "count": 11}, {"file": "Gastrointestinal_Surgery-Esophagus.json", "title": "Gastrointestinal Surgery Esophagus", "category": "Surgery", "count": 25}, {"file": "Gastrointestinal_Surgery-Hernia.json", "title": "Gastrointestinal Surgery Hernia", "category": "Surgery", "count": 26}, {"file": "Gastrointestinal_Surgery-Ileostomy__Colostomy__and_IBD.json", "title": "Gastrointestinal Surgery Ileostomy  Colostomy  And Ibd", "category": "Surgery", "count": 24}, {"file": "Gastrointestinal_Surgery-Intestinal_Obstruction.json", "title": "Gastrointestinal Surgery Intestinal Obstruction", "category": "Surgery", "count": 11}, {"file": "Gastrointestinal_Surgery-Large_Intestine-I.json", "title": "Gastrointestinal Surgery Large Intestine I", "category": "Surgery", "count": 13}, {"file": "Gastrointestinal_Surgery-Large_Intestine-II.json", "title": "Gastrointestinal Surgery Large Intestine Ii", "category": "Surgery", "count": 18}, {"file": "Gastrointestinal_Surgery-Previous_Year_Questions.json", "title": "Gastrointestinal Surgery Previous Year Questions", "category": "Surgery", "count": 205}, {"file": "Gastrointestinal_Surgery-Previous_Year_Questions_1.json", "title": "Gastrointestinal Surgery Previous Year Questions 1", "category": "Surgery", "count": 7}, {"file": "Gastrointestinal_Surgery-Rectum_and_Anal_Canal.json", "title": "Gastrointestinal Surgery Rectum And Anal Canal", "category": "Surgery", "count": 26}, {"file": "Gastrointestinal_Surgery-Small_Intestine.json", "title": "Gastrointestinal Surgery Small Intestine", "category": "Surgery", "count": 25}, {"file": "Gastrointestinal_Surgery-Spleen.json", "title": "Gastrointestinal Surgery Spleen", "category": "Surgery", "count": 10}, {"file": "Gastrointestinal_Surgery-Stomach-I.json", "title": "Gastrointestinal Surgery Stomach I", "category": "Surgery", "count": 20}, {"file": "General_Surgery.json", "title": "General Surgery", "category": "Surgery", "count": 78}, {"file": "General_Surgery_1.json", "title": "General Surgery 1", "category": "Surgery", "count": 6}, {"file": "General_Surgery_IBQ.json", "title": "General Surgery Ibq", "category": "Surgery", "count": 20}, {"file": "General_Surgery-Previous_Year_Questions.json", "title": "General Surgery Previous Year Questions", "category": "Surgery", "count": 46}, {"file": "Hepatobiliary_Pancreatic_Surgery-Bile_Duct.json", "title": "Hepatobiliary Pancreatic Surgery Bile Duct", "category": "Surgery", "count": 22}, {"file": "Hepatobiliary_Pancreatic_Surgery-Gall_bladder.json", "title": "Hepatobiliary Pancreatic Surgery Gall Bladder", "category": "Surgery", "count": 30}, {"file": "Hepatobiliary_Pancreatic_Surgery-Liver_Tumors.json", "title": "Hepatobiliary Pancreatic Surgery Liver Tumors", "category": "Surgery", "count": 14}, {"file": "Hepatobiliary_Pancreatic_Surgery-Pancreatic_Tumors.json", "title": "Hepatobiliary Pancreatic Surgery Pancreatic Tumors", "category": "Surgery", "count": 23}, {"file": "Hepatobiliary_Pancreatic_Surgery-Portal_Hypertension.json", "title": "Hepatobiliary Pancreatic Surgery Portal Hypertension", "category": "Surgery", "count": 14}, {"file": "Hepatobiliary_Pancreatic_Surgery-Previous_Year_Questions.json", "title": "Hepatobiliary Pancreatic Surgery Previous Year Questions", "category": "Surgery", "count": 70}, {"file": "Laparoscopy_Robotic_Bariatric_Surgery.json", "title": "Laparoscopy Robotic Bariatric Surgery", "category": "Surgery", "count": 6